[
    {
        "property_address1":null,
        "property_address2":null,
        "property_building":null,
        "property_id":910,
        "property_notes_access":null,
        "property_notes_general":null,
        "property_notes_guest_access":null,
        "property_photos_url":null,
        "property_state":null,
        "property_status":null,
        "listing_id":"66bf68fa7011f00014648c16",
        "saas_auto_renew":1.0,
        "cleaning_fee_id":"66bf68fa7011f00014648c17",
        "cleaning_fee_value_type":"FIXED",
        "cleaning_fee_formula":470.0,
        "cleaning_fee_multiplier":"PER_STAY",
        "channel_commission_use_account_settings":1.0,
        "channel_commission_id":"67334bb16d8308d9819747e0",
        "channel_commission_created_at":"2024-11-12T12:36:01.011Z",
        "channel_commission_updated_at":"2024-12-11T07:01:40.069Z",
        "cleaning_status":null,
        "picture_caption":"Aerial",
        "picture_thumbnail":"https:\/\/track-pm.s3.amazonaws.com\/gw\/image\/822ff2f9-e043-42bf-8366-39076c6e06c9",
        "minimum_nights":1.0,
        "maximum_nights":365.0,
        "monthly_price_factor":1.0,
        "weekly_price_factor":1.0,
        "base_price":1.0,
        "weekend_base_price":469.0,
        "currency":"USD",
        "cleaning_fee":470.0,
        "confirmed_before_checkin_delay_minutes":45.0,
        "confirmed_day_of_checkin_delay_minutes":45.0,
        "confirmed_day_of_checkout_delay_minutes":45.0,
        "confirmed_during_stay_delay_minutes":45.0,
        "confirmed_after_checkout_delay_minutes":45.0,
        "unconfirmed_first_message_delay_minutes":45.0,
        "unconfirmed_subsequent_message_delay_minutes":45.0,
        "answeing_machine_is_active":null,
        "auto_reviews_status":null,
        "auto_payments_time_relation_names":"AT--x--BEFORE",
        "auto_payments_time_relation_units":"DAYS--x--DAYS",
        "auto_payments_time_relation_amounts":"1--x--14",
        "pms_cleaning_status":null,
        "calendar_rules_default_availability":"AVAILABLE",
        "bookingcom_cut_off_hours_enabled":null,
        "expedia_cut_off_hours_enabled":null,
        "airbnb_cut_off_hours_enabled":null,
        "directbookings_cut_off_hours_enabled":null,
        "calendar_rules_default_hours":24.0,
        "calendar_rules_allow_request_to_book":null,
        "calendar_rules_advance_notice_updated_at":"2024-09-10T19:33:29.715Z",
        "calendar_rules_advance_notice_updated_by":"Data Import",
        "booking_window_default_days":365.0,
        "booking_window_updated_at":"2024-08-16T14:58:02.923Z",
        "preparation_time_updated_at":"2024-08-16T14:58:02.921Z",
        "dynamic_checkin_updated_at":"2024-08-29T17:26:41.432Z",
        "rental_periods_request_to_book":null,
        "rental_periods_ids":"66bf68fa7011f00014648c19",
        "rental_periods_from":1723680000000,
        "default_availability_updated_at":"2024-09-11T20:02:25.492Z",
        "default_availability_updated_by":"Data Import",
        "listing_type":"SINGLE",
        "owners_list":"66bf908ab11c9ac268b42a7c",
        "amenities_list":"Suitable for children (2-12 years)--x--Suitable for infants (under 2 years)--x--Air conditioning--x--BBQ grill--x--Beach essentials--x--Bed linens--x--Blender--x--Body soap--x--Carbon monoxide detector--x--Ceiling fan--x--Coffee maker--x--Conditioner--x--Cookware--x--Dining table--x--Dishes and silverware--x--Dishwasher--x--Dryer--x--Essentials--x--Fire Pit--x--Fishing--x--Free parking on premises--x--Garden or backyard--x--Golf - Optional--x--Hair dryer--x--Heating--x--Hot water--x--Ice maker--x--Internet--x--Kitchen--x--Lake--x--Lake Front--x--Laptop friendly workspace--x--Long term stays allowed--x--Microwave--x--Oven--x--Private entrance--x--Refrigerator--x--Shampoo--x--Shopping--x--Smoke detector--x--Stove--x--Toaster--x--Town--x--TV--x--Washer--x--Water Sports--x--Waterfront--x--Wine glasses--x--Wireless Internet",
        "amenities_not_included_list":null,
        "use_account_revenue_share":1.0,
        "use_account_taxes":null,
        "use_account_markups":1.0,
        "use_account_additional_fees":null,
        "is_active":0.0,
        "net_income_formula":"host_payout",
        "commission_formula":"net_income",
        "owner_revenue_formula":"net_income - pm_commission",
        "tax_ids":null,
        "tax_types":null,
        "tax_amounts":null,
        "tax_names":null,
        "tax_units":null,
        "tax_quantifiers":null,
        "taxes_applied_to_all_fees":null,
        "taxes_applied_on_fees":null,
        "taxes_are_applied_by_default":null,
        "tax_conditional_overrides_view_types":null,
        "tax_conditional_overrides_max_nights":null,
        "tax___vs":null,
        "pre_bookings_list":null,
        "origin_id":104181.0,
        "nick_name":"Zen Lodge",
        "minimum_age":18.0,
        "address_full":"351 Elm Lodge Dr, Kingsland, TX 78639, USA",
        "address_street":"351 Elm Lodge Drive",
        "address_city":"Kingsland",
        "address_country":"United States",
        "address_latitude":30.672264,
        "address_longitude":-98.444046,
        "address_zip_code":78639.0,
        "address_state":"Texas",
        "address_county":null,
        "room_type":"Entire home\/apt",
        "property_type":"House",
        "ota_room_type":"Holiday home",
        "accommodates":18.0,
        "bathrooms":4.0,
        "bedrooms":5.0,
        "beds_count":11.0,
        "listing_status":null,
        "host_name":"Grand Welcome Highland Lakes",
        "wifi_name":"ZenLodge",
        "wifi_password":"351elmlodge!",
        "area_in_square_feet":2436.0,
        "trash_collection_day":"Cans are by black iron gate of driveway",
        "parking_instructions":"Boat Trailer Parking Available in Driveway",
        "created_at":"2024-05-03T00:00:00.000Z",
        "origin":"track",
        "default_check_in_time":"16:00:00",
        "default_check_out_time":"10:00:00",
        "check_in_instructions":"Thank you so much for booking! Your door code and additional access instructions will be texted to you on the day of arrival. If you do not receive them two hours prior to check-in, please reach out to us via call or text at 615-334-0695.\n \n*Important Update*  \nWe\u00e2\u20ac\u2122re thrilled to welcome so many guests this season! To ensure every stay is absolutely perfect, we won't be able to accommodate early check-in or late check-out requests until after Labor Day. This gives our dedicated team the necessary time to clean and inspect each property thoroughly, making sure everything is just right for your arrival.\n \nBut here\u00e2\u20ac\u2122s some good news! If your property is ready earlier, you\u00e2\u20ac\u2122ll receive a notification along with your door code on the day of your arrival. So, there\u00e2\u20ac\u2122s always a chance for a pleasant surprise!\n \nWe appreciate your understanding and patience as we focus on providing top-notch service and handling any urgent needs that might come up during your stay. Your comfort and satisfaction are our top priorities!\n \nThank you for being amazing guests, and we can\u00e2\u20ac\u2122t wait for you to enjoy your stay with us!\n\nCHECK IN INSTRUCTIONS:\nAccess and Parking:\nParking is available for up to 6 vehicles in the circle Driveway.\n \nAccess Instructions:\nOnce parked, follow to the main door which is on the side of the house facing the parking area and it is equipped with a keyless entry lock.\n \nLock Instructions:\n- Use the code provided above for entry access.  The check mark button is located on the bottom left of the keypad and must be pushed after entering code.\nIf you are unable to unlock the door, please call 615-334-0695 and a Grand Welcome representative will assist you.\n\nTo lock the door when leaving the home:\n- The door does NOT lock automatically so please press any key on the keypad to lock when you leave.\n- If you are unable to lock the door, please call at 615-334-0695 and a Grand Welcome representative will assist you.\n \nWireless Internet Information:\nNetwork: ZenLodge \nPassword: 351elmlodge!\n \nWasher and Dryer:\nWasher and dryer are located in the laundry room on the 2nd floor near the living room.\n \nTrash:\nTrash is picked up on Wednesday. The bins are located near the black iron gate at driveway.  If trash day falls during your stay, please take bins to the street - please do not block the mailboxes.  \n \nAdditional Information:\n- Take a quick inventory of the kitchen and bath items that are provided before you go to the store to ensure you will have everything you need for your stay. We provide a starter set of amenities, but for longer stays you will likely want to get more. These complimentary amenities are provided free of charge and are included in the blue boxes in the kitchen and bathrooms so please help yourselves! Nearest grocery store is 2.5 miles away at 215 Ranch Road 2900, Kingsland.\n- This home is not pet friendly. If there is evidence found of an animal presence during your stay or post check-out, you will be charged additional cleaning fees.\n- No Smoking Allowed Anywhere Inside or Outside.  If evidence is found, you will be charged additional fees. \n- There are paddleboards, kayaks, lily pad, paddles, and life vests available for guest use.  Please put back all equipment back in the same place that you found them after use.\n-If bringing a boat or jet skis, there are several options for tying off your boat and\/or jet skis. Boat and jet skis at property are owners and not for guest use. Boats can be launched at Kingsland Community Park located at 155 Lions Park Road, Kingsland, TX 78639.  There is a $10 launch fee - there is no overnight trailer parking at boat launch. Guests may park boat trailers at property.   \n \nCheck-Out:\n- Please leave the house as you found it - nice and tidy.  Please return any items used to it's original location.\n- Set AC to 78 degrees during the summer months when checking out. - Set heater to 58 degrees during winter months when checking out.\n- Bag all garbage and place in trash cans outside.\n- Load all dirty dishes into the dishwasher and start.\n- If the grill was used, please clean after use. If not left cleaned, a $25 fee will be charged.\n- Please lock the door before your departure. We hope you enjoy your stay and invite you to share your experience.\n\nIf you feel you will be unable to provide a 5-Star review, please contact our Customer Care Team at 615-334-0695 to discuss your concerns",
        "check_out_instructions":"- Please leave the house as you found it - nice and tidy.  Please return any items used to it's original location.\n- Set AC to 78 degrees during the summer months when checking out. - Set heater to 58 degrees during winter months when checking out.\n- Bag ",
        "account_id":"66a30f208b331811b8e96639",
        "time_zone":"America\/Chicago",
        "last_updated_at":"2024-12-04T02:38:17.575Z",
        "integration_ids":"66d0af0bb6ad7bcfca3bf989",
        "integration_platforms":"vacayHome",
        "booking_com_initial_complex_listings":null,
        "booking_com_publish_company_logos":null,
        "booking_com_is_published_company_logos":null,
        "booking_com_publish_company_infos":null,
        "booking_com_is_published_company_infos":null,
        "vacayhome_currencies":"USD",
        "vacayhome_statuses":"COMPLETED",
        "vacayhome_cancellation_policies":"firm",
        "vacayhome_cancellation_penalties":100.0,
        "vacayhome_creation_times":"2024-12-04T02:38:17.005Z",
        "listing_room_ids":"66c30cd399e922187e4f7065--x--66c30cd399e922187e4f7066--x--66c30cd399e922187e4f7067--x--66c30cd399e922187e4f7068--x--66c30cd399e922187e4f7069--x--66c30cd399e922187e4f706a--x--66c30cd399e922187e4f706b--x--66c30cd399e922187e4f706c--x--66c30cd399e922187e4f706d",
        "listing_room_numbers":"1--x--2--x--3--x--4--x--5--x--6--x--7--x--8--x--9",
        "listing_room_bed_ids":"66d0af51c611340019a4aacd--x--66d0af51c611340019a4aace--x--66d0af51c611340019a4aacf--x--66d0af51c611340019a4aad0--x--66d0af51c611340019a4aad1--x--66d0af51c611340019a4aad2",
        "listing_room_bed_types":"QUEEN_BED--x--QUEEN_BED--x--QUEEN_BED--x--QUEEN_BED--x--SINGLE_BED--x--BUNK_BED",
        "listing_room_bed_quantities":"1--x--1--x--1--x--1--x--2--x--5",
        "custom_field_values":"\u00c2\u00a0\n\u00c2\u00a0Thank you so much for booking! Your door code and additional access instructions will be texted to you on the day of arrival. If you do not receive them two hours prior to check-in, please reach out to us via call or text at 615-334-0695.\n\u00c2\u00a0\n*Important Update*\u00c2\u00a0\u00c2\u00a0\nWe\u00e2\u20ac\u2122re thrilled to welcome so many guests this season! To ensure every stay is absolutely perfect, we won't be able to accommodate early check-in or late check-out requests until after Labor Day. This gives our dedicated team the necessary time to clean and inspect each property thoroughly, making sure everything is just right for your arrival.\n\u00c2\u00a0\nBut here\u00e2\u20ac\u2122s some good news! If your property is ready earlier, you\u00e2\u20ac\u2122ll receive a notification along with your door code on the day of your arrival. So, there\u00e2\u20ac\u2122s always a chance for a pleasant surprise!\n\u00c2\u00a0\nWe appreciate your understanding and patience as we focus on providing top-notch service and handling any urgent needs that might come up during your stay. Your comfort and satisfaction are our top priorities!\n\u00c2\u00a0\n\u00c2\u00a0\nThank you for being amazing guests, and we can\u00e2\u20ac\u2122t wait for you to enjoy your stay with us!\nCHECK IN INSTRUCTIONS:\nAccess and Parking:\nParking is available for up to 6 vehicles in the circle Driveway.\n\u00c2\u00a0\nAccess Instructions:\nOnce parked, follow to the main door which is on the side of the house facing the parking area and it is equipped with a keyless entry lock.\n\u00c2\u00a0\nLock Instructions:\n- Use the code provided above for entry access. The check mark button is located on the bottom left of the keypad and must be pushed after entering code.\nIf you are unable to unlock the door, please call 615-334-0695 and a Grand Welcome representative will assist you.\n\u00c2\u00a0\nTo lock the door when leaving the home:\n- The door does NOT lock automatically so please press any key on the keypad to lock when you leave.\n- If you are unable to lock the door, please call at 615-334-0695 and a Grand Welcome representative will assist you.\n\u00c2\u00a0\nWireless Internet Information:\nNetwork: ZenLodge\nPassword: 351ElmLodge\n\u00c2\u00a0\nWasher and Dryer:\nWasher and dryer are located in the laundry room on the 2nd floor near the living room.\n\u00c2\u00a0\nTrash:\nTrash is picked up on Wednesday. The bins are located near the black iron gate at driveway. If trash day falls during your stay, please take bins to the street - please do not block the mailboxes.\n\u00c2\u00a0\nAdditional Information:\n- Take a quick inventory of the kitchen and bath items that are provided before you go to the store to ensure you will have everything you need for your stay. We provide a starter set of amenities, but for longer stays you will likely want to get more. These complimentary amenities are provided free of charge and are included in the blue boxes in the kitchen and bathrooms so please help yourselves! Nearest grocery store is 2.5 miles away at 215 Ranch Road 2900, Kingsland.\n- This home is not pet friendly. If there is evidence found of an animal presence during your stay or post check-out, you will be charged additional cleaning fees.\n- No Smoking Allowed Anywhere Inside or Outside. If evidence is found, you will be charged additional fees.\n- There are paddleboards, kayaks, lily pad, paddles, and life vests available for guest use. Please put back all equipment back in the same place that you found them after use.\n-If bringing a boat or jet skis, there are several options for tying off your boat and\/or jet skis. Boat and jet skis at property are owners and not for guest use. Boats can be launched at Kingsland Community Park located at 155 Lions Park Road, Kingsland, TX 78639. There is a $10 launch fee - there is no overnight trailer parking at boat launch. Guests may park boat trailers at property.\n\u00c2\u00a0\nCheck-Out:\n- Please leave the house as you found it - nice and tidy. Please return anything used to it's original location.\n- Set AC to 78 degrees during the summer months when checking out. - Set heater to 58 degrees during winter months when checking out.\n- Bag all garbage and place in trash cans outside.\n- Load all dirty dishes into the dishwasher and start.\n- If the grill was used, please clean after use. If not left cleaned, a $25 fee will be charged.\n- Please lock the door before your departure. We hope you enjoy your stay and invite you to share your experience.\n\u00c2\u00a0\nIf you feel you will be unable to provide a 5-Star review, please contact our Customer Care Team at 615-334-0695 to discuss your concerns--x--Leaving Austin-Bergstrom International Airport\n3600 Presidential Blvd, Austin, TX 78719\n \n- Get on State Hwy 71 W in Del Valle from Hotel Dr and Spirit of Texas Dr - 2 min (0.8 mi)\n- Head southwest on Presidential Blvd toward Service Dr - 10 ft\n- Slight right onto Service Dr - 482 ft\n- Turn right onto Hotel Dr - 0.3 mi\n- Turn right onto Spirit of Texas Dr - 0.2 mi\n- Turn left to merge onto State Hwy 71 W - 0.3 mi\n- Follow State Hwy 71 W and US-290 W to W Texas Hwy 71 Service Rd\/W US Hwy 290 Service Rd in Austin. \n- Take the exit toward Monterey Oaks Blvd\/Industrial Oaks Blvd from US-290 W - 10 min (10.3 mi)\n- Merge onto State Hwy 71 W - 0.6 mi\n- Keep left to stay on State Hwy 71 W - 0.1 mi\n- Use any lane to turn slightly left onto State Hwy 71 W\/E Ben White Blvd - 5.2 mi\n- Continue onto State Hwy 71 W\/US-290 W\/W Ben White Blvd - 2.2 mi\n- Keep left to stay on US-290 W - 1.9 mi\n- Take the exit toward Monterey Oaks Blvd\/Industrial Oaks Blvd - 0.3 mi\n- Follow Southwest Pkwy to State Hwy 71 W - 10 min (6.6 mi)\n- Merge onto W Texas Hwy 71 Service Rd\/W US Hwy 290 Service Rd - 0.1 mi\n- Turn right onto Boston Ln - 0.3 mi\n- Turn left onto Southwest Pkwy - 6.2 mi\n- Follow State Hwy 71 W to Farm to Market Rd 2233\/Ranch Rd 2233 in Llano County - 46 min (42.7 mi)\n- Turn right onto State Hwy 71 W - 29.8 mi\n- Keep left to stay on State Hwy 71 W - 12.9 mi\n- Follow Farm to Market Rd 2233\/Ranch Rd 2233, Ranch Rd 2900 and Farm to Market Rd 2545\/Ranch Rd 2545 to Red Bird in Kingsland - 14 min (10.4 mi)\n- Turn right onto Farm to Market Rd 2233\/Ranch Rd 2233 - 2.6 mi\n- Turn left onto Farm to Market Rd 2900\/Ranch Rd 2900\n- Continue to follow Ranch Rd 2900 - 5.3 mi\n- Turn left onto Farm to Market Rd 1431 W - 0.6 mi\n- At Stop Signal you will see Ace Hardware on your left, then turn Right onto Farm to Market Rd 2545\/Ranch Rd 2545 - 1.7 mi\n- Turn Right onto Elm Lodge Drive - .05 mi\n- Destination will be on the left - 0.3mi\n- Shared driveway with neighbor - driveway will Y\" - stay to the left and continue on till you enter the black iron gate\/fence.",
        "import_time":null,
        "date_of_first_scrape":null,
        "date_of_last_update":null,
        "date_of_last_scrape":null,
        "summary":"property_address1: nan, property_address2: nan, property_building: nan, property_id: 910, property_notes_access: nan, property_notes_general: nan, property_notes_guest_access: nan, property_photos_url: nan, property_state: nan, property_status: nan, listing_id: 66bf68fa7011f00014648c16, saas_auto_renew: True, cleaning_fee_id: 66bf68fa7011f00014648c17, cleaning_fee_value_type: FIXED, cleaning_fee_formula: 470, cleaning_fee_multiplier: PER_STAY, channel_commission_use_account_settings: True, channel_commission_id: 67334bb16d8308d9819747e0, channel_commission_created_at: 2024-11-12T12:36:01.011Z, channel_commission_updated_at: 2024-12-11T07:01:40.069Z, cleaning_status: nan, picture_caption: Aerial, picture_thumbnail: https:\/\/track-pm.s3.amazonaws.com\/gw\/image\/822ff2f9-e043-42bf-8366-39076c6e06c9, minimum_nights: 1, maximum_nights: 365.0, monthly_price_factor: 1, weekly_price_factor: 1.0, base_price: 1.0, weekend_base_price: 469.0, currency: USD, cleaning_fee: 470.0, confirmed_before_checkin_delay_minutes: 45.0, confirmed_day_of_checkin_delay_minutes: 45.0, confirmed_day_of_checkout_delay_minutes: 45.0, confirmed_during_stay_delay_minutes: 45.0, confirmed_after_checkout_delay_minutes: 45.0, unconfirmed_first_message_delay_minutes: 45.0, unconfirmed_subsequent_message_delay_minutes: 45.0, answeing_machine_is_active: nan, auto_reviews_status: nan, auto_payments_time_relation_names: AT--x--BEFORE, auto_payments_time_relation_units: DAYS--x--DAYS, auto_payments_time_relation_amounts: 1--x--14, pms_cleaning_status: nan, calendar_rules_default_availability: AVAILABLE, bookingcom_cut_off_hours_enabled: nan, expedia_cut_off_hours_enabled: nan, airbnb_cut_off_hours_enabled: nan, directbookings_cut_off_hours_enabled: nan, calendar_rules_default_hours: 24.0, calendar_rules_allow_request_to_book: nan, calendar_rules_advance_notice_updated_at: 2024-09-10T19:33:29.715Z, calendar_rules_advance_notice_updated_by: Data Import, booking_window_default_days: 365.0, booking_window_updated_at: 2024-08-16T14:58:02.923Z, preparation_time_updated_at: 2024-08-16T14:58:02.921Z, dynamic_checkin_updated_at: 2024-08-29T17:26:41.432Z, rental_periods_request_to_book: nan, rental_periods_ids: 66bf68fa7011f00014648c19, rental_periods_from: 2024-08-15 00:00:00, default_availability_updated_at: 2024-09-11T20:02:25.492Z, default_availability_updated_by: Data Import, listing_type: SINGLE, owners_list: 66bf908ab11c9ac268b42a7c, amenities_list: Suitable for children (2-12 years)--x--Suitable for infants (under 2 years)--x--Air conditioning--x--BBQ grill--x--Beach essentials--x--Bed linens--x--Blender--x--Body soap--x--Carbon monoxide detector--x--Ceiling fan--x--Coffee maker--x--Conditioner--x--Cookware--x--Dining table--x--Dishes and silverware--x--Dishwasher--x--Dryer--x--Essentials--x--Fire Pit--x--Fishing--x--Free parking on premises--x--Garden or backyard--x--Golf - Optional--x--Hair dryer--x--Heating--x--Hot water--x--Ice maker--x--Internet--x--Kitchen--x--Lake--x--Lake Front--x--Laptop friendly workspace--x--Long term stays allowed--x--Microwave--x--Oven--x--Private entrance--x--Refrigerator--x--Shampoo--x--Shopping--x--Smoke detector--x--Stove--x--Toaster--x--Town--x--TV--x--Washer--x--Water Sports--x--Waterfront--x--Wine glasses--x--Wireless Internet, amenities_not_included_list: nan, use_account_revenue_share: 1.0, use_account_taxes: nan, use_account_markups: 1.0, use_account_additional_fees: nan, is_active: 0.0, net_income_formula: host_payout, commission_formula: net_income, owner_revenue_formula: net_income - pm_commission, tax_ids: nan, tax_types: nan, tax_amounts: nan, tax_names: nan, tax_units: nan, tax_quantifiers: nan, taxes_applied_to_all_fees: nan, taxes_applied_on_fees: nan, taxes_are_applied_by_default: nan, tax_conditional_overrides_view_types: nan, tax_conditional_overrides_max_nights: nan, tax___vs: nan, pre_bookings_list: nan, origin_id: 104181.0, nick_name: Zen Lodge, minimum_age: 18.0, address_full: 351 Elm Lodge Dr, Kingsland, TX 78639, USA, address_street: 351 Elm Lodge Drive, address_city: Kingsland, address_country: United States, address_latitude: 30.672264, address_longitude: -98.444046, address_zip_code: 78639.0, address_state: Texas, address_county: nan, room_type: Entire home\/apt, property_type: House, ota_room_type: Holiday home, accommodates: 18.0, bathrooms: 4.0, bedrooms: 5.0, beds_count: 11.0, listing_status: nan, host_name: Grand Welcome Highland Lakes, wifi_name: ZenLodge, wifi_password: 351elmlodge!, area_in_square_feet: 2436.0, trash_collection_day: Cans are by black iron gate of driveway, parking_instructions: Boat Trailer Parking Available in Driveway, created_at: 2024-05-03T00:00:00.000Z, origin: track, default_check_in_time: 16:00:00, default_check_out_time: 10:00:00, check_in_instructions: Thank you so much for booking! Your door code and additional access instructions will be texted to you on the day of arrival. If you do not receive them two hours prior to check-in, please reach out to us via call or text at 615-334-0695.\n \n*Important Update*  \nWe\u00e2\u20ac\u2122re thrilled to welcome so many guests this season! To ensure every stay is absolutely perfect, we won't be able to accommodate early check-in or late check-out requests until after Labor Day. This gives our dedicated team the necessary time to clean and inspect each property thoroughly, making sure everything is just right for your arrival.\n \nBut here\u00e2\u20ac\u2122s some good news! If your property is ready earlier, you\u00e2\u20ac\u2122ll receive a notification along with your door code on the day of your arrival. So, there\u00e2\u20ac\u2122s always a chance for a pleasant surprise!\n \nWe appreciate your understanding and patience as we focus on providing top-notch service and handling any urgent needs that might come up during your stay. Your comfort and satisfaction are our top priorities!\n \nThank you for being amazing guests, and we can\u00e2\u20ac\u2122t wait for you to enjoy your stay with us!\n\nCHECK IN INSTRUCTIONS:\nAccess and Parking:\nParking is available for up to 6 vehicles in the circle Driveway.\n \nAccess Instructions:\nOnce parked, follow to the main door which is on the side of the house facing the parking area and it is equipped with a keyless entry lock.\n \nLock Instructions:\n- Use the code provided above for entry access.  The check mark button is located on the bottom left of the keypad and must be pushed after entering code.\nIf you are unable to unlock the door, please call 615-334-0695 and a Grand Welcome representative will assist you.\n\nTo lock the door when leaving the home:\n- The door does NOT lock automatically so please press any key on the keypad to lock when you leave.\n- If you are unable to lock the door, please call at 615-334-0695 and a Grand Welcome representative will assist you.\n \nWireless Internet Information:\nNetwork: ZenLodge \nPassword: 351elmlodge!\n \nWasher and Dryer:\nWasher and dryer are located in the laundry room on the 2nd floor near the living room.\n \nTrash:\nTrash is picked up on Wednesday. The bins are located near the black iron gate at driveway.  If trash day falls during your stay, please take bins to the street - please do not block the mailboxes.  \n \nAdditional Information:\n- Take a quick inventory of the kitchen and bath items that are provided before you go to the store to ensure you will have everything you need for your stay. We provide a starter set of amenities, but for longer stays you will likely want to get more. These complimentary amenities are provided free of charge and are included in the blue boxes in the kitchen and bathrooms so please help yourselves! Nearest grocery store is 2.5 miles away at 215 Ranch Road 2900, Kingsland.\n- This home is not pet friendly. If there is evidence found of an animal presence during your stay or post check-out, you will be charged additional cleaning fees.\n- No Smoking Allowed Anywhere Inside or Outside.  If evidence is found, you will be charged additional fees. \n- There are paddleboards, kayaks, lily pad, paddles, and life vests available for guest use.  Please put back all equipment back in the same place that you found them after use.\n-If bringing a boat or jet skis, there are several options for tying off your boat and\/or jet skis. Boat and jet skis at property are owners and not for guest use. Boats can be launched at Kingsland Community Park located at 155 Lions Park Road, Kingsland, TX 78639.  There is a $10 launch fee - there is no overnight trailer parking at boat launch. Guests may park boat trailers at property.   \n \nCheck-Out:\n- Please leave the house as you found it - nice and tidy.  Please return any items used to it's original location.\n- Set AC to 78 degrees during the summer months when checking out. - Set heater to 58 degrees during winter months when checking out.\n- Bag all garbage and place in trash cans outside.\n- Load all dirty dishes into the dishwasher and start.\n- If the grill was used, please clean after use. If not left cleaned, a $25 fee will be charged.\n- Please lock the door before your departure. We hope you enjoy your stay and invite you to share your experience.\n\nIf you feel you will be unable to provide a 5-Star review, please contact our Customer Care Team at 615-334-0695 to discuss your concerns, check_out_instructions: - Please leave the house as you found it - nice and tidy.  Please return any items used to it's original location.\n- Set AC to 78 degrees during the summer months when checking out. - Set heater to 58 degrees during winter months when checking out.\n- Bag , account_id: 66a30f208b331811b8e96639, time_zone: America\/Chicago, last_updated_at: 2024-12-04T02:38:17.575Z, integration_ids: 66d0af0bb6ad7bcfca3bf989, integration_platforms: vacayHome, booking_com_initial_complex_listings: nan, booking_com_publish_company_logos: nan, booking_com_is_published_company_logos: nan, booking_com_publish_company_infos: nan, booking_com_is_published_company_infos: nan, vacayhome_currencies: USD, vacayhome_statuses: COMPLETED, vacayhome_cancellation_policies: firm, vacayhome_cancellation_penalties: 100.0, vacayhome_creation_times: 2024-12-04T02:38:17.005Z, listing_room_ids: 66c30cd399e922187e4f7065--x--66c30cd399e922187e4f7066--x--66c30cd399e922187e4f7067--x--66c30cd399e922187e4f7068--x--66c30cd399e922187e4f7069--x--66c30cd399e922187e4f706a--x--66c30cd399e922187e4f706b--x--66c30cd399e922187e4f706c--x--66c30cd399e922187e4f706d, listing_room_numbers: 1--x--2--x--3--x--4--x--5--x--6--x--7--x--8--x--9, listing_room_bed_ids: 66d0af51c611340019a4aacd--x--66d0af51c611340019a4aace--x--66d0af51c611340019a4aacf--x--66d0af51c611340019a4aad0--x--66d0af51c611340019a4aad1--x--66d0af51c611340019a4aad2, listing_room_bed_types: QUEEN_BED--x--QUEEN_BED--x--QUEEN_BED--x--QUEEN_BED--x--SINGLE_BED--x--BUNK_BED, listing_room_bed_quantities: 1--x--1--x--1--x--1--x--2--x--5, custom_field_values: \u00c2\u00a0\n\u00c2\u00a0Thank you so much for booking! Your door code and additional access instructions will be texted to you on the day of arrival. If you do not receive them two hours prior to check-in, please reach out to us via call or text at 615-334-0695.\n\u00c2\u00a0\n*Important Update*\u00c2\u00a0\u00c2\u00a0\nWe\u00e2\u20ac\u2122re thrilled to welcome so many guests this season! To ensure every stay is absolutely perfect, we won't be able to accommodate early check-in or late check-out requests until after Labor Day. This gives our dedicated team the necessary time to clean and inspect each property thoroughly, making sure everything is just right for your arrival.\n\u00c2\u00a0\nBut here\u00e2\u20ac\u2122s some good news! If your property is ready earlier, you\u00e2\u20ac\u2122ll receive a notification along with your door code on the day of your arrival. So, there\u00e2\u20ac\u2122s always a chance for a pleasant surprise!\n\u00c2\u00a0\nWe appreciate your understanding and patience as we focus on providing top-notch service and handling any urgent needs that might come up during your stay. Your comfort and satisfaction are our top priorities!\n\u00c2\u00a0\n\u00c2\u00a0\nThank you for being amazing guests, and we can\u00e2\u20ac\u2122t wait for you to enjoy your stay with us!\nCHECK IN INSTRUCTIONS:\nAccess and Parking:\nParking is available for up to 6 vehicles in the circle Driveway.\n\u00c2\u00a0\nAccess Instructions:\nOnce parked, follow to the main door which is on the side of the house facing the parking area and it is equipped with a keyless entry lock.\n\u00c2\u00a0\nLock Instructions:\n- Use the code provided above for entry access. The check mark button is located on the bottom left of the keypad and must be pushed after entering code.\nIf you are unable to unlock the door, please call 615-334-0695 and a Grand Welcome representative will assist you.\n\u00c2\u00a0\nTo lock the door when leaving the home:\n- The door does NOT lock automatically so please press any key on the keypad to lock when you leave.\n- If you are unable to lock the door, please call at 615-334-0695 and a Grand Welcome representative will assist you.\n\u00c2\u00a0\nWireless Internet Information:\nNetwork: ZenLodge\nPassword: 351ElmLodge\n\u00c2\u00a0\nWasher and Dryer:\nWasher and dryer are located in the laundry room on the 2nd floor near the living room.\n\u00c2\u00a0\nTrash:\nTrash is picked up on Wednesday. The bins are located near the black iron gate at driveway. If trash day falls during your stay, please take bins to the street - please do not block the mailboxes.\n\u00c2\u00a0\nAdditional Information:\n- Take a quick inventory of the kitchen and bath items that are provided before you go to the store to ensure you will have everything you need for your stay. We provide a starter set of amenities, but for longer stays you will likely want to get more. These complimentary amenities are provided free of charge and are included in the blue boxes in the kitchen and bathrooms so please help yourselves! Nearest grocery store is 2.5 miles away at 215 Ranch Road 2900, Kingsland.\n- This home is not pet friendly. If there is evidence found of an animal presence during your stay or post check-out, you will be charged additional cleaning fees.\n- No Smoking Allowed Anywhere Inside or Outside. If evidence is found, you will be charged additional fees.\n- There are paddleboards, kayaks, lily pad, paddles, and life vests available for guest use. Please put back all equipment back in the same place that you found them after use.\n-If bringing a boat or jet skis, there are several options for tying off your boat and\/or jet skis. Boat and jet skis at property are owners and not for guest use. Boats can be launched at Kingsland Community Park located at 155 Lions Park Road, Kingsland, TX 78639. There is a $10 launch fee - there is no overnight trailer parking at boat launch. Guests may park boat trailers at property.\n\u00c2\u00a0\nCheck-Out:\n- Please leave the house as you found it - nice and tidy. Please return anything used to it's original location.\n- Set AC to 78 degrees during the summer months when checking out. - Set heater to 58 degrees during winter months when checking out.\n- Bag all garbage and place in trash cans outside.\n- Load all dirty dishes into the dishwasher and start.\n- If the grill was used, please clean after use. If not left cleaned, a $25 fee will be charged.\n- Please lock the door before your departure. We hope you enjoy your stay and invite you to share your experience.\n\u00c2\u00a0\nIf you feel you will be unable to provide a 5-Star review, please contact our Customer Care Team at 615-334-0695 to discuss your concerns--x--Leaving Austin-Bergstrom International Airport\n3600 Presidential Blvd, Austin, TX 78719\n \n- Get on State Hwy 71 W in Del Valle from Hotel Dr and Spirit of Texas Dr - 2 min (0.8 mi)\n- Head southwest on Presidential Blvd toward Service Dr - 10 ft\n- Slight right onto Service Dr - 482 ft\n- Turn right onto Hotel Dr - 0.3 mi\n- Turn right onto Spirit of Texas Dr - 0.2 mi\n- Turn left to merge onto State Hwy 71 W - 0.3 mi\n- Follow State Hwy 71 W and US-290 W to W Texas Hwy 71 Service Rd\/W US Hwy 290 Service Rd in Austin. \n- Take the exit toward Monterey Oaks Blvd\/Industrial Oaks Blvd from US-290 W - 10 min (10.3 mi)\n- Merge onto State Hwy 71 W - 0.6 mi\n- Keep left to stay on State Hwy 71 W - 0.1 mi\n- Use any lane to turn slightly left onto State Hwy 71 W\/E Ben White Blvd - 5.2 mi\n- Continue onto State Hwy 71 W\/US-290 W\/W Ben White Blvd - 2.2 mi\n- Keep left to stay on US-290 W - 1.9 mi\n- Take the exit toward Monterey Oaks Blvd\/Industrial Oaks Blvd - 0.3 mi\n- Follow Southwest Pkwy to State Hwy 71 W - 10 min (6.6 mi)\n- Merge onto W Texas Hwy 71 Service Rd\/W US Hwy 290 Service Rd - 0.1 mi\n- Turn right onto Boston Ln - 0.3 mi\n- Turn left onto Southwest Pkwy - 6.2 mi\n- Follow State Hwy 71 W to Farm to Market Rd 2233\/Ranch Rd 2233 in Llano County - 46 min (42.7 mi)\n- Turn right onto State Hwy 71 W - 29.8 mi\n- Keep left to stay on State Hwy 71 W - 12.9 mi\n- Follow Farm to Market Rd 2233\/Ranch Rd 2233, Ranch Rd 2900 and Farm to Market Rd 2545\/Ranch Rd 2545 to Red Bird in Kingsland - 14 min (10.4 mi)\n- Turn right onto Farm to Market Rd 2233\/Ranch Rd 2233 - 2.6 mi\n- Turn left onto Farm to Market Rd 2900\/Ranch Rd 2900\n- Continue to follow Ranch Rd 2900 - 5.3 mi\n- Turn left onto Farm to Market Rd 1431 W - 0.6 mi\n- At Stop Signal you will see Ace Hardware on your left, then turn Right onto Farm to Market Rd 2545\/Ranch Rd 2545 - 1.7 mi\n- Turn Right onto Elm Lodge Drive - .05 mi\n- Destination will be on the left - 0.3mi\n- Shared driveway with neighbor - driveway will Y\" - stay to the left and continue on till you enter the black iron gate\/fence., import_time: nan, date_of_first_scrape: NaT, date_of_last_update: nan, date_of_last_scrape: NaT"
    },
    {
        "property_address1":null,
        "property_address2":null,
        "property_building":null,
        "property_id":925,
        "property_notes_access":null,
        "property_notes_general":null,
        "property_notes_guest_access":null,
        "property_photos_url":null,
        "property_state":null,
        "property_status":null,
        "listing_id":"66bf68e5a970830012f1d6e3",
        "saas_auto_renew":1.0,
        "cleaning_fee_id":"66bf68e5a970830012f1d6e4",
        "cleaning_fee_value_type":"FIXED",
        "cleaning_fee_formula":200.0,
        "cleaning_fee_multiplier":"PER_STAY",
        "channel_commission_use_account_settings":1.0,
        "channel_commission_id":"67334bb16d8308d981974810",
        "channel_commission_created_at":"2024-11-12T12:36:01.135Z",
        "channel_commission_updated_at":"2024-12-11T07:01:40.962Z",
        "cleaning_status":"dirty",
        "picture_caption":"Private laundry is available for your stay!",
        "picture_thumbnail":"https:\/\/track-pm.s3.amazonaws.com\/gw\/image\/eb011afa-7561-4b58-85e6-d6b7c9d46f1c",
        "minimum_nights":1.0,
        "maximum_nights":365.0,
        "monthly_price_factor":1.0,
        "weekly_price_factor":1.0,
        "base_price":1.0,
        "weekend_base_price":281.0,
        "currency":"USD",
        "cleaning_fee":200.0,
        "confirmed_before_checkin_delay_minutes":45.0,
        "confirmed_day_of_checkin_delay_minutes":45.0,
        "confirmed_day_of_checkout_delay_minutes":45.0,
        "confirmed_during_stay_delay_minutes":45.0,
        "confirmed_after_checkout_delay_minutes":45.0,
        "unconfirmed_first_message_delay_minutes":45.0,
        "unconfirmed_subsequent_message_delay_minutes":45.0,
        "answeing_machine_is_active":1.0,
        "auto_reviews_status":1.0,
        "auto_payments_time_relation_names":"AT--x--BEFORE",
        "auto_payments_time_relation_units":"DAYS--x--DAYS",
        "auto_payments_time_relation_amounts":"1--x--14",
        "pms_cleaning_status":1.0,
        "calendar_rules_default_availability":"AVAILABLE",
        "bookingcom_cut_off_hours_enabled":null,
        "expedia_cut_off_hours_enabled":null,
        "airbnb_cut_off_hours_enabled":null,
        "directbookings_cut_off_hours_enabled":null,
        "calendar_rules_default_hours":24.0,
        "calendar_rules_allow_request_to_book":null,
        "calendar_rules_advance_notice_updated_at":"2024-09-10T19:33:22.170Z",
        "calendar_rules_advance_notice_updated_by":"Data Import",
        "booking_window_default_days":365.0,
        "booking_window_updated_at":"2024-08-16T14:57:41.513Z",
        "preparation_time_updated_at":"2024-08-16T14:57:41.511Z",
        "dynamic_checkin_updated_at":"2024-08-29T17:26:55.373Z",
        "rental_periods_request_to_book":null,
        "rental_periods_ids":"66bf68e5a970830012f1d6e6",
        "rental_periods_from":1723680000000,
        "default_availability_updated_at":"2024-09-11T20:02:18.084Z",
        "default_availability_updated_by":"Data Import",
        "listing_type":"SINGLE",
        "owners_list":"66bf9090b11c9ac268b42b30",
        "amenities_list":"Air conditioning--x--BBQ grill--x--Bed linens--x--Blender--x--Body soap--x--Carbon monoxide detector--x--Ceiling fan--x--Coffee maker--x--Conditioner--x--Cookware--x--Crib--x--Dining table--x--Dishes and silverware--x--Dishwasher--x--Downtown--x--Dryer--x--Essentials--x--Foosball table--x--Free parking on premises--x--Free parking on street--x--Garden View--x--Garden or backyard--x--Golf - Optional--x--Hair dryer--x--Heating--x--Hot water--x--Ice maker--x--Internet--x--Iron--x--Kitchen--x--Laptop friendly workspace--x--Long term stays allowed--x--Microwave--x--Museums--x--Oven--x--Pack \u00e2\u20ac\u2122n Play\/travel crib--x--Private entrance--x--Private pool--x--Refrigerator--x--Shampoo--x--Shopping--x--Smoke detector--x--Stove--x--TV--x--Toaster--x--Town--x--Washer--x--Wine glasses--x--Wireless Internet--x--Free parking on Street",
        "amenities_not_included_list":null,
        "use_account_revenue_share":1.0,
        "use_account_taxes":null,
        "use_account_markups":1.0,
        "use_account_additional_fees":null,
        "is_active":1.0,
        "net_income_formula":"host_payout",
        "commission_formula":"net_income",
        "owner_revenue_formula":"net_income - pm_commission",
        "tax_ids":"66e1da77055feb22b03303ba--x--66e1da77055feb22b03303be",
        "tax_types":"STATE_TAX--x--OCCUPANCY_TAX",
        "tax_amounts":"6--x--11",
        "tax_names":"Texas State Tax--x--Travis Cty Hotel Occupancy Tax",
        "tax_units":"PERCENTAGE--x--PERCENTAGE",
        "tax_quantifiers":"PER_STAY--x--PER_STAY",
        "taxes_applied_to_all_fees":"True--x--True",
        "taxes_applied_on_fees":"AF,CF,ADDITIONAL_BED,AIR_CONDITIONING,EARLY_CHECK_IN,LATE_CHECK_IN,BABY_BED,CLEANING,CLUB_CARD,CONCIERGE,EARLY_CHECKOUT,LATE_CHECKOUT,DEPOSIT,ELECTRICITY,FOOD,HEATING,INTERNET,LAUNDRY,LINENS,TOWELS,MANAGEMENT,OIL,PARKING,PET,POOL,POOL_HEATING,RESORT,SERVICE,TOILETRIES,TOUR,TRANSPORTATION,CAR_RENTAL,WATER,WOOD,TRANSFER,HOUSEKEEPING,INSURANCE,COMMUNITY,CREDIT_CARD_PROCESSING_FEE,DAMAGE_WAIVER,VIP_SERVICES,PAYMENT_FEE,ADDITIONAL_CHARGE,MISCELLANEOUS,SHIPPING,VALET,ACTIVITIES,FLIGHTS,GIFT_BASKET,SPA,CHEF,MEET_AND_GREET,DOCK_FEE,UTILITY_FEE,HOT_TUB,BOOKING_FEE,BREAKFAST,BEVERAGE,MEAL,WELLNESS,MINIBAR,BUSINESS_CENTER,WIFI,GUEST_SERVICE,COMMISSION_CHARGE,EQUIPMENT_RENTAL,RESERVATION_FEE,DAMAGE_CHARGE,HOMEOWNERS_ASSOCIATION,GOLF_CART_RENTAL",
        "taxes_are_applied_by_default":"--x--",
        "tax_conditional_overrides_view_types":"LOS--x--LOS",
        "tax_conditional_overrides_max_nights":"29--x--29",
        "tax___vs":"--x--",
        "pre_bookings_list":null,
        "origin_id":104458.0,
        "nick_name":"Oasis on the Hill",
        "minimum_age":21.0,
        "address_full":"8303 Farmington Ct, Austin, TX 78736, USA",
        "address_street":"8303 Farmington Court",
        "address_city":"Austin",
        "address_country":"United States",
        "address_latitude":30.2400272,
        "address_longitude":-97.8934851,
        "address_zip_code":78736.0,
        "address_state":"Texas",
        "address_county":"Travis County",
        "room_type":"Entire home\/apt",
        "property_type":"House",
        "ota_room_type":"Holiday home",
        "accommodates":7.0,
        "bathrooms":2.0,
        "bedrooms":3.0,
        "beds_count":5.0,
        "listing_status":1.0,
        "host_name":"Grand Welcome Austin",
        "wifi_name":"Oasisonthehill",
        "wifi_password":"weregladyourehere",
        "area_in_square_feet":2200.0,
        "trash_collection_day":"Trash and recycling is removed on Tuesday. Bins are located on the left side of the driveway and do not need to be moved for pickup.",
        "parking_instructions":"'- Park in the driveway, which accommodates up to 4 cars. Follow the path to the right of the driveway to reach the front door. Street parking is available as needed on a first come, first served basis.",
        "created_at":"2024-08-12T00:00:00.000Z",
        "origin":"track",
        "default_check_in_time":"16:00:00",
        "default_check_out_time":"10:00:00",
        "check_in_instructions":"Arrival and Parking: \n- Park in the driveway, which accommodates up to 4 cars. Follow the path to the right of the driveway to reach the front door. Street parking is available as needed on a first come, first served basis.\n\u00c2\u00a0\nAccess Instructions: \n- Once parked, proceed to the home\u00e2\u20ac\u2122s main door which is equipped with a keyless lock for entry.\n\u00c2\u00a0\nLock Instructions:\nTo unlock and enter the home:\n- Door code is provided above for entry access. The code will activate right at 4pm.\u00c2\u00a0\n- The door does NOT lock automatically so please lock it when you leave.\u00c2\u00a0\n- Use your code for the door to lock.\u00c2\u00a0\n\u00c2\u00a0\nWireless Internet Information: \nNetwork: Oasisonthehill \nPassword: weregladyourehere\n\u00c2\u00a0\nLaundry: \n- Private laundry is available for your stay, located in the family room off the kitchen.\n\u00c2\u00a0\nTrash: \n- Trash and recycling is removed on Tuesday. Bins are located on the left side of the driveway and do not need to be moved for pickup.\n\u00c2\u00a0\nAdditional Information: \u00c2\u00a0\n- We provide a starter set of supplies, but for longer stays you will likely want buy or bring more. These complimentary amenities are provided free of charge and are included in the blue boxes in the kitchen and bathrooms so please help yourselves!\n- This property is not pet friendly. If there is evidence found of an animal presence during your stay or post check-out, you may be evicted, fined and\/or charged additional cleaning fees. \n- Please reach out if you would like us to send you the entire list of house rules before your arrival.  ",
        "check_out_instructions":"- Set AC to 74 in the summer months  \n- Set heater to 65 in the winter months \n- Bag all garbage and place is designated trash location \n- Load all dirty dishes in the dishwasher and start the dishwasher \n- Place all used towels on the ground in the bathr",
        "account_id":"66a30f208b331811b8e96639",
        "time_zone":"America\/Chicago",
        "last_updated_at":"2024-12-12T20:58:33.741Z",
        "integration_ids":"66d0af0bb6ad7bcfca3bf989--x--66e1a279352e665645cd4fe0--x--66d8cd59cc4df40011491532",
        "integration_platforms":"vacayHome--x--airbnb2--x--homeaway2",
        "booking_com_initial_complex_listings":"--x----x--",
        "booking_com_publish_company_logos":"--x----x--",
        "booking_com_is_published_company_logos":"--x----x--",
        "booking_com_publish_company_infos":"--x----x--",
        "booking_com_is_published_company_infos":"--x----x--",
        "vacayhome_currencies":"USD",
        "vacayhome_statuses":"COMPLETED",
        "vacayhome_cancellation_policies":"firm",
        "vacayhome_cancellation_penalties":100.0,
        "vacayhome_creation_times":"2024-09-11T02:30:15.302Z",
        "listing_room_ids":"66c30cd099e922187e4f6fa8--x--66c30cd099e922187e4f6fa9--x--66c30cd099e922187e4f6faa--x--66c30cd099e922187e4f6fab--x--66c30cd099e922187e4f6fac--x--66c30cd099e922187e4f6fad",
        "listing_room_numbers":null,
        "listing_room_bed_ids":"6700ea406bf9e50010f23892--x--6700ea406bf9e50010f23894--x--6700ea406bf9e50010f23896--x--6700ea406bf9e50010f23898",
        "listing_room_bed_types":"SINGLE_BED--x--QUEEN_BED--x--SINGLE_BED--x--KING_BED",
        "listing_room_bed_quantities":"1--x--1--x--2--x--1",
        "custom_field_values":"Arrival and Parking: \n- Park in the driveway, which accommodates up to 4 cars. Follow the path to the right of the driveway to reach the front door. Street parking is available as needed on a first come, first served basis.\n\u00c2\u00a0\nAccess Instructions: \n- Once parked, proceed to the home\u00e2\u20ac\u2122s main door which is equipped with a keyless lock for entry.\n\u00c2\u00a0\nLock Instructions:\nTo unlock and enter the home:\n- Door code is provided above for entry access. The code will activate right at 4pm.\u00c2\u00a0\n- The door does NOT lock automatically so please lock it when you leave.\u00c2\u00a0\n- Use your code for the door to lock.\u00c2\u00a0\n\u00c2\u00a0\nWireless Internet Information: \nNetwork: Oasisonthehill \nPassword: weregladyourehere\n\u00c2\u00a0\nLaundry: \n- Private laundry is available for your stay, located in the family room off the kitchen.\n\u00c2\u00a0\nTrash: \n- Trash and recycling is removed on Tuesday. Bins are located on the left side of the driveway and do not need to be moved for pickup.\n\u00c2\u00a0\nAdditional Information: \u00c2\u00a0\n- We provide a starter set of supplies, but for longer stays you will likely want buy or bring more. These complimentary amenities are provided free of charge and are included in the blue boxes in the kitchen and bathrooms so please help yourselves!\n- This property is not pet friendly. If there is evidence found of an animal presence during your stay or post check-out, you may be evicted, fined and\/or charged additional cleaning fees. \n- Please reach out if you would like us to send you the entire list of house rules before your arrival.  --x--From Austin-Bergstrom International Airport (AUS)\n3600 Presidential Blvd, Austin, TX 78719\n\u00c2\u00a0\n- Continue to\u00c2\u00a0State Hwy 71 W - 2 min\u00c2\u00a0(1.1 mi)\n- Head\u00c2\u00a0southwest\u00c2\u00a0on\u00c2\u00a0Spirit of Texas Dr - 243 ft\n- Make a\u00c2\u00a0U-turn - 0.2 mi\n- Turn\u00c2\u00a0left\u00c2\u00a0to merge onto\u00c2\u00a0State Hwy 71 W - 0.9 mi\n- Use the middle 3 lanes to stay on\u00c2\u00a0State Hwy 71 W - 0.1 mi\n- Continue on\u00c2\u00a0State Hwy 71 W. Take\u00c2\u00a0US-290 W\u00c2\u00a0to\u00c2\u00a0Frontage Rd\/S Mopac Service Rd. Take the exit toward\u00c2\u00a0William Cannon Dr\u00c2\u00a0from\u00c2\u00a0TX-1 Loop S - 10 min\u00c2\u00a0(10.3 mi)\n- Keep\u00c2\u00a0left\u00c2\u00a0to stay on\u00c2\u00a0State Hwy 71 W - 5.2 mi\n- Continue onto\u00c2\u00a0State Hwy 71 W\/US-290 W - 2.2 mi\n- Use the 2nd from the right lane to stay on\u00c2\u00a0US-290 W - 1.5 mi\n- Take the exit onto\u00c2\u00a0TX-1 Loop S - 1.1 mi\n- Take the exit toward\u00c2\u00a0William Cannon Dr - 0.2 mi\n- Take\u00c2\u00a0W William Cannon Dr,\u00c2\u00a0Convict Hill Rd,\u00c2\u00a0Oak Meadow Dr\u00c2\u00a0and\u00c2\u00a0Scenic Brook Dr\u00c2\u00a0to\u00c2\u00a0Farmington Ct - 13 min\u00c2\u00a0(4.8 mi)\n- Merge onto\u00c2\u00a0Frontage Rd\/S Mopac Service Rd - 0.3 mi\n- Turn\u00c2\u00a0right\u00c2\u00a0onto\u00c2\u00a0W William Cannon Dr - 1.8 mi\n- Turn\u00c2\u00a0left\u00c2\u00a0onto\u00c2\u00a0Escarpment Blvd - 0.4 mi\n- Turn\u00c2\u00a0right\u00c2\u00a0onto\u00c2\u00a0Convict Hill Rd - 0.8 mi\n- Turn\u00c2\u00a0right\u00c2\u00a0onto\u00c2\u00a0US-290 E - 0.1 mi\n- Turn\u00c2\u00a0left\u00c2\u00a0onto\u00c2\u00a0Oak Meadow Dr - 0.6 mi\n- Turn\u00c2\u00a0left\u00c2\u00a0onto\u00c2\u00a0Scenic Brook Dr - 0.6 mi\n- Turn\u00c2\u00a0right\u00c2\u00a0onto\u00c2\u00a0Silvermine Dr - 308 ft\n- Turn\u00c2\u00a0left\u00c2\u00a0onto\u00c2\u00a0Spring Valley Dr - 341 ft\n- Turn\u00c2\u00a0right\u00c2\u00a0onto\u00c2\u00a0Farmington Ct\n- Destination will be on the left - 472 ft\n\u00c2\u00a0\n8303 Farmington Ct\nAustin, TX 78736--x--Permit #: Pending (8\/14\/24 MM)--x--Owner Tax ID\/EIN - 254917001--x--On the gate to the left of driveway--x----x--1 set of towels (bath towel, hand towel, washcloth) per occupant (up to max occupancy on listing)\n2 rolls of toilet paper, bar soap or liquid soap dispenser, and wastebasket trash bag per bathroom\nShampoo, Conditioner, &amp; Body Wash pump bottle per full bathroom\n2 rolls of paper towels, fresh sponge, dish soap, 3 loads of dishwasher detergent, 3 trash bags per kitchen.\n3 loads of laundry detergent per home (with in-house laundry systems)--x--living room--x--In the game room and in the primary bedroom closet--x--Utility Closet--x--One in garage, one on the right side of the house--x--This home is equipped with 1 external Ring security camera, located at the front door and monitoring the entry & street.--x--Private laundry is available for your stay, located in the family room off the kitchen.--x--Street--x--True--x--True--x----x----x--105--x--105--x--Driveway\nPark in the driveway, which accommodates up to 4 cars. Follow the path to the right of the driveway to reach the front door. Street parking is available as needed on a first come, first served basis.--x--4--x--Tuesday - Trash and recycling is removed on Tuesday. Bins are located on the left side of the driveway and do not need to be moved for pickup.--x--No Pool Heating Policy Defined--x--N\/A--x--Keyless Entry 77194--x--Emergency Lockbox (Internal Use) 0723--x--https:\/\/grandwelcomeaustin.guestybookings.com\/en\/properties\/66bf68e5a970830012f1d6e3--x--https:\/\/www.airbnb.com\/rooms\/1242019445945410365--x--https:\/\/www.vrbo.com\/4269855--x--Min Rate $145 ($100 Net BF and MF) - tkt 39277  Min Night: 29",
        "import_time":"2024-08-16T14:57:41.519Z",
        "date_of_first_scrape":1735152600000,
        "date_of_last_update":null,
        "date_of_last_scrape":1735152600000,
        "summary":"property_address1: nan, property_address2: nan, property_building: nan, property_id: 925, property_notes_access: nan, property_notes_general: nan, property_notes_guest_access: nan, property_photos_url: nan, property_state: nan, property_status: nan, listing_id: 66bf68e5a970830012f1d6e3, saas_auto_renew: True, cleaning_fee_id: 66bf68e5a970830012f1d6e4, cleaning_fee_value_type: FIXED, cleaning_fee_formula: 200, cleaning_fee_multiplier: PER_STAY, channel_commission_use_account_settings: True, channel_commission_id: 67334bb16d8308d981974810, channel_commission_created_at: 2024-11-12T12:36:01.135Z, channel_commission_updated_at: 2024-12-11T07:01:40.962Z, cleaning_status: dirty, picture_caption: Private laundry is available for your stay!, picture_thumbnail: https:\/\/track-pm.s3.amazonaws.com\/gw\/image\/eb011afa-7561-4b58-85e6-d6b7c9d46f1c, minimum_nights: 1, maximum_nights: 365.0, monthly_price_factor: 1, weekly_price_factor: 1.0, base_price: 1.0, weekend_base_price: 281.0, currency: USD, cleaning_fee: 200.0, confirmed_before_checkin_delay_minutes: 45.0, confirmed_day_of_checkin_delay_minutes: 45.0, confirmed_day_of_checkout_delay_minutes: 45.0, confirmed_during_stay_delay_minutes: 45.0, confirmed_after_checkout_delay_minutes: 45.0, unconfirmed_first_message_delay_minutes: 45.0, unconfirmed_subsequent_message_delay_minutes: 45.0, answeing_machine_is_active: 1.0, auto_reviews_status: 1.0, auto_payments_time_relation_names: AT--x--BEFORE, auto_payments_time_relation_units: DAYS--x--DAYS, auto_payments_time_relation_amounts: 1--x--14, pms_cleaning_status: 1.0, calendar_rules_default_availability: AVAILABLE, bookingcom_cut_off_hours_enabled: nan, expedia_cut_off_hours_enabled: nan, airbnb_cut_off_hours_enabled: nan, directbookings_cut_off_hours_enabled: nan, calendar_rules_default_hours: 24.0, calendar_rules_allow_request_to_book: nan, calendar_rules_advance_notice_updated_at: 2024-09-10T19:33:22.170Z, calendar_rules_advance_notice_updated_by: Data Import, booking_window_default_days: 365.0, booking_window_updated_at: 2024-08-16T14:57:41.513Z, preparation_time_updated_at: 2024-08-16T14:57:41.511Z, dynamic_checkin_updated_at: 2024-08-29T17:26:55.373Z, rental_periods_request_to_book: nan, rental_periods_ids: 66bf68e5a970830012f1d6e6, rental_periods_from: 2024-08-15 00:00:00, default_availability_updated_at: 2024-09-11T20:02:18.084Z, default_availability_updated_by: Data Import, listing_type: SINGLE, owners_list: 66bf9090b11c9ac268b42b30, amenities_list: Air conditioning--x--BBQ grill--x--Bed linens--x--Blender--x--Body soap--x--Carbon monoxide detector--x--Ceiling fan--x--Coffee maker--x--Conditioner--x--Cookware--x--Crib--x--Dining table--x--Dishes and silverware--x--Dishwasher--x--Downtown--x--Dryer--x--Essentials--x--Foosball table--x--Free parking on premises--x--Free parking on street--x--Garden View--x--Garden or backyard--x--Golf - Optional--x--Hair dryer--x--Heating--x--Hot water--x--Ice maker--x--Internet--x--Iron--x--Kitchen--x--Laptop friendly workspace--x--Long term stays allowed--x--Microwave--x--Museums--x--Oven--x--Pack \u00e2\u20ac\u2122n Play\/travel crib--x--Private entrance--x--Private pool--x--Refrigerator--x--Shampoo--x--Shopping--x--Smoke detector--x--Stove--x--TV--x--Toaster--x--Town--x--Washer--x--Wine glasses--x--Wireless Internet--x--Free parking on Street, amenities_not_included_list: nan, use_account_revenue_share: 1.0, use_account_taxes: nan, use_account_markups: 1.0, use_account_additional_fees: nan, is_active: 1.0, net_income_formula: host_payout, commission_formula: net_income, owner_revenue_formula: net_income - pm_commission, tax_ids: 66e1da77055feb22b03303ba--x--66e1da77055feb22b03303be, tax_types: STATE_TAX--x--OCCUPANCY_TAX, tax_amounts: 6--x--11, tax_names: Texas State Tax--x--Travis Cty Hotel Occupancy Tax, tax_units: PERCENTAGE--x--PERCENTAGE, tax_quantifiers: PER_STAY--x--PER_STAY, taxes_applied_to_all_fees: True--x--True, taxes_applied_on_fees: AF,CF,ADDITIONAL_BED,AIR_CONDITIONING,EARLY_CHECK_IN,LATE_CHECK_IN,BABY_BED,CLEANING,CLUB_CARD,CONCIERGE,EARLY_CHECKOUT,LATE_CHECKOUT,DEPOSIT,ELECTRICITY,FOOD,HEATING,INTERNET,LAUNDRY,LINENS,TOWELS,MANAGEMENT,OIL,PARKING,PET,POOL,POOL_HEATING,RESORT,SERVICE,TOILETRIES,TOUR,TRANSPORTATION,CAR_RENTAL,WATER,WOOD,TRANSFER,HOUSEKEEPING,INSURANCE,COMMUNITY,CREDIT_CARD_PROCESSING_FEE,DAMAGE_WAIVER,VIP_SERVICES,PAYMENT_FEE,ADDITIONAL_CHARGE,MISCELLANEOUS,SHIPPING,VALET,ACTIVITIES,FLIGHTS,GIFT_BASKET,SPA,CHEF,MEET_AND_GREET,DOCK_FEE,UTILITY_FEE,HOT_TUB,BOOKING_FEE,BREAKFAST,BEVERAGE,MEAL,WELLNESS,MINIBAR,BUSINESS_CENTER,WIFI,GUEST_SERVICE,COMMISSION_CHARGE,EQUIPMENT_RENTAL,RESERVATION_FEE,DAMAGE_CHARGE,HOMEOWNERS_ASSOCIATION,GOLF_CART_RENTAL, taxes_are_applied_by_default: --x--, tax_conditional_overrides_view_types: LOS--x--LOS, tax_conditional_overrides_max_nights: 29--x--29, tax___vs: --x--, pre_bookings_list: nan, origin_id: 104458.0, nick_name: Oasis on the Hill, minimum_age: 21.0, address_full: 8303 Farmington Ct, Austin, TX 78736, USA, address_street: 8303 Farmington Court, address_city: Austin, address_country: United States, address_latitude: 30.2400272, address_longitude: -97.8934851, address_zip_code: 78736.0, address_state: Texas, address_county: Travis County, room_type: Entire home\/apt, property_type: House, ota_room_type: Holiday home, accommodates: 7.0, bathrooms: 2.0, bedrooms: 3.0, beds_count: 5.0, listing_status: 1.0, host_name: Grand Welcome Austin, wifi_name: Oasisonthehill, wifi_password: weregladyourehere, area_in_square_feet: 2200.0, trash_collection_day: Trash and recycling is removed on Tuesday. Bins are located on the left side of the driveway and do not need to be moved for pickup., parking_instructions: '- Park in the driveway, which accommodates up to 4 cars. Follow the path to the right of the driveway to reach the front door. Street parking is available as needed on a first come, first served basis., created_at: 2024-08-12T00:00:00.000Z, origin: track, default_check_in_time: 16:00:00, default_check_out_time: 10:00:00, check_in_instructions: Arrival and Parking: \n- Park in the driveway, which accommodates up to 4 cars. Follow the path to the right of the driveway to reach the front door. Street parking is available as needed on a first come, first served basis.\n\u00c2\u00a0\nAccess Instructions: \n- Once parked, proceed to the home\u00e2\u20ac\u2122s main door which is equipped with a keyless lock for entry.\n\u00c2\u00a0\nLock Instructions:\nTo unlock and enter the home:\n- Door code is provided above for entry access. The code will activate right at 4pm.\u00c2\u00a0\n- The door does NOT lock automatically so please lock it when you leave.\u00c2\u00a0\n- Use your code for the door to lock.\u00c2\u00a0\n\u00c2\u00a0\nWireless Internet Information: \nNetwork: Oasisonthehill \nPassword: weregladyourehere\n\u00c2\u00a0\nLaundry: \n- Private laundry is available for your stay, located in the family room off the kitchen.\n\u00c2\u00a0\nTrash: \n- Trash and recycling is removed on Tuesday. Bins are located on the left side of the driveway and do not need to be moved for pickup.\n\u00c2\u00a0\nAdditional Information: \u00c2\u00a0\n- We provide a starter set of supplies, but for longer stays you will likely want buy or bring more. These complimentary amenities are provided free of charge and are included in the blue boxes in the kitchen and bathrooms so please help yourselves!\n- This property is not pet friendly. If there is evidence found of an animal presence during your stay or post check-out, you may be evicted, fined and\/or charged additional cleaning fees. \n- Please reach out if you would like us to send you the entire list of house rules before your arrival.  , check_out_instructions: - Set AC to 74 in the summer months  \n- Set heater to 65 in the winter months \n- Bag all garbage and place is designated trash location \n- Load all dirty dishes in the dishwasher and start the dishwasher \n- Place all used towels on the ground in the bathr, account_id: 66a30f208b331811b8e96639, time_zone: America\/Chicago, last_updated_at: 2024-12-12T20:58:33.741Z, integration_ids: 66d0af0bb6ad7bcfca3bf989--x--66e1a279352e665645cd4fe0--x--66d8cd59cc4df40011491532, integration_platforms: vacayHome--x--airbnb2--x--homeaway2, booking_com_initial_complex_listings: --x----x--, booking_com_publish_company_logos: --x----x--, booking_com_is_published_company_logos: --x----x--, booking_com_publish_company_infos: --x----x--, booking_com_is_published_company_infos: --x----x--, vacayhome_currencies: USD, vacayhome_statuses: COMPLETED, vacayhome_cancellation_policies: firm, vacayhome_cancellation_penalties: 100.0, vacayhome_creation_times: 2024-09-11T02:30:15.302Z, listing_room_ids: 66c30cd099e922187e4f6fa8--x--66c30cd099e922187e4f6fa9--x--66c30cd099e922187e4f6faa--x--66c30cd099e922187e4f6fab--x--66c30cd099e922187e4f6fac--x--66c30cd099e922187e4f6fad, listing_room_numbers: nan, listing_room_bed_ids: 6700ea406bf9e50010f23892--x--6700ea406bf9e50010f23894--x--6700ea406bf9e50010f23896--x--6700ea406bf9e50010f23898, listing_room_bed_types: SINGLE_BED--x--QUEEN_BED--x--SINGLE_BED--x--KING_BED, listing_room_bed_quantities: 1--x--1--x--2--x--1, custom_field_values: Arrival and Parking: \n- Park in the driveway, which accommodates up to 4 cars. Follow the path to the right of the driveway to reach the front door. Street parking is available as needed on a first come, first served basis.\n\u00c2\u00a0\nAccess Instructions: \n- Once parked, proceed to the home\u00e2\u20ac\u2122s main door which is equipped with a keyless lock for entry.\n\u00c2\u00a0\nLock Instructions:\nTo unlock and enter the home:\n- Door code is provided above for entry access. The code will activate right at 4pm.\u00c2\u00a0\n- The door does NOT lock automatically so please lock it when you leave.\u00c2\u00a0\n- Use your code for the door to lock.\u00c2\u00a0\n\u00c2\u00a0\nWireless Internet Information: \nNetwork: Oasisonthehill \nPassword: weregladyourehere\n\u00c2\u00a0\nLaundry: \n- Private laundry is available for your stay, located in the family room off the kitchen.\n\u00c2\u00a0\nTrash: \n- Trash and recycling is removed on Tuesday. Bins are located on the left side of the driveway and do not need to be moved for pickup.\n\u00c2\u00a0\nAdditional Information: \u00c2\u00a0\n- We provide a starter set of supplies, but for longer stays you will likely want buy or bring more. These complimentary amenities are provided free of charge and are included in the blue boxes in the kitchen and bathrooms so please help yourselves!\n- This property is not pet friendly. If there is evidence found of an animal presence during your stay or post check-out, you may be evicted, fined and\/or charged additional cleaning fees. \n- Please reach out if you would like us to send you the entire list of house rules before your arrival.  --x--From Austin-Bergstrom International Airport (AUS)\n3600 Presidential Blvd, Austin, TX 78719\n\u00c2\u00a0\n- Continue to\u00c2\u00a0State Hwy 71 W - 2 min\u00c2\u00a0(1.1 mi)\n- Head\u00c2\u00a0southwest\u00c2\u00a0on\u00c2\u00a0Spirit of Texas Dr - 243 ft\n- Make a\u00c2\u00a0U-turn - 0.2 mi\n- Turn\u00c2\u00a0left\u00c2\u00a0to merge onto\u00c2\u00a0State Hwy 71 W - 0.9 mi\n- Use the middle 3 lanes to stay on\u00c2\u00a0State Hwy 71 W - 0.1 mi\n- Continue on\u00c2\u00a0State Hwy 71 W. Take\u00c2\u00a0US-290 W\u00c2\u00a0to\u00c2\u00a0Frontage Rd\/S Mopac Service Rd. Take the exit toward\u00c2\u00a0William Cannon Dr\u00c2\u00a0from\u00c2\u00a0TX-1 Loop S - 10 min\u00c2\u00a0(10.3 mi)\n- Keep\u00c2\u00a0left\u00c2\u00a0to stay on\u00c2\u00a0State Hwy 71 W - 5.2 mi\n- Continue onto\u00c2\u00a0State Hwy 71 W\/US-290 W - 2.2 mi\n- Use the 2nd from the right lane to stay on\u00c2\u00a0US-290 W - 1.5 mi\n- Take the exit onto\u00c2\u00a0TX-1 Loop S - 1.1 mi\n- Take the exit toward\u00c2\u00a0William Cannon Dr - 0.2 mi\n- Take\u00c2\u00a0W William Cannon Dr,\u00c2\u00a0Convict Hill Rd,\u00c2\u00a0Oak Meadow Dr\u00c2\u00a0and\u00c2\u00a0Scenic Brook Dr\u00c2\u00a0to\u00c2\u00a0Farmington Ct - 13 min\u00c2\u00a0(4.8 mi)\n- Merge onto\u00c2\u00a0Frontage Rd\/S Mopac Service Rd - 0.3 mi\n- Turn\u00c2\u00a0right\u00c2\u00a0onto\u00c2\u00a0W William Cannon Dr - 1.8 mi\n- Turn\u00c2\u00a0left\u00c2\u00a0onto\u00c2\u00a0Escarpment Blvd - 0.4 mi\n- Turn\u00c2\u00a0right\u00c2\u00a0onto\u00c2\u00a0Convict Hill Rd - 0.8 mi\n- Turn\u00c2\u00a0right\u00c2\u00a0onto\u00c2\u00a0US-290 E - 0.1 mi\n- Turn\u00c2\u00a0left\u00c2\u00a0onto\u00c2\u00a0Oak Meadow Dr - 0.6 mi\n- Turn\u00c2\u00a0left\u00c2\u00a0onto\u00c2\u00a0Scenic Brook Dr - 0.6 mi\n- Turn\u00c2\u00a0right\u00c2\u00a0onto\u00c2\u00a0Silvermine Dr - 308 ft\n- Turn\u00c2\u00a0left\u00c2\u00a0onto\u00c2\u00a0Spring Valley Dr - 341 ft\n- Turn\u00c2\u00a0right\u00c2\u00a0onto\u00c2\u00a0Farmington Ct\n- Destination will be on the left - 472 ft\n\u00c2\u00a0\n8303 Farmington Ct\nAustin, TX 78736--x--Permit #: Pending (8\/14\/24 MM)--x--Owner Tax ID\/EIN - 254917001--x--On the gate to the left of driveway--x----x--1 set of towels (bath towel, hand towel, washcloth) per occupant (up to max occupancy on listing)\n2 rolls of toilet paper, bar soap or liquid soap dispenser, and wastebasket trash bag per bathroom\nShampoo, Conditioner, &amp; Body Wash pump bottle per full bathroom\n2 rolls of paper towels, fresh sponge, dish soap, 3 loads of dishwasher detergent, 3 trash bags per kitchen.\n3 loads of laundry detergent per home (with in-house laundry systems)--x--living room--x--In the game room and in the primary bedroom closet--x--Utility Closet--x--One in garage, one on the right side of the house--x--This home is equipped with 1 external Ring security camera, located at the front door and monitoring the entry & street.--x--Private laundry is available for your stay, located in the family room off the kitchen.--x--Street--x--True--x--True--x----x----x--105--x--105--x--Driveway\nPark in the driveway, which accommodates up to 4 cars. Follow the path to the right of the driveway to reach the front door. Street parking is available as needed on a first come, first served basis.--x--4--x--Tuesday - Trash and recycling is removed on Tuesday. Bins are located on the left side of the driveway and do not need to be moved for pickup.--x--No Pool Heating Policy Defined--x--N\/A--x--Keyless Entry 77194--x--Emergency Lockbox (Internal Use) 0723--x--https:\/\/grandwelcomeaustin.guestybookings.com\/en\/properties\/66bf68e5a970830012f1d6e3--x--https:\/\/www.airbnb.com\/rooms\/1242019445945410365--x--https:\/\/www.vrbo.com\/4269855--x--Min Rate $145 ($100 Net BF and MF) - tkt 39277  Min Night: 29, import_time: 2024-08-16T14:57:41.519Z, date_of_first_scrape: 2024-12-25 18:50:00, date_of_last_update: nan, date_of_last_scrape: 2024-12-25 18:50:00"
    },
    {
        "property_address1":null,
        "property_address2":null,
        "property_building":null,
        "property_id":930,
        "property_notes_access":null,
        "property_notes_general":null,
        "property_notes_guest_access":null,
        "property_photos_url":null,
        "property_state":null,
        "property_status":null,
        "listing_id":"66bf68e8115719000f9e478e",
        "saas_auto_renew":1.0,
        "cleaning_fee_id":"66bf68e8115719000f9e478f",
        "cleaning_fee_value_type":"FIXED",
        "cleaning_fee_formula":250.0,
        "cleaning_fee_multiplier":"PER_STAY",
        "channel_commission_use_account_settings":1.0,
        "channel_commission_id":"67334bb16d8308d981974930",
        "channel_commission_created_at":"2024-11-12T12:36:01.734Z",
        "channel_commission_updated_at":"2024-12-11T07:01:40.650Z",
        "cleaning_status":"dirty",
        "picture_caption":"Step outside & enjoy the fresh air in the large back yard oasis",
        "picture_thumbnail":"https:\/\/track-pm.s3.amazonaws.com\/gw\/image\/c300504f-09f7-4a1b-ba3a-1b1cf9f7ab3f",
        "minimum_nights":1.0,
        "maximum_nights":365.0,
        "monthly_price_factor":1.0,
        "weekly_price_factor":1.0,
        "base_price":1.0,
        "weekend_base_price":375.0,
        "currency":"USD",
        "cleaning_fee":250.0,
        "confirmed_before_checkin_delay_minutes":45.0,
        "confirmed_day_of_checkin_delay_minutes":45.0,
        "confirmed_day_of_checkout_delay_minutes":45.0,
        "confirmed_during_stay_delay_minutes":45.0,
        "confirmed_after_checkout_delay_minutes":45.0,
        "unconfirmed_first_message_delay_minutes":45.0,
        "unconfirmed_subsequent_message_delay_minutes":45.0,
        "answeing_machine_is_active":1.0,
        "auto_reviews_status":1.0,
        "auto_payments_time_relation_names":"AT--x--BEFORE",
        "auto_payments_time_relation_units":"DAYS--x--DAYS",
        "auto_payments_time_relation_amounts":"1--x--14",
        "pms_cleaning_status":1.0,
        "calendar_rules_default_availability":"AVAILABLE",
        "bookingcom_cut_off_hours_enabled":null,
        "expedia_cut_off_hours_enabled":null,
        "airbnb_cut_off_hours_enabled":null,
        "directbookings_cut_off_hours_enabled":null,
        "calendar_rules_default_hours":24.0,
        "calendar_rules_allow_request_to_book":null,
        "calendar_rules_advance_notice_updated_at":"2024-09-10T19:33:23.482Z",
        "calendar_rules_advance_notice_updated_by":"Data Import",
        "booking_window_default_days":365.0,
        "booking_window_updated_at":"2024-08-16T14:57:44.458Z",
        "preparation_time_updated_at":"2024-08-16T14:57:44.454Z",
        "dynamic_checkin_updated_at":"2024-08-29T17:26:45.446Z",
        "rental_periods_request_to_book":null,
        "rental_periods_ids":"66bf68e8115719000f9e4791",
        "rental_periods_from":1723680000000,
        "default_availability_updated_at":"2024-09-11T20:02:19.233Z",
        "default_availability_updated_by":"Data Import",
        "listing_type":"SINGLE",
        "owners_list":"66bf908fbc6ac87bd184c33c",
        "amenities_list":"Suitable for children (2-12 years)--x--Suitable for infants (under 2 years)--x--Air conditioning--x--BBQ grill--x--Bed linens--x--Blender--x--Body soap--x--Carbon monoxide detector--x--Ceiling fan--x--City View--x--Coffee maker--x--Conditioner--x--Cookware--x--Dining table--x--Dishes and silverware--x--Dishwasher--x--Downtown--x--Dryer--x--Essentials--x--Fire Pit--x--Free parking on premises--x--Free parking on Street--x--Game room--x--Garden or backyard--x--Garden View--x--Golf - Optional--x--Hair dryer--x--Heating--x--Hot water--x--Ice maker--x--Internet--x--Iron--x--Kitchen--x--Lake--x--Laptop friendly workspace--x--Long term stays allowed--x--Microwave--x--Museums--x--Oven--x--Private entrance--x--Refrigerator--x--Shampoo--x--Shopping--x--Smoke detector--x--Stove--x--Toaster--x--Town--x--TV--x--Washer--x--Wine glasses--x--Wireless Internet",
        "amenities_not_included_list":null,
        "use_account_revenue_share":1.0,
        "use_account_taxes":null,
        "use_account_markups":1.0,
        "use_account_additional_fees":null,
        "is_active":1.0,
        "net_income_formula":"host_payout",
        "commission_formula":"net_income",
        "owner_revenue_formula":"net_income - pm_commission",
        "tax_ids":"66e1da76055feb22b03303aa--x--66e1da76055feb22b03303b0",
        "tax_types":"STATE_TAX--x--OCCUPANCY_TAX",
        "tax_amounts":"6--x--11",
        "tax_names":"Texas State Tax--x--Travis Cty Hotel Occupancy Tax",
        "tax_units":"PERCENTAGE--x--PERCENTAGE",
        "tax_quantifiers":"PER_STAY--x--PER_STAY",
        "taxes_applied_to_all_fees":"True--x--True",
        "taxes_applied_on_fees":"AF,CF,ADDITIONAL_BED,AIR_CONDITIONING,EARLY_CHECK_IN,LATE_CHECK_IN,BABY_BED,CLEANING,CLUB_CARD,CONCIERGE,EARLY_CHECKOUT,LATE_CHECKOUT,DEPOSIT,ELECTRICITY,FOOD,HEATING,INTERNET,LAUNDRY,LINENS,TOWELS,MANAGEMENT,OIL,PARKING,PET,POOL,POOL_HEATING,RESORT,SERVICE,TOILETRIES,TOUR,TRANSPORTATION,CAR_RENTAL,WATER,WOOD,TRANSFER,HOUSEKEEPING,INSURANCE,COMMUNITY,CREDIT_CARD_PROCESSING_FEE,DAMAGE_WAIVER,VIP_SERVICES,PAYMENT_FEE,ADDITIONAL_CHARGE,MISCELLANEOUS,SHIPPING,VALET,ACTIVITIES,FLIGHTS,GIFT_BASKET,SPA,CHEF,MEET_AND_GREET,DOCK_FEE,UTILITY_FEE,HOT_TUB,BOOKING_FEE,BREAKFAST,BEVERAGE,MEAL,WELLNESS,MINIBAR,BUSINESS_CENTER,WIFI,GUEST_SERVICE,COMMISSION_CHARGE,EQUIPMENT_RENTAL,RESERVATION_FEE,DAMAGE_CHARGE,HOMEOWNERS_ASSOCIATION,GOLF_CART_RENTAL",
        "taxes_are_applied_by_default":"--x--",
        "tax_conditional_overrides_view_types":"LOS--x--LOS",
        "tax_conditional_overrides_max_nights":"29--x--29",
        "tax___vs":"--x--",
        "pre_bookings_list":null,
        "origin_id":104399.0,
        "nick_name":"Barton Hills Stunner",
        "minimum_age":18.0,
        "address_full":"2119 Rabb Rd, Austin, TX 78704, USA",
        "address_street":"2119 Rabb Road",
        "address_city":"Austin",
        "address_country":"United States",
        "address_latitude":30.2511715,
        "address_longitude":-97.7792413,
        "address_zip_code":78704.0,
        "address_state":"Texas",
        "address_county":"Travis County",
        "room_type":"Entire home\/apt",
        "property_type":"House",
        "ota_room_type":"Holiday home",
        "accommodates":10.0,
        "bathrooms":3.0,
        "bedrooms":4.0,
        "beds_count":6.0,
        "listing_status":1.0,
        "host_name":"Grand Welcome Austin",
        "wifi_name":"2119 Rabb",
        "wifi_password":"Rabb2119!",
        "area_in_square_feet":3949.0,
        "trash_collection_day":"'- Trash & recycling is removed on Tuesday. Bins are located on the side of the garage.",
        "parking_instructions":"'- Driveway parking is available for up to 4 vehicles. Additional street parking is available as needed on a first come, first served basis.",
        "created_at":"2024-07-12T00:00:00.000Z",
        "origin":"track",
        "default_check_in_time":"16:00:00",
        "default_check_out_time":"10:00:00",
        "check_in_instructions":"Arrival and Parking: \n- Driveway parking is available for up to 4 vehicles. Additional street parking is available as needed on a first come, first served basis.\n\u00c2\u00a0\nAccess Instructions: \n- Once parked, follow the sidewalk to the front door which is equipped with a keyless lock for entry.\n\u00c2\u00a0\nLock Instructions:\nTo unlock and enter the home:\n- Door code is provided above for entry access. The code will activate right at 4pm.\u00c2\u00a0\n- The door does NOT lock automatically so please lock it when you leave.\u00c2\u00a0\n- Use your code for the door to lock.\u00c2\u00a0\n\u00c2\u00a0\nWireless Internet Information: \nNetwork: 2119 Rabb \nPassword: Rabb2119!\n\u00c2\u00a0\nLaundry: \n- Private laundry is available for your stay, located in the utility room.\n\u00c2\u00a0\nTrash: \n- Trash & recycling is removed on Tuesday. Bins are located on the side of the garage.\n\u00c2\u00a0\nAdditional Information: \u00c2\u00a0\n- We provide a starter set of supplies, but for longer stays you will likely want buy or bring more. These complimentary amenities are provided free of charge and are included in the blue boxes in the kitchen and bathrooms so please help yourselves!\n-  This property is not pet friendly. If there is evidence found of an animal presence during your stay or post check-out, you may be evicted, fined and\/or charged additional cleaning fees. \n- Please reach out if you would like us to send you the entire list of house rules before your arrival.  ",
        "check_out_instructions":"- Set AC to 74 in the summer months  \n- Set heater to 65 in the winter months \n- Bag all garbage and place is designated trash location \n- Load all dirty dishes in the dishwasher and start the dishwasher \n- Place all used towels on the ground in the bathr",
        "account_id":"66a30f208b331811b8e96639",
        "time_zone":"America\/Chicago",
        "last_updated_at":"2024-11-13T16:39:07.261Z",
        "integration_ids":"66d0af0bb6ad7bcfca3bf989--x--66d8cd59cc4df40011491532--x--66e1a279352e665645cd4fe0",
        "integration_platforms":"vacayHome--x--homeaway2--x--airbnb2",
        "booking_com_initial_complex_listings":"--x----x--",
        "booking_com_publish_company_logos":"--x----x--",
        "booking_com_is_published_company_logos":"--x----x--",
        "booking_com_publish_company_infos":"--x----x--",
        "booking_com_is_published_company_infos":"--x----x--",
        "vacayhome_currencies":"USD",
        "vacayhome_statuses":"COMPLETED",
        "vacayhome_cancellation_policies":"firm",
        "vacayhome_cancellation_penalties":100.0,
        "vacayhome_creation_times":"2024-08-30T20:30:55.033Z",
        "listing_room_ids":"66c30cd099e922187e4f6fca--x--66c30cd099e922187e4f6fcb--x--66c30cd099e922187e4f6fcc--x--66c30cd099e922187e4f6fcd--x--66c30cd099e922187e4f6fce--x--66c30cd099e922187e4f6fcf--x--66c30cd099e922187e4f6fd0",
        "listing_room_numbers":null,
        "listing_room_bed_ids":"6700bb995afac000117ab006--x--6700bb995afac000117ab008--x--6700bb995afac000117ab00a--x--6700bb995afac000117ab00c",
        "listing_room_bed_types":"SINGLE_BED--x--QUEEN_BED--x--KING_BED--x--SINGLE_BED",
        "listing_room_bed_quantities":"2--x--1--x--1--x--2",
        "custom_field_values":"Arrival and Parking: \n- Driveway parking is available for up to 4 vehicles. Additional street parking is available as needed on a first come, first served basis.\n\u00c2\u00a0\nAccess Instructions: \n- Once parked, follow the sidewalk to the front door which is equipped with a keyless lock for entry.\n\u00c2\u00a0\nLock Instructions:\nTo unlock and enter the home:\n- Door code is provided above for entry access. The code will activate right at 4pm.\u00c2\u00a0\n- The door does NOT lock automatically so please lock it when you leave.\u00c2\u00a0\n- Use your code for the door to lock.\u00c2\u00a0\n\u00c2\u00a0\nWireless Internet Information: \nNetwork: 2119 Rabb \nPassword: Rabb2119!\n\u00c2\u00a0\nLaundry: \n- Private laundry is available for your stay, located in the utility room.\n\u00c2\u00a0\nTrash: \n- Trash & recycling is removed on Tuesday. Bins are located on the side of the garage.\n\u00c2\u00a0\nAdditional Information: \u00c2\u00a0\n- We provide a starter set of supplies, but for longer stays you will likely want buy or bring more. These complimentary amenities are provided free of charge and are included in the blue boxes in the kitchen and bathrooms so please help yourselves!\n-  This property is not pet friendly. If there is evidence found of an animal presence during your stay or post check-out, you may be evicted, fined and\/or charged additional cleaning fees. \n- Please reach out if you would like us to send you the entire list of house rules before your arrival.  --x--From Austin-Bergstrom International Airport (AUS)\n3600 Presidential Blvd, Austin, TX 78719\n\u00c2\u00a0\n- Take\u00c2\u00a0Hotel Dr\u00c2\u00a0to\u00c2\u00a0State Hwy 71 W - 3 min\u00c2\u00a0(1.5 mi)\n- Head\u00c2\u00a0southwest\u00c2\u00a0on\u00c2\u00a0Presidential Blvd\u00c2\u00a0toward\u00c2\u00a0Service Dr - 308 ft\n- Slight\u00c2\u00a0right\u00c2\u00a0onto\u00c2\u00a0Service Dr - 482 ft\n- Turn\u00c2\u00a0right\u00c2\u00a0onto\u00c2\u00a0Hotel Dr - 0.3 mi\n- Turn\u00c2\u00a0right\u00c2\u00a0onto\u00c2\u00a0Spirit of Texas Dr - 0.2 mi\n- Turn\u00c2\u00a0left\u00c2\u00a0to merge onto\u00c2\u00a0State Hwy 71 W - 0.9 mi\n- Use the left 3 lanes to stay on\u00c2\u00a0State Hwy 71 W - 0.1 mi\n- Continue on\u00c2\u00a0State Hwy 71 W\u00c2\u00a0to\u00c2\u00a0W Ben White Blvd\/W Texas Hwy 71 Service Rd. Take the exit toward\u00c2\u00a0Manchaca Rd\/Pack Saddle Pass\/Victory Dr\u00c2\u00a0from\u00c2\u00a0US-290 W - 6 min\u00c2\u00a0(6.9 mi)\n- Keep\u00c2\u00a0left\u00c2\u00a0to stay on\u00c2\u00a0State Hwy 71 W - 5.2 mi\n- Continue onto\u00c2\u00a0State Hwy 71 W\/US-290 W - 1.4 mi\n- Take the exit toward\u00c2\u00a0Manchaca Rd\/Pack Saddle Pass\/Victory Dr - 0.2 mi\n- Take\u00c2\u00a0Menchaca Rd\u00c2\u00a0to\u00c2\u00a0Rabb Rd - 5 min\u00c2\u00a0(1.9 mi)\n- Merge onto\u00c2\u00a0W Ben White Blvd\/W Texas Hwy 71 Service Rd\n- Pass by Whataburger (on the right) - 0.2 mi\n- Turn\u00c2\u00a0right\u00c2\u00a0onto\u00c2\u00a0Menchaca Rd - 1.1 mi\n- Use the left lane to turn\u00c2\u00a0right\u00c2\u00a0onto\u00c2\u00a0S Lamar Blvd\n- Pass by Sonic Drive-In (on the left) - 0.2 mi\n- Turn\u00c2\u00a0left\u00c2\u00a0onto\u00c2\u00a0La Casa Dr - 0.2 mi\n- Turn\u00c2\u00a0right\u00c2\u00a0onto\u00c2\u00a0Rae Dell Ave - 0.2 mi\n- Continue onto\u00c2\u00a0Rabb Rd\n- Destination will be on the right - 161 ft\n\u00c2\u00a0\n2119 Rabb Rd\nAustin, TX 78704--x--Owner Tax ID\/EIN - 450-59-6541\n\n2021 079443 OL\nExp: 06\/11\/2025--x--Owner Tax ID\/EIN - 450-59-6541\n\n2021 079443 OL\nExp: 06\/11\/2025--x----x--1 set of towels (bath towel, hand towel, washcloth) per occupant (up to max occupancy on listing)\n2 rolls of toilet paper, bar soap or liquid soap dispenser, and wastebasket trash bag per bathroom\nShampoo, Conditioner, &amp; Body Wash pump bottle per full bathroom\n2 rolls of paper towels, fresh sponge, dish soap, 3 loads of dishwasher detergent, 3 trash bags per kitchen.\n3 loads of laundry detergent per home (with in-house laundry systems)--x--1 in the hallway at entry, upstairs in the loft--x--Hall closet--x--Utility room closet--x--Outside by HVAC--x--N\/A, per HS (7\/16\/24 MM)--x--Private laundry is available for your stay, located in the utility room.--x--https:\/\/www.grandwelcome.com\/vrp\/unit\/Barton_Hills_Stunner-104399-15--x--https:\/\/www.airbnb.com\/rooms\/1216720149929846806--x--https:\/\/www.vrbo.com\/9991558ha--x--True--x----x----x----x--150--x--150--x--Downtown--x--Driveway & Street\nDriveway parking is available for up to 4 vehicles. Additional street parking is available as needed on a first come, first served basis.--x--4--x--Tuesday--x--No Pool Heating Policy Defined--x--N\/A--x--Emergency Lockbox (Internal Use) 1980\nBackup Keyless Entry Code 1890--x--Min Rate $199 - tkt 38176",
        "import_time":"2024-08-16T14:57:44.472Z",
        "date_of_first_scrape":1735152600000,
        "date_of_last_update":null,
        "date_of_last_scrape":1735152600000,
        "summary":"property_address1: nan, property_address2: nan, property_building: nan, property_id: 930, property_notes_access: nan, property_notes_general: nan, property_notes_guest_access: nan, property_photos_url: nan, property_state: nan, property_status: nan, listing_id: 66bf68e8115719000f9e478e, saas_auto_renew: True, cleaning_fee_id: 66bf68e8115719000f9e478f, cleaning_fee_value_type: FIXED, cleaning_fee_formula: 250, cleaning_fee_multiplier: PER_STAY, channel_commission_use_account_settings: True, channel_commission_id: 67334bb16d8308d981974930, channel_commission_created_at: 2024-11-12T12:36:01.734Z, channel_commission_updated_at: 2024-12-11T07:01:40.650Z, cleaning_status: dirty, picture_caption: Step outside & enjoy the fresh air in the large back yard oasis, picture_thumbnail: https:\/\/track-pm.s3.amazonaws.com\/gw\/image\/c300504f-09f7-4a1b-ba3a-1b1cf9f7ab3f, minimum_nights: 1, maximum_nights: 365.0, monthly_price_factor: 1, weekly_price_factor: 1.0, base_price: 1.0, weekend_base_price: 375.0, currency: USD, cleaning_fee: 250.0, confirmed_before_checkin_delay_minutes: 45.0, confirmed_day_of_checkin_delay_minutes: 45.0, confirmed_day_of_checkout_delay_minutes: 45.0, confirmed_during_stay_delay_minutes: 45.0, confirmed_after_checkout_delay_minutes: 45.0, unconfirmed_first_message_delay_minutes: 45.0, unconfirmed_subsequent_message_delay_minutes: 45.0, answeing_machine_is_active: 1.0, auto_reviews_status: 1.0, auto_payments_time_relation_names: AT--x--BEFORE, auto_payments_time_relation_units: DAYS--x--DAYS, auto_payments_time_relation_amounts: 1--x--14, pms_cleaning_status: 1.0, calendar_rules_default_availability: AVAILABLE, bookingcom_cut_off_hours_enabled: nan, expedia_cut_off_hours_enabled: nan, airbnb_cut_off_hours_enabled: nan, directbookings_cut_off_hours_enabled: nan, calendar_rules_default_hours: 24.0, calendar_rules_allow_request_to_book: nan, calendar_rules_advance_notice_updated_at: 2024-09-10T19:33:23.482Z, calendar_rules_advance_notice_updated_by: Data Import, booking_window_default_days: 365.0, booking_window_updated_at: 2024-08-16T14:57:44.458Z, preparation_time_updated_at: 2024-08-16T14:57:44.454Z, dynamic_checkin_updated_at: 2024-08-29T17:26:45.446Z, rental_periods_request_to_book: nan, rental_periods_ids: 66bf68e8115719000f9e4791, rental_periods_from: 2024-08-15 00:00:00, default_availability_updated_at: 2024-09-11T20:02:19.233Z, default_availability_updated_by: Data Import, listing_type: SINGLE, owners_list: 66bf908fbc6ac87bd184c33c, amenities_list: Suitable for children (2-12 years)--x--Suitable for infants (under 2 years)--x--Air conditioning--x--BBQ grill--x--Bed linens--x--Blender--x--Body soap--x--Carbon monoxide detector--x--Ceiling fan--x--City View--x--Coffee maker--x--Conditioner--x--Cookware--x--Dining table--x--Dishes and silverware--x--Dishwasher--x--Downtown--x--Dryer--x--Essentials--x--Fire Pit--x--Free parking on premises--x--Free parking on Street--x--Game room--x--Garden or backyard--x--Garden View--x--Golf - Optional--x--Hair dryer--x--Heating--x--Hot water--x--Ice maker--x--Internet--x--Iron--x--Kitchen--x--Lake--x--Laptop friendly workspace--x--Long term stays allowed--x--Microwave--x--Museums--x--Oven--x--Private entrance--x--Refrigerator--x--Shampoo--x--Shopping--x--Smoke detector--x--Stove--x--Toaster--x--Town--x--TV--x--Washer--x--Wine glasses--x--Wireless Internet, amenities_not_included_list: nan, use_account_revenue_share: 1.0, use_account_taxes: nan, use_account_markups: 1.0, use_account_additional_fees: nan, is_active: 1.0, net_income_formula: host_payout, commission_formula: net_income, owner_revenue_formula: net_income - pm_commission, tax_ids: 66e1da76055feb22b03303aa--x--66e1da76055feb22b03303b0, tax_types: STATE_TAX--x--OCCUPANCY_TAX, tax_amounts: 6--x--11, tax_names: Texas State Tax--x--Travis Cty Hotel Occupancy Tax, tax_units: PERCENTAGE--x--PERCENTAGE, tax_quantifiers: PER_STAY--x--PER_STAY, taxes_applied_to_all_fees: True--x--True, taxes_applied_on_fees: AF,CF,ADDITIONAL_BED,AIR_CONDITIONING,EARLY_CHECK_IN,LATE_CHECK_IN,BABY_BED,CLEANING,CLUB_CARD,CONCIERGE,EARLY_CHECKOUT,LATE_CHECKOUT,DEPOSIT,ELECTRICITY,FOOD,HEATING,INTERNET,LAUNDRY,LINENS,TOWELS,MANAGEMENT,OIL,PARKING,PET,POOL,POOL_HEATING,RESORT,SERVICE,TOILETRIES,TOUR,TRANSPORTATION,CAR_RENTAL,WATER,WOOD,TRANSFER,HOUSEKEEPING,INSURANCE,COMMUNITY,CREDIT_CARD_PROCESSING_FEE,DAMAGE_WAIVER,VIP_SERVICES,PAYMENT_FEE,ADDITIONAL_CHARGE,MISCELLANEOUS,SHIPPING,VALET,ACTIVITIES,FLIGHTS,GIFT_BASKET,SPA,CHEF,MEET_AND_GREET,DOCK_FEE,UTILITY_FEE,HOT_TUB,BOOKING_FEE,BREAKFAST,BEVERAGE,MEAL,WELLNESS,MINIBAR,BUSINESS_CENTER,WIFI,GUEST_SERVICE,COMMISSION_CHARGE,EQUIPMENT_RENTAL,RESERVATION_FEE,DAMAGE_CHARGE,HOMEOWNERS_ASSOCIATION,GOLF_CART_RENTAL, taxes_are_applied_by_default: --x--, tax_conditional_overrides_view_types: LOS--x--LOS, tax_conditional_overrides_max_nights: 29--x--29, tax___vs: --x--, pre_bookings_list: nan, origin_id: 104399.0, nick_name: Barton Hills Stunner, minimum_age: 18.0, address_full: 2119 Rabb Rd, Austin, TX 78704, USA, address_street: 2119 Rabb Road, address_city: Austin, address_country: United States, address_latitude: 30.2511715, address_longitude: -97.7792413, address_zip_code: 78704.0, address_state: Texas, address_county: Travis County, room_type: Entire home\/apt, property_type: House, ota_room_type: Holiday home, accommodates: 10.0, bathrooms: 3.0, bedrooms: 4.0, beds_count: 6.0, listing_status: 1.0, host_name: Grand Welcome Austin, wifi_name: 2119 Rabb, wifi_password: Rabb2119!, area_in_square_feet: 3949.0, trash_collection_day: '- Trash & recycling is removed on Tuesday. Bins are located on the side of the garage., parking_instructions: '- Driveway parking is available for up to 4 vehicles. Additional street parking is available as needed on a first come, first served basis., created_at: 2024-07-12T00:00:00.000Z, origin: track, default_check_in_time: 16:00:00, default_check_out_time: 10:00:00, check_in_instructions: Arrival and Parking: \n- Driveway parking is available for up to 4 vehicles. Additional street parking is available as needed on a first come, first served basis.\n\u00c2\u00a0\nAccess Instructions: \n- Once parked, follow the sidewalk to the front door which is equipped with a keyless lock for entry.\n\u00c2\u00a0\nLock Instructions:\nTo unlock and enter the home:\n- Door code is provided above for entry access. The code will activate right at 4pm.\u00c2\u00a0\n- The door does NOT lock automatically so please lock it when you leave.\u00c2\u00a0\n- Use your code for the door to lock.\u00c2\u00a0\n\u00c2\u00a0\nWireless Internet Information: \nNetwork: 2119 Rabb \nPassword: Rabb2119!\n\u00c2\u00a0\nLaundry: \n- Private laundry is available for your stay, located in the utility room.\n\u00c2\u00a0\nTrash: \n- Trash & recycling is removed on Tuesday. Bins are located on the side of the garage.\n\u00c2\u00a0\nAdditional Information: \u00c2\u00a0\n- We provide a starter set of supplies, but for longer stays you will likely want buy or bring more. These complimentary amenities are provided free of charge and are included in the blue boxes in the kitchen and bathrooms so please help yourselves!\n-  This property is not pet friendly. If there is evidence found of an animal presence during your stay or post check-out, you may be evicted, fined and\/or charged additional cleaning fees. \n- Please reach out if you would like us to send you the entire list of house rules before your arrival.  , check_out_instructions: - Set AC to 74 in the summer months  \n- Set heater to 65 in the winter months \n- Bag all garbage and place is designated trash location \n- Load all dirty dishes in the dishwasher and start the dishwasher \n- Place all used towels on the ground in the bathr, account_id: 66a30f208b331811b8e96639, time_zone: America\/Chicago, last_updated_at: 2024-11-13T16:39:07.261Z, integration_ids: 66d0af0bb6ad7bcfca3bf989--x--66d8cd59cc4df40011491532--x--66e1a279352e665645cd4fe0, integration_platforms: vacayHome--x--homeaway2--x--airbnb2, booking_com_initial_complex_listings: --x----x--, booking_com_publish_company_logos: --x----x--, booking_com_is_published_company_logos: --x----x--, booking_com_publish_company_infos: --x----x--, booking_com_is_published_company_infos: --x----x--, vacayhome_currencies: USD, vacayhome_statuses: COMPLETED, vacayhome_cancellation_policies: firm, vacayhome_cancellation_penalties: 100.0, vacayhome_creation_times: 2024-08-30T20:30:55.033Z, listing_room_ids: 66c30cd099e922187e4f6fca--x--66c30cd099e922187e4f6fcb--x--66c30cd099e922187e4f6fcc--x--66c30cd099e922187e4f6fcd--x--66c30cd099e922187e4f6fce--x--66c30cd099e922187e4f6fcf--x--66c30cd099e922187e4f6fd0, listing_room_numbers: nan, listing_room_bed_ids: 6700bb995afac000117ab006--x--6700bb995afac000117ab008--x--6700bb995afac000117ab00a--x--6700bb995afac000117ab00c, listing_room_bed_types: SINGLE_BED--x--QUEEN_BED--x--KING_BED--x--SINGLE_BED, listing_room_bed_quantities: 2--x--1--x--1--x--2, custom_field_values: Arrival and Parking: \n- Driveway parking is available for up to 4 vehicles. Additional street parking is available as needed on a first come, first served basis.\n\u00c2\u00a0\nAccess Instructions: \n- Once parked, follow the sidewalk to the front door which is equipped with a keyless lock for entry.\n\u00c2\u00a0\nLock Instructions:\nTo unlock and enter the home:\n- Door code is provided above for entry access. The code will activate right at 4pm.\u00c2\u00a0\n- The door does NOT lock automatically so please lock it when you leave.\u00c2\u00a0\n- Use your code for the door to lock.\u00c2\u00a0\n\u00c2\u00a0\nWireless Internet Information: \nNetwork: 2119 Rabb \nPassword: Rabb2119!\n\u00c2\u00a0\nLaundry: \n- Private laundry is available for your stay, located in the utility room.\n\u00c2\u00a0\nTrash: \n- Trash & recycling is removed on Tuesday. Bins are located on the side of the garage.\n\u00c2\u00a0\nAdditional Information: \u00c2\u00a0\n- We provide a starter set of supplies, but for longer stays you will likely want buy or bring more. These complimentary amenities are provided free of charge and are included in the blue boxes in the kitchen and bathrooms so please help yourselves!\n-  This property is not pet friendly. If there is evidence found of an animal presence during your stay or post check-out, you may be evicted, fined and\/or charged additional cleaning fees. \n- Please reach out if you would like us to send you the entire list of house rules before your arrival.  --x--From Austin-Bergstrom International Airport (AUS)\n3600 Presidential Blvd, Austin, TX 78719\n\u00c2\u00a0\n- Take\u00c2\u00a0Hotel Dr\u00c2\u00a0to\u00c2\u00a0State Hwy 71 W - 3 min\u00c2\u00a0(1.5 mi)\n- Head\u00c2\u00a0southwest\u00c2\u00a0on\u00c2\u00a0Presidential Blvd\u00c2\u00a0toward\u00c2\u00a0Service Dr - 308 ft\n- Slight\u00c2\u00a0right\u00c2\u00a0onto\u00c2\u00a0Service Dr - 482 ft\n- Turn\u00c2\u00a0right\u00c2\u00a0onto\u00c2\u00a0Hotel Dr - 0.3 mi\n- Turn\u00c2\u00a0right\u00c2\u00a0onto\u00c2\u00a0Spirit of Texas Dr - 0.2 mi\n- Turn\u00c2\u00a0left\u00c2\u00a0to merge onto\u00c2\u00a0State Hwy 71 W - 0.9 mi\n- Use the left 3 lanes to stay on\u00c2\u00a0State Hwy 71 W - 0.1 mi\n- Continue on\u00c2\u00a0State Hwy 71 W\u00c2\u00a0to\u00c2\u00a0W Ben White Blvd\/W Texas Hwy 71 Service Rd. Take the exit toward\u00c2\u00a0Manchaca Rd\/Pack Saddle Pass\/Victory Dr\u00c2\u00a0from\u00c2\u00a0US-290 W - 6 min\u00c2\u00a0(6.9 mi)\n- Keep\u00c2\u00a0left\u00c2\u00a0to stay on\u00c2\u00a0State Hwy 71 W - 5.2 mi\n- Continue onto\u00c2\u00a0State Hwy 71 W\/US-290 W - 1.4 mi\n- Take the exit toward\u00c2\u00a0Manchaca Rd\/Pack Saddle Pass\/Victory Dr - 0.2 mi\n- Take\u00c2\u00a0Menchaca Rd\u00c2\u00a0to\u00c2\u00a0Rabb Rd - 5 min\u00c2\u00a0(1.9 mi)\n- Merge onto\u00c2\u00a0W Ben White Blvd\/W Texas Hwy 71 Service Rd\n- Pass by Whataburger (on the right) - 0.2 mi\n- Turn\u00c2\u00a0right\u00c2\u00a0onto\u00c2\u00a0Menchaca Rd - 1.1 mi\n- Use the left lane to turn\u00c2\u00a0right\u00c2\u00a0onto\u00c2\u00a0S Lamar Blvd\n- Pass by Sonic Drive-In (on the left) - 0.2 mi\n- Turn\u00c2\u00a0left\u00c2\u00a0onto\u00c2\u00a0La Casa Dr - 0.2 mi\n- Turn\u00c2\u00a0right\u00c2\u00a0onto\u00c2\u00a0Rae Dell Ave - 0.2 mi\n- Continue onto\u00c2\u00a0Rabb Rd\n- Destination will be on the right - 161 ft\n\u00c2\u00a0\n2119 Rabb Rd\nAustin, TX 78704--x--Owner Tax ID\/EIN - 450-59-6541\n\n2021 079443 OL\nExp: 06\/11\/2025--x--Owner Tax ID\/EIN - 450-59-6541\n\n2021 079443 OL\nExp: 06\/11\/2025--x----x--1 set of towels (bath towel, hand towel, washcloth) per occupant (up to max occupancy on listing)\n2 rolls of toilet paper, bar soap or liquid soap dispenser, and wastebasket trash bag per bathroom\nShampoo, Conditioner, &amp; Body Wash pump bottle per full bathroom\n2 rolls of paper towels, fresh sponge, dish soap, 3 loads of dishwasher detergent, 3 trash bags per kitchen.\n3 loads of laundry detergent per home (with in-house laundry systems)--x--1 in the hallway at entry, upstairs in the loft--x--Hall closet--x--Utility room closet--x--Outside by HVAC--x--N\/A, per HS (7\/16\/24 MM)--x--Private laundry is available for your stay, located in the utility room.--x--https:\/\/www.grandwelcome.com\/vrp\/unit\/Barton_Hills_Stunner-104399-15--x--https:\/\/www.airbnb.com\/rooms\/1216720149929846806--x--https:\/\/www.vrbo.com\/9991558ha--x--True--x----x----x----x--150--x--150--x--Downtown--x--Driveway & Street\nDriveway parking is available for up to 4 vehicles. Additional street parking is available as needed on a first come, first served basis.--x--4--x--Tuesday--x--No Pool Heating Policy Defined--x--N\/A--x--Emergency Lockbox (Internal Use) 1980\nBackup Keyless Entry Code 1890--x--Min Rate $199 - tkt 38176, import_time: 2024-08-16T14:57:44.472Z, date_of_first_scrape: 2024-12-25 18:50:00, date_of_last_update: nan, date_of_last_scrape: 2024-12-25 18:50:00"
    },
    {
        "property_address1":null,
        "property_address2":null,
        "property_building":null,
        "property_id":953,
        "property_notes_access":null,
        "property_notes_general":null,
        "property_notes_guest_access":null,
        "property_photos_url":null,
        "property_state":null,
        "property_status":null,
        "listing_id":"66bf68f7d7003b0013c5ce7c",
        "saas_auto_renew":1.0,
        "cleaning_fee_id":"66bf68f7d7003b0013c5ce7d",
        "cleaning_fee_value_type":"FIXED",
        "cleaning_fee_formula":150.0,
        "cleaning_fee_multiplier":"PER_STAY",
        "channel_commission_use_account_settings":1.0,
        "channel_commission_id":"67334bb16d8308d981974830",
        "channel_commission_created_at":"2024-11-12T12:36:01.197Z",
        "channel_commission_updated_at":"2024-12-11T07:01:41.148Z",
        "cleaning_status":"dirty",
        "picture_caption":"TopGolf",
        "picture_thumbnail":"https:\/\/track-pm.s3.amazonaws.com\/gw\/image\/9ae926bd-f1de-4346-9832-78855e4dc319",
        "minimum_nights":1.0,
        "maximum_nights":365.0,
        "monthly_price_factor":1.0,
        "weekly_price_factor":1.0,
        "base_price":1.0,
        "weekend_base_price":188.0,
        "currency":"USD",
        "cleaning_fee":150.0,
        "confirmed_before_checkin_delay_minutes":45.0,
        "confirmed_day_of_checkin_delay_minutes":45.0,
        "confirmed_day_of_checkout_delay_minutes":45.0,
        "confirmed_during_stay_delay_minutes":45.0,
        "confirmed_after_checkout_delay_minutes":45.0,
        "unconfirmed_first_message_delay_minutes":45.0,
        "unconfirmed_subsequent_message_delay_minutes":45.0,
        "answeing_machine_is_active":null,
        "auto_reviews_status":null,
        "auto_payments_time_relation_names":"AT--x--BEFORE",
        "auto_payments_time_relation_units":"DAYS--x--DAYS",
        "auto_payments_time_relation_amounts":"1--x--14",
        "pms_cleaning_status":null,
        "calendar_rules_default_availability":"AVAILABLE",
        "bookingcom_cut_off_hours_enabled":null,
        "expedia_cut_off_hours_enabled":null,
        "airbnb_cut_off_hours_enabled":null,
        "directbookings_cut_off_hours_enabled":null,
        "calendar_rules_default_hours":24.0,
        "calendar_rules_allow_request_to_book":null,
        "calendar_rules_advance_notice_updated_at":"2024-09-10T19:33:28.090Z",
        "calendar_rules_advance_notice_updated_by":"Data Import",
        "booking_window_default_days":365.0,
        "booking_window_updated_at":"2024-08-16T14:57:59.116Z",
        "preparation_time_updated_at":"2024-08-16T14:57:59.113Z",
        "dynamic_checkin_updated_at":"2024-08-29T17:26:54.122Z",
        "rental_periods_request_to_book":null,
        "rental_periods_ids":"66bf68f7d7003b0013c5ce7f",
        "rental_periods_from":1723680000000,
        "default_availability_updated_at":"2024-09-11T20:02:24.072Z",
        "default_availability_updated_by":"Data Import",
        "listing_type":"SINGLE",
        "owners_list":"66bf9086bc6ac87bd184c292",
        "amenities_list":"Suitable for children (2-12 years)--x--Suitable for infants (under 2 years)--x--Air conditioning--x--Bed linens--x--Body soap--x--Carbon monoxide detector--x--Ceiling fan--x--Coffee maker--x--Conditioner--x--Dining table--x--Dishwasher--x--Downtown--x--Dryer--x--Essentials--x--Free parking on premises--x--Garden or backyard--x--Garden View--x--Golf - Optional--x--Hair dryer--x--Heating--x--Hot water--x--Ice maker--x--Internet--x--Iron--x--Kitchen--x--Laptop friendly workspace--x--Long term stays allowed--x--Microwave--x--Museums--x--Oven--x--Private entrance--x--Refrigerator--x--Shampoo--x--Shopping--x--Smoke detector--x--Stove--x--Toaster--x--Town--x--TV--x--Washer--x--Wireless Internet",
        "amenities_not_included_list":null,
        "use_account_revenue_share":1.0,
        "use_account_taxes":null,
        "use_account_markups":1.0,
        "use_account_additional_fees":null,
        "is_active":0.0,
        "net_income_formula":"host_payout",
        "commission_formula":"net_income",
        "owner_revenue_formula":"net_income - pm_commission",
        "tax_ids":"66e1da71059dc7ccf8e9c2e0--x--66e1da71059dc7ccf8e9c2e6",
        "tax_types":"STATE_TAX--x--OCCUPANCY_TAX",
        "tax_amounts":"6--x--11",
        "tax_names":"Texas State Tax--x--Travis Cty Hotel Occupancy Tax",
        "tax_units":"PERCENTAGE--x--PERCENTAGE",
        "tax_quantifiers":"PER_STAY--x--PER_STAY",
        "taxes_applied_to_all_fees":"True--x--True",
        "taxes_applied_on_fees":"AF,CF,ADDITIONAL_BED,AIR_CONDITIONING,EARLY_CHECK_IN,LATE_CHECK_IN,BABY_BED,CLEANING,CLUB_CARD,CONCIERGE,EARLY_CHECKOUT,LATE_CHECKOUT,DEPOSIT,ELECTRICITY,FOOD,HEATING,INTERNET,LAUNDRY,LINENS,TOWELS,MANAGEMENT,OIL,PARKING,PET,POOL,POOL_HEATING,RESORT,SERVICE,TOILETRIES,TOUR,TRANSPORTATION,CAR_RENTAL,WATER,WOOD,TRANSFER,HOUSEKEEPING,INSURANCE,COMMUNITY,CREDIT_CARD_PROCESSING_FEE,DAMAGE_WAIVER,VIP_SERVICES,PAYMENT_FEE,ADDITIONAL_CHARGE,MISCELLANEOUS,SHIPPING,VALET,ACTIVITIES,FLIGHTS,GIFT_BASKET,SPA,CHEF,MEET_AND_GREET,DOCK_FEE,UTILITY_FEE,HOT_TUB,BOOKING_FEE,BREAKFAST,BEVERAGE,MEAL,WELLNESS,MINIBAR,BUSINESS_CENTER,WIFI,GUEST_SERVICE,COMMISSION_CHARGE,EQUIPMENT_RENTAL,RESERVATION_FEE,DAMAGE_CHARGE,HOMEOWNERS_ASSOCIATION,GOLF_CART_RENTAL",
        "taxes_are_applied_by_default":"--x--",
        "tax_conditional_overrides_view_types":"LOS--x--LOS",
        "tax_conditional_overrides_max_nights":"29--x--29",
        "tax___vs":"--x--",
        "pre_bookings_list":null,
        "origin_id":104185.0,
        "nick_name":"Domain Luxe Loft",
        "minimum_age":18.0,
        "address_full":"1906 Albury Cove c, Austin, TX 78758, USA",
        "address_street":"1906 Albury Cove",
        "address_city":"Austin",
        "address_country":"United States",
        "address_latitude":30.3998501,
        "address_longitude":-97.7025575,
        "address_zip_code":78758.0,
        "address_state":"Texas",
        "address_county":"Travis County, TX",
        "room_type":"Entire home\/apt",
        "property_type":"Condominium",
        "ota_room_type":"Apartment",
        "accommodates":4.0,
        "bathrooms":2.0,
        "bedrooms":2.0,
        "beds_count":2.0,
        "listing_status":null,
        "host_name":"Grand Welcome Austin",
        "wifi_name":"1904C",
        "wifi_password":"Rb3nXZxT!JF",
        "area_in_square_feet":1144.0,
        "trash_collection_day":"Trash is picked up on Wednesday. Trash bins are located behind the fence. If trash day falls during your stay, please take bins to the curb.",
        "parking_instructions":"'- Parking for 2 vehicles is available in the shared parking lot directly in front of property, in spaces marked with a \u00e2\u20ac\u0153C\u00e2\u20ac\u009d.",
        "created_at":"2024-05-03T00:00:00.000Z",
        "origin":"track",
        "default_check_in_time":"16:00:00",
        "default_check_out_time":"10:00:00",
        "check_in_instructions":"Arrival and Parking: \n- Parking for 2 vehicles is available in the shared parking lot directly in front of property, in spaces marked with a \u00e2\u20ac\u0153C\u00e2\u20ac\u009d.\n\u00c2\u00a0\nAccess Instructions: \n- Once parked, proceed to Unit C's entry door which is equipped with an electronic lock.\n\u00c2\u00a0\nLock Instructions:\u00c2\u00a0\nTo unlock and enter the home:\u00c2\u00a0\n- Door code is provided above for entry access. The code will activate right at 4pm.\u00c2\u00a0\n- The door does NOT lock automatically so please lock it when you leave.\u00c2\u00a0\n- Use your code for the door to lock.\u00c2\u00a0\n\u00c2\u00a0\nWireless Internet Information: \nNetwork: 1904C \nPassword: Rb3nXZxT!JF\n\u00c2\u00a0\nLaundry: \n- Washer and dryer are located in the closet of the main level bathroom.\n\u00c2\u00a0\nTrash: \n- Trash is picked up on Wednesday. Trash bins are located behind the fence. If trash day falls during your stay, please take bins to the curb.\n\u00c2\u00a0\nAdditional Information: \u00c2\u00a0\n- We provide a starter set of supplies, but for longer stays you will likely want buy or bring more. These complimentary amenities are provided free of charge and are included in the blue boxes in the kitchen and bathrooms so please help yourselves!\n-  This property is not pet friendly. If there is evidence found of an animal presence during your stay or post check-out, you may be evicted, fined and\/or charged additional cleaning fees. \n- Please reach out if you would like us to send you the entire list of house rules before your arrival.  ",
        "check_out_instructions":"- Set AC to 74 in the summer months  \n- Set heater to 65 in the winter months \n- Bag all garbage and place is designated trash location \n- Load all dirty dishes in the dishwasher and start the dishwasher \n- Place all used towels on the ground in the bathr",
        "account_id":"66a30f208b331811b8e96639",
        "time_zone":"America\/Chicago",
        "last_updated_at":"2024-12-16T20:45:32.019Z",
        "integration_ids":"66d0af0bb6ad7bcfca3bf989--x--66e1a279352e665645cd4fe0",
        "integration_platforms":"vacayHome--x--airbnb2",
        "booking_com_initial_complex_listings":null,
        "booking_com_publish_company_logos":null,
        "booking_com_is_published_company_logos":null,
        "booking_com_publish_company_infos":null,
        "booking_com_is_published_company_infos":null,
        "vacayhome_currencies":"USD",
        "vacayhome_statuses":"DISCONNECTED",
        "vacayhome_cancellation_policies":"firm",
        "vacayhome_cancellation_penalties":100.0,
        "vacayhome_creation_times":"2024-12-16T20:45:07.007Z",
        "listing_room_ids":"66c30cd399e922187e4f7049--x--66c30cd399e922187e4f704a--x--66c30cd399e922187e4f704b--x--66c30cd399e922187e4f704c",
        "listing_room_numbers":null,
        "listing_room_bed_ids":"6700d6d4b102900011d29e7e--x--6700d6d4b102900011d29e80",
        "listing_room_bed_types":"QUEEN_BED--x--KING_BED",
        "listing_room_bed_quantities":"1--x--1",
        "custom_field_values":"Arrival and Parking: \n- Parking for 2 vehicles is available in the shared parking lot directly in front of property, in spaces marked with a \u00e2\u20ac\u0153C\u00e2\u20ac\u009d.\n\u00c2\u00a0\nAccess Instructions: \n- Once parked, proceed to Unit C's entry door which is equipped with an electronic lock.\n\u00c2\u00a0\nLock Instructions:\u00c2\u00a0\nTo unlock and enter the home:\u00c2\u00a0\n- Door code is provided above for entry access. The code will activate right at 4pm.\u00c2\u00a0\n- The door does NOT lock automatically so please lock it when you leave.\u00c2\u00a0\n- Use your code for the door to lock.\u00c2\u00a0\n\u00c2\u00a0\nWireless Internet Information: \nNetwork: 1904C \nPassword: Rb3nXZxT!JF\n\u00c2\u00a0\nLaundry: \n- Washer and dryer are located in the closet of the main level bathroom.\n\u00c2\u00a0\nTrash: \n- Trash is picked up on Wednesday. Trash bins are located behind the fence. If trash day falls during your stay, please take bins to the curb.\n\u00c2\u00a0\nAdditional Information: \u00c2\u00a0\n- We provide a starter set of supplies, but for longer stays you will likely want buy or bring more. These complimentary amenities are provided free of charge and are included in the blue boxes in the kitchen and bathrooms so please help yourselves!\n-  This property is not pet friendly. If there is evidence found of an animal presence during your stay or post check-out, you may be evicted, fined and\/or charged additional cleaning fees. \n- Please reach out if you would like us to send you the entire list of house rules before your arrival.  --x--From Austin-Bergstrom International Airport (AUS)\n3600 Presidential Blvd, Austin, TX 78719\n\u00c2\u00a0\n- Get on\u00c2\u00a0State Hwy 71 W\u00c2\u00a0in\u00c2\u00a0Del Valle\u00c2\u00a0from\u00c2\u00a0Hotel Dr\u00c2\u00a0and\u00c2\u00a0Spirit of Texas Dr - 2 min\u00c2\u00a0(0.9 mi)\n- Head\u00c2\u00a0southwest\u00c2\u00a0on\u00c2\u00a0Presidential Blvd - 354 ft\n- Slight\u00c2\u00a0right\u00c2\u00a0onto\u00c2\u00a0Service Dr - 482 ft\n- Turn\u00c2\u00a0right\u00c2\u00a0onto\u00c2\u00a0Hotel Dr - 0.3 mi\n- Turn\u00c2\u00a0right\u00c2\u00a0onto\u00c2\u00a0Spirit of Texas Dr - 0.2 mi\n- Turn\u00c2\u00a0left\u00c2\u00a0to merge onto\u00c2\u00a0State Hwy 71 W - 0.3 mi\n- Take\u00c2\u00a0183 Toll\u00c2\u00a0and\u00c2\u00a0US-183 N\u00c2\u00a0to\u00c2\u00a0Research Blvd\u00c2\u00a0in\u00c2\u00a0Austin. Take the exit toward\u00c2\u00a0FM 1325\/Burnet Rd\u00c2\u00a0from\u00c2\u00a0US-183 N - 12 min\u00c2\u00a0(13.4 mi)\n- Merge onto\u00c2\u00a0State Hwy 71 W - 0.5 mi\n- Keep\u00c2\u00a0left\u00c2\u00a0to stay on\u00c2\u00a0State Hwy 71 W - 0.1 mi\n- Use the right 2 lanes to turn slightly\u00c2\u00a0right\u00c2\u00a0onto the\u00c2\u00a0US-183 N\u00c2\u00a0ramp - 0.5 mi\n- Continue onto\u00c2\u00a0US-183 N\/S Hwy 183\n- Continue to follow S Hwy 183 (Toll road) - 1.2 mi\n- Continue onto\u00c2\u00a0183 Toll\/Ed Bluestein Blvd\n- Continue to follow 183 Toll (Toll road) - 5.4 mi\n- Continue onto\u00c2\u00a0US-183 N - 5.5 mi\n- Take the exit toward\u00c2\u00a0FM 1325\/Burnet Rd - 0.2 mi\n- Follow\u00c2\u00a0Metric Blvd\u00c2\u00a0to\u00c2\u00a0Albury Cove - 7 min\u00c2\u00a0(2.6 mi)\n- Merge onto\u00c2\u00a0Research Blvd - 292 ft\n- Turn\u00c2\u00a0right\u00c2\u00a0onto\u00c2\u00a0Metric Blvd\n- Pass by Walgreens (on the right in 1.8 mi) - 2.3 mi\n- Turn\u00c2\u00a0right\u00c2\u00a0onto\u00c2\u00a0Sunhillow Bend - 0.2 mi\n- Turn\u00c2\u00a0left\u00c2\u00a0onto\u00c2\u00a0Albury Cove\n- Destination will be on the right - 203 ft\n\u00c2\u00a0\n1906 Albury Cove #C\nAustin, TX 78758--x--2024-044353 OL\nExp: 6\/1\/25--x--2024-044353 OL\nExp: 6\/1\/25--x--Lockbox on 1901 C--x----x--1 set of towels (bath towel, hand towel, washcloth) per occupant (up to max occupancy on listing). 2 rolls of toilet paper, bar soap, hand lotion and wastebasket trash bag per bathroom. Shampoo, conditioner, &amp; body wash per full bathroom. 2 rolls of paper towels, fresh sponge, dish soap, 2 loads of dishwasher detergent, 2 additional trash bags per kitchen. 2 loads of laundry detergent per home. (with in-house laundry systems).--x--Hallway downstairs by bathroom--x--Loft Workspace--x--Bathroom downstairs in the closet--x--Backyard on the living room outside wall--x--N\/a--x--Washer and dryer are located in the closet of the main level bathroom.--x--https:\/\/www.grandwelcome.com\/vrp\/unit\/Domain_Luxe_Loft-104185-15--x--https:\/\/www.airbnb.com\/rooms\/1219795253813198499--x--https:\/\/www.vrbo.com\/9993206ha--x----x----x----x----x--75--x--75--x--Central--x--Parking Lot (Private)\nParking for 2 vehicles is available in the shared parking lot directly in front of property, in spaces marked with a \u00e2\u20ac\u0153C\u00e2\u20ac\u009d.--x--2--x--Wednesday - Trash is picked up on Wednesday. Trash bins are located behind the fence. If trash day falls during your stay, please take bins to the curb.--x--No Pool Heating Policy Defined--x--Emergency Lockbox (Internal Use) 2610--x--Keyless Entry 128556",
        "import_time":"2024-08-16T14:57:59.122Z",
        "date_of_first_scrape":1735152600000,
        "date_of_last_update":null,
        "date_of_last_scrape":1735152600000,
        "summary":"property_address1: nan, property_address2: nan, property_building: nan, property_id: 953, property_notes_access: nan, property_notes_general: nan, property_notes_guest_access: nan, property_photos_url: nan, property_state: nan, property_status: nan, listing_id: 66bf68f7d7003b0013c5ce7c, saas_auto_renew: True, cleaning_fee_id: 66bf68f7d7003b0013c5ce7d, cleaning_fee_value_type: FIXED, cleaning_fee_formula: 150, cleaning_fee_multiplier: PER_STAY, channel_commission_use_account_settings: True, channel_commission_id: 67334bb16d8308d981974830, channel_commission_created_at: 2024-11-12T12:36:01.197Z, channel_commission_updated_at: 2024-12-11T07:01:41.148Z, cleaning_status: dirty, picture_caption: TopGolf, picture_thumbnail: https:\/\/track-pm.s3.amazonaws.com\/gw\/image\/9ae926bd-f1de-4346-9832-78855e4dc319, minimum_nights: 1, maximum_nights: 365.0, monthly_price_factor: 1, weekly_price_factor: 1.0, base_price: 1.0, weekend_base_price: 188.0, currency: USD, cleaning_fee: 150.0, confirmed_before_checkin_delay_minutes: 45.0, confirmed_day_of_checkin_delay_minutes: 45.0, confirmed_day_of_checkout_delay_minutes: 45.0, confirmed_during_stay_delay_minutes: 45.0, confirmed_after_checkout_delay_minutes: 45.0, unconfirmed_first_message_delay_minutes: 45.0, unconfirmed_subsequent_message_delay_minutes: 45.0, answeing_machine_is_active: nan, auto_reviews_status: nan, auto_payments_time_relation_names: AT--x--BEFORE, auto_payments_time_relation_units: DAYS--x--DAYS, auto_payments_time_relation_amounts: 1--x--14, pms_cleaning_status: nan, calendar_rules_default_availability: AVAILABLE, bookingcom_cut_off_hours_enabled: nan, expedia_cut_off_hours_enabled: nan, airbnb_cut_off_hours_enabled: nan, directbookings_cut_off_hours_enabled: nan, calendar_rules_default_hours: 24.0, calendar_rules_allow_request_to_book: nan, calendar_rules_advance_notice_updated_at: 2024-09-10T19:33:28.090Z, calendar_rules_advance_notice_updated_by: Data Import, booking_window_default_days: 365.0, booking_window_updated_at: 2024-08-16T14:57:59.116Z, preparation_time_updated_at: 2024-08-16T14:57:59.113Z, dynamic_checkin_updated_at: 2024-08-29T17:26:54.122Z, rental_periods_request_to_book: nan, rental_periods_ids: 66bf68f7d7003b0013c5ce7f, rental_periods_from: 2024-08-15 00:00:00, default_availability_updated_at: 2024-09-11T20:02:24.072Z, default_availability_updated_by: Data Import, listing_type: SINGLE, owners_list: 66bf9086bc6ac87bd184c292, amenities_list: Suitable for children (2-12 years)--x--Suitable for infants (under 2 years)--x--Air conditioning--x--Bed linens--x--Body soap--x--Carbon monoxide detector--x--Ceiling fan--x--Coffee maker--x--Conditioner--x--Dining table--x--Dishwasher--x--Downtown--x--Dryer--x--Essentials--x--Free parking on premises--x--Garden or backyard--x--Garden View--x--Golf - Optional--x--Hair dryer--x--Heating--x--Hot water--x--Ice maker--x--Internet--x--Iron--x--Kitchen--x--Laptop friendly workspace--x--Long term stays allowed--x--Microwave--x--Museums--x--Oven--x--Private entrance--x--Refrigerator--x--Shampoo--x--Shopping--x--Smoke detector--x--Stove--x--Toaster--x--Town--x--TV--x--Washer--x--Wireless Internet, amenities_not_included_list: nan, use_account_revenue_share: 1.0, use_account_taxes: nan, use_account_markups: 1.0, use_account_additional_fees: nan, is_active: 0.0, net_income_formula: host_payout, commission_formula: net_income, owner_revenue_formula: net_income - pm_commission, tax_ids: 66e1da71059dc7ccf8e9c2e0--x--66e1da71059dc7ccf8e9c2e6, tax_types: STATE_TAX--x--OCCUPANCY_TAX, tax_amounts: 6--x--11, tax_names: Texas State Tax--x--Travis Cty Hotel Occupancy Tax, tax_units: PERCENTAGE--x--PERCENTAGE, tax_quantifiers: PER_STAY--x--PER_STAY, taxes_applied_to_all_fees: True--x--True, taxes_applied_on_fees: AF,CF,ADDITIONAL_BED,AIR_CONDITIONING,EARLY_CHECK_IN,LATE_CHECK_IN,BABY_BED,CLEANING,CLUB_CARD,CONCIERGE,EARLY_CHECKOUT,LATE_CHECKOUT,DEPOSIT,ELECTRICITY,FOOD,HEATING,INTERNET,LAUNDRY,LINENS,TOWELS,MANAGEMENT,OIL,PARKING,PET,POOL,POOL_HEATING,RESORT,SERVICE,TOILETRIES,TOUR,TRANSPORTATION,CAR_RENTAL,WATER,WOOD,TRANSFER,HOUSEKEEPING,INSURANCE,COMMUNITY,CREDIT_CARD_PROCESSING_FEE,DAMAGE_WAIVER,VIP_SERVICES,PAYMENT_FEE,ADDITIONAL_CHARGE,MISCELLANEOUS,SHIPPING,VALET,ACTIVITIES,FLIGHTS,GIFT_BASKET,SPA,CHEF,MEET_AND_GREET,DOCK_FEE,UTILITY_FEE,HOT_TUB,BOOKING_FEE,BREAKFAST,BEVERAGE,MEAL,WELLNESS,MINIBAR,BUSINESS_CENTER,WIFI,GUEST_SERVICE,COMMISSION_CHARGE,EQUIPMENT_RENTAL,RESERVATION_FEE,DAMAGE_CHARGE,HOMEOWNERS_ASSOCIATION,GOLF_CART_RENTAL, taxes_are_applied_by_default: --x--, tax_conditional_overrides_view_types: LOS--x--LOS, tax_conditional_overrides_max_nights: 29--x--29, tax___vs: --x--, pre_bookings_list: nan, origin_id: 104185.0, nick_name: Domain Luxe Loft, minimum_age: 18.0, address_full: 1906 Albury Cove c, Austin, TX 78758, USA, address_street: 1906 Albury Cove, address_city: Austin, address_country: United States, address_latitude: 30.3998501, address_longitude: -97.7025575, address_zip_code: 78758.0, address_state: Texas, address_county: Travis County, TX, room_type: Entire home\/apt, property_type: Condominium, ota_room_type: Apartment, accommodates: 4.0, bathrooms: 2.0, bedrooms: 2.0, beds_count: 2.0, listing_status: nan, host_name: Grand Welcome Austin, wifi_name: 1904C, wifi_password: Rb3nXZxT!JF, area_in_square_feet: 1144.0, trash_collection_day: Trash is picked up on Wednesday. Trash bins are located behind the fence. If trash day falls during your stay, please take bins to the curb., parking_instructions: '- Parking for 2 vehicles is available in the shared parking lot directly in front of property, in spaces marked with a \u00e2\u20ac\u0153C\u00e2\u20ac\u009d., created_at: 2024-05-03T00:00:00.000Z, origin: track, default_check_in_time: 16:00:00, default_check_out_time: 10:00:00, check_in_instructions: Arrival and Parking: \n- Parking for 2 vehicles is available in the shared parking lot directly in front of property, in spaces marked with a \u00e2\u20ac\u0153C\u00e2\u20ac\u009d.\n\u00c2\u00a0\nAccess Instructions: \n- Once parked, proceed to Unit C's entry door which is equipped with an electronic lock.\n\u00c2\u00a0\nLock Instructions:\u00c2\u00a0\nTo unlock and enter the home:\u00c2\u00a0\n- Door code is provided above for entry access. The code will activate right at 4pm.\u00c2\u00a0\n- The door does NOT lock automatically so please lock it when you leave.\u00c2\u00a0\n- Use your code for the door to lock.\u00c2\u00a0\n\u00c2\u00a0\nWireless Internet Information: \nNetwork: 1904C \nPassword: Rb3nXZxT!JF\n\u00c2\u00a0\nLaundry: \n- Washer and dryer are located in the closet of the main level bathroom.\n\u00c2\u00a0\nTrash: \n- Trash is picked up on Wednesday. Trash bins are located behind the fence. If trash day falls during your stay, please take bins to the curb.\n\u00c2\u00a0\nAdditional Information: \u00c2\u00a0\n- We provide a starter set of supplies, but for longer stays you will likely want buy or bring more. These complimentary amenities are provided free of charge and are included in the blue boxes in the kitchen and bathrooms so please help yourselves!\n-  This property is not pet friendly. If there is evidence found of an animal presence during your stay or post check-out, you may be evicted, fined and\/or charged additional cleaning fees. \n- Please reach out if you would like us to send you the entire list of house rules before your arrival.  , check_out_instructions: - Set AC to 74 in the summer months  \n- Set heater to 65 in the winter months \n- Bag all garbage and place is designated trash location \n- Load all dirty dishes in the dishwasher and start the dishwasher \n- Place all used towels on the ground in the bathr, account_id: 66a30f208b331811b8e96639, time_zone: America\/Chicago, last_updated_at: 2024-12-16T20:45:32.019Z, integration_ids: 66d0af0bb6ad7bcfca3bf989--x--66e1a279352e665645cd4fe0, integration_platforms: vacayHome--x--airbnb2, booking_com_initial_complex_listings: nan, booking_com_publish_company_logos: nan, booking_com_is_published_company_logos: nan, booking_com_publish_company_infos: nan, booking_com_is_published_company_infos: nan, vacayhome_currencies: USD, vacayhome_statuses: DISCONNECTED, vacayhome_cancellation_policies: firm, vacayhome_cancellation_penalties: 100.0, vacayhome_creation_times: 2024-12-16T20:45:07.007Z, listing_room_ids: 66c30cd399e922187e4f7049--x--66c30cd399e922187e4f704a--x--66c30cd399e922187e4f704b--x--66c30cd399e922187e4f704c, listing_room_numbers: nan, listing_room_bed_ids: 6700d6d4b102900011d29e7e--x--6700d6d4b102900011d29e80, listing_room_bed_types: QUEEN_BED--x--KING_BED, listing_room_bed_quantities: 1--x--1, custom_field_values: Arrival and Parking: \n- Parking for 2 vehicles is available in the shared parking lot directly in front of property, in spaces marked with a \u00e2\u20ac\u0153C\u00e2\u20ac\u009d.\n\u00c2\u00a0\nAccess Instructions: \n- Once parked, proceed to Unit C's entry door which is equipped with an electronic lock.\n\u00c2\u00a0\nLock Instructions:\u00c2\u00a0\nTo unlock and enter the home:\u00c2\u00a0\n- Door code is provided above for entry access. The code will activate right at 4pm.\u00c2\u00a0\n- The door does NOT lock automatically so please lock it when you leave.\u00c2\u00a0\n- Use your code for the door to lock.\u00c2\u00a0\n\u00c2\u00a0\nWireless Internet Information: \nNetwork: 1904C \nPassword: Rb3nXZxT!JF\n\u00c2\u00a0\nLaundry: \n- Washer and dryer are located in the closet of the main level bathroom.\n\u00c2\u00a0\nTrash: \n- Trash is picked up on Wednesday. Trash bins are located behind the fence. If trash day falls during your stay, please take bins to the curb.\n\u00c2\u00a0\nAdditional Information: \u00c2\u00a0\n- We provide a starter set of supplies, but for longer stays you will likely want buy or bring more. These complimentary amenities are provided free of charge and are included in the blue boxes in the kitchen and bathrooms so please help yourselves!\n-  This property is not pet friendly. If there is evidence found of an animal presence during your stay or post check-out, you may be evicted, fined and\/or charged additional cleaning fees. \n- Please reach out if you would like us to send you the entire list of house rules before your arrival.  --x--From Austin-Bergstrom International Airport (AUS)\n3600 Presidential Blvd, Austin, TX 78719\n\u00c2\u00a0\n- Get on\u00c2\u00a0State Hwy 71 W\u00c2\u00a0in\u00c2\u00a0Del Valle\u00c2\u00a0from\u00c2\u00a0Hotel Dr\u00c2\u00a0and\u00c2\u00a0Spirit of Texas Dr - 2 min\u00c2\u00a0(0.9 mi)\n- Head\u00c2\u00a0southwest\u00c2\u00a0on\u00c2\u00a0Presidential Blvd - 354 ft\n- Slight\u00c2\u00a0right\u00c2\u00a0onto\u00c2\u00a0Service Dr - 482 ft\n- Turn\u00c2\u00a0right\u00c2\u00a0onto\u00c2\u00a0Hotel Dr - 0.3 mi\n- Turn\u00c2\u00a0right\u00c2\u00a0onto\u00c2\u00a0Spirit of Texas Dr - 0.2 mi\n- Turn\u00c2\u00a0left\u00c2\u00a0to merge onto\u00c2\u00a0State Hwy 71 W - 0.3 mi\n- Take\u00c2\u00a0183 Toll\u00c2\u00a0and\u00c2\u00a0US-183 N\u00c2\u00a0to\u00c2\u00a0Research Blvd\u00c2\u00a0in\u00c2\u00a0Austin. Take the exit toward\u00c2\u00a0FM 1325\/Burnet Rd\u00c2\u00a0from\u00c2\u00a0US-183 N - 12 min\u00c2\u00a0(13.4 mi)\n- Merge onto\u00c2\u00a0State Hwy 71 W - 0.5 mi\n- Keep\u00c2\u00a0left\u00c2\u00a0to stay on\u00c2\u00a0State Hwy 71 W - 0.1 mi\n- Use the right 2 lanes to turn slightly\u00c2\u00a0right\u00c2\u00a0onto the\u00c2\u00a0US-183 N\u00c2\u00a0ramp - 0.5 mi\n- Continue onto\u00c2\u00a0US-183 N\/S Hwy 183\n- Continue to follow S Hwy 183 (Toll road) - 1.2 mi\n- Continue onto\u00c2\u00a0183 Toll\/Ed Bluestein Blvd\n- Continue to follow 183 Toll (Toll road) - 5.4 mi\n- Continue onto\u00c2\u00a0US-183 N - 5.5 mi\n- Take the exit toward\u00c2\u00a0FM 1325\/Burnet Rd - 0.2 mi\n- Follow\u00c2\u00a0Metric Blvd\u00c2\u00a0to\u00c2\u00a0Albury Cove - 7 min\u00c2\u00a0(2.6 mi)\n- Merge onto\u00c2\u00a0Research Blvd - 292 ft\n- Turn\u00c2\u00a0right\u00c2\u00a0onto\u00c2\u00a0Metric Blvd\n- Pass by Walgreens (on the right in 1.8 mi) - 2.3 mi\n- Turn\u00c2\u00a0right\u00c2\u00a0onto\u00c2\u00a0Sunhillow Bend - 0.2 mi\n- Turn\u00c2\u00a0left\u00c2\u00a0onto\u00c2\u00a0Albury Cove\n- Destination will be on the right - 203 ft\n\u00c2\u00a0\n1906 Albury Cove #C\nAustin, TX 78758--x--2024-044353 OL\nExp: 6\/1\/25--x--2024-044353 OL\nExp: 6\/1\/25--x--Lockbox on 1901 C--x----x--1 set of towels (bath towel, hand towel, washcloth) per occupant (up to max occupancy on listing). 2 rolls of toilet paper, bar soap, hand lotion and wastebasket trash bag per bathroom. Shampoo, conditioner, &amp; body wash per full bathroom. 2 rolls of paper towels, fresh sponge, dish soap, 2 loads of dishwasher detergent, 2 additional trash bags per kitchen. 2 loads of laundry detergent per home. (with in-house laundry systems).--x--Hallway downstairs by bathroom--x--Loft Workspace--x--Bathroom downstairs in the closet--x--Backyard on the living room outside wall--x--N\/a--x--Washer and dryer are located in the closet of the main level bathroom.--x--https:\/\/www.grandwelcome.com\/vrp\/unit\/Domain_Luxe_Loft-104185-15--x--https:\/\/www.airbnb.com\/rooms\/1219795253813198499--x--https:\/\/www.vrbo.com\/9993206ha--x----x----x----x----x--75--x--75--x--Central--x--Parking Lot (Private)\nParking for 2 vehicles is available in the shared parking lot directly in front of property, in spaces marked with a \u00e2\u20ac\u0153C\u00e2\u20ac\u009d.--x--2--x--Wednesday - Trash is picked up on Wednesday. Trash bins are located behind the fence. If trash day falls during your stay, please take bins to the curb.--x--No Pool Heating Policy Defined--x--Emergency Lockbox (Internal Use) 2610--x--Keyless Entry 128556, import_time: 2024-08-16T14:57:59.122Z, date_of_first_scrape: 2024-12-25 18:50:00, date_of_last_update: nan, date_of_last_scrape: 2024-12-25 18:50:00"
    },
    {
        "property_address1":null,
        "property_address2":null,
        "property_building":null,
        "property_id":1095,
        "property_notes_access":null,
        "property_notes_general":null,
        "property_notes_guest_access":null,
        "property_photos_url":null,
        "property_state":null,
        "property_status":null,
        "listing_id":"66bf68f2dc3d4c001359b529",
        "saas_auto_renew":1.0,
        "cleaning_fee_id":"66bf68f2dc3d4c001359b52a",
        "cleaning_fee_value_type":"FIXED",
        "cleaning_fee_formula":125.0,
        "cleaning_fee_multiplier":"PER_STAY",
        "channel_commission_use_account_settings":1.0,
        "channel_commission_id":"67334bb16d8308d981974910",
        "channel_commission_created_at":"2024-11-12T12:36:01.669Z",
        "channel_commission_updated_at":"2024-12-11T07:01:40.560Z",
        "cleaning_status":"dirty",
        "picture_caption":"Exterior with fire pit and picnic table",
        "picture_thumbnail":"https:\/\/track-pm.s3.amazonaws.com\/gw\/image\/faf15164-f1a1-4388-8baa-d48a465fcaf2",
        "minimum_nights":1.0,
        "maximum_nights":365.0,
        "monthly_price_factor":1.0,
        "weekly_price_factor":1.0,
        "base_price":1.0,
        "weekend_base_price":94.0,
        "currency":"USD",
        "cleaning_fee":125.0,
        "confirmed_before_checkin_delay_minutes":45.0,
        "confirmed_day_of_checkin_delay_minutes":45.0,
        "confirmed_day_of_checkout_delay_minutes":45.0,
        "confirmed_during_stay_delay_minutes":45.0,
        "confirmed_after_checkout_delay_minutes":45.0,
        "unconfirmed_first_message_delay_minutes":45.0,
        "unconfirmed_subsequent_message_delay_minutes":45.0,
        "answeing_machine_is_active":1.0,
        "auto_reviews_status":1.0,
        "auto_payments_time_relation_names":"AT--x--BEFORE",
        "auto_payments_time_relation_units":"DAYS--x--DAYS",
        "auto_payments_time_relation_amounts":"1--x--14",
        "pms_cleaning_status":1.0,
        "calendar_rules_default_availability":"AVAILABLE",
        "bookingcom_cut_off_hours_enabled":null,
        "expedia_cut_off_hours_enabled":null,
        "airbnb_cut_off_hours_enabled":null,
        "directbookings_cut_off_hours_enabled":null,
        "calendar_rules_default_hours":24.0,
        "calendar_rules_allow_request_to_book":null,
        "calendar_rules_advance_notice_updated_at":"2024-09-10T19:33:27.005Z",
        "calendar_rules_advance_notice_updated_by":"Data Import",
        "booking_window_default_days":365.0,
        "booking_window_updated_at":"2024-08-16T14:57:54.644Z",
        "preparation_time_updated_at":"2024-08-16T14:57:54.640Z",
        "dynamic_checkin_updated_at":"2024-08-29T17:26:37.751Z",
        "rental_periods_request_to_book":null,
        "rental_periods_ids":"66bf68f2dc3d4c001359b52c",
        "rental_periods_from":1723680000000,
        "default_availability_updated_at":"2024-09-11T20:02:22.692Z",
        "default_availability_updated_by":"Data Import",
        "listing_type":"SINGLE",
        "owners_list":"66bf9088bc6ac87bd184c2ca",
        "amenities_list":"Air conditioning--x--BBQ grill--x--Bed linens--x--Blender--x--Body soap--x--Carbon monoxide detector--x--Coffee maker--x--Conditioner--x--Cookware--x--Dining table--x--Dishes and silverware--x--Dishwasher--x--Downtown--x--Dryer--x--Essentials--x--Fire Pit--x--Free parking on premises--x--Free parking on street--x--Garden View--x--Garden or backyard--x--Golf - Optional--x--Hair dryer--x--Heating--x--Hot water--x--Internet--x--Iron--x--Kitchen--x--Lake--x--Laptop friendly workspace--x--Microwave--x--Museums--x--Oven--x--Private entrance--x--Refrigerator--x--Shampoo--x--Shopping--x--Smoke detector--x--Stove--x--TV--x--Toaster--x--Town--x--Washer--x--Wine glasses--x--Wireless Internet--x--Free parking on Street",
        "amenities_not_included_list":null,
        "use_account_revenue_share":1.0,
        "use_account_taxes":null,
        "use_account_markups":1.0,
        "use_account_additional_fees":null,
        "is_active":1.0,
        "net_income_formula":"host_payout",
        "commission_formula":"net_income",
        "owner_revenue_formula":"net_income - pm_commission",
        "tax_ids":"66e1da72055feb22b0330384--x--66e1da73055feb22b033038c",
        "tax_types":"STATE_TAX--x--OCCUPANCY_TAX",
        "tax_amounts":"6--x--9",
        "tax_names":"Texas State Tax--x--Travis Cty Hotel Occupancy Tax",
        "tax_units":"PERCENTAGE--x--PERCENTAGE",
        "tax_quantifiers":"PER_STAY--x--PER_STAY",
        "taxes_applied_to_all_fees":"True--x--True",
        "taxes_applied_on_fees":"AF,CF,ADDITIONAL_BED,AIR_CONDITIONING,EARLY_CHECK_IN,LATE_CHECK_IN,BABY_BED,CLEANING,CLUB_CARD,CONCIERGE,EARLY_CHECKOUT,LATE_CHECKOUT,DEPOSIT,ELECTRICITY,FOOD,HEATING,INTERNET,LAUNDRY,LINENS,TOWELS,MANAGEMENT,OIL,PARKING,PET,POOL,POOL_HEATING,RESORT,SERVICE,TOILETRIES,TOUR,TRANSPORTATION,CAR_RENTAL,WATER,WOOD,TRANSFER,HOUSEKEEPING,INSURANCE,COMMUNITY,CREDIT_CARD_PROCESSING_FEE,DAMAGE_WAIVER,VIP_SERVICES,PAYMENT_FEE,ADDITIONAL_CHARGE,MISCELLANEOUS,SHIPPING,VALET,ACTIVITIES,FLIGHTS,GIFT_BASKET,SPA,CHEF,MEET_AND_GREET,DOCK_FEE,UTILITY_FEE,HOT_TUB,BOOKING_FEE,BREAKFAST,BEVERAGE,MEAL,WELLNESS,MINIBAR,BUSINESS_CENTER,WIFI,GUEST_SERVICE,COMMISSION_CHARGE,EQUIPMENT_RENTAL,RESERVATION_FEE,DAMAGE_CHARGE,HOMEOWNERS_ASSOCIATION,GOLF_CART_RENTAL",
        "taxes_are_applied_by_default":"--x--",
        "tax_conditional_overrides_view_types":"LOS--x--LOS",
        "tax_conditional_overrides_max_nights":"29--x--29",
        "tax___vs":"--x--",
        "pre_bookings_list":null,
        "origin_id":104277.0,
        "nick_name":"Lady Bird Sanctuary",
        "minimum_age":18.0,
        "address_full":"1708 Garden St #2, Austin, TX 78702, USA",
        "address_street":"1708 Garden Street",
        "address_city":"Austin",
        "address_country":"United States",
        "address_latitude":30.2550365,
        "address_longitude":-97.726989,
        "address_zip_code":78702.0,
        "address_state":"Texas",
        "address_county":null,
        "room_type":"Entire home\/apt",
        "property_type":"House",
        "ota_room_type":"Holiday home",
        "accommodates":4.0,
        "bathrooms":1.5,
        "bedrooms":1.0,
        "beds_count":2.0,
        "listing_status":1.0,
        "host_name":"Grand Welcome Austin",
        "wifi_name":"SpectrumSetup-E8",
        "wifi_password":"richwolf747",
        "area_in_square_feet":1000.0,
        "trash_collection_day":"Trash bins are located behind the gate along the fence line. If trash falls during your stay, please take bins to the curb.",
        "parking_instructions":"Driveway",
        "created_at":"2024-05-31T00:00:00.000Z",
        "origin":"track",
        "default_check_in_time":"16:00:00",
        "default_check_out_time":"10:00:00",
        "check_in_instructions":"Arrival and Parking:\n- Parking for 1 vehicle is available either under the car awning or in the long unpaved driveway. This home is a back unit and you'll need to access the home via the alleyway between Garden St and Canterbury St.\n \nAccess Instructions:\n- Once parked, please proceed through the gate and to the entry door which is equipped with an electronic lock.\n \nLock Instructions:\nTo unlock and enter the home:\n- Enter the code provided above followed by a checkmark to gain access to the home. The code will activate right at 4pm.\n- The door does NOT lock automatically so please lock when you leave.\n- Press any button on the keypad followed by a checkmark to lock the home before your departure.\n \nWireless Internet Information:\nNetwork: SpectrumSetup-E8\nPassword: richwolf747\n \nLaundry:\n- Washer and dryer are located behind the curtain of the 1st floor bathroom.\n \nTrash:\n- Trash is picked up on Friday. Trash bins are located behind the gate along the fence line. If trash falls during your stay, please take bins to the curb.\n \nAdditional Information:\n- We provide a starter set of supplies, but for longer stays you will likely want buy or bring more.\n- This property is not pet friendly. If there is evidence found of an animal presence during your stay or post check-out, you may be evicted, fined and\/or charged additional cleaning fees. \n- Please reach out if you would like us to send you the entire list of house rules before your arrival.  ",
        "check_out_instructions":"- Set AC to 74 in the summer months  \n- Set heater to 65 in the winter months \n- Bag all garbage and place is designated trash location \n- Load all dirty dishes in the dishwasher and start the dishwasher \n- Place all used towels on the ground in the bathr",
        "account_id":"66a30f208b331811b8e96639",
        "time_zone":"America\/Chicago",
        "last_updated_at":"2024-10-30T15:30:04.598Z",
        "integration_ids":"66d0af0bb6ad7bcfca3bf989--x--66d8cd59cc4df40011491532--x--66e1a279352e665645cd4fe0",
        "integration_platforms":"vacayHome--x--homeaway2--x--airbnb2",
        "booking_com_initial_complex_listings":"--x----x--",
        "booking_com_publish_company_logos":"--x----x--",
        "booking_com_is_published_company_logos":"--x----x--",
        "booking_com_publish_company_infos":"--x----x--",
        "booking_com_is_published_company_infos":"--x----x--",
        "vacayhome_currencies":"USD",
        "vacayhome_statuses":"COMPLETED",
        "vacayhome_cancellation_policies":"firm",
        "vacayhome_cancellation_penalties":100.0,
        "vacayhome_creation_times":"2024-08-30T20:30:51.791Z",
        "listing_room_ids":"66c30cd299e922187e4f702d--x--66c30cd299e922187e4f702e--x--66c30cd299e922187e4f702f--x--66c30cd299e922187e4f7030",
        "listing_room_numbers":null,
        "listing_room_bed_ids":"6700dccc1742730012183309--x--6700dccc174273001218330b",
        "listing_room_bed_types":"SOFA_BED--x--QUEEN_BED",
        "listing_room_bed_quantities":"1--x--1",
        "custom_field_values":"Arrival and Parking:\n- Parking for 1 vehicle is available either under the car awning or in the long unpaved driveway. This home is a back unit and you'll need to access the home via the alleyway between Garden St and Canterbury St.\n \nAccess Instructions:\n- Once parked, please proceed through the gate and to the entry door which is equipped with an electronic lock.\n \nLock Instructions:\nTo unlock and enter the home:\n- Enter the code provided above followed by a checkmark to gain access to the home. The code will activate right at 4pm.\n- The door does NOT lock automatically so please lock when you leave.\n- Press any button on the keypad followed by a checkmark to lock the home before your departure.\n \nWireless Internet Information:\nNetwork: SpectrumSetup-E8\nPassword: richwolf747\n \nLaundry:\n- Washer and dryer are located behind the curtain of the 1st floor bathroom.\n \nTrash:\n- Trash is picked up on Friday. Trash bins are located behind the gate along the fence line. If trash falls during your stay, please take bins to the curb.\n \nAdditional Information:\n- We provide a starter set of supplies, but for longer stays you will likely want buy or bring more.\n- This property is not pet friendly. If there is evidence found of an animal presence during your stay or post check-out, you may be evicted, fined and\/or charged additional cleaning fees. \n- Please reach out if you would like us to send you the entire list of house rules before your arrival.  --x--Bergstrom Village\nAustin, TX 78617\n\u00c2\u00a0\nTake Crozier Ln and Thornberry Rd to State Hwy 71 W\n2 min (0.7 mi)\nTake S Hwy 183 and E Cesar Chavez St to Chicon St in Austin\n8 min (4.8 mi)\nContinue on Chicon St. Drive to Garden St\n1 min (0.3 mi)\n\u00c2\u00a0\n1708 Garden St #2\nAustin, TX 78702--x--2024-051201 OL\n05\/30\/2024--x--2024-051201 OL\n05\/30\/2024--x----x--1 set of towels (bath towel, hand towel, washcloth) per occupant (up to max occupancy on listing)\n2 rolls of toilet paper, bar soap or liquid soap dispenser, and wastebasket trash bag per bathroom\nShampoo, Conditioner, &amp; Body Wash pump bottle per full bathroom\n2 rolls of paper towels, fresh sponge, dish soap, 3 loads of dishwasher detergent, 3 trash bags per kitchen.\n3 loads of laundry detergent per home (with in-house laundry systems)--x--office space on the 2nd floor--x--1st floor bathroom--x--1--x--https:\/\/www.grandwelcome.com\/vrp\/unit\/Lady_Bird_Sanctuary-104277-15--x--https:\/\/www.airbnb.com\/rooms\/1191251442167608577--x--https:\/\/www.vrbo.com\/9978056ha--x----x----x----x----x--Point Central--x--65--x--65--x--East--x--Driveway--x--1--x--Friday - Trash bins are located behind the gate along the fence line. If trash falls during your stay, please take bins to the curb.--x--No Pool Heating Policy Defined--x--N\/A--x--Backup Keyless Entry Code 011708\u00e2\u0153\u201c\nLockbox at the Property 0723--x--Please note: the internal spiral staircase is narrow. With this in mind, upon arrival, please use the exterior staircase to the upstairs, for your convenience (to bring up suitcases.) The door code for the exterior staircase is 2334.--x--Door at Top of Exterior Stair Case: 2334",
        "import_time":"2024-08-16T14:57:54.666Z",
        "date_of_first_scrape":1735178040000,
        "date_of_last_update":null,
        "date_of_last_scrape":1735178040000,
        "summary":"property_address1: nan, property_address2: nan, property_building: nan, property_id: 1095, property_notes_access: nan, property_notes_general: nan, property_notes_guest_access: nan, property_photos_url: nan, property_state: nan, property_status: nan, listing_id: 66bf68f2dc3d4c001359b529, saas_auto_renew: True, cleaning_fee_id: 66bf68f2dc3d4c001359b52a, cleaning_fee_value_type: FIXED, cleaning_fee_formula: 125, cleaning_fee_multiplier: PER_STAY, channel_commission_use_account_settings: True, channel_commission_id: 67334bb16d8308d981974910, channel_commission_created_at: 2024-11-12T12:36:01.669Z, channel_commission_updated_at: 2024-12-11T07:01:40.560Z, cleaning_status: dirty, picture_caption: Exterior with fire pit and picnic table, picture_thumbnail: https:\/\/track-pm.s3.amazonaws.com\/gw\/image\/faf15164-f1a1-4388-8baa-d48a465fcaf2, minimum_nights: 1, maximum_nights: 365.0, monthly_price_factor: 1, weekly_price_factor: 1.0, base_price: 1.0, weekend_base_price: 94.0, currency: USD, cleaning_fee: 125.0, confirmed_before_checkin_delay_minutes: 45.0, confirmed_day_of_checkin_delay_minutes: 45.0, confirmed_day_of_checkout_delay_minutes: 45.0, confirmed_during_stay_delay_minutes: 45.0, confirmed_after_checkout_delay_minutes: 45.0, unconfirmed_first_message_delay_minutes: 45.0, unconfirmed_subsequent_message_delay_minutes: 45.0, answeing_machine_is_active: 1.0, auto_reviews_status: 1.0, auto_payments_time_relation_names: AT--x--BEFORE, auto_payments_time_relation_units: DAYS--x--DAYS, auto_payments_time_relation_amounts: 1--x--14, pms_cleaning_status: 1.0, calendar_rules_default_availability: AVAILABLE, bookingcom_cut_off_hours_enabled: nan, expedia_cut_off_hours_enabled: nan, airbnb_cut_off_hours_enabled: nan, directbookings_cut_off_hours_enabled: nan, calendar_rules_default_hours: 24.0, calendar_rules_allow_request_to_book: nan, calendar_rules_advance_notice_updated_at: 2024-09-10T19:33:27.005Z, calendar_rules_advance_notice_updated_by: Data Import, booking_window_default_days: 365.0, booking_window_updated_at: 2024-08-16T14:57:54.644Z, preparation_time_updated_at: 2024-08-16T14:57:54.640Z, dynamic_checkin_updated_at: 2024-08-29T17:26:37.751Z, rental_periods_request_to_book: nan, rental_periods_ids: 66bf68f2dc3d4c001359b52c, rental_periods_from: 2024-08-15 00:00:00, default_availability_updated_at: 2024-09-11T20:02:22.692Z, default_availability_updated_by: Data Import, listing_type: SINGLE, owners_list: 66bf9088bc6ac87bd184c2ca, amenities_list: Air conditioning--x--BBQ grill--x--Bed linens--x--Blender--x--Body soap--x--Carbon monoxide detector--x--Coffee maker--x--Conditioner--x--Cookware--x--Dining table--x--Dishes and silverware--x--Dishwasher--x--Downtown--x--Dryer--x--Essentials--x--Fire Pit--x--Free parking on premises--x--Free parking on street--x--Garden View--x--Garden or backyard--x--Golf - Optional--x--Hair dryer--x--Heating--x--Hot water--x--Internet--x--Iron--x--Kitchen--x--Lake--x--Laptop friendly workspace--x--Microwave--x--Museums--x--Oven--x--Private entrance--x--Refrigerator--x--Shampoo--x--Shopping--x--Smoke detector--x--Stove--x--TV--x--Toaster--x--Town--x--Washer--x--Wine glasses--x--Wireless Internet--x--Free parking on Street, amenities_not_included_list: nan, use_account_revenue_share: 1.0, use_account_taxes: nan, use_account_markups: 1.0, use_account_additional_fees: nan, is_active: 1.0, net_income_formula: host_payout, commission_formula: net_income, owner_revenue_formula: net_income - pm_commission, tax_ids: 66e1da72055feb22b0330384--x--66e1da73055feb22b033038c, tax_types: STATE_TAX--x--OCCUPANCY_TAX, tax_amounts: 6--x--9, tax_names: Texas State Tax--x--Travis Cty Hotel Occupancy Tax, tax_units: PERCENTAGE--x--PERCENTAGE, tax_quantifiers: PER_STAY--x--PER_STAY, taxes_applied_to_all_fees: True--x--True, taxes_applied_on_fees: AF,CF,ADDITIONAL_BED,AIR_CONDITIONING,EARLY_CHECK_IN,LATE_CHECK_IN,BABY_BED,CLEANING,CLUB_CARD,CONCIERGE,EARLY_CHECKOUT,LATE_CHECKOUT,DEPOSIT,ELECTRICITY,FOOD,HEATING,INTERNET,LAUNDRY,LINENS,TOWELS,MANAGEMENT,OIL,PARKING,PET,POOL,POOL_HEATING,RESORT,SERVICE,TOILETRIES,TOUR,TRANSPORTATION,CAR_RENTAL,WATER,WOOD,TRANSFER,HOUSEKEEPING,INSURANCE,COMMUNITY,CREDIT_CARD_PROCESSING_FEE,DAMAGE_WAIVER,VIP_SERVICES,PAYMENT_FEE,ADDITIONAL_CHARGE,MISCELLANEOUS,SHIPPING,VALET,ACTIVITIES,FLIGHTS,GIFT_BASKET,SPA,CHEF,MEET_AND_GREET,DOCK_FEE,UTILITY_FEE,HOT_TUB,BOOKING_FEE,BREAKFAST,BEVERAGE,MEAL,WELLNESS,MINIBAR,BUSINESS_CENTER,WIFI,GUEST_SERVICE,COMMISSION_CHARGE,EQUIPMENT_RENTAL,RESERVATION_FEE,DAMAGE_CHARGE,HOMEOWNERS_ASSOCIATION,GOLF_CART_RENTAL, taxes_are_applied_by_default: --x--, tax_conditional_overrides_view_types: LOS--x--LOS, tax_conditional_overrides_max_nights: 29--x--29, tax___vs: --x--, pre_bookings_list: nan, origin_id: 104277.0, nick_name: Lady Bird Sanctuary, minimum_age: 18.0, address_full: 1708 Garden St #2, Austin, TX 78702, USA, address_street: 1708 Garden Street, address_city: Austin, address_country: United States, address_latitude: 30.2550365, address_longitude: -97.726989, address_zip_code: 78702.0, address_state: Texas, address_county: nan, room_type: Entire home\/apt, property_type: House, ota_room_type: Holiday home, accommodates: 4.0, bathrooms: 1.5, bedrooms: 1.0, beds_count: 2.0, listing_status: 1.0, host_name: Grand Welcome Austin, wifi_name: SpectrumSetup-E8, wifi_password: richwolf747, area_in_square_feet: 1000.0, trash_collection_day: Trash bins are located behind the gate along the fence line. If trash falls during your stay, please take bins to the curb., parking_instructions: Driveway, created_at: 2024-05-31T00:00:00.000Z, origin: track, default_check_in_time: 16:00:00, default_check_out_time: 10:00:00, check_in_instructions: Arrival and Parking:\n- Parking for 1 vehicle is available either under the car awning or in the long unpaved driveway. This home is a back unit and you'll need to access the home via the alleyway between Garden St and Canterbury St.\n \nAccess Instructions:\n- Once parked, please proceed through the gate and to the entry door which is equipped with an electronic lock.\n \nLock Instructions:\nTo unlock and enter the home:\n- Enter the code provided above followed by a checkmark to gain access to the home. The code will activate right at 4pm.\n- The door does NOT lock automatically so please lock when you leave.\n- Press any button on the keypad followed by a checkmark to lock the home before your departure.\n \nWireless Internet Information:\nNetwork: SpectrumSetup-E8\nPassword: richwolf747\n \nLaundry:\n- Washer and dryer are located behind the curtain of the 1st floor bathroom.\n \nTrash:\n- Trash is picked up on Friday. Trash bins are located behind the gate along the fence line. If trash falls during your stay, please take bins to the curb.\n \nAdditional Information:\n- We provide a starter set of supplies, but for longer stays you will likely want buy or bring more.\n- This property is not pet friendly. If there is evidence found of an animal presence during your stay or post check-out, you may be evicted, fined and\/or charged additional cleaning fees. \n- Please reach out if you would like us to send you the entire list of house rules before your arrival.  , check_out_instructions: - Set AC to 74 in the summer months  \n- Set heater to 65 in the winter months \n- Bag all garbage and place is designated trash location \n- Load all dirty dishes in the dishwasher and start the dishwasher \n- Place all used towels on the ground in the bathr, account_id: 66a30f208b331811b8e96639, time_zone: America\/Chicago, last_updated_at: 2024-10-30T15:30:04.598Z, integration_ids: 66d0af0bb6ad7bcfca3bf989--x--66d8cd59cc4df40011491532--x--66e1a279352e665645cd4fe0, integration_platforms: vacayHome--x--homeaway2--x--airbnb2, booking_com_initial_complex_listings: --x----x--, booking_com_publish_company_logos: --x----x--, booking_com_is_published_company_logos: --x----x--, booking_com_publish_company_infos: --x----x--, booking_com_is_published_company_infos: --x----x--, vacayhome_currencies: USD, vacayhome_statuses: COMPLETED, vacayhome_cancellation_policies: firm, vacayhome_cancellation_penalties: 100.0, vacayhome_creation_times: 2024-08-30T20:30:51.791Z, listing_room_ids: 66c30cd299e922187e4f702d--x--66c30cd299e922187e4f702e--x--66c30cd299e922187e4f702f--x--66c30cd299e922187e4f7030, listing_room_numbers: nan, listing_room_bed_ids: 6700dccc1742730012183309--x--6700dccc174273001218330b, listing_room_bed_types: SOFA_BED--x--QUEEN_BED, listing_room_bed_quantities: 1--x--1, custom_field_values: Arrival and Parking:\n- Parking for 1 vehicle is available either under the car awning or in the long unpaved driveway. This home is a back unit and you'll need to access the home via the alleyway between Garden St and Canterbury St.\n \nAccess Instructions:\n- Once parked, please proceed through the gate and to the entry door which is equipped with an electronic lock.\n \nLock Instructions:\nTo unlock and enter the home:\n- Enter the code provided above followed by a checkmark to gain access to the home. The code will activate right at 4pm.\n- The door does NOT lock automatically so please lock when you leave.\n- Press any button on the keypad followed by a checkmark to lock the home before your departure.\n \nWireless Internet Information:\nNetwork: SpectrumSetup-E8\nPassword: richwolf747\n \nLaundry:\n- Washer and dryer are located behind the curtain of the 1st floor bathroom.\n \nTrash:\n- Trash is picked up on Friday. Trash bins are located behind the gate along the fence line. If trash falls during your stay, please take bins to the curb.\n \nAdditional Information:\n- We provide a starter set of supplies, but for longer stays you will likely want buy or bring more.\n- This property is not pet friendly. If there is evidence found of an animal presence during your stay or post check-out, you may be evicted, fined and\/or charged additional cleaning fees. \n- Please reach out if you would like us to send you the entire list of house rules before your arrival.  --x--Bergstrom Village\nAustin, TX 78617\n\u00c2\u00a0\nTake Crozier Ln and Thornberry Rd to State Hwy 71 W\n2 min (0.7 mi)\nTake S Hwy 183 and E Cesar Chavez St to Chicon St in Austin\n8 min (4.8 mi)\nContinue on Chicon St. Drive to Garden St\n1 min (0.3 mi)\n\u00c2\u00a0\n1708 Garden St #2\nAustin, TX 78702--x--2024-051201 OL\n05\/30\/2024--x--2024-051201 OL\n05\/30\/2024--x----x--1 set of towels (bath towel, hand towel, washcloth) per occupant (up to max occupancy on listing)\n2 rolls of toilet paper, bar soap or liquid soap dispenser, and wastebasket trash bag per bathroom\nShampoo, Conditioner, &amp; Body Wash pump bottle per full bathroom\n2 rolls of paper towels, fresh sponge, dish soap, 3 loads of dishwasher detergent, 3 trash bags per kitchen.\n3 loads of laundry detergent per home (with in-house laundry systems)--x--office space on the 2nd floor--x--1st floor bathroom--x--1--x--https:\/\/www.grandwelcome.com\/vrp\/unit\/Lady_Bird_Sanctuary-104277-15--x--https:\/\/www.airbnb.com\/rooms\/1191251442167608577--x--https:\/\/www.vrbo.com\/9978056ha--x----x----x----x----x--Point Central--x--65--x--65--x--East--x--Driveway--x--1--x--Friday - Trash bins are located behind the gate along the fence line. If trash falls during your stay, please take bins to the curb.--x--No Pool Heating Policy Defined--x--N\/A--x--Backup Keyless Entry Code 011708\u00e2\u0153\u201c\nLockbox at the Property 0723--x--Please note: the internal spiral staircase is narrow. With this in mind, upon arrival, please use the exterior staircase to the upstairs, for your convenience (to bring up suitcases.) The door code for the exterior staircase is 2334.--x--Door at Top of Exterior Stair Case: 2334, import_time: 2024-08-16T14:57:54.666Z, date_of_first_scrape: 2024-12-26 01:54:00, date_of_last_update: nan, date_of_last_scrape: 2024-12-26 01:54:00"
    },
    {
        "property_address1":null,
        "property_address2":null,
        "property_building":null,
        "property_id":1182,
        "property_notes_access":null,
        "property_notes_general":null,
        "property_notes_guest_access":null,
        "property_photos_url":null,
        "property_state":null,
        "property_status":null,
        "listing_id":"66bf6906a970830012f1db0d",
        "saas_auto_renew":1.0,
        "cleaning_fee_id":"66e5b05cb72f1b00118eb7e9",
        "cleaning_fee_value_type":"FIXED",
        "cleaning_fee_formula":200.0,
        "cleaning_fee_multiplier":"PER_STAY",
        "channel_commission_use_account_settings":1.0,
        "channel_commission_id":"67334bb06d8308d981974780",
        "channel_commission_created_at":"2024-11-12T12:36:00.832Z",
        "channel_commission_updated_at":"2024-12-11T07:01:39.812Z",
        "cleaning_status":"dirty",
        "picture_caption":"Aerial view",
        "picture_thumbnail":"https:\/\/track-pm.s3.amazonaws.com\/gw\/image\/076ece42-15ce-487d-97ce-17c31e41ce13",
        "minimum_nights":1.0,
        "maximum_nights":365.0,
        "monthly_price_factor":1.0,
        "weekly_price_factor":1.0,
        "base_price":1.0,
        "weekend_base_price":281.0,
        "currency":"USD",
        "cleaning_fee":200.0,
        "confirmed_before_checkin_delay_minutes":45.0,
        "confirmed_day_of_checkin_delay_minutes":45.0,
        "confirmed_day_of_checkout_delay_minutes":45.0,
        "confirmed_during_stay_delay_minutes":45.0,
        "confirmed_after_checkout_delay_minutes":45.0,
        "unconfirmed_first_message_delay_minutes":45.0,
        "unconfirmed_subsequent_message_delay_minutes":45.0,
        "answeing_machine_is_active":1.0,
        "auto_reviews_status":1.0,
        "auto_payments_time_relation_names":"AT--x--BEFORE",
        "auto_payments_time_relation_units":"DAYS--x--DAYS",
        "auto_payments_time_relation_amounts":"1--x--14",
        "pms_cleaning_status":1.0,
        "calendar_rules_default_availability":"AVAILABLE",
        "bookingcom_cut_off_hours_enabled":null,
        "expedia_cut_off_hours_enabled":null,
        "airbnb_cut_off_hours_enabled":null,
        "directbookings_cut_off_hours_enabled":null,
        "calendar_rules_default_hours":24.0,
        "calendar_rules_allow_request_to_book":null,
        "calendar_rules_advance_notice_updated_at":"2024-09-10T19:33:33.260Z",
        "calendar_rules_advance_notice_updated_by":"Data Import",
        "booking_window_default_days":365.0,
        "booking_window_updated_at":"2024-08-16T14:58:14.897Z",
        "preparation_time_updated_at":"2024-08-16T14:58:14.893Z",
        "dynamic_checkin_updated_at":"2024-08-29T17:26:37.296Z",
        "rental_periods_request_to_book":null,
        "rental_periods_ids":"66bf6906a970830012f1db11",
        "rental_periods_from":1723680000000,
        "default_availability_updated_at":"2024-09-11T20:02:30.975Z",
        "default_availability_updated_by":"Data Import",
        "listing_type":"SINGLE",
        "owners_list":"66bf908db11c9ac268b42ab6",
        "amenities_list":"Air conditioning--x--Bed linens--x--Blender--x--Body soap--x--Carbon monoxide detector--x--Ceiling fan--x--Coffee maker--x--Conditioner--x--Cookware--x--Cycling--x--Dining table--x--Dishes and silverware--x--Dishwasher--x--Downtown--x--Dryer--x--Essentials--x--Free parking on premises--x--Free parking on street--x--Garden or backyard--x--Golf - Optional--x--Hair dryer--x--Heating--x--Hot water--x--Internet--x--Iron--x--Kitchen--x--Lake--x--Laptop friendly workspace--x--Microwave--x--Museums--x--Oven--x--Private entrance--x--Refrigerator--x--Shampoo--x--Shopping--x--Smoke detector--x--Stove--x--TV--x--Toaster--x--Town--x--Washer--x--Wine glasses--x--Wireless Internet--x--Free parking on Street",
        "amenities_not_included_list":null,
        "use_account_revenue_share":1.0,
        "use_account_taxes":null,
        "use_account_markups":1.0,
        "use_account_additional_fees":null,
        "is_active":1.0,
        "net_income_formula":"host_payout",
        "commission_formula":"net_income",
        "owner_revenue_formula":"net_income - pm_commission",
        "tax_ids":"66e1da6e0a677916eb2e62e7--x--66e1da6e0a677916eb2e62ef",
        "tax_types":"STATE_TAX--x--OCCUPANCY_TAX",
        "tax_amounts":"6--x--9",
        "tax_names":"Texas State Tax--x--Travis Cty Hotel Occupancy Tax",
        "tax_units":"PERCENTAGE--x--PERCENTAGE",
        "tax_quantifiers":"PER_STAY--x--PER_STAY",
        "taxes_applied_to_all_fees":"True--x--True",
        "taxes_applied_on_fees":"AF,CF,ADDITIONAL_BED,AIR_CONDITIONING,EARLY_CHECK_IN,LATE_CHECK_IN,BABY_BED,CLEANING,CLUB_CARD,CONCIERGE,EARLY_CHECKOUT,LATE_CHECKOUT,DEPOSIT,ELECTRICITY,FOOD,HEATING,INTERNET,LAUNDRY,LINENS,TOWELS,MANAGEMENT,OIL,PARKING,PET,POOL,POOL_HEATING,RESORT,SERVICE,TOILETRIES,TOUR,TRANSPORTATION,CAR_RENTAL,WATER,WOOD,TRANSFER,HOUSEKEEPING,INSURANCE,COMMUNITY,CREDIT_CARD_PROCESSING_FEE,DAMAGE_WAIVER,VIP_SERVICES,PAYMENT_FEE,ADDITIONAL_CHARGE,MISCELLANEOUS,SHIPPING,VALET,ACTIVITIES,FLIGHTS,GIFT_BASKET,SPA,CHEF,MEET_AND_GREET,DOCK_FEE,UTILITY_FEE,HOT_TUB,BOOKING_FEE,BREAKFAST,BEVERAGE,MEAL,WELLNESS,MINIBAR,BUSINESS_CENTER,WIFI,GUEST_SERVICE,COMMISSION_CHARGE,EQUIPMENT_RENTAL,RESERVATION_FEE,DAMAGE_CHARGE,HOMEOWNERS_ASSOCIATION,GOLF_CART_RENTAL",
        "taxes_are_applied_by_default":"--x--",
        "tax_conditional_overrides_view_types":"LOS--x--LOS",
        "tax_conditional_overrides_max_nights":"29--x--29",
        "tax___vs":"--x--",
        "pre_bookings_list":null,
        "origin_id":104139.0,
        "nick_name":"Deep in the Heart of SoCo - Main House",
        "minimum_age":18.0,
        "address_full":"1317 Newning Avenue, Unit A, 78704 Austin, United States",
        "address_street":"1317 Newning Avenue, Unit A",
        "address_city":"Austin",
        "address_country":"United States",
        "address_latitude":30.2492912,
        "address_longitude":-97.7442201,
        "address_zip_code":78704.0,
        "address_state":"Texas",
        "address_county":"Travis County - City of Austin",
        "room_type":"Entire home\/apt",
        "property_type":"House",
        "ota_room_type":"Holiday home",
        "accommodates":6.0,
        "bathrooms":1.0,
        "bedrooms":3.0,
        "beds_count":3.0,
        "listing_status":1.0,
        "host_name":"Grand Welcome Austin",
        "wifi_name":"Deep in the Heart",
        "wifi_password":"SoCo@2024!",
        "area_in_square_feet":1170.0,
        "trash_collection_day":"'- Trash & recycling is removed on Tuesday. \n- Trash & recycling bins are located on the side of the home. Please ensure that ONLY recyclables are placed in the recycling bin(s).",
        "parking_instructions":"'- This home offers parking for up to 1 vehicle in the driveway. Additional street parking is available as needed on a first come, first served basis.",
        "created_at":"2024-04-19T00:00:00.000Z",
        "origin":"track",
        "default_check_in_time":"16:00:00",
        "default_check_out_time":"10:00:00",
        "check_in_instructions":"Arrival and Parking: \n- This home offers parking for up to 1 vehicle in the driveway. Additional street parking is available as needed on a first come, first served basis.\n\u00c2\u00a0\nAccess Instructions: \n- Once parked, proceed to the primary entrance of the Main House, which is equipped with a keyless lock.\n\u00c2\u00a0\nLock Instructions:\nTo unlock and enter the home:\n- Door code is provided above for entry access. The code will activate right at 4pm.\u00c2\u00a0\n- The door does NOT lock automatically so please lock when you leave.\n- Use your code for the door to lock.\u00c2\u00a0\n\u00c2\u00a0\nWireless Internet Information: \nNetwork: Deep in the Heart\nPassword: SoCo@2024!\n\u00c2\u00a0\nLaundry: \n- Private laundry is available for your stay, located in the kitchen.\n\u00c2\u00a0\nTrash: \n- Trash & recycling is removed on Tuesday.\n- Trash & recycling bins are located on the side of the home. Please ensure that ONLY recyclables are placed in the recycling bin(s).\n\u00c2\u00a0\nAdditional Information: \u00c2\u00a0\n- We provide a starter set of supplies, but for longer stays you will likely want buy or bring more. These complimentary amenities are provided free of charge and are included in the blue boxes in the kitchen and bathrooms so please help yourselves!\n- This home is pet friendly. Cats are not permitted.\u00c2\u00a0\n- If you are bringing a pet, please ensure that they are added to the reservation and that the pet fee is paid. This property allows up to a maximum of 2 pet(s). An additional flat fee of $150 applies, and a maximum of 2 pets are allowed in the unit.\n- Please reach out if you would like us to send you the entire list of house rules before your arrival.  \n",
        "check_out_instructions":"- Set AC to 74 in the summer months  \n- Set heater to 65 in the winter months \n- Bag all garbage and place is designated trash location \n- Load all dirty dishes in the dishwasher and start the dishwasher \n- Place all used towels on the ground in the bathr",
        "account_id":"66a30f208b331811b8e96639",
        "time_zone":"America\/Chicago",
        "last_updated_at":"2024-10-16T07:27:33.974Z",
        "integration_ids":"66d0af0bb6ad7bcfca3bf989--x--66d8cd59cc4df40011491532--x--66e1a279352e665645cd4fe0",
        "integration_platforms":"vacayHome--x--homeaway2--x--airbnb2",
        "booking_com_initial_complex_listings":"--x----x--",
        "booking_com_publish_company_logos":"--x----x--",
        "booking_com_is_published_company_logos":"--x----x--",
        "booking_com_publish_company_infos":"--x----x--",
        "booking_com_is_published_company_infos":"--x----x--",
        "vacayhome_currencies":"USD",
        "vacayhome_statuses":"COMPLETED",
        "vacayhome_cancellation_policies":"firm",
        "vacayhome_cancellation_penalties":100.0,
        "vacayhome_creation_times":"2024-08-30T20:30:52.283Z",
        "listing_room_ids":"66c30cd599e922187e4f70d1--x--66c30cd599e922187e4f70d2--x--66c30cd599e922187e4f70d3--x--66c30cd599e922187e4f70d4",
        "listing_room_numbers":null,
        "listing_room_bed_ids":"6700d62e4fb7080011845109--x--6700d62e4fb708001184510b--x--6700d62e4fb708001184510d",
        "listing_room_bed_types":"KING_BED--x--KING_BED--x--KING_BED",
        "listing_room_bed_quantities":"1--x--1--x--1",
        "custom_field_values":"Arrival and Parking: \n- This home offers parking for up to 1 vehicle in the driveway. Additional street parking is available as needed on a first come, first served basis.\n\u00c2\u00a0\nAccess Instructions: \n- Once parked, proceed to the primary entrance of the Main House, which is equipped with a keyless lock.\n\u00c2\u00a0\nLock Instructions:\nTo unlock and enter the home:\n- Door code is provided above for entry access. The code will activate right at 4pm.\u00c2\u00a0\n- The door does NOT lock automatically so please lock when you leave.\n- Use your code for the door to lock.\u00c2\u00a0\n\u00c2\u00a0\nWireless Internet Information: \nNetwork: Deep in the Heart\nPassword: SoCo@2024!\n\u00c2\u00a0\nLaundry: \n- Private laundry is available for your stay, located in the kitchen.\n\u00c2\u00a0\nTrash: \n- Trash & recycling is removed on Tuesday.\n- Trash & recycling bins are located on the side of the home. Please ensure that ONLY recyclables are placed in the recycling bin(s).\n\u00c2\u00a0\nAdditional Information: \u00c2\u00a0\n- We provide a starter set of supplies, but for longer stays you will likely want buy or bring more. These complimentary amenities are provided free of charge and are included in the blue boxes in the kitchen and bathrooms so please help yourselves!\n- This home is pet friendly. Cats are not permitted.\u00c2\u00a0\n- If you are bringing a pet, please ensure that they are added to the reservation and that the pet fee is paid. This property allows up to a maximum of 2 pet(s). An additional flat fee of $150 applies, and a maximum of 2 pets are allowed in the unit.\n- Please reach out if you would like us to send you the entire list of house rules before your arrival.  \n--x--From Austin-Bergstrom International Airport (AUS)\n3600 Presidential Blvd, Austin, TX 78719\n\u00c2\u00a0\n- Take\u00c2\u00a0Hotel Dr\u00c2\u00a0to\u00c2\u00a0State Hwy 71 W - 3 min\u00c2\u00a0(1.6 mi)\n- Head\u00c2\u00a0southwest\u00c2\u00a0on\u00c2\u00a0Presidential Blvd\u00c2\u00a0toward\u00c2\u00a0Service Dr - 354 ft\n- Slight\u00c2\u00a0right\u00c2\u00a0onto\u00c2\u00a0Service Dr - 482 ft\n- Turn\u00c2\u00a0right\u00c2\u00a0onto\u00c2\u00a0Hotel Dr - 0.3 mi\n- Turn\u00c2\u00a0right\u00c2\u00a0onto\u00c2\u00a0Spirit of Texas Dr - 0.2 mi\n- Turn\u00c2\u00a0left\u00c2\u00a0to merge onto\u00c2\u00a0State Hwy 71 W - 0.9 mi\n- Use the left 3 lanes to stay on\u00c2\u00a0State Hwy 71 W - 0.1 mi\n- Continue on\u00c2\u00a0State Hwy 71 W\u00c2\u00a0to\u00c2\u00a0N Interstate 35 Frontage Rd. Take exit\u00c2\u00a0232B\u00c2\u00a0from\u00c2\u00a0I-35 N\/US-290 E - 6 min\u00c2\u00a0(5.9 mi)\n- Keep\u00c2\u00a0left\u00c2\u00a0to stay on\u00c2\u00a0State Hwy 71 W - 4.1 mi\n- Use the right 2 lanes to merge onto\u00c2\u00a0I-35 N\/US-290 E\u00c2\u00a0toward\u00c2\u00a0Waco - 1.7 mi\n- Take exit\u00c2\u00a0232B\u00c2\u00a0toward\u00c2\u00a0Woodland Ave - 0.2 mi\n- Continue on\u00c2\u00a0N Interstate 35 Frontage Rd. Take\u00c2\u00a0Woodland Ave\u00c2\u00a0to\u00c2\u00a0Newning Ave - 5 min\u00c2\u00a0(1.4 mi)\n- Merge onto\u00c2\u00a0N Interstate 35 Frontage Rd - 0.2 mi\n- Continue straight to stay on\u00c2\u00a0N Interstate 35 Frontage Rd - 0.2 mi\n- Turn\u00c2\u00a0left\u00c2\u00a0onto\u00c2\u00a0Woodland Ave - 0.6 mi\n- Turn\u00c2\u00a0right\u00c2\u00a0onto\u00c2\u00a0Sunset Ln - 0.1 mi\n- Turn\u00c2\u00a0left\u00c2\u00a0onto\u00c2\u00a0E Monroe St - 0.1 mi\n- Turn\u00c2\u00a0right\u00c2\u00a0onto\u00c2\u00a0Newning Ave\n- Destination will be on the right (First house on the corner of Newning and E Monroe) - 0.2 mi\n\u00c2\u00a0\n1317 Newning Ave (Main House)\nAustin, TX 78704\n\u00c2\u00a0\u00c2\u00a0\n**Note: The driveway for this home is located to the left of entrance of home, between the 1315 &amp; 1317 Newning.--x--Owner Tax ID\/EIN - 642211938\nExp: 5\/31\/25\n\nOL 2024 006564\nExp: 2\/8\/2025--x--Owner Tax ID\/EIN - 642211938\nExp: 5\/31\/25\n\nOL 2024 006564\nExp: 2\/8\/2025--x--Left front of 1315 Unit A--x----x--1 set of towels (bath towel, hand towel, washcloth) per occupant (up to max occupancy on listing). 2 rolls of toilet paper, bar soap, hand lotion and wastebasket trash bag per bathroom. Shampoo, conditioner, &amp; body wash per full bathroom. 2 rolls of paper towels, fresh sponge, dish soap, 2 loads of dishwasher detergent, 2 additional trash bags per kitchen. 2 loads of laundry detergent per home. (with in-house laundry systems).--x--hallway--x--Living room--x--Kitchen--x--Outside on the left--x--N\/a--x--Private laundry is available for your stay, located in the kitchen.--x--2--x--https:\/\/www.grandwelcome.com\/vrp\/unit\/Deep_in_the_Heart_of_SoCo_-_Main_House-104139-15--x--https:\/\/www.airbnb.com\/rooms\/1161108201986768098--x--https:\/\/www.vrbo.com\/9961006ha--x----x----x----x----x--105--x--105--x--Backup Keyless Entry Code 011317\u00e2\u0153\u201c\nEmergency Lockbox (Internal Use) 0723",
        "import_time":"2024-08-16T14:58:14.904Z",
        "date_of_first_scrape":1735178160000,
        "date_of_last_update":null,
        "date_of_last_scrape":1735178160000,
        "summary":"property_address1: nan, property_address2: nan, property_building: nan, property_id: 1182, property_notes_access: nan, property_notes_general: nan, property_notes_guest_access: nan, property_photos_url: nan, property_state: nan, property_status: nan, listing_id: 66bf6906a970830012f1db0d, saas_auto_renew: True, cleaning_fee_id: 66e5b05cb72f1b00118eb7e9, cleaning_fee_value_type: FIXED, cleaning_fee_formula: 200, cleaning_fee_multiplier: PER_STAY, channel_commission_use_account_settings: True, channel_commission_id: 67334bb06d8308d981974780, channel_commission_created_at: 2024-11-12T12:36:00.832Z, channel_commission_updated_at: 2024-12-11T07:01:39.812Z, cleaning_status: dirty, picture_caption: Aerial view, picture_thumbnail: https:\/\/track-pm.s3.amazonaws.com\/gw\/image\/076ece42-15ce-487d-97ce-17c31e41ce13, minimum_nights: 1, maximum_nights: 365.0, monthly_price_factor: 1, weekly_price_factor: 1.0, base_price: 1.0, weekend_base_price: 281.0, currency: USD, cleaning_fee: 200.0, confirmed_before_checkin_delay_minutes: 45.0, confirmed_day_of_checkin_delay_minutes: 45.0, confirmed_day_of_checkout_delay_minutes: 45.0, confirmed_during_stay_delay_minutes: 45.0, confirmed_after_checkout_delay_minutes: 45.0, unconfirmed_first_message_delay_minutes: 45.0, unconfirmed_subsequent_message_delay_minutes: 45.0, answeing_machine_is_active: 1.0, auto_reviews_status: 1.0, auto_payments_time_relation_names: AT--x--BEFORE, auto_payments_time_relation_units: DAYS--x--DAYS, auto_payments_time_relation_amounts: 1--x--14, pms_cleaning_status: 1.0, calendar_rules_default_availability: AVAILABLE, bookingcom_cut_off_hours_enabled: nan, expedia_cut_off_hours_enabled: nan, airbnb_cut_off_hours_enabled: nan, directbookings_cut_off_hours_enabled: nan, calendar_rules_default_hours: 24.0, calendar_rules_allow_request_to_book: nan, calendar_rules_advance_notice_updated_at: 2024-09-10T19:33:33.260Z, calendar_rules_advance_notice_updated_by: Data Import, booking_window_default_days: 365.0, booking_window_updated_at: 2024-08-16T14:58:14.897Z, preparation_time_updated_at: 2024-08-16T14:58:14.893Z, dynamic_checkin_updated_at: 2024-08-29T17:26:37.296Z, rental_periods_request_to_book: nan, rental_periods_ids: 66bf6906a970830012f1db11, rental_periods_from: 2024-08-15 00:00:00, default_availability_updated_at: 2024-09-11T20:02:30.975Z, default_availability_updated_by: Data Import, listing_type: SINGLE, owners_list: 66bf908db11c9ac268b42ab6, amenities_list: Air conditioning--x--Bed linens--x--Blender--x--Body soap--x--Carbon monoxide detector--x--Ceiling fan--x--Coffee maker--x--Conditioner--x--Cookware--x--Cycling--x--Dining table--x--Dishes and silverware--x--Dishwasher--x--Downtown--x--Dryer--x--Essentials--x--Free parking on premises--x--Free parking on street--x--Garden or backyard--x--Golf - Optional--x--Hair dryer--x--Heating--x--Hot water--x--Internet--x--Iron--x--Kitchen--x--Lake--x--Laptop friendly workspace--x--Microwave--x--Museums--x--Oven--x--Private entrance--x--Refrigerator--x--Shampoo--x--Shopping--x--Smoke detector--x--Stove--x--TV--x--Toaster--x--Town--x--Washer--x--Wine glasses--x--Wireless Internet--x--Free parking on Street, amenities_not_included_list: nan, use_account_revenue_share: 1.0, use_account_taxes: nan, use_account_markups: 1.0, use_account_additional_fees: nan, is_active: 1.0, net_income_formula: host_payout, commission_formula: net_income, owner_revenue_formula: net_income - pm_commission, tax_ids: 66e1da6e0a677916eb2e62e7--x--66e1da6e0a677916eb2e62ef, tax_types: STATE_TAX--x--OCCUPANCY_TAX, tax_amounts: 6--x--9, tax_names: Texas State Tax--x--Travis Cty Hotel Occupancy Tax, tax_units: PERCENTAGE--x--PERCENTAGE, tax_quantifiers: PER_STAY--x--PER_STAY, taxes_applied_to_all_fees: True--x--True, taxes_applied_on_fees: AF,CF,ADDITIONAL_BED,AIR_CONDITIONING,EARLY_CHECK_IN,LATE_CHECK_IN,BABY_BED,CLEANING,CLUB_CARD,CONCIERGE,EARLY_CHECKOUT,LATE_CHECKOUT,DEPOSIT,ELECTRICITY,FOOD,HEATING,INTERNET,LAUNDRY,LINENS,TOWELS,MANAGEMENT,OIL,PARKING,PET,POOL,POOL_HEATING,RESORT,SERVICE,TOILETRIES,TOUR,TRANSPORTATION,CAR_RENTAL,WATER,WOOD,TRANSFER,HOUSEKEEPING,INSURANCE,COMMUNITY,CREDIT_CARD_PROCESSING_FEE,DAMAGE_WAIVER,VIP_SERVICES,PAYMENT_FEE,ADDITIONAL_CHARGE,MISCELLANEOUS,SHIPPING,VALET,ACTIVITIES,FLIGHTS,GIFT_BASKET,SPA,CHEF,MEET_AND_GREET,DOCK_FEE,UTILITY_FEE,HOT_TUB,BOOKING_FEE,BREAKFAST,BEVERAGE,MEAL,WELLNESS,MINIBAR,BUSINESS_CENTER,WIFI,GUEST_SERVICE,COMMISSION_CHARGE,EQUIPMENT_RENTAL,RESERVATION_FEE,DAMAGE_CHARGE,HOMEOWNERS_ASSOCIATION,GOLF_CART_RENTAL, taxes_are_applied_by_default: --x--, tax_conditional_overrides_view_types: LOS--x--LOS, tax_conditional_overrides_max_nights: 29--x--29, tax___vs: --x--, pre_bookings_list: nan, origin_id: 104139.0, nick_name: Deep in the Heart of SoCo - Main House, minimum_age: 18.0, address_full: 1317 Newning Avenue, Unit A, 78704 Austin, United States, address_street: 1317 Newning Avenue, Unit A, address_city: Austin, address_country: United States, address_latitude: 30.2492912, address_longitude: -97.7442201, address_zip_code: 78704.0, address_state: Texas, address_county: Travis County - City of Austin, room_type: Entire home\/apt, property_type: House, ota_room_type: Holiday home, accommodates: 6.0, bathrooms: 1.0, bedrooms: 3.0, beds_count: 3.0, listing_status: 1.0, host_name: Grand Welcome Austin, wifi_name: Deep in the Heart, wifi_password: SoCo@2024!, area_in_square_feet: 1170.0, trash_collection_day: '- Trash & recycling is removed on Tuesday. \n- Trash & recycling bins are located on the side of the home. Please ensure that ONLY recyclables are placed in the recycling bin(s)., parking_instructions: '- This home offers parking for up to 1 vehicle in the driveway. Additional street parking is available as needed on a first come, first served basis., created_at: 2024-04-19T00:00:00.000Z, origin: track, default_check_in_time: 16:00:00, default_check_out_time: 10:00:00, check_in_instructions: Arrival and Parking: \n- This home offers parking for up to 1 vehicle in the driveway. Additional street parking is available as needed on a first come, first served basis.\n\u00c2\u00a0\nAccess Instructions: \n- Once parked, proceed to the primary entrance of the Main House, which is equipped with a keyless lock.\n\u00c2\u00a0\nLock Instructions:\nTo unlock and enter the home:\n- Door code is provided above for entry access. The code will activate right at 4pm.\u00c2\u00a0\n- The door does NOT lock automatically so please lock when you leave.\n- Use your code for the door to lock.\u00c2\u00a0\n\u00c2\u00a0\nWireless Internet Information: \nNetwork: Deep in the Heart\nPassword: SoCo@2024!\n\u00c2\u00a0\nLaundry: \n- Private laundry is available for your stay, located in the kitchen.\n\u00c2\u00a0\nTrash: \n- Trash & recycling is removed on Tuesday.\n- Trash & recycling bins are located on the side of the home. Please ensure that ONLY recyclables are placed in the recycling bin(s).\n\u00c2\u00a0\nAdditional Information: \u00c2\u00a0\n- We provide a starter set of supplies, but for longer stays you will likely want buy or bring more. These complimentary amenities are provided free of charge and are included in the blue boxes in the kitchen and bathrooms so please help yourselves!\n- This home is pet friendly. Cats are not permitted.\u00c2\u00a0\n- If you are bringing a pet, please ensure that they are added to the reservation and that the pet fee is paid. This property allows up to a maximum of 2 pet(s). An additional flat fee of $150 applies, and a maximum of 2 pets are allowed in the unit.\n- Please reach out if you would like us to send you the entire list of house rules before your arrival.  \n, check_out_instructions: - Set AC to 74 in the summer months  \n- Set heater to 65 in the winter months \n- Bag all garbage and place is designated trash location \n- Load all dirty dishes in the dishwasher and start the dishwasher \n- Place all used towels on the ground in the bathr, account_id: 66a30f208b331811b8e96639, time_zone: America\/Chicago, last_updated_at: 2024-10-16T07:27:33.974Z, integration_ids: 66d0af0bb6ad7bcfca3bf989--x--66d8cd59cc4df40011491532--x--66e1a279352e665645cd4fe0, integration_platforms: vacayHome--x--homeaway2--x--airbnb2, booking_com_initial_complex_listings: --x----x--, booking_com_publish_company_logos: --x----x--, booking_com_is_published_company_logos: --x----x--, booking_com_publish_company_infos: --x----x--, booking_com_is_published_company_infos: --x----x--, vacayhome_currencies: USD, vacayhome_statuses: COMPLETED, vacayhome_cancellation_policies: firm, vacayhome_cancellation_penalties: 100.0, vacayhome_creation_times: 2024-08-30T20:30:52.283Z, listing_room_ids: 66c30cd599e922187e4f70d1--x--66c30cd599e922187e4f70d2--x--66c30cd599e922187e4f70d3--x--66c30cd599e922187e4f70d4, listing_room_numbers: nan, listing_room_bed_ids: 6700d62e4fb7080011845109--x--6700d62e4fb708001184510b--x--6700d62e4fb708001184510d, listing_room_bed_types: KING_BED--x--KING_BED--x--KING_BED, listing_room_bed_quantities: 1--x--1--x--1, custom_field_values: Arrival and Parking: \n- This home offers parking for up to 1 vehicle in the driveway. Additional street parking is available as needed on a first come, first served basis.\n\u00c2\u00a0\nAccess Instructions: \n- Once parked, proceed to the primary entrance of the Main House, which is equipped with a keyless lock.\n\u00c2\u00a0\nLock Instructions:\nTo unlock and enter the home:\n- Door code is provided above for entry access. The code will activate right at 4pm.\u00c2\u00a0\n- The door does NOT lock automatically so please lock when you leave.\n- Use your code for the door to lock.\u00c2\u00a0\n\u00c2\u00a0\nWireless Internet Information: \nNetwork: Deep in the Heart\nPassword: SoCo@2024!\n\u00c2\u00a0\nLaundry: \n- Private laundry is available for your stay, located in the kitchen.\n\u00c2\u00a0\nTrash: \n- Trash & recycling is removed on Tuesday.\n- Trash & recycling bins are located on the side of the home. Please ensure that ONLY recyclables are placed in the recycling bin(s).\n\u00c2\u00a0\nAdditional Information: \u00c2\u00a0\n- We provide a starter set of supplies, but for longer stays you will likely want buy or bring more. These complimentary amenities are provided free of charge and are included in the blue boxes in the kitchen and bathrooms so please help yourselves!\n- This home is pet friendly. Cats are not permitted.\u00c2\u00a0\n- If you are bringing a pet, please ensure that they are added to the reservation and that the pet fee is paid. This property allows up to a maximum of 2 pet(s). An additional flat fee of $150 applies, and a maximum of 2 pets are allowed in the unit.\n- Please reach out if you would like us to send you the entire list of house rules before your arrival.  \n--x--From Austin-Bergstrom International Airport (AUS)\n3600 Presidential Blvd, Austin, TX 78719\n\u00c2\u00a0\n- Take\u00c2\u00a0Hotel Dr\u00c2\u00a0to\u00c2\u00a0State Hwy 71 W - 3 min\u00c2\u00a0(1.6 mi)\n- Head\u00c2\u00a0southwest\u00c2\u00a0on\u00c2\u00a0Presidential Blvd\u00c2\u00a0toward\u00c2\u00a0Service Dr - 354 ft\n- Slight\u00c2\u00a0right\u00c2\u00a0onto\u00c2\u00a0Service Dr - 482 ft\n- Turn\u00c2\u00a0right\u00c2\u00a0onto\u00c2\u00a0Hotel Dr - 0.3 mi\n- Turn\u00c2\u00a0right\u00c2\u00a0onto\u00c2\u00a0Spirit of Texas Dr - 0.2 mi\n- Turn\u00c2\u00a0left\u00c2\u00a0to merge onto\u00c2\u00a0State Hwy 71 W - 0.9 mi\n- Use the left 3 lanes to stay on\u00c2\u00a0State Hwy 71 W - 0.1 mi\n- Continue on\u00c2\u00a0State Hwy 71 W\u00c2\u00a0to\u00c2\u00a0N Interstate 35 Frontage Rd. Take exit\u00c2\u00a0232B\u00c2\u00a0from\u00c2\u00a0I-35 N\/US-290 E - 6 min\u00c2\u00a0(5.9 mi)\n- Keep\u00c2\u00a0left\u00c2\u00a0to stay on\u00c2\u00a0State Hwy 71 W - 4.1 mi\n- Use the right 2 lanes to merge onto\u00c2\u00a0I-35 N\/US-290 E\u00c2\u00a0toward\u00c2\u00a0Waco - 1.7 mi\n- Take exit\u00c2\u00a0232B\u00c2\u00a0toward\u00c2\u00a0Woodland Ave - 0.2 mi\n- Continue on\u00c2\u00a0N Interstate 35 Frontage Rd. Take\u00c2\u00a0Woodland Ave\u00c2\u00a0to\u00c2\u00a0Newning Ave - 5 min\u00c2\u00a0(1.4 mi)\n- Merge onto\u00c2\u00a0N Interstate 35 Frontage Rd - 0.2 mi\n- Continue straight to stay on\u00c2\u00a0N Interstate 35 Frontage Rd - 0.2 mi\n- Turn\u00c2\u00a0left\u00c2\u00a0onto\u00c2\u00a0Woodland Ave - 0.6 mi\n- Turn\u00c2\u00a0right\u00c2\u00a0onto\u00c2\u00a0Sunset Ln - 0.1 mi\n- Turn\u00c2\u00a0left\u00c2\u00a0onto\u00c2\u00a0E Monroe St - 0.1 mi\n- Turn\u00c2\u00a0right\u00c2\u00a0onto\u00c2\u00a0Newning Ave\n- Destination will be on the right (First house on the corner of Newning and E Monroe) - 0.2 mi\n\u00c2\u00a0\n1317 Newning Ave (Main House)\nAustin, TX 78704\n\u00c2\u00a0\u00c2\u00a0\n**Note: The driveway for this home is located to the left of entrance of home, between the 1315 &amp; 1317 Newning.--x--Owner Tax ID\/EIN - 642211938\nExp: 5\/31\/25\n\nOL 2024 006564\nExp: 2\/8\/2025--x--Owner Tax ID\/EIN - 642211938\nExp: 5\/31\/25\n\nOL 2024 006564\nExp: 2\/8\/2025--x--Left front of 1315 Unit A--x----x--1 set of towels (bath towel, hand towel, washcloth) per occupant (up to max occupancy on listing). 2 rolls of toilet paper, bar soap, hand lotion and wastebasket trash bag per bathroom. Shampoo, conditioner, &amp; body wash per full bathroom. 2 rolls of paper towels, fresh sponge, dish soap, 2 loads of dishwasher detergent, 2 additional trash bags per kitchen. 2 loads of laundry detergent per home. (with in-house laundry systems).--x--hallway--x--Living room--x--Kitchen--x--Outside on the left--x--N\/a--x--Private laundry is available for your stay, located in the kitchen.--x--2--x--https:\/\/www.grandwelcome.com\/vrp\/unit\/Deep_in_the_Heart_of_SoCo_-_Main_House-104139-15--x--https:\/\/www.airbnb.com\/rooms\/1161108201986768098--x--https:\/\/www.vrbo.com\/9961006ha--x----x----x----x----x--105--x--105--x--Backup Keyless Entry Code 011317\u00e2\u0153\u201c\nEmergency Lockbox (Internal Use) 0723, import_time: 2024-08-16T14:58:14.904Z, date_of_first_scrape: 2024-12-26 01:56:00, date_of_last_update: nan, date_of_last_scrape: 2024-12-26 01:56:00"
    },
    {
        "property_address1":null,
        "property_address2":null,
        "property_building":null,
        "property_id":1188,
        "property_notes_access":null,
        "property_notes_general":null,
        "property_notes_guest_access":null,
        "property_photos_url":null,
        "property_state":null,
        "property_status":null,
        "listing_id":"66bf68eedf6be6001185c28c",
        "saas_auto_renew":1.0,
        "cleaning_fee_id":"66e5ae2fc71c3a001203f07c",
        "cleaning_fee_value_type":"FIXED",
        "cleaning_fee_formula":175.0,
        "cleaning_fee_multiplier":"PER_STAY",
        "channel_commission_use_account_settings":1.0,
        "channel_commission_id":"67334bb16d8308d981974888",
        "channel_commission_created_at":"2024-11-12T12:36:01.399Z",
        "channel_commission_updated_at":"2024-12-11T07:01:40.277Z",
        "cleaning_status":"dirty",
        "picture_caption":"Front exterior and driveway",
        "picture_thumbnail":"https:\/\/track-pm.s3.amazonaws.com\/gw\/image\/e02dbb21-fe4e-43a7-b9f6-54382dd7cbc0",
        "minimum_nights":1.0,
        "maximum_nights":365.0,
        "monthly_price_factor":1.0,
        "weekly_price_factor":1.0,
        "base_price":1.0,
        "weekend_base_price":188.0,
        "currency":"USD",
        "cleaning_fee":175.0,
        "confirmed_before_checkin_delay_minutes":45.0,
        "confirmed_day_of_checkin_delay_minutes":45.0,
        "confirmed_day_of_checkout_delay_minutes":45.0,
        "confirmed_during_stay_delay_minutes":45.0,
        "confirmed_after_checkout_delay_minutes":45.0,
        "unconfirmed_first_message_delay_minutes":45.0,
        "unconfirmed_subsequent_message_delay_minutes":45.0,
        "answeing_machine_is_active":1.0,
        "auto_reviews_status":1.0,
        "auto_payments_time_relation_names":"AT--x--BEFORE",
        "auto_payments_time_relation_units":"DAYS--x--DAYS",
        "auto_payments_time_relation_amounts":"1--x--14",
        "pms_cleaning_status":1.0,
        "calendar_rules_default_availability":"AVAILABLE",
        "bookingcom_cut_off_hours_enabled":null,
        "expedia_cut_off_hours_enabled":null,
        "airbnb_cut_off_hours_enabled":null,
        "directbookings_cut_off_hours_enabled":null,
        "calendar_rules_default_hours":24.0,
        "calendar_rules_allow_request_to_book":null,
        "calendar_rules_advance_notice_updated_at":"2024-09-10T19:33:25.985Z",
        "calendar_rules_advance_notice_updated_by":"Data Import",
        "booking_window_default_days":365.0,
        "booking_window_updated_at":"2024-08-16T14:57:50.821Z",
        "preparation_time_updated_at":"2024-08-16T14:57:50.818Z",
        "dynamic_checkin_updated_at":"2024-08-29T17:26:38.534Z",
        "rental_periods_request_to_book":null,
        "rental_periods_ids":"66bf68eedf6be6001185c290",
        "rental_periods_from":1723680000000,
        "default_availability_updated_at":"2024-09-11T20:02:21.628Z",
        "default_availability_updated_by":"Data Import",
        "listing_type":"SINGLE",
        "owners_list":"66bf908cbc6ac87bd184c302",
        "amenities_list":"Air conditioning--x--BBQ grill--x--Bed linens--x--Blender--x--Body soap--x--Carbon monoxide detector--x--Ceiling fan--x--Coffee maker--x--Conditioner--x--Cookware--x--Dishes and silverware--x--Dishwasher--x--Downtown--x--Dryer--x--Essentials--x--Free parking on premises--x--Free parking on street--x--Garden View--x--Garden or backyard--x--Golf - Optional--x--Hair dryer--x--Heating--x--Hot water--x--Ice maker--x--Internet--x--Iron--x--Kitchen--x--Laptop friendly workspace--x--Microwave--x--Museums--x--Oven--x--Private entrance--x--Refrigerator--x--Shampoo--x--Shopping--x--Smoke detector--x--Stove--x--TV--x--Toaster--x--Town--x--Washer--x--Wine glasses--x--Wireless Internet--x--Free parking on Street",
        "amenities_not_included_list":null,
        "use_account_revenue_share":1.0,
        "use_account_taxes":null,
        "use_account_markups":1.0,
        "use_account_additional_fees":null,
        "is_active":1.0,
        "net_income_formula":"host_payout",
        "commission_formula":"net_income",
        "owner_revenue_formula":"net_income - pm_commission",
        "tax_ids":"66e1da74059dc7ccf8e9c2f2--x--66e1da74055feb22b033039c",
        "tax_types":"STATE_TAX--x--OCCUPANCY_TAX",
        "tax_amounts":"6--x--11",
        "tax_names":"Texas State Tax--x--Travis Cty Hotel Occupancy Tax",
        "tax_units":"PERCENTAGE--x--PERCENTAGE",
        "tax_quantifiers":"PER_STAY--x--PER_STAY",
        "taxes_applied_to_all_fees":"True--x--True",
        "taxes_applied_on_fees":"AF,CF,ADDITIONAL_BED,AIR_CONDITIONING,EARLY_CHECK_IN,LATE_CHECK_IN,BABY_BED,CLEANING,CLUB_CARD,CONCIERGE,EARLY_CHECKOUT,LATE_CHECKOUT,DEPOSIT,ELECTRICITY,FOOD,HEATING,INTERNET,LAUNDRY,LINENS,TOWELS,MANAGEMENT,OIL,PARKING,PET,POOL,POOL_HEATING,RESORT,SERVICE,TOILETRIES,TOUR,TRANSPORTATION,CAR_RENTAL,WATER,WOOD,TRANSFER,HOUSEKEEPING,INSURANCE,COMMUNITY,CREDIT_CARD_PROCESSING_FEE,DAMAGE_WAIVER,VIP_SERVICES,PAYMENT_FEE,ADDITIONAL_CHARGE,MISCELLANEOUS,SHIPPING,VALET,ACTIVITIES,FLIGHTS,GIFT_BASKET,SPA,CHEF,MEET_AND_GREET,DOCK_FEE,UTILITY_FEE,HOT_TUB,BOOKING_FEE,BREAKFAST,BEVERAGE,MEAL,WELLNESS,MINIBAR,BUSINESS_CENTER,WIFI,GUEST_SERVICE,COMMISSION_CHARGE,EQUIPMENT_RENTAL,RESERVATION_FEE,DAMAGE_CHARGE,HOMEOWNERS_ASSOCIATION,GOLF_CART_RENTAL",
        "taxes_are_applied_by_default":"--x--",
        "tax_conditional_overrides_view_types":"LOS--x--LOS",
        "tax_conditional_overrides_max_nights":"29--x--29",
        "tax___vs":"--x--",
        "pre_bookings_list":null,
        "origin_id":104358.0,
        "nick_name":"Blue Haven Retreat",
        "minimum_age":18.0,
        "address_full":"920 Cardinal Ln #2, Austin, TX 78704, USA",
        "address_street":"920 Cardinal Lane",
        "address_city":"Austin",
        "address_country":"United States",
        "address_latitude":30.2345855,
        "address_longitude":-97.7702242,
        "address_zip_code":78704.0,
        "address_state":"Texas",
        "address_county":null,
        "room_type":"Entire home\/apt",
        "property_type":"House",
        "ota_room_type":"Holiday home",
        "accommodates":4.0,
        "bathrooms":2.0,
        "bedrooms":2.0,
        "beds_count":2.0,
        "listing_status":1.0,
        "host_name":"Grand Welcome Austin",
        "wifi_name":"CardinalGW",
        "wifi_password":"GW Guest",
        "area_in_square_feet":1100.0,
        "trash_collection_day":"Trash bins are located at the left of the house, by the fence",
        "parking_instructions":"Space for up to 4 cars on in the single driveway",
        "created_at":"2024-06-25T00:00:00.000Z",
        "origin":"track",
        "default_check_in_time":"16:00:00",
        "default_check_out_time":"10:00:00",
        "check_in_instructions":"Arrival and Parking: \n- This home offers parking for 4 vehicles in the driveway. Additional street parking is available on a first-come, first-serve basis and at the vehicle owner\u00e2\u20ac\u2122s own risk.\n\u00c2\u00a0\nAccess Instructions: \n- Once parked, proceed to the main door which is equipped with a keyless lock for entry.\n\u00c2\u00a0\n\u00c2\u00a0\nLock Instructions:\nTo unlock and enter the home:\n- Door code is provided above for entry access. The code will activate right at 4pm.\u00c2\u00a0\n- The door will lock automatically after 30 seconds.\n- You can also press any button on the keypad to lock the door upon your departure.\n\u00c2\u00a0\nWireless Internet Information: \nNetwork: CardinalGW \nPassword: GW Guest\n\u00c2\u00a0\n\u00c2\u00a0\nLaundry: \n- Private laundry is available for your stay, located in the utility room off the kitchen.\n\u00c2\u00a0\nTrash: \n- Trash is removed on Tuesday. Bins are located on the left side of the home. \n\u00c2\u00a0\nAdditional Information: \u00c2\u00a0\n- We provide a starter set of supplies, but for longer stays you will likely want buy or bring more. These complimentary amenities are provided free of charge and are included in the blue boxes in the kitchen and bathrooms so please help yourselves!\n- If you are bringing a pet, please ensure that they are added to the reservation and that the pet fee is paid. This property allows up to a maximum of 2 pet(s).  An additional flat fee of $150 applies, and a maximum of 2 pets are allowed in the unit.\n- Please reach out if you would like us to send you the entire list of house rules before your arrival.  ",
        "check_out_instructions":"- Set AC to 74 in the summer months  \n- Set heater to 65 in the winter months \n- Bag all garbage and place is designated trash location \n- Load all dirty dishes in the dishwasher and start the dishwasher \n- Place all used towels on the ground in the bathr",
        "account_id":"66a30f208b331811b8e96639",
        "time_zone":"America\/Chicago",
        "last_updated_at":"2024-11-09T18:06:36.320Z",
        "integration_ids":"66d0af0bb6ad7bcfca3bf989--x--66d8cd59cc4df40011491532--x--66e1a279352e665645cd4fe0",
        "integration_platforms":"vacayHome--x--homeaway2--x--airbnb2",
        "booking_com_initial_complex_listings":"--x----x--",
        "booking_com_publish_company_logos":"--x----x--",
        "booking_com_is_published_company_logos":"--x----x--",
        "booking_com_publish_company_infos":"--x----x--",
        "booking_com_is_published_company_infos":"--x----x--",
        "vacayhome_currencies":"USD",
        "vacayhome_statuses":"COMPLETED",
        "vacayhome_cancellation_policies":"firm",
        "vacayhome_cancellation_penalties":100.0,
        "vacayhome_creation_times":"2024-08-30T20:30:49.666Z",
        "listing_room_ids":"66c30cd299e922187e4f7011--x--66c30cd299e922187e4f7012--x--66c30cd299e922187e4f7013--x--66c30cd299e922187e4f7014",
        "listing_room_numbers":null,
        "listing_room_bed_ids":"6700bcad56da1d00118aaa16--x--6700bcad56da1d00118aaa18",
        "listing_room_bed_types":"QUEEN_BED--x--QUEEN_BED",
        "listing_room_bed_quantities":"1--x--1",
        "custom_field_values":"Arrival and Parking: \n- This home offers parking for 4 vehicles in the driveway. Additional street parking is available on a first-come, first-serve basis and at the vehicle owner\u00e2\u20ac\u2122s own risk.\n\u00c2\u00a0\nAccess Instructions: \n- Once parked, proceed to the main door which is equipped with a keyless lock for entry.\n\u00c2\u00a0\n\u00c2\u00a0\nLock Instructions:\nTo unlock and enter the home:\n- Door code is provided above for entry access. The code will activate right at 4pm.\u00c2\u00a0\n- The door will lock automatically after 30 seconds.\n- You can also press any button on the keypad to lock the door upon your departure.\n\u00c2\u00a0\nWireless Internet Information: \nNetwork: CardinalGW \nPassword: GW Guest\n\u00c2\u00a0\n\u00c2\u00a0\nLaundry: \n- Private laundry is available for your stay, located in the utility room off the kitchen.\n\u00c2\u00a0\nTrash: \n- Trash and recycling is removed on Tuesday morning. Bins are located on the left side of the home. \n\u00c2\u00a0\nAdditional Information: \u00c2\u00a0\n- We provide a starter set of supplies, but for longer stays you will likely want buy or bring more. These complimentary amenities are provided free of charge and are included in the blue boxes in the kitchen and bathrooms so please help yourselves!\n- If you are bringing a pet, please ensure that they are added to the reservation and that the pet fee is paid. This property allows up to a maximum of 2 pet(s).  An additional flat fee of $150 applies, and a maximum of 2 pets are allowed in the unit.\n- Please reach out if you would like us to send you the entire list of house rules before your arrival.  --x--Austin-Bergstrom International Airport\n3600 Presidential Blvd, Austin, TX 78719\n\u00c2\u00a0\nTake Emma Browning Ave and Burleson Rd to US-183 N\n8 min (3.5 mi)\nFollow US-183 N and State Hwy 71 W\/TX-71 W to W Ben White Blvd\/W Texas Hwy 71 Service Rd in Austin. Take the exit toward S First St\/Banister Ln from US-290 W\n9 min (8.5 mi)\nTake S 1st St and Cardinal Ln to Garden Villa Ln\n3 min (0.9 mi)\n\u00c2\u00a0\n920 Cardinal Ln #2\nAustin, TX 78704--x----x--1 set of towels (bath towel, hand towel, washcloth) per occupant (up to max occupancy on listing)\n2 rolls of toilet paper, bar soap or liquid soap dispenser, and wastebasket trash bag per bathroom\nShampoo, Conditioner, &amp; Body Wash pump bottle per full bathroom\n2 rolls of paper towels, fresh sponge, dish soap, 3 loads of dishwasher detergent, 3 trash bags per kitchen.\n3 loads of laundry detergent per home (with in-house laundry systems)--x--Bedroom - downstairs--x--Utility closet off the kitchen--x--2--x--https:\/\/www.grandwelcome.com\/vrp\/unit\/Blue_Haven_Retreat-104358-15--x--https:\/\/www.airbnb.com\/rooms\/1202172380889018363--x--https:\/\/www.vrbo.com\/9983065ha--x----x----x----x----x--90--x--90--x--Downtown--x--Space for up to 4 cars on in the single driveway--x--4--x--Tuesday--x--No Pool Heating Policy Defined--x--N\/A--x--Emergency Lockbox (Internal Use) 9644\nBackup Keyless Entry Code 011920\u00e2\u0153\u201c",
        "import_time":"2024-08-16T14:57:50.829Z",
        "date_of_first_scrape":1735178160000,
        "date_of_last_update":null,
        "date_of_last_scrape":1735178160000,
        "summary":"property_address1: nan, property_address2: nan, property_building: nan, property_id: 1188, property_notes_access: nan, property_notes_general: nan, property_notes_guest_access: nan, property_photos_url: nan, property_state: nan, property_status: nan, listing_id: 66bf68eedf6be6001185c28c, saas_auto_renew: True, cleaning_fee_id: 66e5ae2fc71c3a001203f07c, cleaning_fee_value_type: FIXED, cleaning_fee_formula: 175, cleaning_fee_multiplier: PER_STAY, channel_commission_use_account_settings: True, channel_commission_id: 67334bb16d8308d981974888, channel_commission_created_at: 2024-11-12T12:36:01.399Z, channel_commission_updated_at: 2024-12-11T07:01:40.277Z, cleaning_status: dirty, picture_caption: Front exterior and driveway, picture_thumbnail: https:\/\/track-pm.s3.amazonaws.com\/gw\/image\/e02dbb21-fe4e-43a7-b9f6-54382dd7cbc0, minimum_nights: 1, maximum_nights: 365.0, monthly_price_factor: 1, weekly_price_factor: 1.0, base_price: 1.0, weekend_base_price: 188.0, currency: USD, cleaning_fee: 175.0, confirmed_before_checkin_delay_minutes: 45.0, confirmed_day_of_checkin_delay_minutes: 45.0, confirmed_day_of_checkout_delay_minutes: 45.0, confirmed_during_stay_delay_minutes: 45.0, confirmed_after_checkout_delay_minutes: 45.0, unconfirmed_first_message_delay_minutes: 45.0, unconfirmed_subsequent_message_delay_minutes: 45.0, answeing_machine_is_active: 1.0, auto_reviews_status: 1.0, auto_payments_time_relation_names: AT--x--BEFORE, auto_payments_time_relation_units: DAYS--x--DAYS, auto_payments_time_relation_amounts: 1--x--14, pms_cleaning_status: 1.0, calendar_rules_default_availability: AVAILABLE, bookingcom_cut_off_hours_enabled: nan, expedia_cut_off_hours_enabled: nan, airbnb_cut_off_hours_enabled: nan, directbookings_cut_off_hours_enabled: nan, calendar_rules_default_hours: 24.0, calendar_rules_allow_request_to_book: nan, calendar_rules_advance_notice_updated_at: 2024-09-10T19:33:25.985Z, calendar_rules_advance_notice_updated_by: Data Import, booking_window_default_days: 365.0, booking_window_updated_at: 2024-08-16T14:57:50.821Z, preparation_time_updated_at: 2024-08-16T14:57:50.818Z, dynamic_checkin_updated_at: 2024-08-29T17:26:38.534Z, rental_periods_request_to_book: nan, rental_periods_ids: 66bf68eedf6be6001185c290, rental_periods_from: 2024-08-15 00:00:00, default_availability_updated_at: 2024-09-11T20:02:21.628Z, default_availability_updated_by: Data Import, listing_type: SINGLE, owners_list: 66bf908cbc6ac87bd184c302, amenities_list: Air conditioning--x--BBQ grill--x--Bed linens--x--Blender--x--Body soap--x--Carbon monoxide detector--x--Ceiling fan--x--Coffee maker--x--Conditioner--x--Cookware--x--Dishes and silverware--x--Dishwasher--x--Downtown--x--Dryer--x--Essentials--x--Free parking on premises--x--Free parking on street--x--Garden View--x--Garden or backyard--x--Golf - Optional--x--Hair dryer--x--Heating--x--Hot water--x--Ice maker--x--Internet--x--Iron--x--Kitchen--x--Laptop friendly workspace--x--Microwave--x--Museums--x--Oven--x--Private entrance--x--Refrigerator--x--Shampoo--x--Shopping--x--Smoke detector--x--Stove--x--TV--x--Toaster--x--Town--x--Washer--x--Wine glasses--x--Wireless Internet--x--Free parking on Street, amenities_not_included_list: nan, use_account_revenue_share: 1.0, use_account_taxes: nan, use_account_markups: 1.0, use_account_additional_fees: nan, is_active: 1.0, net_income_formula: host_payout, commission_formula: net_income, owner_revenue_formula: net_income - pm_commission, tax_ids: 66e1da74059dc7ccf8e9c2f2--x--66e1da74055feb22b033039c, tax_types: STATE_TAX--x--OCCUPANCY_TAX, tax_amounts: 6--x--11, tax_names: Texas State Tax--x--Travis Cty Hotel Occupancy Tax, tax_units: PERCENTAGE--x--PERCENTAGE, tax_quantifiers: PER_STAY--x--PER_STAY, taxes_applied_to_all_fees: True--x--True, taxes_applied_on_fees: AF,CF,ADDITIONAL_BED,AIR_CONDITIONING,EARLY_CHECK_IN,LATE_CHECK_IN,BABY_BED,CLEANING,CLUB_CARD,CONCIERGE,EARLY_CHECKOUT,LATE_CHECKOUT,DEPOSIT,ELECTRICITY,FOOD,HEATING,INTERNET,LAUNDRY,LINENS,TOWELS,MANAGEMENT,OIL,PARKING,PET,POOL,POOL_HEATING,RESORT,SERVICE,TOILETRIES,TOUR,TRANSPORTATION,CAR_RENTAL,WATER,WOOD,TRANSFER,HOUSEKEEPING,INSURANCE,COMMUNITY,CREDIT_CARD_PROCESSING_FEE,DAMAGE_WAIVER,VIP_SERVICES,PAYMENT_FEE,ADDITIONAL_CHARGE,MISCELLANEOUS,SHIPPING,VALET,ACTIVITIES,FLIGHTS,GIFT_BASKET,SPA,CHEF,MEET_AND_GREET,DOCK_FEE,UTILITY_FEE,HOT_TUB,BOOKING_FEE,BREAKFAST,BEVERAGE,MEAL,WELLNESS,MINIBAR,BUSINESS_CENTER,WIFI,GUEST_SERVICE,COMMISSION_CHARGE,EQUIPMENT_RENTAL,RESERVATION_FEE,DAMAGE_CHARGE,HOMEOWNERS_ASSOCIATION,GOLF_CART_RENTAL, taxes_are_applied_by_default: --x--, tax_conditional_overrides_view_types: LOS--x--LOS, tax_conditional_overrides_max_nights: 29--x--29, tax___vs: --x--, pre_bookings_list: nan, origin_id: 104358.0, nick_name: Blue Haven Retreat, minimum_age: 18.0, address_full: 920 Cardinal Ln #2, Austin, TX 78704, USA, address_street: 920 Cardinal Lane, address_city: Austin, address_country: United States, address_latitude: 30.2345855, address_longitude: -97.7702242, address_zip_code: 78704.0, address_state: Texas, address_county: nan, room_type: Entire home\/apt, property_type: House, ota_room_type: Holiday home, accommodates: 4.0, bathrooms: 2.0, bedrooms: 2.0, beds_count: 2.0, listing_status: 1.0, host_name: Grand Welcome Austin, wifi_name: CardinalGW, wifi_password: GW Guest, area_in_square_feet: 1100.0, trash_collection_day: Trash bins are located at the left of the house, by the fence, parking_instructions: Space for up to 4 cars on in the single driveway, created_at: 2024-06-25T00:00:00.000Z, origin: track, default_check_in_time: 16:00:00, default_check_out_time: 10:00:00, check_in_instructions: Arrival and Parking: \n- This home offers parking for 4 vehicles in the driveway. Additional street parking is available on a first-come, first-serve basis and at the vehicle owner\u00e2\u20ac\u2122s own risk.\n\u00c2\u00a0\nAccess Instructions: \n- Once parked, proceed to the main door which is equipped with a keyless lock for entry.\n\u00c2\u00a0\n\u00c2\u00a0\nLock Instructions:\nTo unlock and enter the home:\n- Door code is provided above for entry access. The code will activate right at 4pm.\u00c2\u00a0\n- The door will lock automatically after 30 seconds.\n- You can also press any button on the keypad to lock the door upon your departure.\n\u00c2\u00a0\nWireless Internet Information: \nNetwork: CardinalGW \nPassword: GW Guest\n\u00c2\u00a0\n\u00c2\u00a0\nLaundry: \n- Private laundry is available for your stay, located in the utility room off the kitchen.\n\u00c2\u00a0\nTrash: \n- Trash is removed on Tuesday. Bins are located on the left side of the home. \n\u00c2\u00a0\nAdditional Information: \u00c2\u00a0\n- We provide a starter set of supplies, but for longer stays you will likely want buy or bring more. These complimentary amenities are provided free of charge and are included in the blue boxes in the kitchen and bathrooms so please help yourselves!\n- If you are bringing a pet, please ensure that they are added to the reservation and that the pet fee is paid. This property allows up to a maximum of 2 pet(s).  An additional flat fee of $150 applies, and a maximum of 2 pets are allowed in the unit.\n- Please reach out if you would like us to send you the entire list of house rules before your arrival.  , check_out_instructions: - Set AC to 74 in the summer months  \n- Set heater to 65 in the winter months \n- Bag all garbage and place is designated trash location \n- Load all dirty dishes in the dishwasher and start the dishwasher \n- Place all used towels on the ground in the bathr, account_id: 66a30f208b331811b8e96639, time_zone: America\/Chicago, last_updated_at: 2024-11-09T18:06:36.320Z, integration_ids: 66d0af0bb6ad7bcfca3bf989--x--66d8cd59cc4df40011491532--x--66e1a279352e665645cd4fe0, integration_platforms: vacayHome--x--homeaway2--x--airbnb2, booking_com_initial_complex_listings: --x----x--, booking_com_publish_company_logos: --x----x--, booking_com_is_published_company_logos: --x----x--, booking_com_publish_company_infos: --x----x--, booking_com_is_published_company_infos: --x----x--, vacayhome_currencies: USD, vacayhome_statuses: COMPLETED, vacayhome_cancellation_policies: firm, vacayhome_cancellation_penalties: 100.0, vacayhome_creation_times: 2024-08-30T20:30:49.666Z, listing_room_ids: 66c30cd299e922187e4f7011--x--66c30cd299e922187e4f7012--x--66c30cd299e922187e4f7013--x--66c30cd299e922187e4f7014, listing_room_numbers: nan, listing_room_bed_ids: 6700bcad56da1d00118aaa16--x--6700bcad56da1d00118aaa18, listing_room_bed_types: QUEEN_BED--x--QUEEN_BED, listing_room_bed_quantities: 1--x--1, custom_field_values: Arrival and Parking: \n- This home offers parking for 4 vehicles in the driveway. Additional street parking is available on a first-come, first-serve basis and at the vehicle owner\u00e2\u20ac\u2122s own risk.\n\u00c2\u00a0\nAccess Instructions: \n- Once parked, proceed to the main door which is equipped with a keyless lock for entry.\n\u00c2\u00a0\n\u00c2\u00a0\nLock Instructions:\nTo unlock and enter the home:\n- Door code is provided above for entry access. The code will activate right at 4pm.\u00c2\u00a0\n- The door will lock automatically after 30 seconds.\n- You can also press any button on the keypad to lock the door upon your departure.\n\u00c2\u00a0\nWireless Internet Information: \nNetwork: CardinalGW \nPassword: GW Guest\n\u00c2\u00a0\n\u00c2\u00a0\nLaundry: \n- Private laundry is available for your stay, located in the utility room off the kitchen.\n\u00c2\u00a0\nTrash: \n- Trash and recycling is removed on Tuesday morning. Bins are located on the left side of the home. \n\u00c2\u00a0\nAdditional Information: \u00c2\u00a0\n- We provide a starter set of supplies, but for longer stays you will likely want buy or bring more. These complimentary amenities are provided free of charge and are included in the blue boxes in the kitchen and bathrooms so please help yourselves!\n- If you are bringing a pet, please ensure that they are added to the reservation and that the pet fee is paid. This property allows up to a maximum of 2 pet(s).  An additional flat fee of $150 applies, and a maximum of 2 pets are allowed in the unit.\n- Please reach out if you would like us to send you the entire list of house rules before your arrival.  --x--Austin-Bergstrom International Airport\n3600 Presidential Blvd, Austin, TX 78719\n\u00c2\u00a0\nTake Emma Browning Ave and Burleson Rd to US-183 N\n8 min (3.5 mi)\nFollow US-183 N and State Hwy 71 W\/TX-71 W to W Ben White Blvd\/W Texas Hwy 71 Service Rd in Austin. Take the exit toward S First St\/Banister Ln from US-290 W\n9 min (8.5 mi)\nTake S 1st St and Cardinal Ln to Garden Villa Ln\n3 min (0.9 mi)\n\u00c2\u00a0\n920 Cardinal Ln #2\nAustin, TX 78704--x----x--1 set of towels (bath towel, hand towel, washcloth) per occupant (up to max occupancy on listing)\n2 rolls of toilet paper, bar soap or liquid soap dispenser, and wastebasket trash bag per bathroom\nShampoo, Conditioner, &amp; Body Wash pump bottle per full bathroom\n2 rolls of paper towels, fresh sponge, dish soap, 3 loads of dishwasher detergent, 3 trash bags per kitchen.\n3 loads of laundry detergent per home (with in-house laundry systems)--x--Bedroom - downstairs--x--Utility closet off the kitchen--x--2--x--https:\/\/www.grandwelcome.com\/vrp\/unit\/Blue_Haven_Retreat-104358-15--x--https:\/\/www.airbnb.com\/rooms\/1202172380889018363--x--https:\/\/www.vrbo.com\/9983065ha--x----x----x----x----x--90--x--90--x--Downtown--x--Space for up to 4 cars on in the single driveway--x--4--x--Tuesday--x--No Pool Heating Policy Defined--x--N\/A--x--Emergency Lockbox (Internal Use) 9644\nBackup Keyless Entry Code 011920\u00e2\u0153\u201c, import_time: 2024-08-16T14:57:50.829Z, date_of_first_scrape: 2024-12-26 01:56:00, date_of_last_update: nan, date_of_last_scrape: 2024-12-26 01:56:00"
    },
    {
        "property_address1":null,
        "property_address2":null,
        "property_building":null,
        "property_id":1193,
        "property_notes_access":null,
        "property_notes_general":null,
        "property_notes_guest_access":null,
        "property_photos_url":null,
        "property_state":null,
        "property_status":null,
        "listing_id":"66bf68ebefbcd00013478e19",
        "saas_auto_renew":1.0,
        "cleaning_fee_id":"66bf68ebefbcd00013478e1a",
        "cleaning_fee_value_type":"FIXED",
        "cleaning_fee_formula":200.0,
        "cleaning_fee_multiplier":"PER_STAY",
        "channel_commission_use_account_settings":1.0,
        "channel_commission_id":"67334bb16d8308d981974840",
        "channel_commission_created_at":"2024-11-12T12:36:01.225Z",
        "channel_commission_updated_at":"2024-12-11T07:01:41.051Z",
        "cleaning_status":"dirty",
        "picture_caption":"Front exterior and driveway",
        "picture_thumbnail":"https:\/\/track-pm.s3.amazonaws.com\/gw\/image\/7d17473c-6f90-484f-a17f-f8ea800dc28e",
        "minimum_nights":1.0,
        "maximum_nights":365.0,
        "monthly_price_factor":1.0,
        "weekly_price_factor":1.0,
        "base_price":1.0,
        "weekend_base_price":281.0,
        "currency":"USD",
        "cleaning_fee":200.0,
        "confirmed_before_checkin_delay_minutes":45.0,
        "confirmed_day_of_checkin_delay_minutes":45.0,
        "confirmed_day_of_checkout_delay_minutes":45.0,
        "confirmed_during_stay_delay_minutes":45.0,
        "confirmed_after_checkout_delay_minutes":45.0,
        "unconfirmed_first_message_delay_minutes":45.0,
        "unconfirmed_subsequent_message_delay_minutes":45.0,
        "answeing_machine_is_active":1.0,
        "auto_reviews_status":1.0,
        "auto_payments_time_relation_names":"AT--x--BEFORE",
        "auto_payments_time_relation_units":"DAYS--x--DAYS",
        "auto_payments_time_relation_amounts":"1--x--14",
        "pms_cleaning_status":1.0,
        "calendar_rules_default_availability":"AVAILABLE",
        "bookingcom_cut_off_hours_enabled":null,
        "expedia_cut_off_hours_enabled":null,
        "airbnb_cut_off_hours_enabled":null,
        "directbookings_cut_off_hours_enabled":null,
        "calendar_rules_default_hours":24.0,
        "calendar_rules_allow_request_to_book":null,
        "calendar_rules_advance_notice_updated_at":"2024-09-10T19:33:24.932Z",
        "calendar_rules_advance_notice_updated_by":"Data Import",
        "booking_window_default_days":365.0,
        "booking_window_updated_at":"2024-08-16T14:57:47.909Z",
        "preparation_time_updated_at":"2024-08-16T14:57:47.906Z",
        "dynamic_checkin_updated_at":"2024-08-29T17:26:51.294Z",
        "rental_periods_request_to_book":null,
        "rental_periods_ids":"66bf68ebefbcd00013478e1c",
        "rental_periods_from":1723680000000,
        "default_availability_updated_at":"2024-09-11T20:02:20.396Z",
        "default_availability_updated_by":"Data Import",
        "listing_type":"SINGLE",
        "owners_list":"66bf908eb11c9ac268b42af6",
        "amenities_list":"Suitable for children (2-12 years)--x--Suitable for infants (under 2 years)--x--Air conditioning--x--BBQ grill--x--Bed linens--x--Blender--x--Body soap--x--Carbon monoxide detector--x--Ceiling fan--x--Coffee maker--x--Conditioner--x--Cookware--x--Cycling--x--Dining table--x--Dishes and silverware--x--Dishwasher--x--Downtown--x--Dryer--x--Essentials--x--Free parking on premises--x--Free parking on Street--x--Garden or backyard--x--Garden View--x--Golf - Optional--x--Hair dryer--x--Heating--x--Hot water--x--Internet--x--Iron--x--Kitchen--x--Laptop friendly workspace--x--Microwave--x--Museums--x--Oven--x--Patio or balcony--x--Private entrance--x--Refrigerator--x--Shampoo--x--Shopping--x--Smoke detector--x--Stove--x--Toaster--x--Town--x--TV--x--Washer--x--Wine glasses--x--Wireless Internet",
        "amenities_not_included_list":null,
        "use_account_revenue_share":1.0,
        "use_account_taxes":null,
        "use_account_markups":1.0,
        "use_account_additional_fees":null,
        "is_active":1.0,
        "net_income_formula":"host_payout",
        "commission_formula":"net_income",
        "owner_revenue_formula":"net_income - pm_commission",
        "tax_ids":"66e1da75055feb22b03303a0--x--66e1da75055feb22b03303a4",
        "tax_types":"STATE_TAX--x--OCCUPANCY_TAX",
        "tax_amounts":"6--x--11",
        "tax_names":"Texas State Tax--x--Travis Cty Hotel Occupancy Tax",
        "tax_units":"PERCENTAGE--x--PERCENTAGE",
        "tax_quantifiers":"PER_STAY--x--PER_STAY",
        "taxes_applied_to_all_fees":"True--x--True",
        "taxes_applied_on_fees":"AF,CF,ADDITIONAL_BED,AIR_CONDITIONING,EARLY_CHECK_IN,LATE_CHECK_IN,BABY_BED,CLEANING,CLUB_CARD,CONCIERGE,EARLY_CHECKOUT,LATE_CHECKOUT,DEPOSIT,ELECTRICITY,FOOD,HEATING,INTERNET,LAUNDRY,LINENS,TOWELS,MANAGEMENT,OIL,PARKING,PET,POOL,POOL_HEATING,RESORT,SERVICE,TOILETRIES,TOUR,TRANSPORTATION,CAR_RENTAL,WATER,WOOD,TRANSFER,HOUSEKEEPING,INSURANCE,COMMUNITY,CREDIT_CARD_PROCESSING_FEE,DAMAGE_WAIVER,VIP_SERVICES,PAYMENT_FEE,ADDITIONAL_CHARGE,MISCELLANEOUS,SHIPPING,VALET,ACTIVITIES,FLIGHTS,GIFT_BASKET,SPA,CHEF,MEET_AND_GREET,DOCK_FEE,UTILITY_FEE,HOT_TUB,BOOKING_FEE,BREAKFAST,BEVERAGE,MEAL,WELLNESS,MINIBAR,BUSINESS_CENTER,WIFI,GUEST_SERVICE,COMMISSION_CHARGE,EQUIPMENT_RENTAL,RESERVATION_FEE,DAMAGE_CHARGE,HOMEOWNERS_ASSOCIATION,GOLF_CART_RENTAL",
        "taxes_are_applied_by_default":"--x--",
        "tax_conditional_overrides_view_types":"LOS--x--LOS",
        "tax_conditional_overrides_max_nights":"29--x--29",
        "tax___vs":"--x--",
        "pre_bookings_list":null,
        "origin_id":104374.0,
        "nick_name":"East Austin Serenity",
        "minimum_age":18.0,
        "address_full":"3005 Castro St #1, Austin, TX 78702, USA",
        "address_street":"3005 Castro Street",
        "address_city":"Austin",
        "address_country":"United States",
        "address_latitude":30.2616686,
        "address_longitude":-97.7060986,
        "address_zip_code":78702.0,
        "address_state":"Texas",
        "address_county":null,
        "room_type":"Entire home\/apt",
        "property_type":"House",
        "ota_room_type":"Holiday home",
        "accommodates":6.0,
        "bathrooms":2.5,
        "bedrooms":3.0,
        "beds_count":3.0,
        "listing_status":1.0,
        "host_name":"Grand Welcome Austin",
        "wifi_name":"castro-guest",
        "wifi_password":"qwwDYazus*8GbJ2!*jT4",
        "area_in_square_feet":1520.0,
        "trash_collection_day":"Bins are located to the left of the garage",
        "parking_instructions":"Street parking available based on availability",
        "created_at":"2024-07-03T00:00:00.000Z",
        "origin":"track",
        "default_check_in_time":"16:00:00",
        "default_check_out_time":"10:00:00",
        "check_in_instructions":"Arrival and Parking:\n- Parking is available for up to 1 vehicle in the driveway.\n\u00c2\u00a0\nAccess Instructions:\n- Once parked, locate the lockbox on the front porch for entry access.\n\u00c2\u00a0\nLock Instructions:\nTo unlock and enter the home:\n- Locate the main door and use the code provided above to obtain access.\n- The door does NOT lock automatically so please lock when you leave.\n-\u00c2\u00a0Press any key on the keypad to lock the door.\n\u00c2\u00a0\nWireless Internet Information:\nNetwork: castro-guest\nPassword: qwwDYazus*8GbJ2!*jT4\n\u00c2\u00a0\nTrash:\n- Trash is picked up on Friday. The bins are located to the left of the garage. If trash day falls during your stay, please take bins to the curb.\n\u00c2\u00a0\nAdditional Information:\n- We provide a starter set of supplies, but for longer stays you will likely want buy or bring more. These complimentary amenities are provided free of charge and are included in the blue boxes in the kitchen &amp; bathrooms so please help yourselves!\n-  This property is not pet friendly. If there is evidence found of an animal presence during your stay or post check-out, you may be evicted, fined and\/or charged additional cleaning fees. \n- Please reach out if you would like us to send you the entire list of house rules before your arrival.  ",
        "check_out_instructions":"- Set AC to 74 in the summer months  \n- Set heater to 65 in the winter months \n- Bag all garbage and place is designated trash location \n- Load all dirty dishes in the dishwasher and start the dishwasher \n- Place all used towels on the ground in the bathr",
        "account_id":"66a30f208b331811b8e96639",
        "time_zone":"America\/Chicago",
        "last_updated_at":"2024-10-16T07:39:00.370Z",
        "integration_ids":"66d0af0bb6ad7bcfca3bf989--x--66d8cd59cc4df40011491532--x--66e1a279352e665645cd4fe0",
        "integration_platforms":"vacayHome--x--homeaway2--x--airbnb2",
        "booking_com_initial_complex_listings":"--x----x--",
        "booking_com_publish_company_logos":"--x----x--",
        "booking_com_is_published_company_logos":"--x----x--",
        "booking_com_publish_company_infos":"--x----x--",
        "booking_com_is_published_company_infos":"--x----x--",
        "vacayhome_currencies":"USD",
        "vacayhome_statuses":"COMPLETED",
        "vacayhome_cancellation_policies":"firm",
        "vacayhome_cancellation_penalties":100.0,
        "vacayhome_creation_times":"2024-08-30T20:30:54.602Z",
        "listing_room_ids":"66c30cd199e922187e4f6fef--x--66c30cd199e922187e4f6ff0--x--66c30cd199e922187e4f6ff1--x--66c30cd199e922187e4f6ff2--x--66c30cd199e922187e4f6ff3--x--66c30cd199e922187e4f6ff4",
        "listing_room_numbers":null,
        "listing_room_bed_ids":"6700d73d73d3a70013666782--x--6700d73d73d3a70013666784--x--6700d73d73d3a70013666786",
        "listing_room_bed_types":"SOFA_BED--x--QUEEN_BED--x--KING_BED",
        "listing_room_bed_quantities":"1--x--1--x--1",
        "custom_field_values":"Arrival and Parking:\n- Parking is available for up to 1 vehicle in the driveway.\n\u00c2\u00a0\nAccess Instructions:\n- Once parked, locate the lockbox on the front porch for entry access.\n\u00c2\u00a0\nLock Instructions:\nTo unlock and enter the home:\n- Locate the main door and use the code provided above to obtain access.\n- The door does NOT lock automatically so please lock when you leave.\n-\u00c2\u00a0Press any key on the keypad to lock the door.\n\u00c2\u00a0\nWireless Internet Information:\nNetwork: castro-guest\nPassword: qwwDYazus*8GbJ2!*jT4\n\u00c2\u00a0\nTrash:\n- Trash is picked up on Friday. The bins are located to the left of the garage. If trash day falls during your stay, please take bins to the curb.\n\u00c2\u00a0\nAdditional Information:\n- We provide a starter set of supplies, but for longer stays you will likely want buy or bring more. These complimentary amenities are provided free of charge and are included in the blue boxes in the kitchen &amp; bathrooms so please help yourselves!\n-  This property is not pet friendly. If there is evidence found of an animal presence during your stay or post check-out, you may be evicted, fined and\/or charged additional cleaning fees. \n- Please reach out if you would like us to send you the entire list of house rules before your arrival.  --x--To originate from Austin Bergstrom Airport ustin-Bergstrom International Airport\n3600 Presidential Blvd, Austin, TX 78719\n \nTake Emma Browning Ave to Burleson Rd\n6 min (2.3 mi)\n \nHead west toward Outlaw Country Dr\n0.3 mi\n \nTurn left toward Outlaw Country Dr\n276 ft\n \nTurn left at the 1st cross street onto Outlaw Country Dr\n0.3 mi\n \nAt the traffic circle, take the 1st exit and stay on Outlaw Country Dr\n98 ft\n \nOutlaw Country Dr turns slightly right and becomes Emma Browning Ave\n1.5 mi\n \nContinue on Burleson Rd. Take US-183 N and E 7th St to Castro St\n12 min (7.5 mi)\n \nTurn right onto Burleson Rd\n1.3 mi\n \nTurn right onto US-183 N\n3.2 mi\n \nContinue onto US-183 N\n0.4 mi\n \nUse the right 2 lanes to stay on US-183 N toward Montopolis Dr\n1.0 mi\n \nUse the left lane to take the ramp to E 7th St\n0.2 mi\n \nUse the left 2 lanes to take the exit toward E 7th St\n282 ft\n \nTake the 7th St ramp\n0.3 mi\n \nContinue onto E 7th St\n1.0 mi\n \nTurn right onto N Pleasant Valley Rd\n0.2 mi\n \nTurn right onto Castro St\n Destination will be on the right--x--Not required--x--Not required--x----x--1 set of towels (bath towel, hand towel, washcloth) per occupant (up to max occupancy on listing)\n2 rolls of toilet paper, bar soap or liquid soap dispenser, and wastebasket trash bag per bathroom\nShampoo, Conditioner, &amp; Body Wash pump bottle per full bathroom\n2 rolls of paper towels, fresh sponge, dish soap, 3 loads of dishwasher detergent, 3 trash bags per kitchen.\n3 loads of laundry detergent per home (with in-house laundry systems)--x--office closet--x--Front door - Entrance facing the street--x--Near front entry--x--https:\/\/www.grandwelcome.com\/vrp\/unit\/East_Austin_Serenity-104374-15--x--https:\/\/www.airbnb.com\/rooms\/1206516925969649560--x--https:\/\/www.vrbo.com\/9985119ha--x----x----x----x----x--105--x--105--x--East--x--Street parking available based on availability--x--1--x--Friday - Bins are located to the left of the garage--x--No Pool Heating Policy Defined--x--N\/A--x--Backup Keyless Entry Code 5003\nEmergency Lockbox (Internal Use) 0723",
        "import_time":"2024-08-16T14:57:47.917Z",
        "date_of_first_scrape":1735178160000,
        "date_of_last_update":null,
        "date_of_last_scrape":1735178160000,
        "summary":"property_address1: nan, property_address2: nan, property_building: nan, property_id: 1193, property_notes_access: nan, property_notes_general: nan, property_notes_guest_access: nan, property_photos_url: nan, property_state: nan, property_status: nan, listing_id: 66bf68ebefbcd00013478e19, saas_auto_renew: True, cleaning_fee_id: 66bf68ebefbcd00013478e1a, cleaning_fee_value_type: FIXED, cleaning_fee_formula: 200, cleaning_fee_multiplier: PER_STAY, channel_commission_use_account_settings: True, channel_commission_id: 67334bb16d8308d981974840, channel_commission_created_at: 2024-11-12T12:36:01.225Z, channel_commission_updated_at: 2024-12-11T07:01:41.051Z, cleaning_status: dirty, picture_caption: Front exterior and driveway, picture_thumbnail: https:\/\/track-pm.s3.amazonaws.com\/gw\/image\/7d17473c-6f90-484f-a17f-f8ea800dc28e, minimum_nights: 1, maximum_nights: 365.0, monthly_price_factor: 1, weekly_price_factor: 1.0, base_price: 1.0, weekend_base_price: 281.0, currency: USD, cleaning_fee: 200.0, confirmed_before_checkin_delay_minutes: 45.0, confirmed_day_of_checkin_delay_minutes: 45.0, confirmed_day_of_checkout_delay_minutes: 45.0, confirmed_during_stay_delay_minutes: 45.0, confirmed_after_checkout_delay_minutes: 45.0, unconfirmed_first_message_delay_minutes: 45.0, unconfirmed_subsequent_message_delay_minutes: 45.0, answeing_machine_is_active: 1.0, auto_reviews_status: 1.0, auto_payments_time_relation_names: AT--x--BEFORE, auto_payments_time_relation_units: DAYS--x--DAYS, auto_payments_time_relation_amounts: 1--x--14, pms_cleaning_status: 1.0, calendar_rules_default_availability: AVAILABLE, bookingcom_cut_off_hours_enabled: nan, expedia_cut_off_hours_enabled: nan, airbnb_cut_off_hours_enabled: nan, directbookings_cut_off_hours_enabled: nan, calendar_rules_default_hours: 24.0, calendar_rules_allow_request_to_book: nan, calendar_rules_advance_notice_updated_at: 2024-09-10T19:33:24.932Z, calendar_rules_advance_notice_updated_by: Data Import, booking_window_default_days: 365.0, booking_window_updated_at: 2024-08-16T14:57:47.909Z, preparation_time_updated_at: 2024-08-16T14:57:47.906Z, dynamic_checkin_updated_at: 2024-08-29T17:26:51.294Z, rental_periods_request_to_book: nan, rental_periods_ids: 66bf68ebefbcd00013478e1c, rental_periods_from: 2024-08-15 00:00:00, default_availability_updated_at: 2024-09-11T20:02:20.396Z, default_availability_updated_by: Data Import, listing_type: SINGLE, owners_list: 66bf908eb11c9ac268b42af6, amenities_list: Suitable for children (2-12 years)--x--Suitable for infants (under 2 years)--x--Air conditioning--x--BBQ grill--x--Bed linens--x--Blender--x--Body soap--x--Carbon monoxide detector--x--Ceiling fan--x--Coffee maker--x--Conditioner--x--Cookware--x--Cycling--x--Dining table--x--Dishes and silverware--x--Dishwasher--x--Downtown--x--Dryer--x--Essentials--x--Free parking on premises--x--Free parking on Street--x--Garden or backyard--x--Garden View--x--Golf - Optional--x--Hair dryer--x--Heating--x--Hot water--x--Internet--x--Iron--x--Kitchen--x--Laptop friendly workspace--x--Microwave--x--Museums--x--Oven--x--Patio or balcony--x--Private entrance--x--Refrigerator--x--Shampoo--x--Shopping--x--Smoke detector--x--Stove--x--Toaster--x--Town--x--TV--x--Washer--x--Wine glasses--x--Wireless Internet, amenities_not_included_list: nan, use_account_revenue_share: 1.0, use_account_taxes: nan, use_account_markups: 1.0, use_account_additional_fees: nan, is_active: 1.0, net_income_formula: host_payout, commission_formula: net_income, owner_revenue_formula: net_income - pm_commission, tax_ids: 66e1da75055feb22b03303a0--x--66e1da75055feb22b03303a4, tax_types: STATE_TAX--x--OCCUPANCY_TAX, tax_amounts: 6--x--11, tax_names: Texas State Tax--x--Travis Cty Hotel Occupancy Tax, tax_units: PERCENTAGE--x--PERCENTAGE, tax_quantifiers: PER_STAY--x--PER_STAY, taxes_applied_to_all_fees: True--x--True, taxes_applied_on_fees: AF,CF,ADDITIONAL_BED,AIR_CONDITIONING,EARLY_CHECK_IN,LATE_CHECK_IN,BABY_BED,CLEANING,CLUB_CARD,CONCIERGE,EARLY_CHECKOUT,LATE_CHECKOUT,DEPOSIT,ELECTRICITY,FOOD,HEATING,INTERNET,LAUNDRY,LINENS,TOWELS,MANAGEMENT,OIL,PARKING,PET,POOL,POOL_HEATING,RESORT,SERVICE,TOILETRIES,TOUR,TRANSPORTATION,CAR_RENTAL,WATER,WOOD,TRANSFER,HOUSEKEEPING,INSURANCE,COMMUNITY,CREDIT_CARD_PROCESSING_FEE,DAMAGE_WAIVER,VIP_SERVICES,PAYMENT_FEE,ADDITIONAL_CHARGE,MISCELLANEOUS,SHIPPING,VALET,ACTIVITIES,FLIGHTS,GIFT_BASKET,SPA,CHEF,MEET_AND_GREET,DOCK_FEE,UTILITY_FEE,HOT_TUB,BOOKING_FEE,BREAKFAST,BEVERAGE,MEAL,WELLNESS,MINIBAR,BUSINESS_CENTER,WIFI,GUEST_SERVICE,COMMISSION_CHARGE,EQUIPMENT_RENTAL,RESERVATION_FEE,DAMAGE_CHARGE,HOMEOWNERS_ASSOCIATION,GOLF_CART_RENTAL, taxes_are_applied_by_default: --x--, tax_conditional_overrides_view_types: LOS--x--LOS, tax_conditional_overrides_max_nights: 29--x--29, tax___vs: --x--, pre_bookings_list: nan, origin_id: 104374.0, nick_name: East Austin Serenity, minimum_age: 18.0, address_full: 3005 Castro St #1, Austin, TX 78702, USA, address_street: 3005 Castro Street, address_city: Austin, address_country: United States, address_latitude: 30.2616686, address_longitude: -97.7060986, address_zip_code: 78702.0, address_state: Texas, address_county: nan, room_type: Entire home\/apt, property_type: House, ota_room_type: Holiday home, accommodates: 6.0, bathrooms: 2.5, bedrooms: 3.0, beds_count: 3.0, listing_status: 1.0, host_name: Grand Welcome Austin, wifi_name: castro-guest, wifi_password: qwwDYazus*8GbJ2!*jT4, area_in_square_feet: 1520.0, trash_collection_day: Bins are located to the left of the garage, parking_instructions: Street parking available based on availability, created_at: 2024-07-03T00:00:00.000Z, origin: track, default_check_in_time: 16:00:00, default_check_out_time: 10:00:00, check_in_instructions: Arrival and Parking:\n- Parking is available for up to 1 vehicle in the driveway.\n\u00c2\u00a0\nAccess Instructions:\n- Once parked, locate the lockbox on the front porch for entry access.\n\u00c2\u00a0\nLock Instructions:\nTo unlock and enter the home:\n- Locate the main door and use the code provided above to obtain access.\n- The door does NOT lock automatically so please lock when you leave.\n-\u00c2\u00a0Press any key on the keypad to lock the door.\n\u00c2\u00a0\nWireless Internet Information:\nNetwork: castro-guest\nPassword: qwwDYazus*8GbJ2!*jT4\n\u00c2\u00a0\nTrash:\n- Trash is picked up on Friday. The bins are located to the left of the garage. If trash day falls during your stay, please take bins to the curb.\n\u00c2\u00a0\nAdditional Information:\n- We provide a starter set of supplies, but for longer stays you will likely want buy or bring more. These complimentary amenities are provided free of charge and are included in the blue boxes in the kitchen &amp; bathrooms so please help yourselves!\n-  This property is not pet friendly. If there is evidence found of an animal presence during your stay or post check-out, you may be evicted, fined and\/or charged additional cleaning fees. \n- Please reach out if you would like us to send you the entire list of house rules before your arrival.  , check_out_instructions: - Set AC to 74 in the summer months  \n- Set heater to 65 in the winter months \n- Bag all garbage and place is designated trash location \n- Load all dirty dishes in the dishwasher and start the dishwasher \n- Place all used towels on the ground in the bathr, account_id: 66a30f208b331811b8e96639, time_zone: America\/Chicago, last_updated_at: 2024-10-16T07:39:00.370Z, integration_ids: 66d0af0bb6ad7bcfca3bf989--x--66d8cd59cc4df40011491532--x--66e1a279352e665645cd4fe0, integration_platforms: vacayHome--x--homeaway2--x--airbnb2, booking_com_initial_complex_listings: --x----x--, booking_com_publish_company_logos: --x----x--, booking_com_is_published_company_logos: --x----x--, booking_com_publish_company_infos: --x----x--, booking_com_is_published_company_infos: --x----x--, vacayhome_currencies: USD, vacayhome_statuses: COMPLETED, vacayhome_cancellation_policies: firm, vacayhome_cancellation_penalties: 100.0, vacayhome_creation_times: 2024-08-30T20:30:54.602Z, listing_room_ids: 66c30cd199e922187e4f6fef--x--66c30cd199e922187e4f6ff0--x--66c30cd199e922187e4f6ff1--x--66c30cd199e922187e4f6ff2--x--66c30cd199e922187e4f6ff3--x--66c30cd199e922187e4f6ff4, listing_room_numbers: nan, listing_room_bed_ids: 6700d73d73d3a70013666782--x--6700d73d73d3a70013666784--x--6700d73d73d3a70013666786, listing_room_bed_types: SOFA_BED--x--QUEEN_BED--x--KING_BED, listing_room_bed_quantities: 1--x--1--x--1, custom_field_values: Arrival and Parking:\n- Parking is available for up to 1 vehicle in the driveway.\n\u00c2\u00a0\nAccess Instructions:\n- Once parked, locate the lockbox on the front porch for entry access.\n\u00c2\u00a0\nLock Instructions:\nTo unlock and enter the home:\n- Locate the main door and use the code provided above to obtain access.\n- The door does NOT lock automatically so please lock when you leave.\n-\u00c2\u00a0Press any key on the keypad to lock the door.\n\u00c2\u00a0\nWireless Internet Information:\nNetwork: castro-guest\nPassword: qwwDYazus*8GbJ2!*jT4\n\u00c2\u00a0\nTrash:\n- Trash is picked up on Friday. The bins are located to the left of the garage. If trash day falls during your stay, please take bins to the curb.\n\u00c2\u00a0\nAdditional Information:\n- We provide a starter set of supplies, but for longer stays you will likely want buy or bring more. These complimentary amenities are provided free of charge and are included in the blue boxes in the kitchen &amp; bathrooms so please help yourselves!\n-  This property is not pet friendly. If there is evidence found of an animal presence during your stay or post check-out, you may be evicted, fined and\/or charged additional cleaning fees. \n- Please reach out if you would like us to send you the entire list of house rules before your arrival.  --x--To originate from Austin Bergstrom Airport ustin-Bergstrom International Airport\n3600 Presidential Blvd, Austin, TX 78719\n \nTake Emma Browning Ave to Burleson Rd\n6 min (2.3 mi)\n \nHead west toward Outlaw Country Dr\n0.3 mi\n \nTurn left toward Outlaw Country Dr\n276 ft\n \nTurn left at the 1st cross street onto Outlaw Country Dr\n0.3 mi\n \nAt the traffic circle, take the 1st exit and stay on Outlaw Country Dr\n98 ft\n \nOutlaw Country Dr turns slightly right and becomes Emma Browning Ave\n1.5 mi\n \nContinue on Burleson Rd. Take US-183 N and E 7th St to Castro St\n12 min (7.5 mi)\n \nTurn right onto Burleson Rd\n1.3 mi\n \nTurn right onto US-183 N\n3.2 mi\n \nContinue onto US-183 N\n0.4 mi\n \nUse the right 2 lanes to stay on US-183 N toward Montopolis Dr\n1.0 mi\n \nUse the left lane to take the ramp to E 7th St\n0.2 mi\n \nUse the left 2 lanes to take the exit toward E 7th St\n282 ft\n \nTake the 7th St ramp\n0.3 mi\n \nContinue onto E 7th St\n1.0 mi\n \nTurn right onto N Pleasant Valley Rd\n0.2 mi\n \nTurn right onto Castro St\n Destination will be on the right--x--Not required--x--Not required--x----x--1 set of towels (bath towel, hand towel, washcloth) per occupant (up to max occupancy on listing)\n2 rolls of toilet paper, bar soap or liquid soap dispenser, and wastebasket trash bag per bathroom\nShampoo, Conditioner, &amp; Body Wash pump bottle per full bathroom\n2 rolls of paper towels, fresh sponge, dish soap, 3 loads of dishwasher detergent, 3 trash bags per kitchen.\n3 loads of laundry detergent per home (with in-house laundry systems)--x--office closet--x--Front door - Entrance facing the street--x--Near front entry--x--https:\/\/www.grandwelcome.com\/vrp\/unit\/East_Austin_Serenity-104374-15--x--https:\/\/www.airbnb.com\/rooms\/1206516925969649560--x--https:\/\/www.vrbo.com\/9985119ha--x----x----x----x----x--105--x--105--x--East--x--Street parking available based on availability--x--1--x--Friday - Bins are located to the left of the garage--x--No Pool Heating Policy Defined--x--N\/A--x--Backup Keyless Entry Code 5003\nEmergency Lockbox (Internal Use) 0723, import_time: 2024-08-16T14:57:47.917Z, date_of_first_scrape: 2024-12-26 01:56:00, date_of_last_update: nan, date_of_last_scrape: 2024-12-26 01:56:00"
    },
    {
        "property_address1":null,
        "property_address2":null,
        "property_building":null,
        "property_id":1201,
        "property_notes_access":null,
        "property_notes_general":null,
        "property_notes_guest_access":null,
        "property_photos_url":null,
        "property_state":null,
        "property_status":null,
        "listing_id":"66bf69027011f00014649130",
        "saas_auto_renew":1.0,
        "cleaning_fee_id":"66e5b03c7f6027000f21af46",
        "cleaning_fee_value_type":"FIXED",
        "cleaning_fee_formula":150.0,
        "cleaning_fee_multiplier":"PER_STAY",
        "channel_commission_use_account_settings":1.0,
        "channel_commission_id":"67334bb06d8308d981974778",
        "channel_commission_created_at":"2024-11-12T12:36:00.819Z",
        "channel_commission_updated_at":"2024-12-11T07:01:39.791Z",
        "cleaning_status":"dirty",
        "picture_caption":"Aerial view",
        "picture_thumbnail":"https:\/\/track-pm.s3.amazonaws.com\/gw\/image\/c3557658-eea3-4b23-a61d-d961f72e01c9",
        "minimum_nights":1.0,
        "maximum_nights":365.0,
        "monthly_price_factor":1.0,
        "weekly_price_factor":1.0,
        "base_price":1.0,
        "weekend_base_price":188.0,
        "currency":"USD",
        "cleaning_fee":150.0,
        "confirmed_before_checkin_delay_minutes":45.0,
        "confirmed_day_of_checkin_delay_minutes":45.0,
        "confirmed_day_of_checkout_delay_minutes":45.0,
        "confirmed_during_stay_delay_minutes":45.0,
        "confirmed_after_checkout_delay_minutes":45.0,
        "unconfirmed_first_message_delay_minutes":45.0,
        "unconfirmed_subsequent_message_delay_minutes":45.0,
        "answeing_machine_is_active":1.0,
        "auto_reviews_status":1.0,
        "auto_payments_time_relation_names":"AT--x--BEFORE",
        "auto_payments_time_relation_units":"DAYS--x--DAYS",
        "auto_payments_time_relation_amounts":"1--x--14",
        "pms_cleaning_status":1.0,
        "calendar_rules_default_availability":"AVAILABLE",
        "bookingcom_cut_off_hours_enabled":null,
        "expedia_cut_off_hours_enabled":null,
        "airbnb_cut_off_hours_enabled":null,
        "directbookings_cut_off_hours_enabled":null,
        "calendar_rules_default_hours":24.0,
        "calendar_rules_allow_request_to_book":null,
        "calendar_rules_advance_notice_updated_at":"2024-09-10T19:33:32.349Z",
        "calendar_rules_advance_notice_updated_by":"Data Import",
        "booking_window_default_days":365.0,
        "booking_window_updated_at":"2024-08-16T14:58:10.934Z",
        "preparation_time_updated_at":"2024-08-16T14:58:10.931Z",
        "dynamic_checkin_updated_at":"2024-08-29T17:26:44.779Z",
        "rental_periods_request_to_book":null,
        "rental_periods_ids":"66bf69027011f00014649134",
        "rental_periods_from":1723680000000,
        "default_availability_updated_at":"2024-09-11T20:02:29.913Z",
        "default_availability_updated_by":"Data Import",
        "listing_type":"SINGLE",
        "owners_list":"66bf908db11c9ac268b42ab6",
        "amenities_list":"Pets allowed--x--Suitable for children (2-12 years)--x--Suitable for infants (under 2 years)--x--Air conditioning--x--Bed linens--x--Blender--x--Body soap--x--Carbon monoxide detector--x--Ceiling fan--x--Coffee maker--x--Conditioner--x--Cookware--x--Cycling--x--Dining table--x--Dishes and silverware--x--Dishwasher--x--Downtown--x--Dryer--x--Essentials--x--Free parking on premises--x--Free parking on Street--x--Garden or backyard--x--Golf - Optional--x--Hair dryer--x--Heating--x--Hot water--x--Internet--x--Iron--x--Kitchen--x--Lake--x--Laptop friendly workspace--x--Microwave--x--Museums--x--Oven--x--Private entrance--x--Refrigerator--x--Shampoo--x--Shopping--x--Smoke detector--x--Stove--x--Toaster--x--Town--x--TV--x--Washer--x--Wine glasses--x--Wireless Internet",
        "amenities_not_included_list":null,
        "use_account_revenue_share":1.0,
        "use_account_taxes":null,
        "use_account_markups":1.0,
        "use_account_additional_fees":null,
        "is_active":1.0,
        "net_income_formula":"host_payout",
        "commission_formula":"net_income",
        "owner_revenue_formula":"net_income - pm_commission",
        "tax_ids":"66e1da6f059dc7ccf8e9c2ae--x--66e1da6f059dc7ccf8e9c2d2",
        "tax_types":"STATE_TAX--x--OCCUPANCY_TAX",
        "tax_amounts":"6--x--11",
        "tax_names":"Texas State Tax--x--Travis Cty Hotel Occupancy Tax",
        "tax_units":"PERCENTAGE--x--PERCENTAGE",
        "tax_quantifiers":"PER_STAY--x--PER_STAY",
        "taxes_applied_to_all_fees":"True--x--True",
        "taxes_applied_on_fees":"AF,CF,ADDITIONAL_BED,AIR_CONDITIONING,EARLY_CHECK_IN,LATE_CHECK_IN,BABY_BED,CLEANING,CLUB_CARD,CONCIERGE,EARLY_CHECKOUT,LATE_CHECKOUT,DEPOSIT,ELECTRICITY,FOOD,HEATING,INTERNET,LAUNDRY,LINENS,TOWELS,MANAGEMENT,OIL,PARKING,PET,POOL,POOL_HEATING,RESORT,SERVICE,TOILETRIES,TOUR,TRANSPORTATION,CAR_RENTAL,WATER,WOOD,TRANSFER,HOUSEKEEPING,INSURANCE,COMMUNITY,CREDIT_CARD_PROCESSING_FEE,DAMAGE_WAIVER,VIP_SERVICES,PAYMENT_FEE,ADDITIONAL_CHARGE,MISCELLANEOUS,SHIPPING,VALET,ACTIVITIES,FLIGHTS,GIFT_BASKET,SPA,CHEF,MEET_AND_GREET,DOCK_FEE,UTILITY_FEE,HOT_TUB,BOOKING_FEE,BREAKFAST,BEVERAGE,MEAL,WELLNESS,MINIBAR,BUSINESS_CENTER,WIFI,GUEST_SERVICE,COMMISSION_CHARGE,EQUIPMENT_RENTAL,RESERVATION_FEE,DAMAGE_CHARGE,HOMEOWNERS_ASSOCIATION,GOLF_CART_RENTAL",
        "taxes_are_applied_by_default":"--x--",
        "tax_conditional_overrides_view_types":"LOS--x--LOS",
        "tax_conditional_overrides_max_nights":"29--x--29",
        "tax___vs":"--x--",
        "pre_bookings_list":null,
        "origin_id":104140.0,
        "nick_name":"Deep in the Heart of SoCo - Guest House",
        "minimum_age":18.0,
        "address_full":"1315 Newning Avenue, Austin, Texas 78704, United States",
        "address_street":"1315 Newning Avenue",
        "address_city":"Austin",
        "address_country":"United States",
        "address_latitude":30.2493751,
        "address_longitude":-97.7441641,
        "address_zip_code":78704.0,
        "address_state":"Texas",
        "address_county":null,
        "room_type":"Entire home\/apt",
        "property_type":"House",
        "ota_room_type":"Holiday home",
        "accommodates":6.0,
        "bathrooms":1.0,
        "bedrooms":2.0,
        "beds_count":3.0,
        "listing_status":1.0,
        "host_name":"Grand Welcome Austin",
        "wifi_name":"Deep in the Heart",
        "wifi_password":"SoCo@2024!",
        "area_in_square_feet":823.0,
        "trash_collection_day":"'- Trash & recycling is removed on Tuesday. \n- Trash & recycling bins are located on the side of the home. Please ensure that ONLY recyclables are placed in the recycling bin(s).",
        "parking_instructions":"'- This home offers parking for up to 1 vehicle in the driveway. Additional street parking is available as needed on a first come, first served basis.",
        "created_at":"2024-04-19T00:00:00.000Z",
        "origin":"track",
        "default_check_in_time":"16:00:00",
        "default_check_out_time":"10:00:00",
        "check_in_instructions":"Arrival and Parking: \n- This home offers parking for up to 1 vehicle in the driveway. Additional street parking is available as needed on a first come, first served basis.\n\u00c2\u00a0\nAccess Instructions: \n- Upon arrival, guests may park in the driveway in front of the home and enter through the front door of the house. The main door is equipped with a keyless lock for entry.\n\u00c2\u00a0\nLock Instructions:\nTo unlock and enter the home:\n- Door code is provided above for entry access. The code will activate right at 4pm.\u00c2\u00a0\n- The door does NOT lock automatically so please lock when you leave.\n- Use your code for the door to lock.\u00c2\u00a0\n\u00c2\u00a0\nWireless Internet Information: \nNetwork: Deep in the Heart \nPassword: SoCo@2024!\n\u00c2\u00a0\nLaundry: \n- Private laundry is available for your stay, located in the hallway across from the bathroom.\n\u00c2\u00a0\nTrash: \n- Trash & recycling is removed on Tuesday.\n- Trash & recycling bins are located on the side of the home. Please ensure that ONLY recyclables are placed in the recycling bin(s).\n\u00c2\u00a0\nAdditional Information: \u00c2\u00a0\n- We provide a starter set of supplies, but for longer stays you will likely want buy or bring more. These complimentary amenities are provided free of charge and are included in the blue boxes in the kitchen and bathrooms so please help yourselves!\n- This home is pet friendly. Cats are not permitted.\u00c2\u00a0\n- If you are bringing a pet, please ensure that they are added to the reservation and that the pet fee is paid. This property allows up to a maximum of 2 pet(s). An additional flat fee of $150 applies, and a maximum of 2 pets are allowed in the unit.\n- Please reach out if you would like us to send you the entire list of house rules before your arrival.  ",
        "check_out_instructions":"- Set AC to 74 in the summer months  \n- Set heater to 65 in the winter months \n- Bag all garbage and place is designated trash location \n- Load all dirty dishes in the dishwasher and start the dishwasher \n- Place all used towels on the ground in the bathr",
        "account_id":"66a30f208b331811b8e96639",
        "time_zone":"America\/Chicago",
        "last_updated_at":"2024-10-16T07:25:13.893Z",
        "integration_ids":"66d0af0bb6ad7bcfca3bf989--x--66d8cd59cc4df40011491532--x--66e1a279352e665645cd4fe0",
        "integration_platforms":"vacayHome--x--homeaway2--x--airbnb2",
        "booking_com_initial_complex_listings":"--x----x--",
        "booking_com_publish_company_logos":"--x----x--",
        "booking_com_is_published_company_logos":"--x----x--",
        "booking_com_publish_company_infos":"--x----x--",
        "booking_com_is_published_company_infos":"--x----x--",
        "vacayhome_currencies":"USD",
        "vacayhome_statuses":"COMPLETED",
        "vacayhome_cancellation_policies":"firm",
        "vacayhome_cancellation_penalties":100.0,
        "vacayhome_creation_times":"2024-08-30T20:30:53.599Z",
        "listing_room_ids":"66c30cd499e922187e4f70b5--x--66c30cd499e922187e4f70b6--x--66c30cd499e922187e4f70b7--x--66c30cd499e922187e4f70b8",
        "listing_room_numbers":null,
        "listing_room_bed_ids":"6700d5ebace50d0010701d29--x--6700d5ebace50d0010701d2b--x--6700d5ebace50d0010701d2d",
        "listing_room_bed_types":"SOFA_BED--x--KING_BED--x--KING_BED",
        "listing_room_bed_quantities":"1--x--1--x--1",
        "custom_field_values":"Arrival and Parking: \n- This home offers parking for up to 1 vehicle in the driveway. Additional street parking is available as needed on a first come, first served basis.\n\u00c2\u00a0\nAccess Instructions: \n- Upon arrival, guests may park in the driveway in front of the home and enter through the front door of the house. The main door is equipped with a keyless lock for entry.\n\u00c2\u00a0\nLock Instructions:\nTo unlock and enter the home:\n- Door code is provided above for entry access. The code will activate right at 4pm.\u00c2\u00a0\n- The door does NOT lock automatically so please lock when you leave.\n- Use your code for the door to lock.\u00c2\u00a0\n\u00c2\u00a0\nWireless Internet Information: \nNetwork: Deep in the Heart \nPassword: SoCo@2024!\n\u00c2\u00a0\nLaundry: \n- Private laundry is available for your stay, located in the hallway across from the bathroom.\n\u00c2\u00a0\nTrash: \n- Trash & recycling is removed on Tuesday.\n- Trash & recycling bins are located on the side of the home. Please ensure that ONLY recyclables are placed in the recycling bin(s).\n\u00c2\u00a0\nAdditional Information: \u00c2\u00a0\n- We provide a starter set of supplies, but for longer stays you will likely want buy or bring more. These complimentary amenities are provided free of charge and are included in the blue boxes in the kitchen and bathrooms so please help yourselves!\n- This home is pet friendly. Cats are not permitted.\u00c2\u00a0\n- If you are bringing a pet, please ensure that they are added to the reservation and that the pet fee is paid. This property allows up to a maximum of 2 pet(s). An additional flat fee of $150 applies, and a maximum of 2 pets are allowed in the unit.\n- Please reach out if you would like us to send you the entire list of house rules before your arrival.  --x--From Austin-Bergstrom International Airport (AUS)\n3600 Presidential Blvd, Austin, TX 78719\n\u00c2\u00a0\n- Take\u00c2\u00a0Hotel Dr\u00c2\u00a0to\u00c2\u00a0State Hwy 71 W - 3 min\u00c2\u00a0(1.6 mi)\n- Head\u00c2\u00a0southwest\u00c2\u00a0on\u00c2\u00a0Presidential Blvd\u00c2\u00a0toward\u00c2\u00a0Service Dr - 354 ft\n- Slight\u00c2\u00a0right\u00c2\u00a0onto\u00c2\u00a0Service Dr - 482 ft\n- Turn\u00c2\u00a0right\u00c2\u00a0onto\u00c2\u00a0Hotel Dr - 0.3 mi\n- Turn\u00c2\u00a0right\u00c2\u00a0onto\u00c2\u00a0Spirit of Texas Dr - 0.2 mi\n- Turn\u00c2\u00a0left\u00c2\u00a0to merge onto\u00c2\u00a0State Hwy 71 W - 0.9 mi\n- Use the left 3 lanes to stay on\u00c2\u00a0State Hwy 71 W - 0.1 mi\n- Continue on\u00c2\u00a0State Hwy 71 W\u00c2\u00a0to\u00c2\u00a0N Interstate 35 Frontage Rd. Take exit\u00c2\u00a0232B\u00c2\u00a0from\u00c2\u00a0I-35 N\/US-290 E - 6 min\u00c2\u00a0(5.9 mi)\n- Keep\u00c2\u00a0left\u00c2\u00a0to stay on\u00c2\u00a0State Hwy 71 W - 4.1 mi\n- Use the right 2 lanes to merge onto\u00c2\u00a0I-35 N\/US-290 E\u00c2\u00a0toward\u00c2\u00a0Waco - 1.7 mi\n- Take exit\u00c2\u00a0232B\u00c2\u00a0toward\u00c2\u00a0Woodland Ave - 0.2 mi\n- Continue on\u00c2\u00a0N Interstate 35 Frontage Rd. Take\u00c2\u00a0Woodland Ave\u00c2\u00a0to\u00c2\u00a0Newning Ave - 5 min\u00c2\u00a0(1.4 mi)\n- Merge onto\u00c2\u00a0N Interstate 35 Frontage Rd - 0.2 mi\n- Continue straight to stay on\u00c2\u00a0N Interstate 35 Frontage Rd - 0.2 mi\n- Turn\u00c2\u00a0left\u00c2\u00a0onto\u00c2\u00a0Woodland Ave - 0.6 mi\n- Turn\u00c2\u00a0right\u00c2\u00a0onto\u00c2\u00a0Sunset Ln - 0.1 mi\n- Turn\u00c2\u00a0left\u00c2\u00a0onto\u00c2\u00a0E Monroe St - 0.1 mi\n- Turn\u00c2\u00a0right\u00c2\u00a0onto\u00c2\u00a0Newning Ave\n- Destination will be on the right (Second house) - 0.2 mi\n\u00c2\u00a0\n1315 Newning Ave, Unit C (Guest House)\nAustin, TX 78704\n\u00c2\u00a0\n**Note: Upon arrival, guests may park in the driveway in front of the home and enter through the front door of the house.--x--Owner Tax ID\/EIN - 642211938\nExp: 5\/30\/2025\n\nOL 2024 006564\nExp: 2\/8\/2025--x--Owner Tax ID\/EIN - 642211938\nExp: 5\/30\/2025\n\nOL 2024 006564\nExp: 2\/8\/2025--x--Left front of 1315 Unit A--x----x--1 set of towels (bath towel, hand towel, washcloth) per occupant (up to max occupancy on listing). 2 rolls of toilet paper, bar soap, hand lotion and wastebasket trash bag per bathroom. Shampoo, conditioner, &amp; body wash per full bathroom. 2 rolls of paper towels, fresh sponge, dish soap, 2 loads of dishwasher detergent, 2 additional trash bags per kitchen. 2 loads of laundry detergent per home. (with in-house laundry systems).--x--Front bedroom--x--Main house in the living room--x--Tankless in the kitchen, alarm code is 911--x--Kitchen--x--N\/a--x--Private laundry is available for your stay, located in the hallway across from the bathroom.--x--2--x--https:\/\/www.grandwelcome.com\/vrp\/unit\/Deep_in_the_Heart_of_SoCo_-_Guest_House-104140-15--x--https:\/\/www.airbnb.com\/rooms\/1161107810458716901--x--https:\/\/www.vrbo.com\/9961008ha--x----x----x----x----x--75--x--75--x--1--x--Driveway, Street Parking (Free)\nThis home offers parking for up to 1 vehicle in the driveway. Additional street parking is available as needed on a first come, first served basis.--x--Tuesday - Trash & recycling is removed on Tuesday. --x--No Pool Heating Policy Defined--x--N\/A--x--Backup Keyless Entry Code 01313\u00e2\u0153\u201c\nEmergency Lockbox (Internal Use) 0723",
        "import_time":"2024-08-16T14:58:10.943Z",
        "date_of_first_scrape":1735178160000,
        "date_of_last_update":null,
        "date_of_last_scrape":1735178160000,
        "summary":"property_address1: nan, property_address2: nan, property_building: nan, property_id: 1201, property_notes_access: nan, property_notes_general: nan, property_notes_guest_access: nan, property_photos_url: nan, property_state: nan, property_status: nan, listing_id: 66bf69027011f00014649130, saas_auto_renew: True, cleaning_fee_id: 66e5b03c7f6027000f21af46, cleaning_fee_value_type: FIXED, cleaning_fee_formula: 150, cleaning_fee_multiplier: PER_STAY, channel_commission_use_account_settings: True, channel_commission_id: 67334bb06d8308d981974778, channel_commission_created_at: 2024-11-12T12:36:00.819Z, channel_commission_updated_at: 2024-12-11T07:01:39.791Z, cleaning_status: dirty, picture_caption: Aerial view, picture_thumbnail: https:\/\/track-pm.s3.amazonaws.com\/gw\/image\/c3557658-eea3-4b23-a61d-d961f72e01c9, minimum_nights: 1, maximum_nights: 365.0, monthly_price_factor: 1, weekly_price_factor: 1.0, base_price: 1.0, weekend_base_price: 188.0, currency: USD, cleaning_fee: 150.0, confirmed_before_checkin_delay_minutes: 45.0, confirmed_day_of_checkin_delay_minutes: 45.0, confirmed_day_of_checkout_delay_minutes: 45.0, confirmed_during_stay_delay_minutes: 45.0, confirmed_after_checkout_delay_minutes: 45.0, unconfirmed_first_message_delay_minutes: 45.0, unconfirmed_subsequent_message_delay_minutes: 45.0, answeing_machine_is_active: 1.0, auto_reviews_status: 1.0, auto_payments_time_relation_names: AT--x--BEFORE, auto_payments_time_relation_units: DAYS--x--DAYS, auto_payments_time_relation_amounts: 1--x--14, pms_cleaning_status: 1.0, calendar_rules_default_availability: AVAILABLE, bookingcom_cut_off_hours_enabled: nan, expedia_cut_off_hours_enabled: nan, airbnb_cut_off_hours_enabled: nan, directbookings_cut_off_hours_enabled: nan, calendar_rules_default_hours: 24.0, calendar_rules_allow_request_to_book: nan, calendar_rules_advance_notice_updated_at: 2024-09-10T19:33:32.349Z, calendar_rules_advance_notice_updated_by: Data Import, booking_window_default_days: 365.0, booking_window_updated_at: 2024-08-16T14:58:10.934Z, preparation_time_updated_at: 2024-08-16T14:58:10.931Z, dynamic_checkin_updated_at: 2024-08-29T17:26:44.779Z, rental_periods_request_to_book: nan, rental_periods_ids: 66bf69027011f00014649134, rental_periods_from: 2024-08-15 00:00:00, default_availability_updated_at: 2024-09-11T20:02:29.913Z, default_availability_updated_by: Data Import, listing_type: SINGLE, owners_list: 66bf908db11c9ac268b42ab6, amenities_list: Pets allowed--x--Suitable for children (2-12 years)--x--Suitable for infants (under 2 years)--x--Air conditioning--x--Bed linens--x--Blender--x--Body soap--x--Carbon monoxide detector--x--Ceiling fan--x--Coffee maker--x--Conditioner--x--Cookware--x--Cycling--x--Dining table--x--Dishes and silverware--x--Dishwasher--x--Downtown--x--Dryer--x--Essentials--x--Free parking on premises--x--Free parking on Street--x--Garden or backyard--x--Golf - Optional--x--Hair dryer--x--Heating--x--Hot water--x--Internet--x--Iron--x--Kitchen--x--Lake--x--Laptop friendly workspace--x--Microwave--x--Museums--x--Oven--x--Private entrance--x--Refrigerator--x--Shampoo--x--Shopping--x--Smoke detector--x--Stove--x--Toaster--x--Town--x--TV--x--Washer--x--Wine glasses--x--Wireless Internet, amenities_not_included_list: nan, use_account_revenue_share: 1.0, use_account_taxes: nan, use_account_markups: 1.0, use_account_additional_fees: nan, is_active: 1.0, net_income_formula: host_payout, commission_formula: net_income, owner_revenue_formula: net_income - pm_commission, tax_ids: 66e1da6f059dc7ccf8e9c2ae--x--66e1da6f059dc7ccf8e9c2d2, tax_types: STATE_TAX--x--OCCUPANCY_TAX, tax_amounts: 6--x--11, tax_names: Texas State Tax--x--Travis Cty Hotel Occupancy Tax, tax_units: PERCENTAGE--x--PERCENTAGE, tax_quantifiers: PER_STAY--x--PER_STAY, taxes_applied_to_all_fees: True--x--True, taxes_applied_on_fees: AF,CF,ADDITIONAL_BED,AIR_CONDITIONING,EARLY_CHECK_IN,LATE_CHECK_IN,BABY_BED,CLEANING,CLUB_CARD,CONCIERGE,EARLY_CHECKOUT,LATE_CHECKOUT,DEPOSIT,ELECTRICITY,FOOD,HEATING,INTERNET,LAUNDRY,LINENS,TOWELS,MANAGEMENT,OIL,PARKING,PET,POOL,POOL_HEATING,RESORT,SERVICE,TOILETRIES,TOUR,TRANSPORTATION,CAR_RENTAL,WATER,WOOD,TRANSFER,HOUSEKEEPING,INSURANCE,COMMUNITY,CREDIT_CARD_PROCESSING_FEE,DAMAGE_WAIVER,VIP_SERVICES,PAYMENT_FEE,ADDITIONAL_CHARGE,MISCELLANEOUS,SHIPPING,VALET,ACTIVITIES,FLIGHTS,GIFT_BASKET,SPA,CHEF,MEET_AND_GREET,DOCK_FEE,UTILITY_FEE,HOT_TUB,BOOKING_FEE,BREAKFAST,BEVERAGE,MEAL,WELLNESS,MINIBAR,BUSINESS_CENTER,WIFI,GUEST_SERVICE,COMMISSION_CHARGE,EQUIPMENT_RENTAL,RESERVATION_FEE,DAMAGE_CHARGE,HOMEOWNERS_ASSOCIATION,GOLF_CART_RENTAL, taxes_are_applied_by_default: --x--, tax_conditional_overrides_view_types: LOS--x--LOS, tax_conditional_overrides_max_nights: 29--x--29, tax___vs: --x--, pre_bookings_list: nan, origin_id: 104140.0, nick_name: Deep in the Heart of SoCo - Guest House, minimum_age: 18.0, address_full: 1315 Newning Avenue, Austin, Texas 78704, United States, address_street: 1315 Newning Avenue, address_city: Austin, address_country: United States, address_latitude: 30.2493751, address_longitude: -97.7441641, address_zip_code: 78704.0, address_state: Texas, address_county: nan, room_type: Entire home\/apt, property_type: House, ota_room_type: Holiday home, accommodates: 6.0, bathrooms: 1.0, bedrooms: 2.0, beds_count: 3.0, listing_status: 1.0, host_name: Grand Welcome Austin, wifi_name: Deep in the Heart, wifi_password: SoCo@2024!, area_in_square_feet: 823.0, trash_collection_day: '- Trash & recycling is removed on Tuesday. \n- Trash & recycling bins are located on the side of the home. Please ensure that ONLY recyclables are placed in the recycling bin(s)., parking_instructions: '- This home offers parking for up to 1 vehicle in the driveway. Additional street parking is available as needed on a first come, first served basis., created_at: 2024-04-19T00:00:00.000Z, origin: track, default_check_in_time: 16:00:00, default_check_out_time: 10:00:00, check_in_instructions: Arrival and Parking: \n- This home offers parking for up to 1 vehicle in the driveway. Additional street parking is available as needed on a first come, first served basis.\n\u00c2\u00a0\nAccess Instructions: \n- Upon arrival, guests may park in the driveway in front of the home and enter through the front door of the house. The main door is equipped with a keyless lock for entry.\n\u00c2\u00a0\nLock Instructions:\nTo unlock and enter the home:\n- Door code is provided above for entry access. The code will activate right at 4pm.\u00c2\u00a0\n- The door does NOT lock automatically so please lock when you leave.\n- Use your code for the door to lock.\u00c2\u00a0\n\u00c2\u00a0\nWireless Internet Information: \nNetwork: Deep in the Heart \nPassword: SoCo@2024!\n\u00c2\u00a0\nLaundry: \n- Private laundry is available for your stay, located in the hallway across from the bathroom.\n\u00c2\u00a0\nTrash: \n- Trash & recycling is removed on Tuesday.\n- Trash & recycling bins are located on the side of the home. Please ensure that ONLY recyclables are placed in the recycling bin(s).\n\u00c2\u00a0\nAdditional Information: \u00c2\u00a0\n- We provide a starter set of supplies, but for longer stays you will likely want buy or bring more. These complimentary amenities are provided free of charge and are included in the blue boxes in the kitchen and bathrooms so please help yourselves!\n- This home is pet friendly. Cats are not permitted.\u00c2\u00a0\n- If you are bringing a pet, please ensure that they are added to the reservation and that the pet fee is paid. This property allows up to a maximum of 2 pet(s). An additional flat fee of $150 applies, and a maximum of 2 pets are allowed in the unit.\n- Please reach out if you would like us to send you the entire list of house rules before your arrival.  , check_out_instructions: - Set AC to 74 in the summer months  \n- Set heater to 65 in the winter months \n- Bag all garbage and place is designated trash location \n- Load all dirty dishes in the dishwasher and start the dishwasher \n- Place all used towels on the ground in the bathr, account_id: 66a30f208b331811b8e96639, time_zone: America\/Chicago, last_updated_at: 2024-10-16T07:25:13.893Z, integration_ids: 66d0af0bb6ad7bcfca3bf989--x--66d8cd59cc4df40011491532--x--66e1a279352e665645cd4fe0, integration_platforms: vacayHome--x--homeaway2--x--airbnb2, booking_com_initial_complex_listings: --x----x--, booking_com_publish_company_logos: --x----x--, booking_com_is_published_company_logos: --x----x--, booking_com_publish_company_infos: --x----x--, booking_com_is_published_company_infos: --x----x--, vacayhome_currencies: USD, vacayhome_statuses: COMPLETED, vacayhome_cancellation_policies: firm, vacayhome_cancellation_penalties: 100.0, vacayhome_creation_times: 2024-08-30T20:30:53.599Z, listing_room_ids: 66c30cd499e922187e4f70b5--x--66c30cd499e922187e4f70b6--x--66c30cd499e922187e4f70b7--x--66c30cd499e922187e4f70b8, listing_room_numbers: nan, listing_room_bed_ids: 6700d5ebace50d0010701d29--x--6700d5ebace50d0010701d2b--x--6700d5ebace50d0010701d2d, listing_room_bed_types: SOFA_BED--x--KING_BED--x--KING_BED, listing_room_bed_quantities: 1--x--1--x--1, custom_field_values: Arrival and Parking: \n- This home offers parking for up to 1 vehicle in the driveway. Additional street parking is available as needed on a first come, first served basis.\n\u00c2\u00a0\nAccess Instructions: \n- Upon arrival, guests may park in the driveway in front of the home and enter through the front door of the house. The main door is equipped with a keyless lock for entry.\n\u00c2\u00a0\nLock Instructions:\nTo unlock and enter the home:\n- Door code is provided above for entry access. The code will activate right at 4pm.\u00c2\u00a0\n- The door does NOT lock automatically so please lock when you leave.\n- Use your code for the door to lock.\u00c2\u00a0\n\u00c2\u00a0\nWireless Internet Information: \nNetwork: Deep in the Heart \nPassword: SoCo@2024!\n\u00c2\u00a0\nLaundry: \n- Private laundry is available for your stay, located in the hallway across from the bathroom.\n\u00c2\u00a0\nTrash: \n- Trash & recycling is removed on Tuesday.\n- Trash & recycling bins are located on the side of the home. Please ensure that ONLY recyclables are placed in the recycling bin(s).\n\u00c2\u00a0\nAdditional Information: \u00c2\u00a0\n- We provide a starter set of supplies, but for longer stays you will likely want buy or bring more. These complimentary amenities are provided free of charge and are included in the blue boxes in the kitchen and bathrooms so please help yourselves!\n- This home is pet friendly. Cats are not permitted.\u00c2\u00a0\n- If you are bringing a pet, please ensure that they are added to the reservation and that the pet fee is paid. This property allows up to a maximum of 2 pet(s). An additional flat fee of $150 applies, and a maximum of 2 pets are allowed in the unit.\n- Please reach out if you would like us to send you the entire list of house rules before your arrival.  --x--From Austin-Bergstrom International Airport (AUS)\n3600 Presidential Blvd, Austin, TX 78719\n\u00c2\u00a0\n- Take\u00c2\u00a0Hotel Dr\u00c2\u00a0to\u00c2\u00a0State Hwy 71 W - 3 min\u00c2\u00a0(1.6 mi)\n- Head\u00c2\u00a0southwest\u00c2\u00a0on\u00c2\u00a0Presidential Blvd\u00c2\u00a0toward\u00c2\u00a0Service Dr - 354 ft\n- Slight\u00c2\u00a0right\u00c2\u00a0onto\u00c2\u00a0Service Dr - 482 ft\n- Turn\u00c2\u00a0right\u00c2\u00a0onto\u00c2\u00a0Hotel Dr - 0.3 mi\n- Turn\u00c2\u00a0right\u00c2\u00a0onto\u00c2\u00a0Spirit of Texas Dr - 0.2 mi\n- Turn\u00c2\u00a0left\u00c2\u00a0to merge onto\u00c2\u00a0State Hwy 71 W - 0.9 mi\n- Use the left 3 lanes to stay on\u00c2\u00a0State Hwy 71 W - 0.1 mi\n- Continue on\u00c2\u00a0State Hwy 71 W\u00c2\u00a0to\u00c2\u00a0N Interstate 35 Frontage Rd. Take exit\u00c2\u00a0232B\u00c2\u00a0from\u00c2\u00a0I-35 N\/US-290 E - 6 min\u00c2\u00a0(5.9 mi)\n- Keep\u00c2\u00a0left\u00c2\u00a0to stay on\u00c2\u00a0State Hwy 71 W - 4.1 mi\n- Use the right 2 lanes to merge onto\u00c2\u00a0I-35 N\/US-290 E\u00c2\u00a0toward\u00c2\u00a0Waco - 1.7 mi\n- Take exit\u00c2\u00a0232B\u00c2\u00a0toward\u00c2\u00a0Woodland Ave - 0.2 mi\n- Continue on\u00c2\u00a0N Interstate 35 Frontage Rd. Take\u00c2\u00a0Woodland Ave\u00c2\u00a0to\u00c2\u00a0Newning Ave - 5 min\u00c2\u00a0(1.4 mi)\n- Merge onto\u00c2\u00a0N Interstate 35 Frontage Rd - 0.2 mi\n- Continue straight to stay on\u00c2\u00a0N Interstate 35 Frontage Rd - 0.2 mi\n- Turn\u00c2\u00a0left\u00c2\u00a0onto\u00c2\u00a0Woodland Ave - 0.6 mi\n- Turn\u00c2\u00a0right\u00c2\u00a0onto\u00c2\u00a0Sunset Ln - 0.1 mi\n- Turn\u00c2\u00a0left\u00c2\u00a0onto\u00c2\u00a0E Monroe St - 0.1 mi\n- Turn\u00c2\u00a0right\u00c2\u00a0onto\u00c2\u00a0Newning Ave\n- Destination will be on the right (Second house) - 0.2 mi\n\u00c2\u00a0\n1315 Newning Ave, Unit C (Guest House)\nAustin, TX 78704\n\u00c2\u00a0\n**Note: Upon arrival, guests may park in the driveway in front of the home and enter through the front door of the house.--x--Owner Tax ID\/EIN - 642211938\nExp: 5\/30\/2025\n\nOL 2024 006564\nExp: 2\/8\/2025--x--Owner Tax ID\/EIN - 642211938\nExp: 5\/30\/2025\n\nOL 2024 006564\nExp: 2\/8\/2025--x--Left front of 1315 Unit A--x----x--1 set of towels (bath towel, hand towel, washcloth) per occupant (up to max occupancy on listing). 2 rolls of toilet paper, bar soap, hand lotion and wastebasket trash bag per bathroom. Shampoo, conditioner, &amp; body wash per full bathroom. 2 rolls of paper towels, fresh sponge, dish soap, 2 loads of dishwasher detergent, 2 additional trash bags per kitchen. 2 loads of laundry detergent per home. (with in-house laundry systems).--x--Front bedroom--x--Main house in the living room--x--Tankless in the kitchen, alarm code is 911--x--Kitchen--x--N\/a--x--Private laundry is available for your stay, located in the hallway across from the bathroom.--x--2--x--https:\/\/www.grandwelcome.com\/vrp\/unit\/Deep_in_the_Heart_of_SoCo_-_Guest_House-104140-15--x--https:\/\/www.airbnb.com\/rooms\/1161107810458716901--x--https:\/\/www.vrbo.com\/9961008ha--x----x----x----x----x--75--x--75--x--1--x--Driveway, Street Parking (Free)\nThis home offers parking for up to 1 vehicle in the driveway. Additional street parking is available as needed on a first come, first served basis.--x--Tuesday - Trash & recycling is removed on Tuesday. --x--No Pool Heating Policy Defined--x--N\/A--x--Backup Keyless Entry Code 01313\u00e2\u0153\u201c\nEmergency Lockbox (Internal Use) 0723, import_time: 2024-08-16T14:58:10.943Z, date_of_first_scrape: 2024-12-26 01:56:00, date_of_last_update: nan, date_of_last_scrape: 2024-12-26 01:56:00"
    },
    {
        "property_address1":null,
        "property_address2":null,
        "property_building":null,
        "property_id":1204,
        "property_notes_access":null,
        "property_notes_general":null,
        "property_notes_guest_access":null,
        "property_photos_url":null,
        "property_state":null,
        "property_status":null,
        "listing_id":"66bf68fe3041f6000e104abb",
        "saas_auto_renew":1.0,
        "cleaning_fee_id":"6709168f3931bc0012ca6e12",
        "cleaning_fee_value_type":"FIXED",
        "cleaning_fee_formula":250.0,
        "cleaning_fee_multiplier":"PER_STAY",
        "channel_commission_use_account_settings":1.0,
        "channel_commission_id":"67334bb16d8308d981974920",
        "channel_commission_created_at":"2024-11-12T12:36:01.706Z",
        "channel_commission_updated_at":"2024-12-11T07:01:40.601Z",
        "cleaning_status":"dirty",
        "picture_caption":"Exterior",
        "picture_thumbnail":"https:\/\/track-pm.s3.amazonaws.com\/gw\/image\/0f9b3681-b846-4963-bd38-7983f188cdd4",
        "minimum_nights":1.0,
        "maximum_nights":365.0,
        "monthly_price_factor":1.0,
        "weekly_price_factor":1.0,
        "base_price":1.0,
        "weekend_base_price":375.0,
        "currency":"USD",
        "cleaning_fee":250.0,
        "confirmed_before_checkin_delay_minutes":45.0,
        "confirmed_day_of_checkin_delay_minutes":45.0,
        "confirmed_day_of_checkout_delay_minutes":45.0,
        "confirmed_during_stay_delay_minutes":45.0,
        "confirmed_after_checkout_delay_minutes":45.0,
        "unconfirmed_first_message_delay_minutes":45.0,
        "unconfirmed_subsequent_message_delay_minutes":45.0,
        "answeing_machine_is_active":1.0,
        "auto_reviews_status":1.0,
        "auto_payments_time_relation_names":"AT--x--BEFORE",
        "auto_payments_time_relation_units":"DAYS--x--DAYS",
        "auto_payments_time_relation_amounts":"1--x--14",
        "pms_cleaning_status":1.0,
        "calendar_rules_default_availability":"AVAILABLE",
        "bookingcom_cut_off_hours_enabled":null,
        "expedia_cut_off_hours_enabled":null,
        "airbnb_cut_off_hours_enabled":null,
        "directbookings_cut_off_hours_enabled":null,
        "calendar_rules_default_hours":24.0,
        "calendar_rules_allow_request_to_book":null,
        "calendar_rules_advance_notice_updated_at":"2024-09-10T19:33:31.203Z",
        "calendar_rules_advance_notice_updated_by":"Data Import",
        "booking_window_default_days":365.0,
        "booking_window_updated_at":"2024-08-16T14:58:06.559Z",
        "preparation_time_updated_at":"2024-08-16T14:58:06.557Z",
        "dynamic_checkin_updated_at":"2024-08-29T17:26:45.134Z",
        "rental_periods_request_to_book":null,
        "rental_periods_ids":"66bf68fe3041f6000e104abf",
        "rental_periods_from":1723680000000,
        "default_availability_updated_at":"2024-09-11T20:02:28.217Z",
        "default_availability_updated_by":"Data Import",
        "listing_type":"SINGLE",
        "owners_list":"66bf907bf9b8639a586a35c9",
        "amenities_list":"Air conditioning--x--Bed linens--x--Blender--x--Body soap--x--Carbon monoxide detector--x--Ceiling fan--x--Coffee maker--x--Conditioner--x--Cookware--x--Dining table--x--Dishes and silverware--x--Dishwasher--x--Downtown--x--Dryer--x--Essentials--x--Free parking on premises--x--Free parking on street--x--Golf - Optional--x--Hair dryer--x--Heating--x--Hot water--x--Ice maker--x--Internet--x--Iron--x--Kitchen--x--Laptop friendly workspace--x--Microwave--x--Museums--x--Oven--x--Private entrance--x--Refrigerator--x--Shampoo--x--Shopping--x--Smoke detector--x--Stove--x--TV--x--Toaster--x--Town--x--Washer--x--Wireless Internet--x--Free parking on Street",
        "amenities_not_included_list":null,
        "use_account_revenue_share":1.0,
        "use_account_taxes":null,
        "use_account_markups":1.0,
        "use_account_additional_fees":null,
        "is_active":1.0,
        "net_income_formula":"host_payout",
        "commission_formula":"net_income",
        "owner_revenue_formula":"net_income - pm_commission",
        "tax_ids":"66e1da70055feb22b0330374--x--66e1da70059dc7ccf8e9c2d8",
        "tax_types":"STATE_TAX--x--OCCUPANCY_TAX",
        "tax_amounts":"6--x--11",
        "tax_names":"Texas State Tax--x--Travis Cty Hotel Occupancy Tax",
        "tax_units":"PERCENTAGE--x--PERCENTAGE",
        "tax_quantifiers":"PER_STAY--x--PER_STAY",
        "taxes_applied_to_all_fees":"True--x--True",
        "taxes_applied_on_fees":"AF,CF,ADDITIONAL_BED,AIR_CONDITIONING,EARLY_CHECK_IN,LATE_CHECK_IN,BABY_BED,CLEANING,CLUB_CARD,CONCIERGE,EARLY_CHECKOUT,LATE_CHECKOUT,DEPOSIT,ELECTRICITY,FOOD,HEATING,INTERNET,LAUNDRY,LINENS,TOWELS,MANAGEMENT,OIL,PARKING,PET,POOL,POOL_HEATING,RESORT,SERVICE,TOILETRIES,TOUR,TRANSPORTATION,CAR_RENTAL,WATER,WOOD,TRANSFER,HOUSEKEEPING,INSURANCE,COMMUNITY,CREDIT_CARD_PROCESSING_FEE,DAMAGE_WAIVER,VIP_SERVICES,PAYMENT_FEE,ADDITIONAL_CHARGE,MISCELLANEOUS,SHIPPING,VALET,ACTIVITIES,FLIGHTS,GIFT_BASKET,SPA,CHEF,MEET_AND_GREET,DOCK_FEE,UTILITY_FEE,HOT_TUB,BOOKING_FEE,BREAKFAST,BEVERAGE,MEAL,WELLNESS,MINIBAR,BUSINESS_CENTER,WIFI,GUEST_SERVICE,COMMISSION_CHARGE,EQUIPMENT_RENTAL,RESERVATION_FEE,DAMAGE_CHARGE,HOMEOWNERS_ASSOCIATION,GOLF_CART_RENTAL",
        "taxes_are_applied_by_default":"--x--",
        "tax_conditional_overrides_view_types":"LOS--x--LOS",
        "tax_conditional_overrides_max_nights":"29--x--29",
        "tax___vs":"--x--",
        "pre_bookings_list":null,
        "origin_id":104145.0,
        "nick_name":"South Lamar Serenity",
        "minimum_age":18.0,
        "address_full":"3605 Winfield Cove, Austin, TX 78704, USA",
        "address_street":"3605 Winfield Cove",
        "address_city":"Austin",
        "address_country":"United States",
        "address_latitude":30.2364048,
        "address_longitude":-97.7807659,
        "address_zip_code":78704.0,
        "address_state":"Texas",
        "address_county":null,
        "room_type":"Entire home\/apt",
        "property_type":"House",
        "ota_room_type":"Holiday home",
        "accommodates":10.0,
        "bathrooms":3.0,
        "bedrooms":4.0,
        "beds_count":5.0,
        "listing_status":1.0,
        "host_name":"Grand Welcome Austin",
        "wifi_name":"93D3",
        "wifi_password":"calmmethod574",
        "area_in_square_feet":1683.0,
        "trash_collection_day":null,
        "parking_instructions":"Driveway + additional street parking",
        "created_at":"2024-04-19T00:00:00.000Z",
        "origin":"track",
        "default_check_in_time":"16:00:00",
        "default_check_out_time":"10:00:00",
        "check_in_instructions":"Arrival and Parking: \n- Parking is available for 2 vehicles in the driveway, and additional parking is available on the street. \n\u00c2\u00a0\nAccess Instructions: \n- Once parked, please proceed to the front door which is equipped with a keyless lock for entry.\n\u00c2\u00a0\nLock Instructions:\nTo unlock and enter the home:\n- Enter the code provided above followed by a checkmark to gain access to the home. The code will activate right at 4pm.\n- The door does NOT lock automatically so please lock when you leave.\n- Press any button on the keypad followed by a checkmark to lock the home before your departure.\u00c2\u00a0\n\u00c2\u00a0\nWireless Internet Information: \nNetwork: 93D3\nPassword: calmmethod574\n\nLaundry: \n- Washer and dryer are located in the utility room.\n\u00c2\u00a0\nTrash: \n- Trash is picked up on Thursday. \n\u00c2\u00a0\nAdditional Information: \u00c2\u00a0\n- We provide a starter set of supplies, but for longer stays you will likely want buy or bring more. These complimentary amenities are provided free of charge and are included in the blue boxes in the kitchen and bathrooms so please help yourselves!\n- This home\u00c2\u00a0is\u00c2\u00a0pet friendly. A Maximum of 2 Dogs may be brought to this home. Puppies and untrained animals are not permitted.\n-\u00c2\u00a0If you are bringing a pet, please ensure that they are added to the reservation and that the pet fee is paid. This property allows up to a maximum of 2 pet(s). An additional flat fee of $150 applies, and a maximum of 2 pets are allowed in the unit.\n- Please reach out if you would like us to send you the entire list of house rules before your arrival.  ",
        "check_out_instructions":"- Set AC to 74 in the summer months  \n- Set heater to 65 in the winter months \n- Bag all garbage and place is designated trash location \n- Load all dirty dishes in the dishwasher and start the dishwasher \n- Place all used towels on the ground in the bathr",
        "account_id":"66a30f208b331811b8e96639",
        "time_zone":"America\/Chicago",
        "last_updated_at":"2024-11-26T22:27:14.314Z",
        "integration_ids":"66d0af0bb6ad7bcfca3bf989--x--66d8cd59cc4df40011491532--x--66e1a279352e665645cd4fe0",
        "integration_platforms":"vacayHome--x--homeaway2--x--airbnb2",
        "booking_com_initial_complex_listings":"--x----x--",
        "booking_com_publish_company_logos":"--x----x--",
        "booking_com_is_published_company_logos":"--x----x--",
        "booking_com_publish_company_infos":"--x----x--",
        "booking_com_is_published_company_infos":"--x----x--",
        "vacayhome_currencies":"USD",
        "vacayhome_statuses":"COMPLETED",
        "vacayhome_cancellation_policies":"firm",
        "vacayhome_cancellation_penalties":100.0,
        "vacayhome_creation_times":"2024-08-30T20:30:47.681Z",
        "listing_room_ids":"66c30cd499e922187e4f7090--x--66c30cd499e922187e4f7091--x--66c30cd499e922187e4f7092--x--66c30cd499e922187e4f7093--x--66c30cd499e922187e4f7094--x--66c30cd499e922187e4f7095--x--66c30cd499e922187e4f7096",
        "listing_room_numbers":null,
        "listing_room_bed_ids":"6700ed5152664300118a57f8--x--6700ed5152664300118a57fa--x--6700ed5152664300118a57fc--x--6700ed5152664300118a57fe",
        "listing_room_bed_types":"KING_BED--x--KING_BED--x--QUEEN_BED--x--QUEEN_BED",
        "listing_room_bed_quantities":"1--x--1--x--2--x--1",
        "custom_field_values":"Arrival and Parking: \n- Parking is available for 2 vehicles in the driveway, and additional parking is available on the street. \n\u00c2\u00a0\nAccess Instructions: \n- Once parked, please proceed to the front door which is equipped with a keyless lock for entry.\n\u00c2\u00a0\nLock Instructions:\nTo unlock and enter the home:\n- Enter the code provided above followed by a checkmark to gain access to the home. The code will activate right at 4pm.\n- The door does NOT lock automatically so please lock when you leave.\n- Press any button on the keypad followed by a checkmark to lock the home before your departure.\u00c2\u00a0\n\u00c2\u00a0\nWireless Internet Information: \nNetwork: 93D3\nPassword: calmmethod574\n\nLaundry: \n- Washer and dryer are located in the utility room.\n\u00c2\u00a0\nTrash: \n- Trash is picked up on Thursday. \n\u00c2\u00a0\nAdditional Information: \u00c2\u00a0\n- We provide a starter set of supplies, but for longer stays you will likely want buy or bring more. These complimentary amenities are provided free of charge and are included in the blue boxes in the kitchen and bathrooms so please help yourselves!\n- This home\u00c2\u00a0is\u00c2\u00a0pet friendly. A Maximum of 2 Dogs may be brought to this home. Puppies and untrained animals are not permitted.\n-\u00c2\u00a0If you are bringing a pet, please ensure that they are added to the reservation and that the pet fee is paid. This property allows up to a maximum of 2 pet(s). An additional flat fee of $150 applies, and a maximum of 2 pets are allowed in the unit.\n- Please reach out if you would like us to send you the entire list of house rules before your arrival.  --x--To originate from Austin Bergstrom Airport:\n\u00c2\u00a0\nTake Hotel Dr to State Hwy 71 W\nHead southwest on Presidential Blvd toward Service Dr\nSlight right onto Service Dr\nTurn right onto Hotel Dr\nTurn right onto Spirit of Texas Dr\nTurn left to merge onto State Hwy 71 W\nUse the left 3 lanes to stay on State Hwy 71 \nContinue on State Hwy 71 W to W Ben White Blvd\/W Texas Hwy 71 Service Rd. Take the exit toward Manchaca Rd\/Pack Saddle Pass\/Victory Dr from US-290 W\nKeep left to stay on State Hwy 71 W\nContinue onto State Hwy 71 W\/US-290 W\nTake the exit toward Manchaca Rd\/Pack Saddle Pass\/Victory Dr\nTake Menchaca Rd to Winfield Cove\nMerge onto W Ben White Blvd\/W Texas Hwy 71 Service Rd\n\u00c2\u00a0Pass by Whataburger (on the right)\nTurn right onto Menchaca Rd\nTurn right onto Larchmont Dr\nTurn right onto Winfield Cove\n\u00c2\u00a0Destination will be on the left\n\u00c2\u00a0\n3605 Winfield Cove\nAustin TX 78704--x----x--1 set of towels (bath towel, hand towel, washcloth) per occupant (up to max occupancy on listing). 2 rolls of toilet paper, bar soap, hand lotion and wastebasket trash bag per bathroom. Shampoo, conditioner, &amp; body wash per full bathroom. 2 rolls of paper towels, fresh sponge, dish soap, 2 loads of dishwasher detergent, 2 additional trash bags per kitchen. 2 loads of laundry detergent per home. (with in-house laundry systems).--x--Bedroom off kitchen--x--Utility Room--x--2--x--https:\/\/www.grandwelcome.com\/vrp\/unit\/South_Lamar_Serenity-104145-15--x--https:\/\/www.airbnb.com\/rooms\/1161590813480749655--x--https:\/\/www.vrbo.com\/9957449ha--x----x----x----x----x--150--x--150--x--Downtown--x--Driveway + additional street parking--x--2--x--Thursday--x--No Pool Heating Policy Defined--x--N\/A--x--Backup Keyless Entry Code 013605\nEmergency Lockbox (Internal Use) 2580",
        "import_time":"2024-08-16T14:58:06.569Z",
        "date_of_first_scrape":1735178160000,
        "date_of_last_update":null,
        "date_of_last_scrape":1735178160000,
        "summary":"property_address1: nan, property_address2: nan, property_building: nan, property_id: 1204, property_notes_access: nan, property_notes_general: nan, property_notes_guest_access: nan, property_photos_url: nan, property_state: nan, property_status: nan, listing_id: 66bf68fe3041f6000e104abb, saas_auto_renew: True, cleaning_fee_id: 6709168f3931bc0012ca6e12, cleaning_fee_value_type: FIXED, cleaning_fee_formula: 250, cleaning_fee_multiplier: PER_STAY, channel_commission_use_account_settings: True, channel_commission_id: 67334bb16d8308d981974920, channel_commission_created_at: 2024-11-12T12:36:01.706Z, channel_commission_updated_at: 2024-12-11T07:01:40.601Z, cleaning_status: dirty, picture_caption: Exterior, picture_thumbnail: https:\/\/track-pm.s3.amazonaws.com\/gw\/image\/0f9b3681-b846-4963-bd38-7983f188cdd4, minimum_nights: 1, maximum_nights: 365.0, monthly_price_factor: 1, weekly_price_factor: 1.0, base_price: 1.0, weekend_base_price: 375.0, currency: USD, cleaning_fee: 250.0, confirmed_before_checkin_delay_minutes: 45.0, confirmed_day_of_checkin_delay_minutes: 45.0, confirmed_day_of_checkout_delay_minutes: 45.0, confirmed_during_stay_delay_minutes: 45.0, confirmed_after_checkout_delay_minutes: 45.0, unconfirmed_first_message_delay_minutes: 45.0, unconfirmed_subsequent_message_delay_minutes: 45.0, answeing_machine_is_active: 1.0, auto_reviews_status: 1.0, auto_payments_time_relation_names: AT--x--BEFORE, auto_payments_time_relation_units: DAYS--x--DAYS, auto_payments_time_relation_amounts: 1--x--14, pms_cleaning_status: 1.0, calendar_rules_default_availability: AVAILABLE, bookingcom_cut_off_hours_enabled: nan, expedia_cut_off_hours_enabled: nan, airbnb_cut_off_hours_enabled: nan, directbookings_cut_off_hours_enabled: nan, calendar_rules_default_hours: 24.0, calendar_rules_allow_request_to_book: nan, calendar_rules_advance_notice_updated_at: 2024-09-10T19:33:31.203Z, calendar_rules_advance_notice_updated_by: Data Import, booking_window_default_days: 365.0, booking_window_updated_at: 2024-08-16T14:58:06.559Z, preparation_time_updated_at: 2024-08-16T14:58:06.557Z, dynamic_checkin_updated_at: 2024-08-29T17:26:45.134Z, rental_periods_request_to_book: nan, rental_periods_ids: 66bf68fe3041f6000e104abf, rental_periods_from: 2024-08-15 00:00:00, default_availability_updated_at: 2024-09-11T20:02:28.217Z, default_availability_updated_by: Data Import, listing_type: SINGLE, owners_list: 66bf907bf9b8639a586a35c9, amenities_list: Air conditioning--x--Bed linens--x--Blender--x--Body soap--x--Carbon monoxide detector--x--Ceiling fan--x--Coffee maker--x--Conditioner--x--Cookware--x--Dining table--x--Dishes and silverware--x--Dishwasher--x--Downtown--x--Dryer--x--Essentials--x--Free parking on premises--x--Free parking on street--x--Golf - Optional--x--Hair dryer--x--Heating--x--Hot water--x--Ice maker--x--Internet--x--Iron--x--Kitchen--x--Laptop friendly workspace--x--Microwave--x--Museums--x--Oven--x--Private entrance--x--Refrigerator--x--Shampoo--x--Shopping--x--Smoke detector--x--Stove--x--TV--x--Toaster--x--Town--x--Washer--x--Wireless Internet--x--Free parking on Street, amenities_not_included_list: nan, use_account_revenue_share: 1.0, use_account_taxes: nan, use_account_markups: 1.0, use_account_additional_fees: nan, is_active: 1.0, net_income_formula: host_payout, commission_formula: net_income, owner_revenue_formula: net_income - pm_commission, tax_ids: 66e1da70055feb22b0330374--x--66e1da70059dc7ccf8e9c2d8, tax_types: STATE_TAX--x--OCCUPANCY_TAX, tax_amounts: 6--x--11, tax_names: Texas State Tax--x--Travis Cty Hotel Occupancy Tax, tax_units: PERCENTAGE--x--PERCENTAGE, tax_quantifiers: PER_STAY--x--PER_STAY, taxes_applied_to_all_fees: True--x--True, taxes_applied_on_fees: AF,CF,ADDITIONAL_BED,AIR_CONDITIONING,EARLY_CHECK_IN,LATE_CHECK_IN,BABY_BED,CLEANING,CLUB_CARD,CONCIERGE,EARLY_CHECKOUT,LATE_CHECKOUT,DEPOSIT,ELECTRICITY,FOOD,HEATING,INTERNET,LAUNDRY,LINENS,TOWELS,MANAGEMENT,OIL,PARKING,PET,POOL,POOL_HEATING,RESORT,SERVICE,TOILETRIES,TOUR,TRANSPORTATION,CAR_RENTAL,WATER,WOOD,TRANSFER,HOUSEKEEPING,INSURANCE,COMMUNITY,CREDIT_CARD_PROCESSING_FEE,DAMAGE_WAIVER,VIP_SERVICES,PAYMENT_FEE,ADDITIONAL_CHARGE,MISCELLANEOUS,SHIPPING,VALET,ACTIVITIES,FLIGHTS,GIFT_BASKET,SPA,CHEF,MEET_AND_GREET,DOCK_FEE,UTILITY_FEE,HOT_TUB,BOOKING_FEE,BREAKFAST,BEVERAGE,MEAL,WELLNESS,MINIBAR,BUSINESS_CENTER,WIFI,GUEST_SERVICE,COMMISSION_CHARGE,EQUIPMENT_RENTAL,RESERVATION_FEE,DAMAGE_CHARGE,HOMEOWNERS_ASSOCIATION,GOLF_CART_RENTAL, taxes_are_applied_by_default: --x--, tax_conditional_overrides_view_types: LOS--x--LOS, tax_conditional_overrides_max_nights: 29--x--29, tax___vs: --x--, pre_bookings_list: nan, origin_id: 104145.0, nick_name: South Lamar Serenity, minimum_age: 18.0, address_full: 3605 Winfield Cove, Austin, TX 78704, USA, address_street: 3605 Winfield Cove, address_city: Austin, address_country: United States, address_latitude: 30.2364048, address_longitude: -97.7807659, address_zip_code: 78704.0, address_state: Texas, address_county: nan, room_type: Entire home\/apt, property_type: House, ota_room_type: Holiday home, accommodates: 10.0, bathrooms: 3.0, bedrooms: 4.0, beds_count: 5.0, listing_status: 1.0, host_name: Grand Welcome Austin, wifi_name: 93D3, wifi_password: calmmethod574, area_in_square_feet: 1683.0, trash_collection_day: nan, parking_instructions: Driveway + additional street parking, created_at: 2024-04-19T00:00:00.000Z, origin: track, default_check_in_time: 16:00:00, default_check_out_time: 10:00:00, check_in_instructions: Arrival and Parking: \n- Parking is available for 2 vehicles in the driveway, and additional parking is available on the street. \n\u00c2\u00a0\nAccess Instructions: \n- Once parked, please proceed to the front door which is equipped with a keyless lock for entry.\n\u00c2\u00a0\nLock Instructions:\nTo unlock and enter the home:\n- Enter the code provided above followed by a checkmark to gain access to the home. The code will activate right at 4pm.\n- The door does NOT lock automatically so please lock when you leave.\n- Press any button on the keypad followed by a checkmark to lock the home before your departure.\u00c2\u00a0\n\u00c2\u00a0\nWireless Internet Information: \nNetwork: 93D3\nPassword: calmmethod574\n\nLaundry: \n- Washer and dryer are located in the utility room.\n\u00c2\u00a0\nTrash: \n- Trash is picked up on Thursday. \n\u00c2\u00a0\nAdditional Information: \u00c2\u00a0\n- We provide a starter set of supplies, but for longer stays you will likely want buy or bring more. These complimentary amenities are provided free of charge and are included in the blue boxes in the kitchen and bathrooms so please help yourselves!\n- This home\u00c2\u00a0is\u00c2\u00a0pet friendly. A Maximum of 2 Dogs may be brought to this home. Puppies and untrained animals are not permitted.\n-\u00c2\u00a0If you are bringing a pet, please ensure that they are added to the reservation and that the pet fee is paid. This property allows up to a maximum of 2 pet(s). An additional flat fee of $150 applies, and a maximum of 2 pets are allowed in the unit.\n- Please reach out if you would like us to send you the entire list of house rules before your arrival.  , check_out_instructions: - Set AC to 74 in the summer months  \n- Set heater to 65 in the winter months \n- Bag all garbage and place is designated trash location \n- Load all dirty dishes in the dishwasher and start the dishwasher \n- Place all used towels on the ground in the bathr, account_id: 66a30f208b331811b8e96639, time_zone: America\/Chicago, last_updated_at: 2024-11-26T22:27:14.314Z, integration_ids: 66d0af0bb6ad7bcfca3bf989--x--66d8cd59cc4df40011491532--x--66e1a279352e665645cd4fe0, integration_platforms: vacayHome--x--homeaway2--x--airbnb2, booking_com_initial_complex_listings: --x----x--, booking_com_publish_company_logos: --x----x--, booking_com_is_published_company_logos: --x----x--, booking_com_publish_company_infos: --x----x--, booking_com_is_published_company_infos: --x----x--, vacayhome_currencies: USD, vacayhome_statuses: COMPLETED, vacayhome_cancellation_policies: firm, vacayhome_cancellation_penalties: 100.0, vacayhome_creation_times: 2024-08-30T20:30:47.681Z, listing_room_ids: 66c30cd499e922187e4f7090--x--66c30cd499e922187e4f7091--x--66c30cd499e922187e4f7092--x--66c30cd499e922187e4f7093--x--66c30cd499e922187e4f7094--x--66c30cd499e922187e4f7095--x--66c30cd499e922187e4f7096, listing_room_numbers: nan, listing_room_bed_ids: 6700ed5152664300118a57f8--x--6700ed5152664300118a57fa--x--6700ed5152664300118a57fc--x--6700ed5152664300118a57fe, listing_room_bed_types: KING_BED--x--KING_BED--x--QUEEN_BED--x--QUEEN_BED, listing_room_bed_quantities: 1--x--1--x--2--x--1, custom_field_values: Arrival and Parking: \n- Parking is available for 2 vehicles in the driveway, and additional parking is available on the street. \n\u00c2\u00a0\nAccess Instructions: \n- Once parked, please proceed to the front door which is equipped with a keyless lock for entry.\n\u00c2\u00a0\nLock Instructions:\nTo unlock and enter the home:\n- Enter the code provided above followed by a checkmark to gain access to the home. The code will activate right at 4pm.\n- The door does NOT lock automatically so please lock when you leave.\n- Press any button on the keypad followed by a checkmark to lock the home before your departure.\u00c2\u00a0\n\u00c2\u00a0\nWireless Internet Information: \nNetwork: 93D3\nPassword: calmmethod574\n\nLaundry: \n- Washer and dryer are located in the utility room.\n\u00c2\u00a0\nTrash: \n- Trash is picked up on Thursday. \n\u00c2\u00a0\nAdditional Information: \u00c2\u00a0\n- We provide a starter set of supplies, but for longer stays you will likely want buy or bring more. These complimentary amenities are provided free of charge and are included in the blue boxes in the kitchen and bathrooms so please help yourselves!\n- This home\u00c2\u00a0is\u00c2\u00a0pet friendly. A Maximum of 2 Dogs may be brought to this home. Puppies and untrained animals are not permitted.\n-\u00c2\u00a0If you are bringing a pet, please ensure that they are added to the reservation and that the pet fee is paid. This property allows up to a maximum of 2 pet(s). An additional flat fee of $150 applies, and a maximum of 2 pets are allowed in the unit.\n- Please reach out if you would like us to send you the entire list of house rules before your arrival.  --x--To originate from Austin Bergstrom Airport:\n\u00c2\u00a0\nTake Hotel Dr to State Hwy 71 W\nHead southwest on Presidential Blvd toward Service Dr\nSlight right onto Service Dr\nTurn right onto Hotel Dr\nTurn right onto Spirit of Texas Dr\nTurn left to merge onto State Hwy 71 W\nUse the left 3 lanes to stay on State Hwy 71 \nContinue on State Hwy 71 W to W Ben White Blvd\/W Texas Hwy 71 Service Rd. Take the exit toward Manchaca Rd\/Pack Saddle Pass\/Victory Dr from US-290 W\nKeep left to stay on State Hwy 71 W\nContinue onto State Hwy 71 W\/US-290 W\nTake the exit toward Manchaca Rd\/Pack Saddle Pass\/Victory Dr\nTake Menchaca Rd to Winfield Cove\nMerge onto W Ben White Blvd\/W Texas Hwy 71 Service Rd\n\u00c2\u00a0Pass by Whataburger (on the right)\nTurn right onto Menchaca Rd\nTurn right onto Larchmont Dr\nTurn right onto Winfield Cove\n\u00c2\u00a0Destination will be on the left\n\u00c2\u00a0\n3605 Winfield Cove\nAustin TX 78704--x----x--1 set of towels (bath towel, hand towel, washcloth) per occupant (up to max occupancy on listing). 2 rolls of toilet paper, bar soap, hand lotion and wastebasket trash bag per bathroom. Shampoo, conditioner, &amp; body wash per full bathroom. 2 rolls of paper towels, fresh sponge, dish soap, 2 loads of dishwasher detergent, 2 additional trash bags per kitchen. 2 loads of laundry detergent per home. (with in-house laundry systems).--x--Bedroom off kitchen--x--Utility Room--x--2--x--https:\/\/www.grandwelcome.com\/vrp\/unit\/South_Lamar_Serenity-104145-15--x--https:\/\/www.airbnb.com\/rooms\/1161590813480749655--x--https:\/\/www.vrbo.com\/9957449ha--x----x----x----x----x--150--x--150--x--Downtown--x--Driveway + additional street parking--x--2--x--Thursday--x--No Pool Heating Policy Defined--x--N\/A--x--Backup Keyless Entry Code 013605\nEmergency Lockbox (Internal Use) 2580, import_time: 2024-08-16T14:58:06.569Z, date_of_first_scrape: 2024-12-26 01:56:00, date_of_last_update: nan, date_of_last_scrape: 2024-12-26 01:56:00"
    },
    {
        "property_address1":"844 Cherokee Ave #11",
        "property_address2":null,
        "property_building":"Cherokee",
        "property_id":453841,
        "property_notes_access":"<p class=RichTextInputTheme__paragraph\" dir=\"ltr\"><span class=\"RichTextInputTheme__textBase\">Backup Keyless Entry Code:  005587<\/span><\/p><p class=\"RichTextInputTheme__paragraph\" dir=\"ltr\"><span class=\"RichTextInputTheme__textBase\">Garage Code:  7106<\/span><\/p><p class=\"RichTextInputTheme__paragraph\" dir=\"ltr\"><span class=\"RichTextInputTheme__textBase\">Emergency Lockbox - 5976 (front door handle).<\/span><\/p><p class=\"RichTextInputTheme__paragraph\" dir=\"ltr\"><br><\/p>\"",
        "property_notes_general":"<p class=RichTextInputTheme__paragraph\" dir=\"ltr\"><span class=\"RichTextInputTheme__textBase\">Backup Keyless Entry Code:  005587<\/span><\/p><p class=\"RichTextInputTheme__paragraph\" dir=\"ltr\"><span class=\"RichTextInputTheme__textBase\">Garage Code:  7106<\/span><\/p><p class=\"RichTextInputTheme__paragraph\" dir=\"ltr\"><span class=\"RichTextInputTheme__textBase\">Emergency Lockbox - 5976 (front door handle).<\/span><\/p><p class=\"RichTextInputTheme__paragraph\" dir=\"ltr\"><br><\/p><p class=\"RichTextInputTheme__paragraph\" dir=\"ltr\"><span class=\"RichTextInputTheme__textBase\">Layout: 3 levels<\/span><\/p><p class=\"RichTextInputTheme__paragraph\" dir=\"ltr\"><span class=\"RichTextInputTheme__textBase\">1st Floor: 1 bedroom",
        "property_notes_guest_access":" 1 full bath",
        "property_photos_url":" laundry <\/span><\/p><p class=\"RichTextInputTheme__paragraph\" dir=\"ltr\"><br><span class=\"RichTextInputTheme__textBase\">Each bedroom does have a TV for this unit. There\u00e2\u20ac\u2122s 4 TVs total (including the living room)<\/span><\/p><p class=\"RichTextInputTheme__paragraph\" dir=\"ltr\"><br><\/p><p class=\"RichTextInputTheme__paragraph\" dir=\"ltr\"><i><b><strong class=\"RichTextInputTheme__textBase RichTextInputTheme__textBold RichTextInputTheme__textItalic\">***OWNER NOTES***<\/strong><\/b><\/i><\/p><p class=\"RichTextInputTheme__paragraph\" dir=\"ltr\"><span class=\"RichTextInputTheme__textBase\">Owner -<\/span><\/p><p class=\"RichTextInputTheme__paragraph\" dir=\"ltr\"><span class=\"RichTextInputTheme__textBase\">Currently Escalated? Yes<\/span><\/p><p class=\"RichTextInputTheme__paragraph\" dir=\"ltr\"><span class=\"RichTextInputTheme__textBase\">Escalated within last 30 days? Yes<\/span><\/p><p class=\"RichTextInputTheme__paragraph\" dir=\"ltr\"><span class=\"RichTextInputTheme__textBase\">Persona - hands off investor<\/span><\/p><p class=\"RichTextInputTheme__paragraph\" dir=\"ltr\"><span class=\"RichTextInputTheme__textBase\">Owner Restrictions? No<\/span><\/p>\"",
        "property_state":"TN",
        "property_status":"active",
        "listing_id":null,
        "saas_auto_renew":null,
        "cleaning_fee_id":null,
        "cleaning_fee_value_type":null,
        "cleaning_fee_formula":null,
        "cleaning_fee_multiplier":null,
        "channel_commission_use_account_settings":null,
        "channel_commission_id":null,
        "channel_commission_created_at":null,
        "channel_commission_updated_at":null,
        "cleaning_status":null,
        "picture_caption":null,
        "picture_thumbnail":null,
        "minimum_nights":null,
        "maximum_nights":null,
        "monthly_price_factor":null,
        "weekly_price_factor":null,
        "base_price":null,
        "weekend_base_price":null,
        "currency":null,
        "cleaning_fee":null,
        "confirmed_before_checkin_delay_minutes":null,
        "confirmed_day_of_checkin_delay_minutes":null,
        "confirmed_day_of_checkout_delay_minutes":null,
        "confirmed_during_stay_delay_minutes":null,
        "confirmed_after_checkout_delay_minutes":null,
        "unconfirmed_first_message_delay_minutes":null,
        "unconfirmed_subsequent_message_delay_minutes":null,
        "answeing_machine_is_active":null,
        "auto_reviews_status":null,
        "auto_payments_time_relation_names":null,
        "auto_payments_time_relation_units":null,
        "auto_payments_time_relation_amounts":null,
        "pms_cleaning_status":null,
        "calendar_rules_default_availability":null,
        "bookingcom_cut_off_hours_enabled":null,
        "expedia_cut_off_hours_enabled":null,
        "airbnb_cut_off_hours_enabled":null,
        "directbookings_cut_off_hours_enabled":null,
        "calendar_rules_default_hours":null,
        "calendar_rules_allow_request_to_book":null,
        "calendar_rules_advance_notice_updated_at":null,
        "calendar_rules_advance_notice_updated_by":null,
        "booking_window_default_days":null,
        "booking_window_updated_at":null,
        "preparation_time_updated_at":null,
        "dynamic_checkin_updated_at":null,
        "rental_periods_request_to_book":null,
        "rental_periods_ids":null,
        "rental_periods_from":null,
        "default_availability_updated_at":null,
        "default_availability_updated_by":null,
        "listing_type":null,
        "owners_list":null,
        "amenities_list":null,
        "amenities_not_included_list":null,
        "use_account_revenue_share":null,
        "use_account_taxes":null,
        "use_account_markups":null,
        "use_account_additional_fees":null,
        "is_active":null,
        "net_income_formula":null,
        "commission_formula":null,
        "owner_revenue_formula":null,
        "tax_ids":null,
        "tax_types":null,
        "tax_amounts":null,
        "tax_names":null,
        "tax_units":null,
        "tax_quantifiers":null,
        "taxes_applied_to_all_fees":null,
        "taxes_applied_on_fees":null,
        "taxes_are_applied_by_default":null,
        "tax_conditional_overrides_view_types":null,
        "tax_conditional_overrides_max_nights":null,
        "tax___vs":null,
        "pre_bookings_list":null,
        "origin_id":null,
        "nick_name":null,
        "minimum_age":null,
        "address_full":null,
        "address_street":null,
        "address_city":null,
        "address_country":null,
        "address_latitude":null,
        "address_longitude":null,
        "address_zip_code":null,
        "address_state":null,
        "address_county":null,
        "room_type":null,
        "property_type":null,
        "ota_room_type":null,
        "accommodates":null,
        "bathrooms":null,
        "bedrooms":null,
        "beds_count":null,
        "listing_status":null,
        "host_name":null,
        "wifi_name":null,
        "wifi_password":null,
        "area_in_square_feet":null,
        "trash_collection_day":null,
        "parking_instructions":null,
        "created_at":null,
        "origin":null,
        "default_check_in_time":null,
        "default_check_out_time":null,
        "check_in_instructions":null,
        "check_out_instructions":null,
        "account_id":null,
        "time_zone":null,
        "last_updated_at":null,
        "integration_ids":null,
        "integration_platforms":null,
        "booking_com_initial_complex_listings":null,
        "booking_com_publish_company_logos":null,
        "booking_com_is_published_company_logos":null,
        "booking_com_publish_company_infos":null,
        "booking_com_is_published_company_infos":null,
        "vacayhome_currencies":null,
        "vacayhome_statuses":null,
        "vacayhome_cancellation_policies":null,
        "vacayhome_cancellation_penalties":null,
        "vacayhome_creation_times":null,
        "listing_room_ids":null,
        "listing_room_numbers":null,
        "listing_room_bed_ids":null,
        "listing_room_bed_types":null,
        "listing_room_bed_quantities":null,
        "custom_field_values":null,
        "import_time":null,
        "date_of_first_scrape":null,
        "date_of_last_update":null,
        "date_of_last_scrape":null,
        "summary":"property_address1: 844 Cherokee Ave #11, property_address2: nan, property_building: Cherokee, property_id: 453841, property_notes_access: <p class=RichTextInputTheme__paragraph\" dir=\"ltr\"><span class=\"RichTextInputTheme__textBase\">Backup Keyless Entry Code:  005587<\/span><\/p><p class=\"RichTextInputTheme__paragraph\" dir=\"ltr\"><span class=\"RichTextInputTheme__textBase\">Garage Code:  7106<\/span><\/p><p class=\"RichTextInputTheme__paragraph\" dir=\"ltr\"><span class=\"RichTextInputTheme__textBase\">Emergency Lockbox - 5976 (front door handle).<\/span><\/p><p class=\"RichTextInputTheme__paragraph\" dir=\"ltr\"><br><\/p>\", property_notes_general: <p class=RichTextInputTheme__paragraph\" dir=\"ltr\"><span class=\"RichTextInputTheme__textBase\">Backup Keyless Entry Code:  005587<\/span><\/p><p class=\"RichTextInputTheme__paragraph\" dir=\"ltr\"><span class=\"RichTextInputTheme__textBase\">Garage Code:  7106<\/span><\/p><p class=\"RichTextInputTheme__paragraph\" dir=\"ltr\"><span class=\"RichTextInputTheme__textBase\">Emergency Lockbox - 5976 (front door handle).<\/span><\/p><p class=\"RichTextInputTheme__paragraph\" dir=\"ltr\"><br><\/p><p class=\"RichTextInputTheme__paragraph\" dir=\"ltr\"><span class=\"RichTextInputTheme__textBase\">Layout: 3 levels<\/span><\/p><p class=\"RichTextInputTheme__paragraph\" dir=\"ltr\"><span class=\"RichTextInputTheme__textBase\">1st Floor: 1 bedroom, property_notes_guest_access:  1 full bath, property_photos_url:  laundry <\/span><\/p><p class=\"RichTextInputTheme__paragraph\" dir=\"ltr\"><br><span class=\"RichTextInputTheme__textBase\">Each bedroom does have a TV for this unit. There\u00e2\u20ac\u2122s 4 TVs total (including the living room)<\/span><\/p><p class=\"RichTextInputTheme__paragraph\" dir=\"ltr\"><br><\/p><p class=\"RichTextInputTheme__paragraph\" dir=\"ltr\"><i><b><strong class=\"RichTextInputTheme__textBase RichTextInputTheme__textBold RichTextInputTheme__textItalic\">***OWNER NOTES***<\/strong><\/b><\/i><\/p><p class=\"RichTextInputTheme__paragraph\" dir=\"ltr\"><span class=\"RichTextInputTheme__textBase\">Owner -<\/span><\/p><p class=\"RichTextInputTheme__paragraph\" dir=\"ltr\"><span class=\"RichTextInputTheme__textBase\">Currently Escalated? Yes<\/span><\/p><p class=\"RichTextInputTheme__paragraph\" dir=\"ltr\"><span class=\"RichTextInputTheme__textBase\">Escalated within last 30 days? Yes<\/span><\/p><p class=\"RichTextInputTheme__paragraph\" dir=\"ltr\"><span class=\"RichTextInputTheme__textBase\">Persona - hands off investor<\/span><\/p><p class=\"RichTextInputTheme__paragraph\" dir=\"ltr\"><span class=\"RichTextInputTheme__textBase\">Owner Restrictions? No<\/span><\/p>\", property_state: TN, property_status: active, listing_id: nan, saas_auto_renew: nan, cleaning_fee_id: nan, cleaning_fee_value_type: nan, cleaning_fee_formula: nan, cleaning_fee_multiplier: nan, channel_commission_use_account_settings: nan, channel_commission_id: nan, channel_commission_created_at: nan, channel_commission_updated_at: nan, cleaning_status: nan, picture_caption: nan, picture_thumbnail: nan, minimum_nights: nan, maximum_nights: nan, monthly_price_factor: nan, weekly_price_factor: nan, base_price: nan, weekend_base_price: nan, currency: nan, cleaning_fee: nan, confirmed_before_checkin_delay_minutes: nan, confirmed_day_of_checkin_delay_minutes: nan, confirmed_day_of_checkout_delay_minutes: nan, confirmed_during_stay_delay_minutes: nan, confirmed_after_checkout_delay_minutes: nan, unconfirmed_first_message_delay_minutes: nan, unconfirmed_subsequent_message_delay_minutes: nan, answeing_machine_is_active: nan, auto_reviews_status: nan, auto_payments_time_relation_names: nan, auto_payments_time_relation_units: nan, auto_payments_time_relation_amounts: nan, pms_cleaning_status: nan, calendar_rules_default_availability: nan, bookingcom_cut_off_hours_enabled: nan, expedia_cut_off_hours_enabled: nan, airbnb_cut_off_hours_enabled: nan, directbookings_cut_off_hours_enabled: nan, calendar_rules_default_hours: nan, calendar_rules_allow_request_to_book: nan, calendar_rules_advance_notice_updated_at: nan, calendar_rules_advance_notice_updated_by: nan, booking_window_default_days: nan, booking_window_updated_at: nan, preparation_time_updated_at: nan, dynamic_checkin_updated_at: nan, rental_periods_request_to_book: nan, rental_periods_ids: nan, rental_periods_from: NaT, default_availability_updated_at: nan, default_availability_updated_by: nan, listing_type: nan, owners_list: nan, amenities_list: nan, amenities_not_included_list: nan, use_account_revenue_share: nan, use_account_taxes: nan, use_account_markups: nan, use_account_additional_fees: nan, is_active: nan, net_income_formula: nan, commission_formula: nan, owner_revenue_formula: nan, tax_ids: nan, tax_types: nan, tax_amounts: nan, tax_names: nan, tax_units: nan, tax_quantifiers: nan, taxes_applied_to_all_fees: nan, taxes_applied_on_fees: nan, taxes_are_applied_by_default: nan, tax_conditional_overrides_view_types: nan, tax_conditional_overrides_max_nights: nan, tax___vs: nan, pre_bookings_list: nan, origin_id: nan, nick_name: nan, minimum_age: nan, address_full: nan, address_street: nan, address_city: nan, address_country: nan, address_latitude: nan, address_longitude: nan, address_zip_code: nan, address_state: nan, address_county: nan, room_type: nan, property_type: nan, ota_room_type: nan, accommodates: nan, bathrooms: nan, bedrooms: nan, beds_count: nan, listing_status: nan, host_name: nan, wifi_name: nan, wifi_password: nan, area_in_square_feet: nan, trash_collection_day: nan, parking_instructions: nan, created_at: nan, origin: nan, default_check_in_time: nan, default_check_out_time: nan, check_in_instructions: nan, check_out_instructions: nan, account_id: nan, time_zone: nan, last_updated_at: nan, integration_ids: nan, integration_platforms: nan, booking_com_initial_complex_listings: nan, booking_com_publish_company_logos: nan, booking_com_is_published_company_logos: nan, booking_com_publish_company_infos: nan, booking_com_is_published_company_infos: nan, vacayhome_currencies: nan, vacayhome_statuses: nan, vacayhome_cancellation_policies: nan, vacayhome_cancellation_penalties: nan, vacayhome_creation_times: nan, listing_room_ids: nan, listing_room_numbers: nan, listing_room_bed_ids: nan, listing_room_bed_types: nan, listing_room_bed_quantities: nan, custom_field_values: nan, import_time: nan, date_of_first_scrape: NaT, date_of_last_update: nan, date_of_last_scrape: NaT"
    },
    {
        "property_address1":"2919 Morningside Dr",
        "property_address2":null,
        "property_building":null,
        "property_id":453845,
        "property_notes_access":"<p class=RichTextInputTheme__paragraph\" dir=\"ltr\"><span class=\"RichTextInputTheme__textBase\">Master Code: 029190<\/span><\/p>\"",
        "property_notes_general":"<p class=RichTextInputTheme__paragraph\" dir=\"ltr\"><span class=\"RichTextInputTheme__textBase\">Master Code: 029190<\/span><\/p><p class=\"RichTextInputTheme__paragraph\" dir=\"ltr\"><span class=\"RichTextInputTheme__textBase\">Lock box code - 9174<\/span><\/p><p class=\"RichTextInputTheme__paragraph\" dir=\"ltr\"><span class=\"RichTextInputTheme__textBase\">Lockbox location - front door knob.<\/span><\/p><p class=\"RichTextInputTheme__paragraph\" dir=\"ltr\"><i><b><strong class=\"RichTextInputTheme__textBase RichTextInputTheme__textBold RichTextInputTheme__textItalic\">***OWNER NOTES***<\/strong><\/b><\/i><\/p><p class=\"RichTextInputTheme__paragraph\" dir=\"ltr\"><span class=\"RichTextInputTheme__textBase\">Owner -<\/span><\/p><p class=\"RichTextInputTheme__paragraph\" dir=\"ltr\"><span class=\"RichTextInputTheme__textBase\">Currently Escalated? No<\/span><\/p><p class=\"RichTextInputTheme__paragraph\" dir=\"ltr\"><span class=\"RichTextInputTheme__textBase\">Escalated within last 30 days? No<\/span><\/p><p class=\"RichTextInputTheme__paragraph\" dir=\"ltr\"><span class=\"RichTextInputTheme__textBase\">Persona - <\/span><\/p><p class=\"RichTextInputTheme__paragraph\" dir=\"ltr\"><span class=\"RichTextInputTheme__textBase\">Owner Restrictions? No<\/span><\/p>\"",
        "property_notes_guest_access":"<p class=RichTextInputTheme__paragraph\" dir=\"ltr\"><b><strong class=\"RichTextInputTheme__textBase RichTextInputTheme__textBold\">Arrival and Parking: <\/strong><\/b><\/p><p class=\"RichTextInputTheme__paragraph\" dir=\"ltr\"><span class=\"RichTextInputTheme__textBase\">Parking available for one mid-size or smaller vehicle in the shared driveway. Additional street parking available at a first-come",
        "property_photos_url":" sofa and en suite bathroom--x--Master bedroom: King bed",
        "property_state":"TN",
        "property_status":"active",
        "listing_id":null,
        "saas_auto_renew":null,
        "cleaning_fee_id":null,
        "cleaning_fee_value_type":null,
        "cleaning_fee_formula":null,
        "cleaning_fee_multiplier":null,
        "channel_commission_use_account_settings":null,
        "channel_commission_id":null,
        "channel_commission_created_at":null,
        "channel_commission_updated_at":null,
        "cleaning_status":null,
        "picture_caption":null,
        "picture_thumbnail":null,
        "minimum_nights":null,
        "maximum_nights":null,
        "monthly_price_factor":null,
        "weekly_price_factor":null,
        "base_price":null,
        "weekend_base_price":null,
        "currency":null,
        "cleaning_fee":null,
        "confirmed_before_checkin_delay_minutes":null,
        "confirmed_day_of_checkin_delay_minutes":null,
        "confirmed_day_of_checkout_delay_minutes":null,
        "confirmed_during_stay_delay_minutes":null,
        "confirmed_after_checkout_delay_minutes":null,
        "unconfirmed_first_message_delay_minutes":null,
        "unconfirmed_subsequent_message_delay_minutes":null,
        "answeing_machine_is_active":null,
        "auto_reviews_status":null,
        "auto_payments_time_relation_names":null,
        "auto_payments_time_relation_units":null,
        "auto_payments_time_relation_amounts":null,
        "pms_cleaning_status":null,
        "calendar_rules_default_availability":null,
        "bookingcom_cut_off_hours_enabled":null,
        "expedia_cut_off_hours_enabled":null,
        "airbnb_cut_off_hours_enabled":null,
        "directbookings_cut_off_hours_enabled":null,
        "calendar_rules_default_hours":null,
        "calendar_rules_allow_request_to_book":null,
        "calendar_rules_advance_notice_updated_at":null,
        "calendar_rules_advance_notice_updated_by":null,
        "booking_window_default_days":null,
        "booking_window_updated_at":null,
        "preparation_time_updated_at":null,
        "dynamic_checkin_updated_at":null,
        "rental_periods_request_to_book":null,
        "rental_periods_ids":null,
        "rental_periods_from":null,
        "default_availability_updated_at":null,
        "default_availability_updated_by":null,
        "listing_type":null,
        "owners_list":null,
        "amenities_list":null,
        "amenities_not_included_list":null,
        "use_account_revenue_share":null,
        "use_account_taxes":null,
        "use_account_markups":null,
        "use_account_additional_fees":null,
        "is_active":null,
        "net_income_formula":null,
        "commission_formula":null,
        "owner_revenue_formula":null,
        "tax_ids":null,
        "tax_types":null,
        "tax_amounts":null,
        "tax_names":null,
        "tax_units":null,
        "tax_quantifiers":null,
        "taxes_applied_to_all_fees":null,
        "taxes_applied_on_fees":null,
        "taxes_are_applied_by_default":null,
        "tax_conditional_overrides_view_types":null,
        "tax_conditional_overrides_max_nights":null,
        "tax___vs":null,
        "pre_bookings_list":null,
        "origin_id":null,
        "nick_name":null,
        "minimum_age":null,
        "address_full":null,
        "address_street":null,
        "address_city":null,
        "address_country":null,
        "address_latitude":null,
        "address_longitude":null,
        "address_zip_code":null,
        "address_state":null,
        "address_county":null,
        "room_type":null,
        "property_type":null,
        "ota_room_type":null,
        "accommodates":null,
        "bathrooms":null,
        "bedrooms":null,
        "beds_count":null,
        "listing_status":null,
        "host_name":null,
        "wifi_name":null,
        "wifi_password":null,
        "area_in_square_feet":null,
        "trash_collection_day":null,
        "parking_instructions":null,
        "created_at":null,
        "origin":null,
        "default_check_in_time":null,
        "default_check_out_time":null,
        "check_in_instructions":null,
        "check_out_instructions":null,
        "account_id":null,
        "time_zone":null,
        "last_updated_at":null,
        "integration_ids":null,
        "integration_platforms":null,
        "booking_com_initial_complex_listings":null,
        "booking_com_publish_company_logos":null,
        "booking_com_is_published_company_logos":null,
        "booking_com_publish_company_infos":null,
        "booking_com_is_published_company_infos":null,
        "vacayhome_currencies":null,
        "vacayhome_statuses":null,
        "vacayhome_cancellation_policies":null,
        "vacayhome_cancellation_penalties":null,
        "vacayhome_creation_times":null,
        "listing_room_ids":null,
        "listing_room_numbers":null,
        "listing_room_bed_ids":null,
        "listing_room_bed_types":null,
        "listing_room_bed_quantities":null,
        "custom_field_values":null,
        "import_time":null,
        "date_of_first_scrape":null,
        "date_of_last_update":null,
        "date_of_last_scrape":null,
        "summary":"property_address1: 2919 Morningside Dr, property_address2: nan, property_building: nan, property_id: 453845, property_notes_access: <p class=RichTextInputTheme__paragraph\" dir=\"ltr\"><span class=\"RichTextInputTheme__textBase\">Master Code: 029190<\/span><\/p>\", property_notes_general: <p class=RichTextInputTheme__paragraph\" dir=\"ltr\"><span class=\"RichTextInputTheme__textBase\">Master Code: 029190<\/span><\/p><p class=\"RichTextInputTheme__paragraph\" dir=\"ltr\"><span class=\"RichTextInputTheme__textBase\">Lock box code - 9174<\/span><\/p><p class=\"RichTextInputTheme__paragraph\" dir=\"ltr\"><span class=\"RichTextInputTheme__textBase\">Lockbox location - front door knob.<\/span><\/p><p class=\"RichTextInputTheme__paragraph\" dir=\"ltr\"><i><b><strong class=\"RichTextInputTheme__textBase RichTextInputTheme__textBold RichTextInputTheme__textItalic\">***OWNER NOTES***<\/strong><\/b><\/i><\/p><p class=\"RichTextInputTheme__paragraph\" dir=\"ltr\"><span class=\"RichTextInputTheme__textBase\">Owner -<\/span><\/p><p class=\"RichTextInputTheme__paragraph\" dir=\"ltr\"><span class=\"RichTextInputTheme__textBase\">Currently Escalated? No<\/span><\/p><p class=\"RichTextInputTheme__paragraph\" dir=\"ltr\"><span class=\"RichTextInputTheme__textBase\">Escalated within last 30 days? No<\/span><\/p><p class=\"RichTextInputTheme__paragraph\" dir=\"ltr\"><span class=\"RichTextInputTheme__textBase\">Persona - <\/span><\/p><p class=\"RichTextInputTheme__paragraph\" dir=\"ltr\"><span class=\"RichTextInputTheme__textBase\">Owner Restrictions? No<\/span><\/p>\", property_notes_guest_access: <p class=RichTextInputTheme__paragraph\" dir=\"ltr\"><b><strong class=\"RichTextInputTheme__textBase RichTextInputTheme__textBold\">Arrival and Parking: <\/strong><\/b><\/p><p class=\"RichTextInputTheme__paragraph\" dir=\"ltr\"><span class=\"RichTextInputTheme__textBase\">Parking available for one mid-size or smaller vehicle in the shared driveway. Additional street parking available at a first-come, property_photos_url:  sofa and en suite bathroom--x--Master bedroom: King bed, property_state: TN, property_status: active, listing_id: nan, saas_auto_renew: nan, cleaning_fee_id: nan, cleaning_fee_value_type: nan, cleaning_fee_formula: nan, cleaning_fee_multiplier: nan, channel_commission_use_account_settings: nan, channel_commission_id: nan, channel_commission_created_at: nan, channel_commission_updated_at: nan, cleaning_status: nan, picture_caption: nan, picture_thumbnail: nan, minimum_nights: nan, maximum_nights: nan, monthly_price_factor: nan, weekly_price_factor: nan, base_price: nan, weekend_base_price: nan, currency: nan, cleaning_fee: nan, confirmed_before_checkin_delay_minutes: nan, confirmed_day_of_checkin_delay_minutes: nan, confirmed_day_of_checkout_delay_minutes: nan, confirmed_during_stay_delay_minutes: nan, confirmed_after_checkout_delay_minutes: nan, unconfirmed_first_message_delay_minutes: nan, unconfirmed_subsequent_message_delay_minutes: nan, answeing_machine_is_active: nan, auto_reviews_status: nan, auto_payments_time_relation_names: nan, auto_payments_time_relation_units: nan, auto_payments_time_relation_amounts: nan, pms_cleaning_status: nan, calendar_rules_default_availability: nan, bookingcom_cut_off_hours_enabled: nan, expedia_cut_off_hours_enabled: nan, airbnb_cut_off_hours_enabled: nan, directbookings_cut_off_hours_enabled: nan, calendar_rules_default_hours: nan, calendar_rules_allow_request_to_book: nan, calendar_rules_advance_notice_updated_at: nan, calendar_rules_advance_notice_updated_by: nan, booking_window_default_days: nan, booking_window_updated_at: nan, preparation_time_updated_at: nan, dynamic_checkin_updated_at: nan, rental_periods_request_to_book: nan, rental_periods_ids: nan, rental_periods_from: NaT, default_availability_updated_at: nan, default_availability_updated_by: nan, listing_type: nan, owners_list: nan, amenities_list: nan, amenities_not_included_list: nan, use_account_revenue_share: nan, use_account_taxes: nan, use_account_markups: nan, use_account_additional_fees: nan, is_active: nan, net_income_formula: nan, commission_formula: nan, owner_revenue_formula: nan, tax_ids: nan, tax_types: nan, tax_amounts: nan, tax_names: nan, tax_units: nan, tax_quantifiers: nan, taxes_applied_to_all_fees: nan, taxes_applied_on_fees: nan, taxes_are_applied_by_default: nan, tax_conditional_overrides_view_types: nan, tax_conditional_overrides_max_nights: nan, tax___vs: nan, pre_bookings_list: nan, origin_id: nan, nick_name: nan, minimum_age: nan, address_full: nan, address_street: nan, address_city: nan, address_country: nan, address_latitude: nan, address_longitude: nan, address_zip_code: nan, address_state: nan, address_county: nan, room_type: nan, property_type: nan, ota_room_type: nan, accommodates: nan, bathrooms: nan, bedrooms: nan, beds_count: nan, listing_status: nan, host_name: nan, wifi_name: nan, wifi_password: nan, area_in_square_feet: nan, trash_collection_day: nan, parking_instructions: nan, created_at: nan, origin: nan, default_check_in_time: nan, default_check_out_time: nan, check_in_instructions: nan, check_out_instructions: nan, account_id: nan, time_zone: nan, last_updated_at: nan, integration_ids: nan, integration_platforms: nan, booking_com_initial_complex_listings: nan, booking_com_publish_company_logos: nan, booking_com_is_published_company_logos: nan, booking_com_publish_company_infos: nan, booking_com_is_published_company_infos: nan, vacayhome_currencies: nan, vacayhome_statuses: nan, vacayhome_cancellation_policies: nan, vacayhome_cancellation_penalties: nan, vacayhome_creation_times: nan, listing_room_ids: nan, listing_room_numbers: nan, listing_room_bed_ids: nan, listing_room_bed_types: nan, listing_room_bed_quantities: nan, custom_field_values: nan, import_time: nan, date_of_first_scrape: NaT, date_of_last_update: nan, date_of_last_scrape: NaT"
    },
    {
        "property_address1":"904 1st Ave N",
        "property_address2":null,
        "property_building":"Riverfront Condos",
        "property_id":453886,
        "property_notes_access":"<p class=RichTextInputTheme__paragraph\" dir=\"ltr\"><span class=\"RichTextInputTheme__textBase\">Master Code: 009040<\/span><\/p><p class=\"RichTextInputTheme__paragraph\" dir=\"ltr\"><span class=\"RichTextInputTheme__textBase\">Emergency Lockbox - 0520 (front door knob)<\/span><\/p>\"",
        "property_notes_general":"<p class=RichTextInputTheme__paragraph\" dir=\"ltr\"><span class=\"RichTextInputTheme__textBase\">Master Code: 009040<\/span><\/p><p class=\"RichTextInputTheme__paragraph\" dir=\"ltr\"><span class=\"RichTextInputTheme__textBase\">Emergency Lockbox - 0520 (front door knob)<\/span><\/p><p class=\"RichTextInputTheme__paragraph\" dir=\"ltr\"><span class=\"RichTextInputTheme__textBase\">904 is the unit number<\/span><\/p><p class=\"RichTextInputTheme__paragraph\" dir=\"ltr\"><i><b><strong class=\"RichTextInputTheme__textBase RichTextInputTheme__textBold RichTextInputTheme__textItalic\">***OWNER NOTES***<\/strong><\/b><\/i><\/p><p class=\"RichTextInputTheme__paragraph\" dir=\"ltr\"><span class=\"RichTextInputTheme__textBase\">Owner - Chase<\/span><\/p><p class=\"RichTextInputTheme__paragraph\" dir=\"ltr\"><span class=\"RichTextInputTheme__textBase\">Currently Escalated? No<\/span><\/p><p class=\"RichTextInputTheme__paragraph\" dir=\"ltr\"><span class=\"RichTextInputTheme__textBase\">Escalated within last 30 days? No<\/span><\/p><p class=\"RichTextInputTheme__paragraph\" dir=\"ltr\"><span class=\"RichTextInputTheme__textBase\">Persona - hands off investor<\/span><\/p><p class=\"RichTextInputTheme__paragraph\" dir=\"ltr\"><span class=\"RichTextInputTheme__textBase\">Owner Restrictions? No<\/span><\/p>\"",
        "property_notes_guest_access":"<p class=RichTextInputTheme__paragraph\" dir=\"ltr\"><b><strong class=\"RichTextInputTheme__textBase RichTextInputTheme__textBold\">Arrival and Parking: <\/strong><\/b><\/p><p class=\"RichTextInputTheme__paragraph\" dir=\"ltr\"><span class=\"RichTextInputTheme__textBase\">Unassigned parking available for up to two vehicles in the open parking lot.<\/span><\/p><p class=\"RichTextInputTheme__paragraph\" dir=\"ltr\"><b><strong class=\"RichTextInputTheme__textBase RichTextInputTheme__textBold\"> Access Instructions: <\/strong><\/b><\/p><p class=\"RichTextInputTheme__paragraph\" dir=\"ltr\"><span class=\"RichTextInputTheme__textBase\">Once parked",
        "property_photos_url":" sofa sleeper--x--Living room with 55\" Apple TV",
        "property_state":"TN",
        "property_status":"active",
        "listing_id":null,
        "saas_auto_renew":null,
        "cleaning_fee_id":null,
        "cleaning_fee_value_type":null,
        "cleaning_fee_formula":null,
        "cleaning_fee_multiplier":null,
        "channel_commission_use_account_settings":null,
        "channel_commission_id":null,
        "channel_commission_created_at":null,
        "channel_commission_updated_at":null,
        "cleaning_status":null,
        "picture_caption":null,
        "picture_thumbnail":null,
        "minimum_nights":null,
        "maximum_nights":null,
        "monthly_price_factor":null,
        "weekly_price_factor":null,
        "base_price":null,
        "weekend_base_price":null,
        "currency":null,
        "cleaning_fee":null,
        "confirmed_before_checkin_delay_minutes":null,
        "confirmed_day_of_checkin_delay_minutes":null,
        "confirmed_day_of_checkout_delay_minutes":null,
        "confirmed_during_stay_delay_minutes":null,
        "confirmed_after_checkout_delay_minutes":null,
        "unconfirmed_first_message_delay_minutes":null,
        "unconfirmed_subsequent_message_delay_minutes":null,
        "answeing_machine_is_active":null,
        "auto_reviews_status":null,
        "auto_payments_time_relation_names":null,
        "auto_payments_time_relation_units":null,
        "auto_payments_time_relation_amounts":null,
        "pms_cleaning_status":null,
        "calendar_rules_default_availability":null,
        "bookingcom_cut_off_hours_enabled":null,
        "expedia_cut_off_hours_enabled":null,
        "airbnb_cut_off_hours_enabled":null,
        "directbookings_cut_off_hours_enabled":null,
        "calendar_rules_default_hours":null,
        "calendar_rules_allow_request_to_book":null,
        "calendar_rules_advance_notice_updated_at":null,
        "calendar_rules_advance_notice_updated_by":null,
        "booking_window_default_days":null,
        "booking_window_updated_at":null,
        "preparation_time_updated_at":null,
        "dynamic_checkin_updated_at":null,
        "rental_periods_request_to_book":null,
        "rental_periods_ids":null,
        "rental_periods_from":null,
        "default_availability_updated_at":null,
        "default_availability_updated_by":null,
        "listing_type":null,
        "owners_list":null,
        "amenities_list":null,
        "amenities_not_included_list":null,
        "use_account_revenue_share":null,
        "use_account_taxes":null,
        "use_account_markups":null,
        "use_account_additional_fees":null,
        "is_active":null,
        "net_income_formula":null,
        "commission_formula":null,
        "owner_revenue_formula":null,
        "tax_ids":null,
        "tax_types":null,
        "tax_amounts":null,
        "tax_names":null,
        "tax_units":null,
        "tax_quantifiers":null,
        "taxes_applied_to_all_fees":null,
        "taxes_applied_on_fees":null,
        "taxes_are_applied_by_default":null,
        "tax_conditional_overrides_view_types":null,
        "tax_conditional_overrides_max_nights":null,
        "tax___vs":null,
        "pre_bookings_list":null,
        "origin_id":null,
        "nick_name":null,
        "minimum_age":null,
        "address_full":null,
        "address_street":null,
        "address_city":null,
        "address_country":null,
        "address_latitude":null,
        "address_longitude":null,
        "address_zip_code":null,
        "address_state":null,
        "address_county":null,
        "room_type":null,
        "property_type":null,
        "ota_room_type":null,
        "accommodates":null,
        "bathrooms":null,
        "bedrooms":null,
        "beds_count":null,
        "listing_status":null,
        "host_name":null,
        "wifi_name":null,
        "wifi_password":null,
        "area_in_square_feet":null,
        "trash_collection_day":null,
        "parking_instructions":null,
        "created_at":null,
        "origin":null,
        "default_check_in_time":null,
        "default_check_out_time":null,
        "check_in_instructions":null,
        "check_out_instructions":null,
        "account_id":null,
        "time_zone":null,
        "last_updated_at":null,
        "integration_ids":null,
        "integration_platforms":null,
        "booking_com_initial_complex_listings":null,
        "booking_com_publish_company_logos":null,
        "booking_com_is_published_company_logos":null,
        "booking_com_publish_company_infos":null,
        "booking_com_is_published_company_infos":null,
        "vacayhome_currencies":null,
        "vacayhome_statuses":null,
        "vacayhome_cancellation_policies":null,
        "vacayhome_cancellation_penalties":null,
        "vacayhome_creation_times":null,
        "listing_room_ids":null,
        "listing_room_numbers":null,
        "listing_room_bed_ids":null,
        "listing_room_bed_types":null,
        "listing_room_bed_quantities":null,
        "custom_field_values":null,
        "import_time":null,
        "date_of_first_scrape":null,
        "date_of_last_update":null,
        "date_of_last_scrape":null,
        "summary":"property_address1: 904 1st Ave N, property_address2: nan, property_building: Riverfront Condos, property_id: 453886, property_notes_access: <p class=RichTextInputTheme__paragraph\" dir=\"ltr\"><span class=\"RichTextInputTheme__textBase\">Master Code: 009040<\/span><\/p><p class=\"RichTextInputTheme__paragraph\" dir=\"ltr\"><span class=\"RichTextInputTheme__textBase\">Emergency Lockbox - 0520 (front door knob)<\/span><\/p>\", property_notes_general: <p class=RichTextInputTheme__paragraph\" dir=\"ltr\"><span class=\"RichTextInputTheme__textBase\">Master Code: 009040<\/span><\/p><p class=\"RichTextInputTheme__paragraph\" dir=\"ltr\"><span class=\"RichTextInputTheme__textBase\">Emergency Lockbox - 0520 (front door knob)<\/span><\/p><p class=\"RichTextInputTheme__paragraph\" dir=\"ltr\"><span class=\"RichTextInputTheme__textBase\">904 is the unit number<\/span><\/p><p class=\"RichTextInputTheme__paragraph\" dir=\"ltr\"><i><b><strong class=\"RichTextInputTheme__textBase RichTextInputTheme__textBold RichTextInputTheme__textItalic\">***OWNER NOTES***<\/strong><\/b><\/i><\/p><p class=\"RichTextInputTheme__paragraph\" dir=\"ltr\"><span class=\"RichTextInputTheme__textBase\">Owner - Chase<\/span><\/p><p class=\"RichTextInputTheme__paragraph\" dir=\"ltr\"><span class=\"RichTextInputTheme__textBase\">Currently Escalated? No<\/span><\/p><p class=\"RichTextInputTheme__paragraph\" dir=\"ltr\"><span class=\"RichTextInputTheme__textBase\">Escalated within last 30 days? No<\/span><\/p><p class=\"RichTextInputTheme__paragraph\" dir=\"ltr\"><span class=\"RichTextInputTheme__textBase\">Persona - hands off investor<\/span><\/p><p class=\"RichTextInputTheme__paragraph\" dir=\"ltr\"><span class=\"RichTextInputTheme__textBase\">Owner Restrictions? No<\/span><\/p>\", property_notes_guest_access: <p class=RichTextInputTheme__paragraph\" dir=\"ltr\"><b><strong class=\"RichTextInputTheme__textBase RichTextInputTheme__textBold\">Arrival and Parking: <\/strong><\/b><\/p><p class=\"RichTextInputTheme__paragraph\" dir=\"ltr\"><span class=\"RichTextInputTheme__textBase\">Unassigned parking available for up to two vehicles in the open parking lot.<\/span><\/p><p class=\"RichTextInputTheme__paragraph\" dir=\"ltr\"><b><strong class=\"RichTextInputTheme__textBase RichTextInputTheme__textBold\"> Access Instructions: <\/strong><\/b><\/p><p class=\"RichTextInputTheme__paragraph\" dir=\"ltr\"><span class=\"RichTextInputTheme__textBase\">Once parked, property_photos_url:  sofa sleeper--x--Living room with 55\" Apple TV, property_state: TN, property_status: active, listing_id: nan, saas_auto_renew: nan, cleaning_fee_id: nan, cleaning_fee_value_type: nan, cleaning_fee_formula: nan, cleaning_fee_multiplier: nan, channel_commission_use_account_settings: nan, channel_commission_id: nan, channel_commission_created_at: nan, channel_commission_updated_at: nan, cleaning_status: nan, picture_caption: nan, picture_thumbnail: nan, minimum_nights: nan, maximum_nights: nan, monthly_price_factor: nan, weekly_price_factor: nan, base_price: nan, weekend_base_price: nan, currency: nan, cleaning_fee: nan, confirmed_before_checkin_delay_minutes: nan, confirmed_day_of_checkin_delay_minutes: nan, confirmed_day_of_checkout_delay_minutes: nan, confirmed_during_stay_delay_minutes: nan, confirmed_after_checkout_delay_minutes: nan, unconfirmed_first_message_delay_minutes: nan, unconfirmed_subsequent_message_delay_minutes: nan, answeing_machine_is_active: nan, auto_reviews_status: nan, auto_payments_time_relation_names: nan, auto_payments_time_relation_units: nan, auto_payments_time_relation_amounts: nan, pms_cleaning_status: nan, calendar_rules_default_availability: nan, bookingcom_cut_off_hours_enabled: nan, expedia_cut_off_hours_enabled: nan, airbnb_cut_off_hours_enabled: nan, directbookings_cut_off_hours_enabled: nan, calendar_rules_default_hours: nan, calendar_rules_allow_request_to_book: nan, calendar_rules_advance_notice_updated_at: nan, calendar_rules_advance_notice_updated_by: nan, booking_window_default_days: nan, booking_window_updated_at: nan, preparation_time_updated_at: nan, dynamic_checkin_updated_at: nan, rental_periods_request_to_book: nan, rental_periods_ids: nan, rental_periods_from: NaT, default_availability_updated_at: nan, default_availability_updated_by: nan, listing_type: nan, owners_list: nan, amenities_list: nan, amenities_not_included_list: nan, use_account_revenue_share: nan, use_account_taxes: nan, use_account_markups: nan, use_account_additional_fees: nan, is_active: nan, net_income_formula: nan, commission_formula: nan, owner_revenue_formula: nan, tax_ids: nan, tax_types: nan, tax_amounts: nan, tax_names: nan, tax_units: nan, tax_quantifiers: nan, taxes_applied_to_all_fees: nan, taxes_applied_on_fees: nan, taxes_are_applied_by_default: nan, tax_conditional_overrides_view_types: nan, tax_conditional_overrides_max_nights: nan, tax___vs: nan, pre_bookings_list: nan, origin_id: nan, nick_name: nan, minimum_age: nan, address_full: nan, address_street: nan, address_city: nan, address_country: nan, address_latitude: nan, address_longitude: nan, address_zip_code: nan, address_state: nan, address_county: nan, room_type: nan, property_type: nan, ota_room_type: nan, accommodates: nan, bathrooms: nan, bedrooms: nan, beds_count: nan, listing_status: nan, host_name: nan, wifi_name: nan, wifi_password: nan, area_in_square_feet: nan, trash_collection_day: nan, parking_instructions: nan, created_at: nan, origin: nan, default_check_in_time: nan, default_check_out_time: nan, check_in_instructions: nan, check_out_instructions: nan, account_id: nan, time_zone: nan, last_updated_at: nan, integration_ids: nan, integration_platforms: nan, booking_com_initial_complex_listings: nan, booking_com_publish_company_logos: nan, booking_com_is_published_company_logos: nan, booking_com_publish_company_infos: nan, booking_com_is_published_company_infos: nan, vacayhome_currencies: nan, vacayhome_statuses: nan, vacayhome_cancellation_policies: nan, vacayhome_cancellation_penalties: nan, vacayhome_creation_times: nan, listing_room_ids: nan, listing_room_numbers: nan, listing_room_bed_ids: nan, listing_room_bed_types: nan, listing_room_bed_quantities: nan, custom_field_values: nan, import_time: nan, date_of_first_scrape: NaT, date_of_last_update: nan, date_of_last_scrape: NaT"
    },
    {
        "property_address1":"210 N 9th Street #4",
        "property_address2":null,
        "property_building":null,
        "property_id":453929,
        "property_notes_access":"<p class=RichTextInputTheme__paragraph\" dir=\"ltr\"><span class=\"RichTextInputTheme__textBase\">Supply closet code 5757<\/span><br><span class=\"RichTextInputTheme__textBase\">Master Code: 002100<\/span><\/p><p class=\"RichTextInputTheme__paragraph\" dir=\"ltr\"><span class=\"RichTextInputTheme__textBase\">Emergency lockbox - 2876<\/span><\/p>\"",
        "property_notes_general":"<p class=RichTextInputTheme__paragraph\" dir=\"ltr\"><span class=\"RichTextInputTheme__textBase\">Supply closet code 5757<\/span><br><span class=\"RichTextInputTheme__textBase\">Master Code: 002100<\/span><\/p><p class=\"RichTextInputTheme__paragraph\" dir=\"ltr\"><span class=\"RichTextInputTheme__textBase\">Emergency lockbox - 2876<\/span><\/p><p class=\"RichTextInputTheme__paragraph\" dir=\"ltr\"><i><b><strong class=\"RichTextInputTheme__textBase RichTextInputTheme__textBold RichTextInputTheme__textItalic\">***OWNER NOTES***<\/strong><\/b><\/i><\/p><p class=\"RichTextInputTheme__paragraph\" dir=\"ltr\"><span class=\"RichTextInputTheme__textBase\">Owner - Steve Wax<\/span><\/p><p class=\"RichTextInputTheme__paragraph\" dir=\"ltr\"><span class=\"RichTextInputTheme__textBase\">Currently Escalated? No<\/span><\/p><p class=\"RichTextInputTheme__paragraph\" dir=\"ltr\"><span class=\"RichTextInputTheme__textBase\">Escalated within last 30 days? No<\/span><\/p><p class=\"RichTextInputTheme__paragraph\" dir=\"ltr\"><span class=\"RichTextInputTheme__textBase\">Persona - hands off investor<\/span><\/p><p class=\"RichTextInputTheme__paragraph\" dir=\"ltr\"><span class=\"RichTextInputTheme__textBase\">Owner Restrictions? No<\/span><\/p>\"",
        "property_notes_guest_access":"<p class=RichTextInputTheme__paragraph\" dir=\"ltr\"><b><strong class=\"RichTextInputTheme__textBase RichTextInputTheme__textBold\">Arrival and Parking:<\/strong><\/b><\/p><p class=\"RichTextInputTheme__paragraph\" dir=\"ltr\"><span class=\"RichTextInputTheme__textBase\">Assigned parking available for one vehicle in space #4. Additional street parking at a first-come",
        "property_photos_url":"True--x--False--x--False--x--False--x--False--x--False--x--False--x--False--x--False--x--False--x--False--x--False--x--False--x--False--x--False--x--False--x--False--x--False--x--False--x--False--x--False--x--False--x--False--x--False--x--False--x--False--x--False--x--False--x--False",
        "property_state":"TN",
        "property_status":"active",
        "listing_id":null,
        "saas_auto_renew":null,
        "cleaning_fee_id":null,
        "cleaning_fee_value_type":null,
        "cleaning_fee_formula":null,
        "cleaning_fee_multiplier":null,
        "channel_commission_use_account_settings":null,
        "channel_commission_id":null,
        "channel_commission_created_at":null,
        "channel_commission_updated_at":null,
        "cleaning_status":null,
        "picture_caption":null,
        "picture_thumbnail":null,
        "minimum_nights":null,
        "maximum_nights":null,
        "monthly_price_factor":null,
        "weekly_price_factor":null,
        "base_price":null,
        "weekend_base_price":null,
        "currency":null,
        "cleaning_fee":null,
        "confirmed_before_checkin_delay_minutes":null,
        "confirmed_day_of_checkin_delay_minutes":null,
        "confirmed_day_of_checkout_delay_minutes":null,
        "confirmed_during_stay_delay_minutes":null,
        "confirmed_after_checkout_delay_minutes":null,
        "unconfirmed_first_message_delay_minutes":null,
        "unconfirmed_subsequent_message_delay_minutes":null,
        "answeing_machine_is_active":null,
        "auto_reviews_status":null,
        "auto_payments_time_relation_names":null,
        "auto_payments_time_relation_units":null,
        "auto_payments_time_relation_amounts":null,
        "pms_cleaning_status":null,
        "calendar_rules_default_availability":null,
        "bookingcom_cut_off_hours_enabled":null,
        "expedia_cut_off_hours_enabled":null,
        "airbnb_cut_off_hours_enabled":null,
        "directbookings_cut_off_hours_enabled":null,
        "calendar_rules_default_hours":null,
        "calendar_rules_allow_request_to_book":null,
        "calendar_rules_advance_notice_updated_at":null,
        "calendar_rules_advance_notice_updated_by":null,
        "booking_window_default_days":null,
        "booking_window_updated_at":null,
        "preparation_time_updated_at":null,
        "dynamic_checkin_updated_at":null,
        "rental_periods_request_to_book":null,
        "rental_periods_ids":null,
        "rental_periods_from":null,
        "default_availability_updated_at":null,
        "default_availability_updated_by":null,
        "listing_type":null,
        "owners_list":null,
        "amenities_list":null,
        "amenities_not_included_list":null,
        "use_account_revenue_share":null,
        "use_account_taxes":null,
        "use_account_markups":null,
        "use_account_additional_fees":null,
        "is_active":null,
        "net_income_formula":null,
        "commission_formula":null,
        "owner_revenue_formula":null,
        "tax_ids":null,
        "tax_types":null,
        "tax_amounts":null,
        "tax_names":null,
        "tax_units":null,
        "tax_quantifiers":null,
        "taxes_applied_to_all_fees":null,
        "taxes_applied_on_fees":null,
        "taxes_are_applied_by_default":null,
        "tax_conditional_overrides_view_types":null,
        "tax_conditional_overrides_max_nights":null,
        "tax___vs":null,
        "pre_bookings_list":null,
        "origin_id":null,
        "nick_name":null,
        "minimum_age":null,
        "address_full":null,
        "address_street":null,
        "address_city":null,
        "address_country":null,
        "address_latitude":null,
        "address_longitude":null,
        "address_zip_code":null,
        "address_state":null,
        "address_county":null,
        "room_type":null,
        "property_type":null,
        "ota_room_type":null,
        "accommodates":null,
        "bathrooms":null,
        "bedrooms":null,
        "beds_count":null,
        "listing_status":null,
        "host_name":null,
        "wifi_name":null,
        "wifi_password":null,
        "area_in_square_feet":null,
        "trash_collection_day":null,
        "parking_instructions":null,
        "created_at":null,
        "origin":null,
        "default_check_in_time":null,
        "default_check_out_time":null,
        "check_in_instructions":null,
        "check_out_instructions":null,
        "account_id":null,
        "time_zone":null,
        "last_updated_at":null,
        "integration_ids":null,
        "integration_platforms":null,
        "booking_com_initial_complex_listings":null,
        "booking_com_publish_company_logos":null,
        "booking_com_is_published_company_logos":null,
        "booking_com_publish_company_infos":null,
        "booking_com_is_published_company_infos":null,
        "vacayhome_currencies":null,
        "vacayhome_statuses":null,
        "vacayhome_cancellation_policies":null,
        "vacayhome_cancellation_penalties":null,
        "vacayhome_creation_times":null,
        "listing_room_ids":null,
        "listing_room_numbers":null,
        "listing_room_bed_ids":null,
        "listing_room_bed_types":null,
        "listing_room_bed_quantities":null,
        "custom_field_values":null,
        "import_time":null,
        "date_of_first_scrape":null,
        "date_of_last_update":null,
        "date_of_last_scrape":null,
        "summary":"property_address1: 210 N 9th Street #4, property_address2: nan, property_building: nan, property_id: 453929, property_notes_access: <p class=RichTextInputTheme__paragraph\" dir=\"ltr\"><span class=\"RichTextInputTheme__textBase\">Supply closet code 5757<\/span><br><span class=\"RichTextInputTheme__textBase\">Master Code: 002100<\/span><\/p><p class=\"RichTextInputTheme__paragraph\" dir=\"ltr\"><span class=\"RichTextInputTheme__textBase\">Emergency lockbox - 2876<\/span><\/p>\", property_notes_general: <p class=RichTextInputTheme__paragraph\" dir=\"ltr\"><span class=\"RichTextInputTheme__textBase\">Supply closet code 5757<\/span><br><span class=\"RichTextInputTheme__textBase\">Master Code: 002100<\/span><\/p><p class=\"RichTextInputTheme__paragraph\" dir=\"ltr\"><span class=\"RichTextInputTheme__textBase\">Emergency lockbox - 2876<\/span><\/p><p class=\"RichTextInputTheme__paragraph\" dir=\"ltr\"><i><b><strong class=\"RichTextInputTheme__textBase RichTextInputTheme__textBold RichTextInputTheme__textItalic\">***OWNER NOTES***<\/strong><\/b><\/i><\/p><p class=\"RichTextInputTheme__paragraph\" dir=\"ltr\"><span class=\"RichTextInputTheme__textBase\">Owner - Steve Wax<\/span><\/p><p class=\"RichTextInputTheme__paragraph\" dir=\"ltr\"><span class=\"RichTextInputTheme__textBase\">Currently Escalated? No<\/span><\/p><p class=\"RichTextInputTheme__paragraph\" dir=\"ltr\"><span class=\"RichTextInputTheme__textBase\">Escalated within last 30 days? No<\/span><\/p><p class=\"RichTextInputTheme__paragraph\" dir=\"ltr\"><span class=\"RichTextInputTheme__textBase\">Persona - hands off investor<\/span><\/p><p class=\"RichTextInputTheme__paragraph\" dir=\"ltr\"><span class=\"RichTextInputTheme__textBase\">Owner Restrictions? No<\/span><\/p>\", property_notes_guest_access: <p class=RichTextInputTheme__paragraph\" dir=\"ltr\"><b><strong class=\"RichTextInputTheme__textBase RichTextInputTheme__textBold\">Arrival and Parking:<\/strong><\/b><\/p><p class=\"RichTextInputTheme__paragraph\" dir=\"ltr\"><span class=\"RichTextInputTheme__textBase\">Assigned parking available for one vehicle in space #4. Additional street parking at a first-come, property_photos_url: True--x--False--x--False--x--False--x--False--x--False--x--False--x--False--x--False--x--False--x--False--x--False--x--False--x--False--x--False--x--False--x--False--x--False--x--False--x--False--x--False--x--False--x--False--x--False--x--False--x--False--x--False--x--False--x--False, property_state: TN, property_status: active, listing_id: nan, saas_auto_renew: nan, cleaning_fee_id: nan, cleaning_fee_value_type: nan, cleaning_fee_formula: nan, cleaning_fee_multiplier: nan, channel_commission_use_account_settings: nan, channel_commission_id: nan, channel_commission_created_at: nan, channel_commission_updated_at: nan, cleaning_status: nan, picture_caption: nan, picture_thumbnail: nan, minimum_nights: nan, maximum_nights: nan, monthly_price_factor: nan, weekly_price_factor: nan, base_price: nan, weekend_base_price: nan, currency: nan, cleaning_fee: nan, confirmed_before_checkin_delay_minutes: nan, confirmed_day_of_checkin_delay_minutes: nan, confirmed_day_of_checkout_delay_minutes: nan, confirmed_during_stay_delay_minutes: nan, confirmed_after_checkout_delay_minutes: nan, unconfirmed_first_message_delay_minutes: nan, unconfirmed_subsequent_message_delay_minutes: nan, answeing_machine_is_active: nan, auto_reviews_status: nan, auto_payments_time_relation_names: nan, auto_payments_time_relation_units: nan, auto_payments_time_relation_amounts: nan, pms_cleaning_status: nan, calendar_rules_default_availability: nan, bookingcom_cut_off_hours_enabled: nan, expedia_cut_off_hours_enabled: nan, airbnb_cut_off_hours_enabled: nan, directbookings_cut_off_hours_enabled: nan, calendar_rules_default_hours: nan, calendar_rules_allow_request_to_book: nan, calendar_rules_advance_notice_updated_at: nan, calendar_rules_advance_notice_updated_by: nan, booking_window_default_days: nan, booking_window_updated_at: nan, preparation_time_updated_at: nan, dynamic_checkin_updated_at: nan, rental_periods_request_to_book: nan, rental_periods_ids: nan, rental_periods_from: NaT, default_availability_updated_at: nan, default_availability_updated_by: nan, listing_type: nan, owners_list: nan, amenities_list: nan, amenities_not_included_list: nan, use_account_revenue_share: nan, use_account_taxes: nan, use_account_markups: nan, use_account_additional_fees: nan, is_active: nan, net_income_formula: nan, commission_formula: nan, owner_revenue_formula: nan, tax_ids: nan, tax_types: nan, tax_amounts: nan, tax_names: nan, tax_units: nan, tax_quantifiers: nan, taxes_applied_to_all_fees: nan, taxes_applied_on_fees: nan, taxes_are_applied_by_default: nan, tax_conditional_overrides_view_types: nan, tax_conditional_overrides_max_nights: nan, tax___vs: nan, pre_bookings_list: nan, origin_id: nan, nick_name: nan, minimum_age: nan, address_full: nan, address_street: nan, address_city: nan, address_country: nan, address_latitude: nan, address_longitude: nan, address_zip_code: nan, address_state: nan, address_county: nan, room_type: nan, property_type: nan, ota_room_type: nan, accommodates: nan, bathrooms: nan, bedrooms: nan, beds_count: nan, listing_status: nan, host_name: nan, wifi_name: nan, wifi_password: nan, area_in_square_feet: nan, trash_collection_day: nan, parking_instructions: nan, created_at: nan, origin: nan, default_check_in_time: nan, default_check_out_time: nan, check_in_instructions: nan, check_out_instructions: nan, account_id: nan, time_zone: nan, last_updated_at: nan, integration_ids: nan, integration_platforms: nan, booking_com_initial_complex_listings: nan, booking_com_publish_company_logos: nan, booking_com_is_published_company_logos: nan, booking_com_publish_company_infos: nan, booking_com_is_published_company_infos: nan, vacayhome_currencies: nan, vacayhome_statuses: nan, vacayhome_cancellation_policies: nan, vacayhome_cancellation_penalties: nan, vacayhome_creation_times: nan, listing_room_ids: nan, listing_room_numbers: nan, listing_room_bed_ids: nan, listing_room_bed_types: nan, listing_room_bed_quantities: nan, custom_field_values: nan, import_time: nan, date_of_first_scrape: NaT, date_of_last_update: nan, date_of_last_scrape: NaT"
    },
    {
        "property_address1":"844 Cherokee Ave #9",
        "property_address2":null,
        "property_building":"Cherokee",
        "property_id":453966,
        "property_notes_access":"<p class=RichTextInputTheme__paragraph\" dir=\"ltr\"><span class=\"RichTextInputTheme__textBase\">Master code - 084490<\/span><\/p><p class=\"RichTextInputTheme__paragraph\" dir=\"ltr\"><span class=\"RichTextInputTheme__textBase\">Emergency Lockbox - 1019 (Front door handle)<\/span><\/p>\"",
        "property_notes_general":"<p class=RichTextInputTheme__paragraph\" dir=\"ltr\"><span class=\"RichTextInputTheme__textBase\">Layout: 3 levels<\/span><\/p><p class=\"RichTextInputTheme__paragraph\" dir=\"ltr\"><span class=\"RichTextInputTheme__textBase\">1st Floor: 1 bedroom",
        "property_notes_guest_access":" 1 full bath",
        "property_photos_url":" laundry <\/span><br><span class=\"RichTextInputTheme__textBase\">Master code - 005587Backup Access Code:  005587<\/span><\/p><p class=\"RichTextInputTheme__paragraph\" dir=\"ltr\"><span class=\"RichTextInputTheme__textBase\">Emergency Lockbox - 1019 (Front door handle)<\/span><\/p><p class=\"RichTextInputTheme__paragraph\" dir=\"ltr\"><br><\/p><p class=\"RichTextInputTheme__paragraph\" dir=\"ltr\"><i><b><strong class=\"RichTextInputTheme__textBase RichTextInputTheme__textBold RichTextInputTheme__textItalic\">***OWNER NOTES***<\/strong><\/b><\/i><\/p><p class=\"RichTextInputTheme__paragraph\" dir=\"ltr\"><span class=\"RichTextInputTheme__textBase\">Owner - <\/span><\/p><p class=\"RichTextInputTheme__paragraph\" dir=\"ltr\"><span class=\"RichTextInputTheme__textBase\">Currently Escalated? No<\/span><\/p><p class=\"RichTextInputTheme__paragraph\" dir=\"ltr\"><span class=\"RichTextInputTheme__textBase\">Escalated within last 30 days? Yes<\/span><\/p><p class=\"RichTextInputTheme__paragraph\" dir=\"ltr\"><span class=\"RichTextInputTheme__textBase\">Persona - hands on investor<\/span><\/p><p class=\"RichTextInputTheme__paragraph\" dir=\"ltr\"><span class=\"RichTextInputTheme__textBase\">Owner Restrictions? No<\/span><\/p>\"",
        "property_state":"TN",
        "property_status":"active",
        "listing_id":null,
        "saas_auto_renew":null,
        "cleaning_fee_id":null,
        "cleaning_fee_value_type":null,
        "cleaning_fee_formula":null,
        "cleaning_fee_multiplier":null,
        "channel_commission_use_account_settings":null,
        "channel_commission_id":null,
        "channel_commission_created_at":null,
        "channel_commission_updated_at":null,
        "cleaning_status":null,
        "picture_caption":null,
        "picture_thumbnail":null,
        "minimum_nights":null,
        "maximum_nights":null,
        "monthly_price_factor":null,
        "weekly_price_factor":null,
        "base_price":null,
        "weekend_base_price":null,
        "currency":null,
        "cleaning_fee":null,
        "confirmed_before_checkin_delay_minutes":null,
        "confirmed_day_of_checkin_delay_minutes":null,
        "confirmed_day_of_checkout_delay_minutes":null,
        "confirmed_during_stay_delay_minutes":null,
        "confirmed_after_checkout_delay_minutes":null,
        "unconfirmed_first_message_delay_minutes":null,
        "unconfirmed_subsequent_message_delay_minutes":null,
        "answeing_machine_is_active":null,
        "auto_reviews_status":null,
        "auto_payments_time_relation_names":null,
        "auto_payments_time_relation_units":null,
        "auto_payments_time_relation_amounts":null,
        "pms_cleaning_status":null,
        "calendar_rules_default_availability":null,
        "bookingcom_cut_off_hours_enabled":null,
        "expedia_cut_off_hours_enabled":null,
        "airbnb_cut_off_hours_enabled":null,
        "directbookings_cut_off_hours_enabled":null,
        "calendar_rules_default_hours":null,
        "calendar_rules_allow_request_to_book":null,
        "calendar_rules_advance_notice_updated_at":null,
        "calendar_rules_advance_notice_updated_by":null,
        "booking_window_default_days":null,
        "booking_window_updated_at":null,
        "preparation_time_updated_at":null,
        "dynamic_checkin_updated_at":null,
        "rental_periods_request_to_book":null,
        "rental_periods_ids":null,
        "rental_periods_from":null,
        "default_availability_updated_at":null,
        "default_availability_updated_by":null,
        "listing_type":null,
        "owners_list":null,
        "amenities_list":null,
        "amenities_not_included_list":null,
        "use_account_revenue_share":null,
        "use_account_taxes":null,
        "use_account_markups":null,
        "use_account_additional_fees":null,
        "is_active":null,
        "net_income_formula":null,
        "commission_formula":null,
        "owner_revenue_formula":null,
        "tax_ids":null,
        "tax_types":null,
        "tax_amounts":null,
        "tax_names":null,
        "tax_units":null,
        "tax_quantifiers":null,
        "taxes_applied_to_all_fees":null,
        "taxes_applied_on_fees":null,
        "taxes_are_applied_by_default":null,
        "tax_conditional_overrides_view_types":null,
        "tax_conditional_overrides_max_nights":null,
        "tax___vs":null,
        "pre_bookings_list":null,
        "origin_id":null,
        "nick_name":null,
        "minimum_age":null,
        "address_full":null,
        "address_street":null,
        "address_city":null,
        "address_country":null,
        "address_latitude":null,
        "address_longitude":null,
        "address_zip_code":null,
        "address_state":null,
        "address_county":null,
        "room_type":null,
        "property_type":null,
        "ota_room_type":null,
        "accommodates":null,
        "bathrooms":null,
        "bedrooms":null,
        "beds_count":null,
        "listing_status":null,
        "host_name":null,
        "wifi_name":null,
        "wifi_password":null,
        "area_in_square_feet":null,
        "trash_collection_day":null,
        "parking_instructions":null,
        "created_at":null,
        "origin":null,
        "default_check_in_time":null,
        "default_check_out_time":null,
        "check_in_instructions":null,
        "check_out_instructions":null,
        "account_id":null,
        "time_zone":null,
        "last_updated_at":null,
        "integration_ids":null,
        "integration_platforms":null,
        "booking_com_initial_complex_listings":null,
        "booking_com_publish_company_logos":null,
        "booking_com_is_published_company_logos":null,
        "booking_com_publish_company_infos":null,
        "booking_com_is_published_company_infos":null,
        "vacayhome_currencies":null,
        "vacayhome_statuses":null,
        "vacayhome_cancellation_policies":null,
        "vacayhome_cancellation_penalties":null,
        "vacayhome_creation_times":null,
        "listing_room_ids":null,
        "listing_room_numbers":null,
        "listing_room_bed_ids":null,
        "listing_room_bed_types":null,
        "listing_room_bed_quantities":null,
        "custom_field_values":null,
        "import_time":null,
        "date_of_first_scrape":null,
        "date_of_last_update":null,
        "date_of_last_scrape":null,
        "summary":"property_address1: 844 Cherokee Ave #9, property_address2: nan, property_building: Cherokee, property_id: 453966, property_notes_access: <p class=RichTextInputTheme__paragraph\" dir=\"ltr\"><span class=\"RichTextInputTheme__textBase\">Master code - 084490<\/span><\/p><p class=\"RichTextInputTheme__paragraph\" dir=\"ltr\"><span class=\"RichTextInputTheme__textBase\">Emergency Lockbox - 1019 (Front door handle)<\/span><\/p>\", property_notes_general: <p class=RichTextInputTheme__paragraph\" dir=\"ltr\"><span class=\"RichTextInputTheme__textBase\">Layout: 3 levels<\/span><\/p><p class=\"RichTextInputTheme__paragraph\" dir=\"ltr\"><span class=\"RichTextInputTheme__textBase\">1st Floor: 1 bedroom, property_notes_guest_access:  1 full bath, property_photos_url:  laundry <\/span><br><span class=\"RichTextInputTheme__textBase\">Master code - 005587Backup Access Code:  005587<\/span><\/p><p class=\"RichTextInputTheme__paragraph\" dir=\"ltr\"><span class=\"RichTextInputTheme__textBase\">Emergency Lockbox - 1019 (Front door handle)<\/span><\/p><p class=\"RichTextInputTheme__paragraph\" dir=\"ltr\"><br><\/p><p class=\"RichTextInputTheme__paragraph\" dir=\"ltr\"><i><b><strong class=\"RichTextInputTheme__textBase RichTextInputTheme__textBold RichTextInputTheme__textItalic\">***OWNER NOTES***<\/strong><\/b><\/i><\/p><p class=\"RichTextInputTheme__paragraph\" dir=\"ltr\"><span class=\"RichTextInputTheme__textBase\">Owner - <\/span><\/p><p class=\"RichTextInputTheme__paragraph\" dir=\"ltr\"><span class=\"RichTextInputTheme__textBase\">Currently Escalated? No<\/span><\/p><p class=\"RichTextInputTheme__paragraph\" dir=\"ltr\"><span class=\"RichTextInputTheme__textBase\">Escalated within last 30 days? Yes<\/span><\/p><p class=\"RichTextInputTheme__paragraph\" dir=\"ltr\"><span class=\"RichTextInputTheme__textBase\">Persona - hands on investor<\/span><\/p><p class=\"RichTextInputTheme__paragraph\" dir=\"ltr\"><span class=\"RichTextInputTheme__textBase\">Owner Restrictions? No<\/span><\/p>\", property_state: TN, property_status: active, listing_id: nan, saas_auto_renew: nan, cleaning_fee_id: nan, cleaning_fee_value_type: nan, cleaning_fee_formula: nan, cleaning_fee_multiplier: nan, channel_commission_use_account_settings: nan, channel_commission_id: nan, channel_commission_created_at: nan, channel_commission_updated_at: nan, cleaning_status: nan, picture_caption: nan, picture_thumbnail: nan, minimum_nights: nan, maximum_nights: nan, monthly_price_factor: nan, weekly_price_factor: nan, base_price: nan, weekend_base_price: nan, currency: nan, cleaning_fee: nan, confirmed_before_checkin_delay_minutes: nan, confirmed_day_of_checkin_delay_minutes: nan, confirmed_day_of_checkout_delay_minutes: nan, confirmed_during_stay_delay_minutes: nan, confirmed_after_checkout_delay_minutes: nan, unconfirmed_first_message_delay_minutes: nan, unconfirmed_subsequent_message_delay_minutes: nan, answeing_machine_is_active: nan, auto_reviews_status: nan, auto_payments_time_relation_names: nan, auto_payments_time_relation_units: nan, auto_payments_time_relation_amounts: nan, pms_cleaning_status: nan, calendar_rules_default_availability: nan, bookingcom_cut_off_hours_enabled: nan, expedia_cut_off_hours_enabled: nan, airbnb_cut_off_hours_enabled: nan, directbookings_cut_off_hours_enabled: nan, calendar_rules_default_hours: nan, calendar_rules_allow_request_to_book: nan, calendar_rules_advance_notice_updated_at: nan, calendar_rules_advance_notice_updated_by: nan, booking_window_default_days: nan, booking_window_updated_at: nan, preparation_time_updated_at: nan, dynamic_checkin_updated_at: nan, rental_periods_request_to_book: nan, rental_periods_ids: nan, rental_periods_from: NaT, default_availability_updated_at: nan, default_availability_updated_by: nan, listing_type: nan, owners_list: nan, amenities_list: nan, amenities_not_included_list: nan, use_account_revenue_share: nan, use_account_taxes: nan, use_account_markups: nan, use_account_additional_fees: nan, is_active: nan, net_income_formula: nan, commission_formula: nan, owner_revenue_formula: nan, tax_ids: nan, tax_types: nan, tax_amounts: nan, tax_names: nan, tax_units: nan, tax_quantifiers: nan, taxes_applied_to_all_fees: nan, taxes_applied_on_fees: nan, taxes_are_applied_by_default: nan, tax_conditional_overrides_view_types: nan, tax_conditional_overrides_max_nights: nan, tax___vs: nan, pre_bookings_list: nan, origin_id: nan, nick_name: nan, minimum_age: nan, address_full: nan, address_street: nan, address_city: nan, address_country: nan, address_latitude: nan, address_longitude: nan, address_zip_code: nan, address_state: nan, address_county: nan, room_type: nan, property_type: nan, ota_room_type: nan, accommodates: nan, bathrooms: nan, bedrooms: nan, beds_count: nan, listing_status: nan, host_name: nan, wifi_name: nan, wifi_password: nan, area_in_square_feet: nan, trash_collection_day: nan, parking_instructions: nan, created_at: nan, origin: nan, default_check_in_time: nan, default_check_out_time: nan, check_in_instructions: nan, check_out_instructions: nan, account_id: nan, time_zone: nan, last_updated_at: nan, integration_ids: nan, integration_platforms: nan, booking_com_initial_complex_listings: nan, booking_com_publish_company_logos: nan, booking_com_is_published_company_logos: nan, booking_com_publish_company_infos: nan, booking_com_is_published_company_infos: nan, vacayhome_currencies: nan, vacayhome_statuses: nan, vacayhome_cancellation_policies: nan, vacayhome_cancellation_penalties: nan, vacayhome_creation_times: nan, listing_room_ids: nan, listing_room_numbers: nan, listing_room_bed_ids: nan, listing_room_bed_types: nan, listing_room_bed_quantities: nan, custom_field_values: nan, import_time: nan, date_of_first_scrape: NaT, date_of_last_update: nan, date_of_last_scrape: NaT"
    },
    {
        "property_address1":"43 Brookwood Terrace D",
        "property_address2":null,
        "property_building":"Brookwood",
        "property_id":453990,
        "property_notes_access":"<p class=RichTextInputTheme__paragraph\" dir=\"ltr\"><span class=\"RichTextInputTheme__textBase\">Master Code: 004300<\/span><\/p><p class=\"RichTextInputTheme__paragraph\" dir=\"ltr\"><span class=\"RichTextInputTheme__textBase\">Emergency Lockbox - 7593 (Entry door knob)<\/span><\/p>\"",
        "property_notes_general":"<p class=RichTextInputTheme__paragraph\" dir=\"ltr\"><span class=\"RichTextInputTheme__textBase\">Master Code: 004300<\/span><\/p><p class=\"RichTextInputTheme__paragraph\" dir=\"ltr\"><span class=\"RichTextInputTheme__textBase\">Emergency Lockbox - 7593 (Entry door knob)<\/span><\/p><p class=\"RichTextInputTheme__paragraph\" dir=\"ltr\"><i><b><strong class=\"RichTextInputTheme__textBase RichTextInputTheme__textBold RichTextInputTheme__textItalic\">***OWNER NOTES***<\/strong><\/b><\/i><\/p><p class=\"RichTextInputTheme__paragraph\" dir=\"ltr\"><span class=\"RichTextInputTheme__textBase\">Owner -<\/span><\/p><p class=\"RichTextInputTheme__paragraph\" dir=\"ltr\"><span class=\"RichTextInputTheme__textBase\">Currently Escalated? No<\/span><\/p><p class=\"RichTextInputTheme__paragraph\" dir=\"ltr\"><span class=\"RichTextInputTheme__textBase\">Escalated within last 30 days? No<\/span><\/p><p class=\"RichTextInputTheme__paragraph\" dir=\"ltr\"><span class=\"RichTextInputTheme__textBase\">Persona - total hands off <\/span><\/p><p class=\"RichTextInputTheme__paragraph\" dir=\"ltr\"><span class=\"RichTextInputTheme__textBase\">Owner Restrictions? No<\/span><\/p>\"",
        "property_notes_guest_access":"<p class=RichTextInputTheme__paragraph\" dir=\"ltr\"><b><strong class=\"RichTextInputTheme__textBase RichTextInputTheme__textBold\">Arrival and Parking:<\/strong><\/b><span class=\"RichTextInputTheme__textBase\"> <\/span><\/p><p class=\"RichTextInputTheme__paragraph\" dir=\"ltr\"><span class=\"RichTextInputTheme__textBase\">Assigned parking available for two vehicles - the paved spaces will be directly below Unit D.<\/span><\/p><p class=\"RichTextInputTheme__paragraph\" dir=\"ltr\"><b><strong class=\"RichTextInputTheme__textBase RichTextInputTheme__textBold\"> Access Instructions: <\/strong><\/b><\/p><p class=\"RichTextInputTheme__paragraph\" dir=\"ltr\"><span class=\"RichTextInputTheme__textBase\">Once parked",
        "property_photos_url":"https:\/\/track-pm.s3.amazonaws.com\/gw\/image\/b41bdb70-869d-4614-9c46-fed85cf047de--x--https:\/\/track-pm.s3.amazonaws.com\/gw\/image\/41f62fa6-e69f-4b02-a7d9-bfabd52a0f2f--x--https:\/\/track-pm.s3.amazonaws.com\/gw\/image\/c4c47d90-ab5d-4f54-b0d3-012d217770ac--x--https:\/\/track-pm.s3.amazonaws.com\/gw\/image\/b3bc844a-7dfb-4b97-82ba-4b6422020088--x--https:\/\/track-pm.s3.amazonaws.com\/gw\/image\/f689e793-e62a-434c-a4c2-201cf7ba3cc0--x--https:\/\/track-pm.s3.amazonaws.com\/gw\/image\/a3d1a4ec-6158-45f1-a214-e1505920f02d--x--https:\/\/track-pm.s3.amazonaws.com\/gw\/image\/1b79c42f-e9f9-4d8c-8a6c-dbe941e58821--x--https:\/\/track-pm.s3.amazonaws.com\/gw\/image\/047c106b-8ae2-4770-8c5b-1928d8307c90--x--https:\/\/track-pm.s3.amazonaws.com\/gw\/image\/b29f16ec-048f-4c3a-bbf6-6fd089725819--x--https:\/\/track-pm.s3.amazonaws.com\/gw\/image\/f76eb11e-2acc-434c-9651-60149ec50902--x--https:\/\/track-pm.s3.amazonaws.com\/gw\/image\/9cc21e15-8e4e-4736-9549-a841b3368aa2--x--https:\/\/track-pm.s3.amazonaws.com\/gw\/image\/08dc3eb2-7fae-43f0-9c40-02c766462930--x--https:\/\/track-pm.s3.amazonaws.com\/gw\/image\/2d3713dc-ae95-48c8-9cfb-8b06e56baa49--x--https:\/\/track-pm.s3.amazonaws.com\/gw\/image\/8f4afdcb-b96f-4e1a-b0f0-f01be7fec450--x--https:\/\/track-pm.s3.amazonaws.com\/gw\/image\/1e561f7a-dc47-4ca4-a8d0-0fc11eef23ed--x--https:\/\/track-pm.s3.amazonaws.com\/gw\/image\/48ee5ca5-58df-4888-8f17-7822468acfc5--x--https:\/\/track-pm.s3.amazonaws.com\/gw\/image\/0c8b80b5-191f-4937-b52e-a48b32b60e81--x--https:\/\/track-pm.s3.amazonaws.com\/gw\/image\/72be9567-50b2-4445-a03b-753aa7b29326--x--https:\/\/track-pm.s3.amazonaws.com\/gw\/image\/5b772790-ca7c-4113-bca9-4d124e52205c--x--https:\/\/track-pm.s3.amazonaws.com\/gw\/image\/401bdc93-b9e8-4db7-8d6e-9d9caf4259e5--x--https:\/\/track-pm.s3.amazonaws.com\/gw\/image\/6572358b-d62f-4da5-a6d5-0f48a3c93679--x--https:\/\/track-pm.s3.amazonaws.com\/gw\/image\/85146757-7bdf-4eef-8546-609bff54ea8b--x--https:\/\/track-pm.s3.amazonaws.com\/gw\/image\/d298f81a-eb3b-4c0c-a50b-4a17970cded0--x--https:\/\/track-pm.s3.amazonaws.com\/gw\/image\/7efdd9eb-cbff-4a0a-b7bb-0dd965178373",
        "property_state":"TN",
        "property_status":"active",
        "listing_id":null,
        "saas_auto_renew":null,
        "cleaning_fee_id":null,
        "cleaning_fee_value_type":null,
        "cleaning_fee_formula":null,
        "cleaning_fee_multiplier":null,
        "channel_commission_use_account_settings":null,
        "channel_commission_id":null,
        "channel_commission_created_at":null,
        "channel_commission_updated_at":null,
        "cleaning_status":null,
        "picture_caption":null,
        "picture_thumbnail":null,
        "minimum_nights":null,
        "maximum_nights":null,
        "monthly_price_factor":null,
        "weekly_price_factor":null,
        "base_price":null,
        "weekend_base_price":null,
        "currency":null,
        "cleaning_fee":null,
        "confirmed_before_checkin_delay_minutes":null,
        "confirmed_day_of_checkin_delay_minutes":null,
        "confirmed_day_of_checkout_delay_minutes":null,
        "confirmed_during_stay_delay_minutes":null,
        "confirmed_after_checkout_delay_minutes":null,
        "unconfirmed_first_message_delay_minutes":null,
        "unconfirmed_subsequent_message_delay_minutes":null,
        "answeing_machine_is_active":null,
        "auto_reviews_status":null,
        "auto_payments_time_relation_names":null,
        "auto_payments_time_relation_units":null,
        "auto_payments_time_relation_amounts":null,
        "pms_cleaning_status":null,
        "calendar_rules_default_availability":null,
        "bookingcom_cut_off_hours_enabled":null,
        "expedia_cut_off_hours_enabled":null,
        "airbnb_cut_off_hours_enabled":null,
        "directbookings_cut_off_hours_enabled":null,
        "calendar_rules_default_hours":null,
        "calendar_rules_allow_request_to_book":null,
        "calendar_rules_advance_notice_updated_at":null,
        "calendar_rules_advance_notice_updated_by":null,
        "booking_window_default_days":null,
        "booking_window_updated_at":null,
        "preparation_time_updated_at":null,
        "dynamic_checkin_updated_at":null,
        "rental_periods_request_to_book":null,
        "rental_periods_ids":null,
        "rental_periods_from":null,
        "default_availability_updated_at":null,
        "default_availability_updated_by":null,
        "listing_type":null,
        "owners_list":null,
        "amenities_list":null,
        "amenities_not_included_list":null,
        "use_account_revenue_share":null,
        "use_account_taxes":null,
        "use_account_markups":null,
        "use_account_additional_fees":null,
        "is_active":null,
        "net_income_formula":null,
        "commission_formula":null,
        "owner_revenue_formula":null,
        "tax_ids":null,
        "tax_types":null,
        "tax_amounts":null,
        "tax_names":null,
        "tax_units":null,
        "tax_quantifiers":null,
        "taxes_applied_to_all_fees":null,
        "taxes_applied_on_fees":null,
        "taxes_are_applied_by_default":null,
        "tax_conditional_overrides_view_types":null,
        "tax_conditional_overrides_max_nights":null,
        "tax___vs":null,
        "pre_bookings_list":null,
        "origin_id":null,
        "nick_name":null,
        "minimum_age":null,
        "address_full":null,
        "address_street":null,
        "address_city":null,
        "address_country":null,
        "address_latitude":null,
        "address_longitude":null,
        "address_zip_code":null,
        "address_state":null,
        "address_county":null,
        "room_type":null,
        "property_type":null,
        "ota_room_type":null,
        "accommodates":null,
        "bathrooms":null,
        "bedrooms":null,
        "beds_count":null,
        "listing_status":null,
        "host_name":null,
        "wifi_name":null,
        "wifi_password":null,
        "area_in_square_feet":null,
        "trash_collection_day":null,
        "parking_instructions":null,
        "created_at":null,
        "origin":null,
        "default_check_in_time":null,
        "default_check_out_time":null,
        "check_in_instructions":null,
        "check_out_instructions":null,
        "account_id":null,
        "time_zone":null,
        "last_updated_at":null,
        "integration_ids":null,
        "integration_platforms":null,
        "booking_com_initial_complex_listings":null,
        "booking_com_publish_company_logos":null,
        "booking_com_is_published_company_logos":null,
        "booking_com_publish_company_infos":null,
        "booking_com_is_published_company_infos":null,
        "vacayhome_currencies":null,
        "vacayhome_statuses":null,
        "vacayhome_cancellation_policies":null,
        "vacayhome_cancellation_penalties":null,
        "vacayhome_creation_times":null,
        "listing_room_ids":null,
        "listing_room_numbers":null,
        "listing_room_bed_ids":null,
        "listing_room_bed_types":null,
        "listing_room_bed_quantities":null,
        "custom_field_values":null,
        "import_time":null,
        "date_of_first_scrape":null,
        "date_of_last_update":null,
        "date_of_last_scrape":null,
        "summary":"property_address1: 43 Brookwood Terrace D, property_address2: nan, property_building: Brookwood, property_id: 453990, property_notes_access: <p class=RichTextInputTheme__paragraph\" dir=\"ltr\"><span class=\"RichTextInputTheme__textBase\">Master Code: 004300<\/span><\/p><p class=\"RichTextInputTheme__paragraph\" dir=\"ltr\"><span class=\"RichTextInputTheme__textBase\">Emergency Lockbox - 7593 (Entry door knob)<\/span><\/p>\", property_notes_general: <p class=RichTextInputTheme__paragraph\" dir=\"ltr\"><span class=\"RichTextInputTheme__textBase\">Master Code: 004300<\/span><\/p><p class=\"RichTextInputTheme__paragraph\" dir=\"ltr\"><span class=\"RichTextInputTheme__textBase\">Emergency Lockbox - 7593 (Entry door knob)<\/span><\/p><p class=\"RichTextInputTheme__paragraph\" dir=\"ltr\"><i><b><strong class=\"RichTextInputTheme__textBase RichTextInputTheme__textBold RichTextInputTheme__textItalic\">***OWNER NOTES***<\/strong><\/b><\/i><\/p><p class=\"RichTextInputTheme__paragraph\" dir=\"ltr\"><span class=\"RichTextInputTheme__textBase\">Owner -<\/span><\/p><p class=\"RichTextInputTheme__paragraph\" dir=\"ltr\"><span class=\"RichTextInputTheme__textBase\">Currently Escalated? No<\/span><\/p><p class=\"RichTextInputTheme__paragraph\" dir=\"ltr\"><span class=\"RichTextInputTheme__textBase\">Escalated within last 30 days? No<\/span><\/p><p class=\"RichTextInputTheme__paragraph\" dir=\"ltr\"><span class=\"RichTextInputTheme__textBase\">Persona - total hands off <\/span><\/p><p class=\"RichTextInputTheme__paragraph\" dir=\"ltr\"><span class=\"RichTextInputTheme__textBase\">Owner Restrictions? No<\/span><\/p>\", property_notes_guest_access: <p class=RichTextInputTheme__paragraph\" dir=\"ltr\"><b><strong class=\"RichTextInputTheme__textBase RichTextInputTheme__textBold\">Arrival and Parking:<\/strong><\/b><span class=\"RichTextInputTheme__textBase\"> <\/span><\/p><p class=\"RichTextInputTheme__paragraph\" dir=\"ltr\"><span class=\"RichTextInputTheme__textBase\">Assigned parking available for two vehicles - the paved spaces will be directly below Unit D.<\/span><\/p><p class=\"RichTextInputTheme__paragraph\" dir=\"ltr\"><b><strong class=\"RichTextInputTheme__textBase RichTextInputTheme__textBold\"> Access Instructions: <\/strong><\/b><\/p><p class=\"RichTextInputTheme__paragraph\" dir=\"ltr\"><span class=\"RichTextInputTheme__textBase\">Once parked, property_photos_url: https:\/\/track-pm.s3.amazonaws.com\/gw\/image\/b41bdb70-869d-4614-9c46-fed85cf047de--x--https:\/\/track-pm.s3.amazonaws.com\/gw\/image\/41f62fa6-e69f-4b02-a7d9-bfabd52a0f2f--x--https:\/\/track-pm.s3.amazonaws.com\/gw\/image\/c4c47d90-ab5d-4f54-b0d3-012d217770ac--x--https:\/\/track-pm.s3.amazonaws.com\/gw\/image\/b3bc844a-7dfb-4b97-82ba-4b6422020088--x--https:\/\/track-pm.s3.amazonaws.com\/gw\/image\/f689e793-e62a-434c-a4c2-201cf7ba3cc0--x--https:\/\/track-pm.s3.amazonaws.com\/gw\/image\/a3d1a4ec-6158-45f1-a214-e1505920f02d--x--https:\/\/track-pm.s3.amazonaws.com\/gw\/image\/1b79c42f-e9f9-4d8c-8a6c-dbe941e58821--x--https:\/\/track-pm.s3.amazonaws.com\/gw\/image\/047c106b-8ae2-4770-8c5b-1928d8307c90--x--https:\/\/track-pm.s3.amazonaws.com\/gw\/image\/b29f16ec-048f-4c3a-bbf6-6fd089725819--x--https:\/\/track-pm.s3.amazonaws.com\/gw\/image\/f76eb11e-2acc-434c-9651-60149ec50902--x--https:\/\/track-pm.s3.amazonaws.com\/gw\/image\/9cc21e15-8e4e-4736-9549-a841b3368aa2--x--https:\/\/track-pm.s3.amazonaws.com\/gw\/image\/08dc3eb2-7fae-43f0-9c40-02c766462930--x--https:\/\/track-pm.s3.amazonaws.com\/gw\/image\/2d3713dc-ae95-48c8-9cfb-8b06e56baa49--x--https:\/\/track-pm.s3.amazonaws.com\/gw\/image\/8f4afdcb-b96f-4e1a-b0f0-f01be7fec450--x--https:\/\/track-pm.s3.amazonaws.com\/gw\/image\/1e561f7a-dc47-4ca4-a8d0-0fc11eef23ed--x--https:\/\/track-pm.s3.amazonaws.com\/gw\/image\/48ee5ca5-58df-4888-8f17-7822468acfc5--x--https:\/\/track-pm.s3.amazonaws.com\/gw\/image\/0c8b80b5-191f-4937-b52e-a48b32b60e81--x--https:\/\/track-pm.s3.amazonaws.com\/gw\/image\/72be9567-50b2-4445-a03b-753aa7b29326--x--https:\/\/track-pm.s3.amazonaws.com\/gw\/image\/5b772790-ca7c-4113-bca9-4d124e52205c--x--https:\/\/track-pm.s3.amazonaws.com\/gw\/image\/401bdc93-b9e8-4db7-8d6e-9d9caf4259e5--x--https:\/\/track-pm.s3.amazonaws.com\/gw\/image\/6572358b-d62f-4da5-a6d5-0f48a3c93679--x--https:\/\/track-pm.s3.amazonaws.com\/gw\/image\/85146757-7bdf-4eef-8546-609bff54ea8b--x--https:\/\/track-pm.s3.amazonaws.com\/gw\/image\/d298f81a-eb3b-4c0c-a50b-4a17970cded0--x--https:\/\/track-pm.s3.amazonaws.com\/gw\/image\/7efdd9eb-cbff-4a0a-b7bb-0dd965178373, property_state: TN, property_status: active, listing_id: nan, saas_auto_renew: nan, cleaning_fee_id: nan, cleaning_fee_value_type: nan, cleaning_fee_formula: nan, cleaning_fee_multiplier: nan, channel_commission_use_account_settings: nan, channel_commission_id: nan, channel_commission_created_at: nan, channel_commission_updated_at: nan, cleaning_status: nan, picture_caption: nan, picture_thumbnail: nan, minimum_nights: nan, maximum_nights: nan, monthly_price_factor: nan, weekly_price_factor: nan, base_price: nan, weekend_base_price: nan, currency: nan, cleaning_fee: nan, confirmed_before_checkin_delay_minutes: nan, confirmed_day_of_checkin_delay_minutes: nan, confirmed_day_of_checkout_delay_minutes: nan, confirmed_during_stay_delay_minutes: nan, confirmed_after_checkout_delay_minutes: nan, unconfirmed_first_message_delay_minutes: nan, unconfirmed_subsequent_message_delay_minutes: nan, answeing_machine_is_active: nan, auto_reviews_status: nan, auto_payments_time_relation_names: nan, auto_payments_time_relation_units: nan, auto_payments_time_relation_amounts: nan, pms_cleaning_status: nan, calendar_rules_default_availability: nan, bookingcom_cut_off_hours_enabled: nan, expedia_cut_off_hours_enabled: nan, airbnb_cut_off_hours_enabled: nan, directbookings_cut_off_hours_enabled: nan, calendar_rules_default_hours: nan, calendar_rules_allow_request_to_book: nan, calendar_rules_advance_notice_updated_at: nan, calendar_rules_advance_notice_updated_by: nan, booking_window_default_days: nan, booking_window_updated_at: nan, preparation_time_updated_at: nan, dynamic_checkin_updated_at: nan, rental_periods_request_to_book: nan, rental_periods_ids: nan, rental_periods_from: NaT, default_availability_updated_at: nan, default_availability_updated_by: nan, listing_type: nan, owners_list: nan, amenities_list: nan, amenities_not_included_list: nan, use_account_revenue_share: nan, use_account_taxes: nan, use_account_markups: nan, use_account_additional_fees: nan, is_active: nan, net_income_formula: nan, commission_formula: nan, owner_revenue_formula: nan, tax_ids: nan, tax_types: nan, tax_amounts: nan, tax_names: nan, tax_units: nan, tax_quantifiers: nan, taxes_applied_to_all_fees: nan, taxes_applied_on_fees: nan, taxes_are_applied_by_default: nan, tax_conditional_overrides_view_types: nan, tax_conditional_overrides_max_nights: nan, tax___vs: nan, pre_bookings_list: nan, origin_id: nan, nick_name: nan, minimum_age: nan, address_full: nan, address_street: nan, address_city: nan, address_country: nan, address_latitude: nan, address_longitude: nan, address_zip_code: nan, address_state: nan, address_county: nan, room_type: nan, property_type: nan, ota_room_type: nan, accommodates: nan, bathrooms: nan, bedrooms: nan, beds_count: nan, listing_status: nan, host_name: nan, wifi_name: nan, wifi_password: nan, area_in_square_feet: nan, trash_collection_day: nan, parking_instructions: nan, created_at: nan, origin: nan, default_check_in_time: nan, default_check_out_time: nan, check_in_instructions: nan, check_out_instructions: nan, account_id: nan, time_zone: nan, last_updated_at: nan, integration_ids: nan, integration_platforms: nan, booking_com_initial_complex_listings: nan, booking_com_publish_company_logos: nan, booking_com_is_published_company_logos: nan, booking_com_publish_company_infos: nan, booking_com_is_published_company_infos: nan, vacayhome_currencies: nan, vacayhome_statuses: nan, vacayhome_cancellation_policies: nan, vacayhome_cancellation_penalties: nan, vacayhome_creation_times: nan, listing_room_ids: nan, listing_room_numbers: nan, listing_room_bed_ids: nan, listing_room_bed_types: nan, listing_room_bed_quantities: nan, custom_field_values: nan, import_time: nan, date_of_first_scrape: NaT, date_of_last_update: nan, date_of_last_scrape: NaT"
    },
    {
        "property_address1":"1302 Jackson St - Unit B",
        "property_address2":null,
        "property_building":"Germantown",
        "property_id":453997,
        "property_notes_access":"<p class=RichTextInputTheme__paragraph\" dir=\"ltr\"><span class=\"RichTextInputTheme__textBase\">Master code: 001310<\/span><\/p><p class=\"RichTextInputTheme__paragraph\" dir=\"ltr\"><span class=\"RichTextInputTheme__textBase\">Emergency lockbox code - 1014<\/span><\/p><p class=\"RichTextInputTheme__paragraph\" dir=\"ltr\"><span class=\"RichTextInputTheme__textBase\">Emergency lockbox location - base of brown railing across from entry of unit B.<\/span><\/p><p class=\"RichTextInputTheme__paragraph\" dir=\"ltr\"><span class=\"RichTextInputTheme__textBase\">Joining door lockbox code - 1097<\/span><\/p><p class=\"RichTextInputTheme__paragraph\" dir=\"ltr\"><span class=\"RichTextInputTheme__textBase\">Joining door lockbox location - black wood lattice on opposite side of entry below the stoop.<\/span><\/p><p class=\"RichTextInputTheme__paragraph\" dir=\"ltr\"><br><\/p>\"",
        "property_notes_general":"<p class=RichTextInputTheme__paragraph\" dir=\"ltr\"><span class=\"RichTextInputTheme__textBase\">Master code: 001310<\/span><\/p><p class=\"RichTextInputTheme__paragraph\" dir=\"ltr\"><span class=\"RichTextInputTheme__textBase\">Emergency lockbox code - 1014<\/span><\/p><p class=\"RichTextInputTheme__paragraph\" dir=\"ltr\"><span class=\"RichTextInputTheme__textBase\">Emergency lockbox location - base of brown railing across from entry of unit B.<\/span><\/p><p class=\"RichTextInputTheme__paragraph\" dir=\"ltr\"><span class=\"RichTextInputTheme__textBase\">Joining door lockbox code - 1097<\/span><\/p><p class=\"RichTextInputTheme__paragraph\" dir=\"ltr\"><span class=\"RichTextInputTheme__textBase\">Joining door lockbox location - black wood lattice on opposite side of entry below the stoop.<\/span><\/p><p class=\"RichTextInputTheme__paragraph\" dir=\"ltr\"><i><b><strong class=\"RichTextInputTheme__textBase RichTextInputTheme__textBold RichTextInputTheme__textItalic\">***OWNER NOTES***<\/strong><\/b><\/i><\/p><p class=\"RichTextInputTheme__paragraph\" dir=\"ltr\"><span class=\"RichTextInputTheme__textBase\">Owner -<\/span><\/p><p class=\"RichTextInputTheme__paragraph\" dir=\"ltr\"><span class=\"RichTextInputTheme__textBase\">Currently Escalated? No<\/span><\/p><p class=\"RichTextInputTheme__paragraph\" dir=\"ltr\"><span class=\"RichTextInputTheme__textBase\">Escalated within last 30 days? No<\/span><\/p><p class=\"RichTextInputTheme__paragraph\" dir=\"ltr\"><span class=\"RichTextInputTheme__textBase\">Persona - <\/span><\/p><p class=\"RichTextInputTheme__paragraph\" dir=\"ltr\"><span class=\"RichTextInputTheme__textBase\">Owner Restrictions? No<\/span><\/p>\"",
        "property_notes_guest_access":"<p class=RichTextInputTheme__paragraph\" dir=\"ltr\"><b><strong class=\"RichTextInputTheme__textBase RichTextInputTheme__textBold\">Arrival and Parking: <\/strong><\/b><\/p><p class=\"RichTextInputTheme__paragraph\" dir=\"ltr\"><span class=\"RichTextInputTheme__textBase\">Parking available for up to one vehicle in the gravel parking lot located at the rear of the unit. Additional street parking at a first-come",
        "property_photos_url":"130499770--x--130499743--x--130499744--x--130499745--x--130499746--x--130499747--x--130499748--x--130499749--x--130499750--x--130499751--x--130499752--x--130499753--x--130499754--x--130499755--x--130499756--x--130499757--x--130499758--x--130499759--x--130499760--x--130499761--x--130499762--x--130499763--x--130499764--x--130499765--x--130499766--x--130499767--x--130499768--x--130499769",
        "property_state":"TN",
        "property_status":"active",
        "listing_id":null,
        "saas_auto_renew":null,
        "cleaning_fee_id":null,
        "cleaning_fee_value_type":null,
        "cleaning_fee_formula":null,
        "cleaning_fee_multiplier":null,
        "channel_commission_use_account_settings":null,
        "channel_commission_id":null,
        "channel_commission_created_at":null,
        "channel_commission_updated_at":null,
        "cleaning_status":null,
        "picture_caption":null,
        "picture_thumbnail":null,
        "minimum_nights":null,
        "maximum_nights":null,
        "monthly_price_factor":null,
        "weekly_price_factor":null,
        "base_price":null,
        "weekend_base_price":null,
        "currency":null,
        "cleaning_fee":null,
        "confirmed_before_checkin_delay_minutes":null,
        "confirmed_day_of_checkin_delay_minutes":null,
        "confirmed_day_of_checkout_delay_minutes":null,
        "confirmed_during_stay_delay_minutes":null,
        "confirmed_after_checkout_delay_minutes":null,
        "unconfirmed_first_message_delay_minutes":null,
        "unconfirmed_subsequent_message_delay_minutes":null,
        "answeing_machine_is_active":null,
        "auto_reviews_status":null,
        "auto_payments_time_relation_names":null,
        "auto_payments_time_relation_units":null,
        "auto_payments_time_relation_amounts":null,
        "pms_cleaning_status":null,
        "calendar_rules_default_availability":null,
        "bookingcom_cut_off_hours_enabled":null,
        "expedia_cut_off_hours_enabled":null,
        "airbnb_cut_off_hours_enabled":null,
        "directbookings_cut_off_hours_enabled":null,
        "calendar_rules_default_hours":null,
        "calendar_rules_allow_request_to_book":null,
        "calendar_rules_advance_notice_updated_at":null,
        "calendar_rules_advance_notice_updated_by":null,
        "booking_window_default_days":null,
        "booking_window_updated_at":null,
        "preparation_time_updated_at":null,
        "dynamic_checkin_updated_at":null,
        "rental_periods_request_to_book":null,
        "rental_periods_ids":null,
        "rental_periods_from":null,
        "default_availability_updated_at":null,
        "default_availability_updated_by":null,
        "listing_type":null,
        "owners_list":null,
        "amenities_list":null,
        "amenities_not_included_list":null,
        "use_account_revenue_share":null,
        "use_account_taxes":null,
        "use_account_markups":null,
        "use_account_additional_fees":null,
        "is_active":null,
        "net_income_formula":null,
        "commission_formula":null,
        "owner_revenue_formula":null,
        "tax_ids":null,
        "tax_types":null,
        "tax_amounts":null,
        "tax_names":null,
        "tax_units":null,
        "tax_quantifiers":null,
        "taxes_applied_to_all_fees":null,
        "taxes_applied_on_fees":null,
        "taxes_are_applied_by_default":null,
        "tax_conditional_overrides_view_types":null,
        "tax_conditional_overrides_max_nights":null,
        "tax___vs":null,
        "pre_bookings_list":null,
        "origin_id":null,
        "nick_name":null,
        "minimum_age":null,
        "address_full":null,
        "address_street":null,
        "address_city":null,
        "address_country":null,
        "address_latitude":null,
        "address_longitude":null,
        "address_zip_code":null,
        "address_state":null,
        "address_county":null,
        "room_type":null,
        "property_type":null,
        "ota_room_type":null,
        "accommodates":null,
        "bathrooms":null,
        "bedrooms":null,
        "beds_count":null,
        "listing_status":null,
        "host_name":null,
        "wifi_name":null,
        "wifi_password":null,
        "area_in_square_feet":null,
        "trash_collection_day":null,
        "parking_instructions":null,
        "created_at":null,
        "origin":null,
        "default_check_in_time":null,
        "default_check_out_time":null,
        "check_in_instructions":null,
        "check_out_instructions":null,
        "account_id":null,
        "time_zone":null,
        "last_updated_at":null,
        "integration_ids":null,
        "integration_platforms":null,
        "booking_com_initial_complex_listings":null,
        "booking_com_publish_company_logos":null,
        "booking_com_is_published_company_logos":null,
        "booking_com_publish_company_infos":null,
        "booking_com_is_published_company_infos":null,
        "vacayhome_currencies":null,
        "vacayhome_statuses":null,
        "vacayhome_cancellation_policies":null,
        "vacayhome_cancellation_penalties":null,
        "vacayhome_creation_times":null,
        "listing_room_ids":null,
        "listing_room_numbers":null,
        "listing_room_bed_ids":null,
        "listing_room_bed_types":null,
        "listing_room_bed_quantities":null,
        "custom_field_values":null,
        "import_time":null,
        "date_of_first_scrape":null,
        "date_of_last_update":null,
        "date_of_last_scrape":null,
        "summary":"property_address1: 1302 Jackson St - Unit B, property_address2: nan, property_building: Germantown, property_id: 453997, property_notes_access: <p class=RichTextInputTheme__paragraph\" dir=\"ltr\"><span class=\"RichTextInputTheme__textBase\">Master code: 001310<\/span><\/p><p class=\"RichTextInputTheme__paragraph\" dir=\"ltr\"><span class=\"RichTextInputTheme__textBase\">Emergency lockbox code - 1014<\/span><\/p><p class=\"RichTextInputTheme__paragraph\" dir=\"ltr\"><span class=\"RichTextInputTheme__textBase\">Emergency lockbox location - base of brown railing across from entry of unit B.<\/span><\/p><p class=\"RichTextInputTheme__paragraph\" dir=\"ltr\"><span class=\"RichTextInputTheme__textBase\">Joining door lockbox code - 1097<\/span><\/p><p class=\"RichTextInputTheme__paragraph\" dir=\"ltr\"><span class=\"RichTextInputTheme__textBase\">Joining door lockbox location - black wood lattice on opposite side of entry below the stoop.<\/span><\/p><p class=\"RichTextInputTheme__paragraph\" dir=\"ltr\"><br><\/p>\", property_notes_general: <p class=RichTextInputTheme__paragraph\" dir=\"ltr\"><span class=\"RichTextInputTheme__textBase\">Master code: 001310<\/span><\/p><p class=\"RichTextInputTheme__paragraph\" dir=\"ltr\"><span class=\"RichTextInputTheme__textBase\">Emergency lockbox code - 1014<\/span><\/p><p class=\"RichTextInputTheme__paragraph\" dir=\"ltr\"><span class=\"RichTextInputTheme__textBase\">Emergency lockbox location - base of brown railing across from entry of unit B.<\/span><\/p><p class=\"RichTextInputTheme__paragraph\" dir=\"ltr\"><span class=\"RichTextInputTheme__textBase\">Joining door lockbox code - 1097<\/span><\/p><p class=\"RichTextInputTheme__paragraph\" dir=\"ltr\"><span class=\"RichTextInputTheme__textBase\">Joining door lockbox location - black wood lattice on opposite side of entry below the stoop.<\/span><\/p><p class=\"RichTextInputTheme__paragraph\" dir=\"ltr\"><i><b><strong class=\"RichTextInputTheme__textBase RichTextInputTheme__textBold RichTextInputTheme__textItalic\">***OWNER NOTES***<\/strong><\/b><\/i><\/p><p class=\"RichTextInputTheme__paragraph\" dir=\"ltr\"><span class=\"RichTextInputTheme__textBase\">Owner -<\/span><\/p><p class=\"RichTextInputTheme__paragraph\" dir=\"ltr\"><span class=\"RichTextInputTheme__textBase\">Currently Escalated? No<\/span><\/p><p class=\"RichTextInputTheme__paragraph\" dir=\"ltr\"><span class=\"RichTextInputTheme__textBase\">Escalated within last 30 days? No<\/span><\/p><p class=\"RichTextInputTheme__paragraph\" dir=\"ltr\"><span class=\"RichTextInputTheme__textBase\">Persona - <\/span><\/p><p class=\"RichTextInputTheme__paragraph\" dir=\"ltr\"><span class=\"RichTextInputTheme__textBase\">Owner Restrictions? No<\/span><\/p>\", property_notes_guest_access: <p class=RichTextInputTheme__paragraph\" dir=\"ltr\"><b><strong class=\"RichTextInputTheme__textBase RichTextInputTheme__textBold\">Arrival and Parking: <\/strong><\/b><\/p><p class=\"RichTextInputTheme__paragraph\" dir=\"ltr\"><span class=\"RichTextInputTheme__textBase\">Parking available for up to one vehicle in the gravel parking lot located at the rear of the unit. Additional street parking at a first-come, property_photos_url: 130499770--x--130499743--x--130499744--x--130499745--x--130499746--x--130499747--x--130499748--x--130499749--x--130499750--x--130499751--x--130499752--x--130499753--x--130499754--x--130499755--x--130499756--x--130499757--x--130499758--x--130499759--x--130499760--x--130499761--x--130499762--x--130499763--x--130499764--x--130499765--x--130499766--x--130499767--x--130499768--x--130499769, property_state: TN, property_status: active, listing_id: nan, saas_auto_renew: nan, cleaning_fee_id: nan, cleaning_fee_value_type: nan, cleaning_fee_formula: nan, cleaning_fee_multiplier: nan, channel_commission_use_account_settings: nan, channel_commission_id: nan, channel_commission_created_at: nan, channel_commission_updated_at: nan, cleaning_status: nan, picture_caption: nan, picture_thumbnail: nan, minimum_nights: nan, maximum_nights: nan, monthly_price_factor: nan, weekly_price_factor: nan, base_price: nan, weekend_base_price: nan, currency: nan, cleaning_fee: nan, confirmed_before_checkin_delay_minutes: nan, confirmed_day_of_checkin_delay_minutes: nan, confirmed_day_of_checkout_delay_minutes: nan, confirmed_during_stay_delay_minutes: nan, confirmed_after_checkout_delay_minutes: nan, unconfirmed_first_message_delay_minutes: nan, unconfirmed_subsequent_message_delay_minutes: nan, answeing_machine_is_active: nan, auto_reviews_status: nan, auto_payments_time_relation_names: nan, auto_payments_time_relation_units: nan, auto_payments_time_relation_amounts: nan, pms_cleaning_status: nan, calendar_rules_default_availability: nan, bookingcom_cut_off_hours_enabled: nan, expedia_cut_off_hours_enabled: nan, airbnb_cut_off_hours_enabled: nan, directbookings_cut_off_hours_enabled: nan, calendar_rules_default_hours: nan, calendar_rules_allow_request_to_book: nan, calendar_rules_advance_notice_updated_at: nan, calendar_rules_advance_notice_updated_by: nan, booking_window_default_days: nan, booking_window_updated_at: nan, preparation_time_updated_at: nan, dynamic_checkin_updated_at: nan, rental_periods_request_to_book: nan, rental_periods_ids: nan, rental_periods_from: NaT, default_availability_updated_at: nan, default_availability_updated_by: nan, listing_type: nan, owners_list: nan, amenities_list: nan, amenities_not_included_list: nan, use_account_revenue_share: nan, use_account_taxes: nan, use_account_markups: nan, use_account_additional_fees: nan, is_active: nan, net_income_formula: nan, commission_formula: nan, owner_revenue_formula: nan, tax_ids: nan, tax_types: nan, tax_amounts: nan, tax_names: nan, tax_units: nan, tax_quantifiers: nan, taxes_applied_to_all_fees: nan, taxes_applied_on_fees: nan, taxes_are_applied_by_default: nan, tax_conditional_overrides_view_types: nan, tax_conditional_overrides_max_nights: nan, tax___vs: nan, pre_bookings_list: nan, origin_id: nan, nick_name: nan, minimum_age: nan, address_full: nan, address_street: nan, address_city: nan, address_country: nan, address_latitude: nan, address_longitude: nan, address_zip_code: nan, address_state: nan, address_county: nan, room_type: nan, property_type: nan, ota_room_type: nan, accommodates: nan, bathrooms: nan, bedrooms: nan, beds_count: nan, listing_status: nan, host_name: nan, wifi_name: nan, wifi_password: nan, area_in_square_feet: nan, trash_collection_day: nan, parking_instructions: nan, created_at: nan, origin: nan, default_check_in_time: nan, default_check_out_time: nan, check_in_instructions: nan, check_out_instructions: nan, account_id: nan, time_zone: nan, last_updated_at: nan, integration_ids: nan, integration_platforms: nan, booking_com_initial_complex_listings: nan, booking_com_publish_company_logos: nan, booking_com_is_published_company_logos: nan, booking_com_publish_company_infos: nan, booking_com_is_published_company_infos: nan, vacayhome_currencies: nan, vacayhome_statuses: nan, vacayhome_cancellation_policies: nan, vacayhome_cancellation_penalties: nan, vacayhome_creation_times: nan, listing_room_ids: nan, listing_room_numbers: nan, listing_room_bed_ids: nan, listing_room_bed_types: nan, listing_room_bed_quantities: nan, custom_field_values: nan, import_time: nan, date_of_first_scrape: NaT, date_of_last_update: nan, date_of_last_scrape: NaT"
    },
    {
        "property_address1":"844 Cherokee Ave #8",
        "property_address2":null,
        "property_building":"Cherokee",
        "property_id":454000,
        "property_notes_access":"<p class=RichTextInputTheme__paragraph\" dir=\"ltr\"><span class=\"RichTextInputTheme__textBase\">Emergency Lockbox - 6230 (front door handle)<\/span><\/p><p class=\"RichTextInputTheme__paragraph\" dir=\"ltr\"><span class=\"RichTextInputTheme__textBase\">Backup Keyless entry:  084480<\/span><\/p><p class=\"RichTextInputTheme__paragraph\" dir=\"ltr\"><br><\/p>\"",
        "property_notes_general":"<p class=RichTextInputTheme__paragraph\" dir=\"ltr\"><span class=\"RichTextInputTheme__textBase\">Layout: 3 levels<\/span><\/p><p class=\"RichTextInputTheme__paragraph\" dir=\"ltr\"><span class=\"RichTextInputTheme__textBase\">1st Floor: 1 bedroom",
        "property_notes_guest_access":" 1 full bath",
        "property_photos_url":" laundry <\/span><\/p><p class=\"RichTextInputTheme__paragraph\" dir=\"ltr\"><br><span class=\"RichTextInputTheme__textBase\">Backup Keyless entry:  084480<\/span><\/p><p class=\"RichTextInputTheme__paragraph\" dir=\"ltr\"><span class=\"RichTextInputTheme__textBase\">Emergency Lockbox - 6230 (front door handle)<\/span><\/p><p class=\"RichTextInputTheme__paragraph\" dir=\"ltr\"><i><b><strong class=\"RichTextInputTheme__textBase RichTextInputTheme__textBold RichTextInputTheme__textItalic\">***OWNER NOTES***<\/strong><\/b><\/i><\/p><p class=\"RichTextInputTheme__paragraph\" dir=\"ltr\"><span class=\"RichTextInputTheme__textBase\">Owner - Matthew MArtinez<\/span><\/p><p class=\"RichTextInputTheme__paragraph\" dir=\"ltr\"><span class=\"RichTextInputTheme__textBase\">Currently Escalated? No<\/span><\/p><p class=\"RichTextInputTheme__paragraph\" dir=\"ltr\"><span class=\"RichTextInputTheme__textBase\">Escalated within last 30 days? No<\/span><\/p><p class=\"RichTextInputTheme__paragraph\" dir=\"ltr\"><span class=\"RichTextInputTheme__textBase\">Persona - <\/span><\/p><p class=\"RichTextInputTheme__paragraph\" dir=\"ltr\"><span class=\"RichTextInputTheme__textBase\">Owner Restrictions? No<\/span><\/p>\"",
        "property_state":"TN",
        "property_status":"active",
        "listing_id":null,
        "saas_auto_renew":null,
        "cleaning_fee_id":null,
        "cleaning_fee_value_type":null,
        "cleaning_fee_formula":null,
        "cleaning_fee_multiplier":null,
        "channel_commission_use_account_settings":null,
        "channel_commission_id":null,
        "channel_commission_created_at":null,
        "channel_commission_updated_at":null,
        "cleaning_status":null,
        "picture_caption":null,
        "picture_thumbnail":null,
        "minimum_nights":null,
        "maximum_nights":null,
        "monthly_price_factor":null,
        "weekly_price_factor":null,
        "base_price":null,
        "weekend_base_price":null,
        "currency":null,
        "cleaning_fee":null,
        "confirmed_before_checkin_delay_minutes":null,
        "confirmed_day_of_checkin_delay_minutes":null,
        "confirmed_day_of_checkout_delay_minutes":null,
        "confirmed_during_stay_delay_minutes":null,
        "confirmed_after_checkout_delay_minutes":null,
        "unconfirmed_first_message_delay_minutes":null,
        "unconfirmed_subsequent_message_delay_minutes":null,
        "answeing_machine_is_active":null,
        "auto_reviews_status":null,
        "auto_payments_time_relation_names":null,
        "auto_payments_time_relation_units":null,
        "auto_payments_time_relation_amounts":null,
        "pms_cleaning_status":null,
        "calendar_rules_default_availability":null,
        "bookingcom_cut_off_hours_enabled":null,
        "expedia_cut_off_hours_enabled":null,
        "airbnb_cut_off_hours_enabled":null,
        "directbookings_cut_off_hours_enabled":null,
        "calendar_rules_default_hours":null,
        "calendar_rules_allow_request_to_book":null,
        "calendar_rules_advance_notice_updated_at":null,
        "calendar_rules_advance_notice_updated_by":null,
        "booking_window_default_days":null,
        "booking_window_updated_at":null,
        "preparation_time_updated_at":null,
        "dynamic_checkin_updated_at":null,
        "rental_periods_request_to_book":null,
        "rental_periods_ids":null,
        "rental_periods_from":null,
        "default_availability_updated_at":null,
        "default_availability_updated_by":null,
        "listing_type":null,
        "owners_list":null,
        "amenities_list":null,
        "amenities_not_included_list":null,
        "use_account_revenue_share":null,
        "use_account_taxes":null,
        "use_account_markups":null,
        "use_account_additional_fees":null,
        "is_active":null,
        "net_income_formula":null,
        "commission_formula":null,
        "owner_revenue_formula":null,
        "tax_ids":null,
        "tax_types":null,
        "tax_amounts":null,
        "tax_names":null,
        "tax_units":null,
        "tax_quantifiers":null,
        "taxes_applied_to_all_fees":null,
        "taxes_applied_on_fees":null,
        "taxes_are_applied_by_default":null,
        "tax_conditional_overrides_view_types":null,
        "tax_conditional_overrides_max_nights":null,
        "tax___vs":null,
        "pre_bookings_list":null,
        "origin_id":null,
        "nick_name":null,
        "minimum_age":null,
        "address_full":null,
        "address_street":null,
        "address_city":null,
        "address_country":null,
        "address_latitude":null,
        "address_longitude":null,
        "address_zip_code":null,
        "address_state":null,
        "address_county":null,
        "room_type":null,
        "property_type":null,
        "ota_room_type":null,
        "accommodates":null,
        "bathrooms":null,
        "bedrooms":null,
        "beds_count":null,
        "listing_status":null,
        "host_name":null,
        "wifi_name":null,
        "wifi_password":null,
        "area_in_square_feet":null,
        "trash_collection_day":null,
        "parking_instructions":null,
        "created_at":null,
        "origin":null,
        "default_check_in_time":null,
        "default_check_out_time":null,
        "check_in_instructions":null,
        "check_out_instructions":null,
        "account_id":null,
        "time_zone":null,
        "last_updated_at":null,
        "integration_ids":null,
        "integration_platforms":null,
        "booking_com_initial_complex_listings":null,
        "booking_com_publish_company_logos":null,
        "booking_com_is_published_company_logos":null,
        "booking_com_publish_company_infos":null,
        "booking_com_is_published_company_infos":null,
        "vacayhome_currencies":null,
        "vacayhome_statuses":null,
        "vacayhome_cancellation_policies":null,
        "vacayhome_cancellation_penalties":null,
        "vacayhome_creation_times":null,
        "listing_room_ids":null,
        "listing_room_numbers":null,
        "listing_room_bed_ids":null,
        "listing_room_bed_types":null,
        "listing_room_bed_quantities":null,
        "custom_field_values":null,
        "import_time":null,
        "date_of_first_scrape":null,
        "date_of_last_update":null,
        "date_of_last_scrape":null,
        "summary":"property_address1: 844 Cherokee Ave #8, property_address2: nan, property_building: Cherokee, property_id: 454000, property_notes_access: <p class=RichTextInputTheme__paragraph\" dir=\"ltr\"><span class=\"RichTextInputTheme__textBase\">Emergency Lockbox - 6230 (front door handle)<\/span><\/p><p class=\"RichTextInputTheme__paragraph\" dir=\"ltr\"><span class=\"RichTextInputTheme__textBase\">Backup Keyless entry:  084480<\/span><\/p><p class=\"RichTextInputTheme__paragraph\" dir=\"ltr\"><br><\/p>\", property_notes_general: <p class=RichTextInputTheme__paragraph\" dir=\"ltr\"><span class=\"RichTextInputTheme__textBase\">Layout: 3 levels<\/span><\/p><p class=\"RichTextInputTheme__paragraph\" dir=\"ltr\"><span class=\"RichTextInputTheme__textBase\">1st Floor: 1 bedroom, property_notes_guest_access:  1 full bath, property_photos_url:  laundry <\/span><\/p><p class=\"RichTextInputTheme__paragraph\" dir=\"ltr\"><br><span class=\"RichTextInputTheme__textBase\">Backup Keyless entry:  084480<\/span><\/p><p class=\"RichTextInputTheme__paragraph\" dir=\"ltr\"><span class=\"RichTextInputTheme__textBase\">Emergency Lockbox - 6230 (front door handle)<\/span><\/p><p class=\"RichTextInputTheme__paragraph\" dir=\"ltr\"><i><b><strong class=\"RichTextInputTheme__textBase RichTextInputTheme__textBold RichTextInputTheme__textItalic\">***OWNER NOTES***<\/strong><\/b><\/i><\/p><p class=\"RichTextInputTheme__paragraph\" dir=\"ltr\"><span class=\"RichTextInputTheme__textBase\">Owner - Matthew MArtinez<\/span><\/p><p class=\"RichTextInputTheme__paragraph\" dir=\"ltr\"><span class=\"RichTextInputTheme__textBase\">Currently Escalated? No<\/span><\/p><p class=\"RichTextInputTheme__paragraph\" dir=\"ltr\"><span class=\"RichTextInputTheme__textBase\">Escalated within last 30 days? No<\/span><\/p><p class=\"RichTextInputTheme__paragraph\" dir=\"ltr\"><span class=\"RichTextInputTheme__textBase\">Persona - <\/span><\/p><p class=\"RichTextInputTheme__paragraph\" dir=\"ltr\"><span class=\"RichTextInputTheme__textBase\">Owner Restrictions? No<\/span><\/p>\", property_state: TN, property_status: active, listing_id: nan, saas_auto_renew: nan, cleaning_fee_id: nan, cleaning_fee_value_type: nan, cleaning_fee_formula: nan, cleaning_fee_multiplier: nan, channel_commission_use_account_settings: nan, channel_commission_id: nan, channel_commission_created_at: nan, channel_commission_updated_at: nan, cleaning_status: nan, picture_caption: nan, picture_thumbnail: nan, minimum_nights: nan, maximum_nights: nan, monthly_price_factor: nan, weekly_price_factor: nan, base_price: nan, weekend_base_price: nan, currency: nan, cleaning_fee: nan, confirmed_before_checkin_delay_minutes: nan, confirmed_day_of_checkin_delay_minutes: nan, confirmed_day_of_checkout_delay_minutes: nan, confirmed_during_stay_delay_minutes: nan, confirmed_after_checkout_delay_minutes: nan, unconfirmed_first_message_delay_minutes: nan, unconfirmed_subsequent_message_delay_minutes: nan, answeing_machine_is_active: nan, auto_reviews_status: nan, auto_payments_time_relation_names: nan, auto_payments_time_relation_units: nan, auto_payments_time_relation_amounts: nan, pms_cleaning_status: nan, calendar_rules_default_availability: nan, bookingcom_cut_off_hours_enabled: nan, expedia_cut_off_hours_enabled: nan, airbnb_cut_off_hours_enabled: nan, directbookings_cut_off_hours_enabled: nan, calendar_rules_default_hours: nan, calendar_rules_allow_request_to_book: nan, calendar_rules_advance_notice_updated_at: nan, calendar_rules_advance_notice_updated_by: nan, booking_window_default_days: nan, booking_window_updated_at: nan, preparation_time_updated_at: nan, dynamic_checkin_updated_at: nan, rental_periods_request_to_book: nan, rental_periods_ids: nan, rental_periods_from: NaT, default_availability_updated_at: nan, default_availability_updated_by: nan, listing_type: nan, owners_list: nan, amenities_list: nan, amenities_not_included_list: nan, use_account_revenue_share: nan, use_account_taxes: nan, use_account_markups: nan, use_account_additional_fees: nan, is_active: nan, net_income_formula: nan, commission_formula: nan, owner_revenue_formula: nan, tax_ids: nan, tax_types: nan, tax_amounts: nan, tax_names: nan, tax_units: nan, tax_quantifiers: nan, taxes_applied_to_all_fees: nan, taxes_applied_on_fees: nan, taxes_are_applied_by_default: nan, tax_conditional_overrides_view_types: nan, tax_conditional_overrides_max_nights: nan, tax___vs: nan, pre_bookings_list: nan, origin_id: nan, nick_name: nan, minimum_age: nan, address_full: nan, address_street: nan, address_city: nan, address_country: nan, address_latitude: nan, address_longitude: nan, address_zip_code: nan, address_state: nan, address_county: nan, room_type: nan, property_type: nan, ota_room_type: nan, accommodates: nan, bathrooms: nan, bedrooms: nan, beds_count: nan, listing_status: nan, host_name: nan, wifi_name: nan, wifi_password: nan, area_in_square_feet: nan, trash_collection_day: nan, parking_instructions: nan, created_at: nan, origin: nan, default_check_in_time: nan, default_check_out_time: nan, check_in_instructions: nan, check_out_instructions: nan, account_id: nan, time_zone: nan, last_updated_at: nan, integration_ids: nan, integration_platforms: nan, booking_com_initial_complex_listings: nan, booking_com_publish_company_logos: nan, booking_com_is_published_company_logos: nan, booking_com_publish_company_infos: nan, booking_com_is_published_company_infos: nan, vacayhome_currencies: nan, vacayhome_statuses: nan, vacayhome_cancellation_policies: nan, vacayhome_cancellation_penalties: nan, vacayhome_creation_times: nan, listing_room_ids: nan, listing_room_numbers: nan, listing_room_bed_ids: nan, listing_room_bed_types: nan, listing_room_bed_quantities: nan, custom_field_values: nan, import_time: nan, date_of_first_scrape: NaT, date_of_last_update: nan, date_of_last_scrape: NaT"
    },
    {
        "property_address1":"3301 Albion St",
        "property_address2":null,
        "property_building":"Albion",
        "property_id":454007,
        "property_notes_access":"<p class=RichTextInputTheme__paragraph\" dir=\"ltr\"><span class=\"RichTextInputTheme__textBase\">Master code: 003301<\/span><\/p>\"",
        "property_notes_general":"<p class=RichTextInputTheme__paragraph\" dir=\"ltr\"><span class=\"RichTextInputTheme__textBase\">Layout: 1 level; 2-3 steps required for entry<\/span><\/p><p class=\"RichTextInputTheme__paragraph\" dir=\"ltr\"><br><b><strong class=\"RichTextInputTheme__textBase RichTextInputTheme__textBold\">Main door is the back (parking side) door!! This is the only door with a Yale lock<\/strong><\/b><\/p><p class=\"RichTextInputTheme__paragraph\" dir=\"ltr\"><span class=\"RichTextInputTheme__textBase\">Backup Keyless Entry:  003301<\/span><\/p><p class=\"RichTextInputTheme__paragraph\" dir=\"ltr\"><span class=\"RichTextInputTheme__textBase\">Lockbox code - 0824<\/span><\/p><p class=\"RichTextInputTheme__paragraph\" dir=\"ltr\"><span class=\"RichTextInputTheme__textBase\">Lockbox location - back door knob.<\/span><\/p>\"",
        "property_notes_guest_access":"<p class=RichTextInputTheme__paragraph\" dir=\"ltr\"><b><strong class=\"RichTextInputTheme__textBase RichTextInputTheme__textBold\">Arrival and Parking: <\/strong><\/b><\/p><p class=\"RichTextInputTheme__paragraph\" dir=\"ltr\"><span class=\"RichTextInputTheme__textBase\">Assigned parking spaces #s 1 and 2",
        "property_photos_url":"130499166--x--130499167--x--130499168--x--130499169--x--130499170--x--130499171--x--130499172--x--130499173--x--130499174--x--130499175",
        "property_state":"TN",
        "property_status":"active",
        "listing_id":null,
        "saas_auto_renew":null,
        "cleaning_fee_id":null,
        "cleaning_fee_value_type":null,
        "cleaning_fee_formula":null,
        "cleaning_fee_multiplier":null,
        "channel_commission_use_account_settings":null,
        "channel_commission_id":null,
        "channel_commission_created_at":null,
        "channel_commission_updated_at":null,
        "cleaning_status":null,
        "picture_caption":null,
        "picture_thumbnail":null,
        "minimum_nights":null,
        "maximum_nights":null,
        "monthly_price_factor":null,
        "weekly_price_factor":null,
        "base_price":null,
        "weekend_base_price":null,
        "currency":null,
        "cleaning_fee":null,
        "confirmed_before_checkin_delay_minutes":null,
        "confirmed_day_of_checkin_delay_minutes":null,
        "confirmed_day_of_checkout_delay_minutes":null,
        "confirmed_during_stay_delay_minutes":null,
        "confirmed_after_checkout_delay_minutes":null,
        "unconfirmed_first_message_delay_minutes":null,
        "unconfirmed_subsequent_message_delay_minutes":null,
        "answeing_machine_is_active":null,
        "auto_reviews_status":null,
        "auto_payments_time_relation_names":null,
        "auto_payments_time_relation_units":null,
        "auto_payments_time_relation_amounts":null,
        "pms_cleaning_status":null,
        "calendar_rules_default_availability":null,
        "bookingcom_cut_off_hours_enabled":null,
        "expedia_cut_off_hours_enabled":null,
        "airbnb_cut_off_hours_enabled":null,
        "directbookings_cut_off_hours_enabled":null,
        "calendar_rules_default_hours":null,
        "calendar_rules_allow_request_to_book":null,
        "calendar_rules_advance_notice_updated_at":null,
        "calendar_rules_advance_notice_updated_by":null,
        "booking_window_default_days":null,
        "booking_window_updated_at":null,
        "preparation_time_updated_at":null,
        "dynamic_checkin_updated_at":null,
        "rental_periods_request_to_book":null,
        "rental_periods_ids":null,
        "rental_periods_from":null,
        "default_availability_updated_at":null,
        "default_availability_updated_by":null,
        "listing_type":null,
        "owners_list":null,
        "amenities_list":null,
        "amenities_not_included_list":null,
        "use_account_revenue_share":null,
        "use_account_taxes":null,
        "use_account_markups":null,
        "use_account_additional_fees":null,
        "is_active":null,
        "net_income_formula":null,
        "commission_formula":null,
        "owner_revenue_formula":null,
        "tax_ids":null,
        "tax_types":null,
        "tax_amounts":null,
        "tax_names":null,
        "tax_units":null,
        "tax_quantifiers":null,
        "taxes_applied_to_all_fees":null,
        "taxes_applied_on_fees":null,
        "taxes_are_applied_by_default":null,
        "tax_conditional_overrides_view_types":null,
        "tax_conditional_overrides_max_nights":null,
        "tax___vs":null,
        "pre_bookings_list":null,
        "origin_id":null,
        "nick_name":null,
        "minimum_age":null,
        "address_full":null,
        "address_street":null,
        "address_city":null,
        "address_country":null,
        "address_latitude":null,
        "address_longitude":null,
        "address_zip_code":null,
        "address_state":null,
        "address_county":null,
        "room_type":null,
        "property_type":null,
        "ota_room_type":null,
        "accommodates":null,
        "bathrooms":null,
        "bedrooms":null,
        "beds_count":null,
        "listing_status":null,
        "host_name":null,
        "wifi_name":null,
        "wifi_password":null,
        "area_in_square_feet":null,
        "trash_collection_day":null,
        "parking_instructions":null,
        "created_at":null,
        "origin":null,
        "default_check_in_time":null,
        "default_check_out_time":null,
        "check_in_instructions":null,
        "check_out_instructions":null,
        "account_id":null,
        "time_zone":null,
        "last_updated_at":null,
        "integration_ids":null,
        "integration_platforms":null,
        "booking_com_initial_complex_listings":null,
        "booking_com_publish_company_logos":null,
        "booking_com_is_published_company_logos":null,
        "booking_com_publish_company_infos":null,
        "booking_com_is_published_company_infos":null,
        "vacayhome_currencies":null,
        "vacayhome_statuses":null,
        "vacayhome_cancellation_policies":null,
        "vacayhome_cancellation_penalties":null,
        "vacayhome_creation_times":null,
        "listing_room_ids":null,
        "listing_room_numbers":null,
        "listing_room_bed_ids":null,
        "listing_room_bed_types":null,
        "listing_room_bed_quantities":null,
        "custom_field_values":null,
        "import_time":null,
        "date_of_first_scrape":null,
        "date_of_last_update":null,
        "date_of_last_scrape":null,
        "summary":"property_address1: 3301 Albion St, property_address2: nan, property_building: Albion, property_id: 454007, property_notes_access: <p class=RichTextInputTheme__paragraph\" dir=\"ltr\"><span class=\"RichTextInputTheme__textBase\">Master code: 003301<\/span><\/p>\", property_notes_general: <p class=RichTextInputTheme__paragraph\" dir=\"ltr\"><span class=\"RichTextInputTheme__textBase\">Layout: 1 level; 2-3 steps required for entry<\/span><\/p><p class=\"RichTextInputTheme__paragraph\" dir=\"ltr\"><br><b><strong class=\"RichTextInputTheme__textBase RichTextInputTheme__textBold\">Main door is the back (parking side) door!! This is the only door with a Yale lock<\/strong><\/b><\/p><p class=\"RichTextInputTheme__paragraph\" dir=\"ltr\"><span class=\"RichTextInputTheme__textBase\">Backup Keyless Entry:  003301<\/span><\/p><p class=\"RichTextInputTheme__paragraph\" dir=\"ltr\"><span class=\"RichTextInputTheme__textBase\">Lockbox code - 0824<\/span><\/p><p class=\"RichTextInputTheme__paragraph\" dir=\"ltr\"><span class=\"RichTextInputTheme__textBase\">Lockbox location - back door knob.<\/span><\/p>\", property_notes_guest_access: <p class=RichTextInputTheme__paragraph\" dir=\"ltr\"><b><strong class=\"RichTextInputTheme__textBase RichTextInputTheme__textBold\">Arrival and Parking: <\/strong><\/b><\/p><p class=\"RichTextInputTheme__paragraph\" dir=\"ltr\"><span class=\"RichTextInputTheme__textBase\">Assigned parking spaces #s 1 and 2, property_photos_url: 130499166--x--130499167--x--130499168--x--130499169--x--130499170--x--130499171--x--130499172--x--130499173--x--130499174--x--130499175, property_state: TN, property_status: active, listing_id: nan, saas_auto_renew: nan, cleaning_fee_id: nan, cleaning_fee_value_type: nan, cleaning_fee_formula: nan, cleaning_fee_multiplier: nan, channel_commission_use_account_settings: nan, channel_commission_id: nan, channel_commission_created_at: nan, channel_commission_updated_at: nan, cleaning_status: nan, picture_caption: nan, picture_thumbnail: nan, minimum_nights: nan, maximum_nights: nan, monthly_price_factor: nan, weekly_price_factor: nan, base_price: nan, weekend_base_price: nan, currency: nan, cleaning_fee: nan, confirmed_before_checkin_delay_minutes: nan, confirmed_day_of_checkin_delay_minutes: nan, confirmed_day_of_checkout_delay_minutes: nan, confirmed_during_stay_delay_minutes: nan, confirmed_after_checkout_delay_minutes: nan, unconfirmed_first_message_delay_minutes: nan, unconfirmed_subsequent_message_delay_minutes: nan, answeing_machine_is_active: nan, auto_reviews_status: nan, auto_payments_time_relation_names: nan, auto_payments_time_relation_units: nan, auto_payments_time_relation_amounts: nan, pms_cleaning_status: nan, calendar_rules_default_availability: nan, bookingcom_cut_off_hours_enabled: nan, expedia_cut_off_hours_enabled: nan, airbnb_cut_off_hours_enabled: nan, directbookings_cut_off_hours_enabled: nan, calendar_rules_default_hours: nan, calendar_rules_allow_request_to_book: nan, calendar_rules_advance_notice_updated_at: nan, calendar_rules_advance_notice_updated_by: nan, booking_window_default_days: nan, booking_window_updated_at: nan, preparation_time_updated_at: nan, dynamic_checkin_updated_at: nan, rental_periods_request_to_book: nan, rental_periods_ids: nan, rental_periods_from: NaT, default_availability_updated_at: nan, default_availability_updated_by: nan, listing_type: nan, owners_list: nan, amenities_list: nan, amenities_not_included_list: nan, use_account_revenue_share: nan, use_account_taxes: nan, use_account_markups: nan, use_account_additional_fees: nan, is_active: nan, net_income_formula: nan, commission_formula: nan, owner_revenue_formula: nan, tax_ids: nan, tax_types: nan, tax_amounts: nan, tax_names: nan, tax_units: nan, tax_quantifiers: nan, taxes_applied_to_all_fees: nan, taxes_applied_on_fees: nan, taxes_are_applied_by_default: nan, tax_conditional_overrides_view_types: nan, tax_conditional_overrides_max_nights: nan, tax___vs: nan, pre_bookings_list: nan, origin_id: nan, nick_name: nan, minimum_age: nan, address_full: nan, address_street: nan, address_city: nan, address_country: nan, address_latitude: nan, address_longitude: nan, address_zip_code: nan, address_state: nan, address_county: nan, room_type: nan, property_type: nan, ota_room_type: nan, accommodates: nan, bathrooms: nan, bedrooms: nan, beds_count: nan, listing_status: nan, host_name: nan, wifi_name: nan, wifi_password: nan, area_in_square_feet: nan, trash_collection_day: nan, parking_instructions: nan, created_at: nan, origin: nan, default_check_in_time: nan, default_check_out_time: nan, check_in_instructions: nan, check_out_instructions: nan, account_id: nan, time_zone: nan, last_updated_at: nan, integration_ids: nan, integration_platforms: nan, booking_com_initial_complex_listings: nan, booking_com_publish_company_logos: nan, booking_com_is_published_company_logos: nan, booking_com_publish_company_infos: nan, booking_com_is_published_company_infos: nan, vacayhome_currencies: nan, vacayhome_statuses: nan, vacayhome_cancellation_policies: nan, vacayhome_cancellation_penalties: nan, vacayhome_creation_times: nan, listing_room_ids: nan, listing_room_numbers: nan, listing_room_bed_ids: nan, listing_room_bed_types: nan, listing_room_bed_quantities: nan, custom_field_values: nan, import_time: nan, date_of_first_scrape: NaT, date_of_last_update: nan, date_of_last_scrape: NaT"
    },
    {
        "property_address1":"43 Brookwood Terrace C",
        "property_address2":null,
        "property_building":"Brookwood",
        "property_id":454066,
        "property_notes_access":"<p class=RichTextInputTheme__paragraph\" dir=\"ltr\"><span class=\"RichTextInputTheme__textBase\">Master Code: 000043<\/span><\/p><p class=\"RichTextInputTheme__paragraph\" dir=\"ltr\"><span class=\"RichTextInputTheme__textBase\">Emergency Lockbox -  7923 (front door knob)<\/span><\/p>\"",
        "property_notes_general":"<p class=RichTextInputTheme__paragraph\" dir=\"ltr\"><span class=\"RichTextInputTheme__textBase\">Master Code: 000043<\/span><\/p><p class=\"RichTextInputTheme__paragraph\" dir=\"ltr\"><span class=\"RichTextInputTheme__textBase\">Emergency Lockbox - 7923 (front door knob)<\/span><\/p><p class=\"RichTextInputTheme__paragraph\" dir=\"ltr\"><i><b><strong class=\"RichTextInputTheme__textBase RichTextInputTheme__textBold RichTextInputTheme__textItalic\">***OWNER NOTES***<\/strong><\/b><\/i><\/p><p class=\"RichTextInputTheme__paragraph\" dir=\"ltr\"><span class=\"RichTextInputTheme__textBase\">Owner -<\/span><\/p><p class=\"RichTextInputTheme__paragraph\" dir=\"ltr\"><span class=\"RichTextInputTheme__textBase\">Currently Escalated? No<\/span><\/p><p class=\"RichTextInputTheme__paragraph\" dir=\"ltr\"><span class=\"RichTextInputTheme__textBase\">Escalated within last 30 days? No<\/span><\/p><p class=\"RichTextInputTheme__paragraph\" dir=\"ltr\"><span class=\"RichTextInputTheme__textBase\">Persona - total hands off <\/span><\/p><p class=\"RichTextInputTheme__paragraph\" dir=\"ltr\"><span class=\"RichTextInputTheme__textBase\">Owner Restrictions? No<\/span><\/p>\"",
        "property_notes_guest_access":"<p class=RichTextInputTheme__paragraph\" dir=\"ltr\"><b><strong class=\"RichTextInputTheme__textBase RichTextInputTheme__textBold\">Arrival and Parking: <\/strong><\/b><\/p><p class=\"RichTextInputTheme__paragraph\" dir=\"ltr\"><span class=\"RichTextInputTheme__textBase\">Assigned parking available for two vehicles.. The far left spot under the brown carport and the middle spot that is underneath the white carport.<\/span><\/p><p class=\"RichTextInputTheme__paragraph\" dir=\"ltr\"><b><strong class=\"RichTextInputTheme__textBase RichTextInputTheme__textBold\">Access Instructions: <\/strong><\/b><\/p><p class=\"RichTextInputTheme__paragraph\" dir=\"ltr\"><span class=\"RichTextInputTheme__textBase\">Once parked",
        "property_photos_url":"True--x--False--x--False--x--False--x--False--x--False--x--False--x--False--x--False--x--False--x--False--x--False--x--False--x--False--x--False--x--False--x--False--x--False--x--False--x--False--x--False",
        "property_state":"TN",
        "property_status":"active",
        "listing_id":null,
        "saas_auto_renew":null,
        "cleaning_fee_id":null,
        "cleaning_fee_value_type":null,
        "cleaning_fee_formula":null,
        "cleaning_fee_multiplier":null,
        "channel_commission_use_account_settings":null,
        "channel_commission_id":null,
        "channel_commission_created_at":null,
        "channel_commission_updated_at":null,
        "cleaning_status":null,
        "picture_caption":null,
        "picture_thumbnail":null,
        "minimum_nights":null,
        "maximum_nights":null,
        "monthly_price_factor":null,
        "weekly_price_factor":null,
        "base_price":null,
        "weekend_base_price":null,
        "currency":null,
        "cleaning_fee":null,
        "confirmed_before_checkin_delay_minutes":null,
        "confirmed_day_of_checkin_delay_minutes":null,
        "confirmed_day_of_checkout_delay_minutes":null,
        "confirmed_during_stay_delay_minutes":null,
        "confirmed_after_checkout_delay_minutes":null,
        "unconfirmed_first_message_delay_minutes":null,
        "unconfirmed_subsequent_message_delay_minutes":null,
        "answeing_machine_is_active":null,
        "auto_reviews_status":null,
        "auto_payments_time_relation_names":null,
        "auto_payments_time_relation_units":null,
        "auto_payments_time_relation_amounts":null,
        "pms_cleaning_status":null,
        "calendar_rules_default_availability":null,
        "bookingcom_cut_off_hours_enabled":null,
        "expedia_cut_off_hours_enabled":null,
        "airbnb_cut_off_hours_enabled":null,
        "directbookings_cut_off_hours_enabled":null,
        "calendar_rules_default_hours":null,
        "calendar_rules_allow_request_to_book":null,
        "calendar_rules_advance_notice_updated_at":null,
        "calendar_rules_advance_notice_updated_by":null,
        "booking_window_default_days":null,
        "booking_window_updated_at":null,
        "preparation_time_updated_at":null,
        "dynamic_checkin_updated_at":null,
        "rental_periods_request_to_book":null,
        "rental_periods_ids":null,
        "rental_periods_from":null,
        "default_availability_updated_at":null,
        "default_availability_updated_by":null,
        "listing_type":null,
        "owners_list":null,
        "amenities_list":null,
        "amenities_not_included_list":null,
        "use_account_revenue_share":null,
        "use_account_taxes":null,
        "use_account_markups":null,
        "use_account_additional_fees":null,
        "is_active":null,
        "net_income_formula":null,
        "commission_formula":null,
        "owner_revenue_formula":null,
        "tax_ids":null,
        "tax_types":null,
        "tax_amounts":null,
        "tax_names":null,
        "tax_units":null,
        "tax_quantifiers":null,
        "taxes_applied_to_all_fees":null,
        "taxes_applied_on_fees":null,
        "taxes_are_applied_by_default":null,
        "tax_conditional_overrides_view_types":null,
        "tax_conditional_overrides_max_nights":null,
        "tax___vs":null,
        "pre_bookings_list":null,
        "origin_id":null,
        "nick_name":null,
        "minimum_age":null,
        "address_full":null,
        "address_street":null,
        "address_city":null,
        "address_country":null,
        "address_latitude":null,
        "address_longitude":null,
        "address_zip_code":null,
        "address_state":null,
        "address_county":null,
        "room_type":null,
        "property_type":null,
        "ota_room_type":null,
        "accommodates":null,
        "bathrooms":null,
        "bedrooms":null,
        "beds_count":null,
        "listing_status":null,
        "host_name":null,
        "wifi_name":null,
        "wifi_password":null,
        "area_in_square_feet":null,
        "trash_collection_day":null,
        "parking_instructions":null,
        "created_at":null,
        "origin":null,
        "default_check_in_time":null,
        "default_check_out_time":null,
        "check_in_instructions":null,
        "check_out_instructions":null,
        "account_id":null,
        "time_zone":null,
        "last_updated_at":null,
        "integration_ids":null,
        "integration_platforms":null,
        "booking_com_initial_complex_listings":null,
        "booking_com_publish_company_logos":null,
        "booking_com_is_published_company_logos":null,
        "booking_com_publish_company_infos":null,
        "booking_com_is_published_company_infos":null,
        "vacayhome_currencies":null,
        "vacayhome_statuses":null,
        "vacayhome_cancellation_policies":null,
        "vacayhome_cancellation_penalties":null,
        "vacayhome_creation_times":null,
        "listing_room_ids":null,
        "listing_room_numbers":null,
        "listing_room_bed_ids":null,
        "listing_room_bed_types":null,
        "listing_room_bed_quantities":null,
        "custom_field_values":null,
        "import_time":null,
        "date_of_first_scrape":null,
        "date_of_last_update":null,
        "date_of_last_scrape":null,
        "summary":"property_address1: 43 Brookwood Terrace C, property_address2: nan, property_building: Brookwood, property_id: 454066, property_notes_access: <p class=RichTextInputTheme__paragraph\" dir=\"ltr\"><span class=\"RichTextInputTheme__textBase\">Master Code: 000043<\/span><\/p><p class=\"RichTextInputTheme__paragraph\" dir=\"ltr\"><span class=\"RichTextInputTheme__textBase\">Emergency Lockbox -  7923 (front door knob)<\/span><\/p>\", property_notes_general: <p class=RichTextInputTheme__paragraph\" dir=\"ltr\"><span class=\"RichTextInputTheme__textBase\">Master Code: 000043<\/span><\/p><p class=\"RichTextInputTheme__paragraph\" dir=\"ltr\"><span class=\"RichTextInputTheme__textBase\">Emergency Lockbox - 7923 (front door knob)<\/span><\/p><p class=\"RichTextInputTheme__paragraph\" dir=\"ltr\"><i><b><strong class=\"RichTextInputTheme__textBase RichTextInputTheme__textBold RichTextInputTheme__textItalic\">***OWNER NOTES***<\/strong><\/b><\/i><\/p><p class=\"RichTextInputTheme__paragraph\" dir=\"ltr\"><span class=\"RichTextInputTheme__textBase\">Owner -<\/span><\/p><p class=\"RichTextInputTheme__paragraph\" dir=\"ltr\"><span class=\"RichTextInputTheme__textBase\">Currently Escalated? No<\/span><\/p><p class=\"RichTextInputTheme__paragraph\" dir=\"ltr\"><span class=\"RichTextInputTheme__textBase\">Escalated within last 30 days? No<\/span><\/p><p class=\"RichTextInputTheme__paragraph\" dir=\"ltr\"><span class=\"RichTextInputTheme__textBase\">Persona - total hands off <\/span><\/p><p class=\"RichTextInputTheme__paragraph\" dir=\"ltr\"><span class=\"RichTextInputTheme__textBase\">Owner Restrictions? No<\/span><\/p>\", property_notes_guest_access: <p class=RichTextInputTheme__paragraph\" dir=\"ltr\"><b><strong class=\"RichTextInputTheme__textBase RichTextInputTheme__textBold\">Arrival and Parking: <\/strong><\/b><\/p><p class=\"RichTextInputTheme__paragraph\" dir=\"ltr\"><span class=\"RichTextInputTheme__textBase\">Assigned parking available for two vehicles.. The far left spot under the brown carport and the middle spot that is underneath the white carport.<\/span><\/p><p class=\"RichTextInputTheme__paragraph\" dir=\"ltr\"><b><strong class=\"RichTextInputTheme__textBase RichTextInputTheme__textBold\">Access Instructions: <\/strong><\/b><\/p><p class=\"RichTextInputTheme__paragraph\" dir=\"ltr\"><span class=\"RichTextInputTheme__textBase\">Once parked, property_photos_url: True--x--False--x--False--x--False--x--False--x--False--x--False--x--False--x--False--x--False--x--False--x--False--x--False--x--False--x--False--x--False--x--False--x--False--x--False--x--False--x--False, property_state: TN, property_status: active, listing_id: nan, saas_auto_renew: nan, cleaning_fee_id: nan, cleaning_fee_value_type: nan, cleaning_fee_formula: nan, cleaning_fee_multiplier: nan, channel_commission_use_account_settings: nan, channel_commission_id: nan, channel_commission_created_at: nan, channel_commission_updated_at: nan, cleaning_status: nan, picture_caption: nan, picture_thumbnail: nan, minimum_nights: nan, maximum_nights: nan, monthly_price_factor: nan, weekly_price_factor: nan, base_price: nan, weekend_base_price: nan, currency: nan, cleaning_fee: nan, confirmed_before_checkin_delay_minutes: nan, confirmed_day_of_checkin_delay_minutes: nan, confirmed_day_of_checkout_delay_minutes: nan, confirmed_during_stay_delay_minutes: nan, confirmed_after_checkout_delay_minutes: nan, unconfirmed_first_message_delay_minutes: nan, unconfirmed_subsequent_message_delay_minutes: nan, answeing_machine_is_active: nan, auto_reviews_status: nan, auto_payments_time_relation_names: nan, auto_payments_time_relation_units: nan, auto_payments_time_relation_amounts: nan, pms_cleaning_status: nan, calendar_rules_default_availability: nan, bookingcom_cut_off_hours_enabled: nan, expedia_cut_off_hours_enabled: nan, airbnb_cut_off_hours_enabled: nan, directbookings_cut_off_hours_enabled: nan, calendar_rules_default_hours: nan, calendar_rules_allow_request_to_book: nan, calendar_rules_advance_notice_updated_at: nan, calendar_rules_advance_notice_updated_by: nan, booking_window_default_days: nan, booking_window_updated_at: nan, preparation_time_updated_at: nan, dynamic_checkin_updated_at: nan, rental_periods_request_to_book: nan, rental_periods_ids: nan, rental_periods_from: NaT, default_availability_updated_at: nan, default_availability_updated_by: nan, listing_type: nan, owners_list: nan, amenities_list: nan, amenities_not_included_list: nan, use_account_revenue_share: nan, use_account_taxes: nan, use_account_markups: nan, use_account_additional_fees: nan, is_active: nan, net_income_formula: nan, commission_formula: nan, owner_revenue_formula: nan, tax_ids: nan, tax_types: nan, tax_amounts: nan, tax_names: nan, tax_units: nan, tax_quantifiers: nan, taxes_applied_to_all_fees: nan, taxes_applied_on_fees: nan, taxes_are_applied_by_default: nan, tax_conditional_overrides_view_types: nan, tax_conditional_overrides_max_nights: nan, tax___vs: nan, pre_bookings_list: nan, origin_id: nan, nick_name: nan, minimum_age: nan, address_full: nan, address_street: nan, address_city: nan, address_country: nan, address_latitude: nan, address_longitude: nan, address_zip_code: nan, address_state: nan, address_county: nan, room_type: nan, property_type: nan, ota_room_type: nan, accommodates: nan, bathrooms: nan, bedrooms: nan, beds_count: nan, listing_status: nan, host_name: nan, wifi_name: nan, wifi_password: nan, area_in_square_feet: nan, trash_collection_day: nan, parking_instructions: nan, created_at: nan, origin: nan, default_check_in_time: nan, default_check_out_time: nan, check_in_instructions: nan, check_out_instructions: nan, account_id: nan, time_zone: nan, last_updated_at: nan, integration_ids: nan, integration_platforms: nan, booking_com_initial_complex_listings: nan, booking_com_publish_company_logos: nan, booking_com_is_published_company_logos: nan, booking_com_publish_company_infos: nan, booking_com_is_published_company_infos: nan, vacayhome_currencies: nan, vacayhome_statuses: nan, vacayhome_cancellation_policies: nan, vacayhome_cancellation_penalties: nan, vacayhome_creation_times: nan, listing_room_ids: nan, listing_room_numbers: nan, listing_room_bed_ids: nan, listing_room_bed_types: nan, listing_room_bed_quantities: nan, custom_field_values: nan, import_time: nan, date_of_first_scrape: NaT, date_of_last_update: nan, date_of_last_scrape: NaT"
    }
]
